Title,Video ID,Published At
Reakcja rosyjskiej propagandy na utrat Nowoczerkaska. Uznanie dla SZU i przekierowanie uwagi widz贸w,hvP-qqxU36s,2023-12-30T15:00:12Z
"Jenisejsk-15. cile tajna stacja radiolokacyjna, kt贸r godni mieszkacy rozkradli na zom",oNEbarMHYVw,2023-12-28T15:00:24Z
Przepis na pyszne ciasto od Andromedy na wita,OeDo8sD4qUQ,2023-12-26T11:00:33Z
Wszystkie wstawki z 偶artami jakie pojawiy si w czasie Q&A. Kompilacja na wita,c0495EkqpO4,2023-12-24T11:00:16Z
Rosyjska telewizja z zapaem opowiada o nadchodzcych rosyjskich samolotach 6. generacji,auUgy66LIfE,2023-12-22T15:00:10Z
"Co jest wa偶niejsze dla zwycistwa: zasoby, bro czy morale? Matematyczne modelowanie wojny [PODCAST]",2d7JKaqp0os,2023-12-20T15:00:09Z
Realia 偶ycia po rosyjskiej stronie Mierzei Wilanej. Poniemieckie bunkry i destrukcyjna turystyka,aKmy2E_jhRo,2023-12-18T15:00:13Z
Kr贸tkie Q&A z moimi odpowiedziami na kilka pyta ,mbYucE0RvVQ,2023-12-16T12:00:13Z
"Jak 偶yje por贸d radioaktywnych wysypisk Krasnokamiensk, aktywnie walczcy na specoperacji [PODCAST]",cwvReoKZTnE,2023-12-14T15:00:06Z
"Zmobilizowany poleg z rk wsp贸towarzyszy, a rodzinie odmawiaj wypaty odszkodowania [PODCAST]",Baknz63FKBc,2023-12-12T15:00:03Z
Dikson. Ci偶kie 偶ycie w najbardziej wysunitej na p贸noc miejscowoci w Rosji.,_3mwtcYoKdg,2023-12-10T14:00:34Z
"Dlaczego ludzie nadal chc mieszka w Jubilejnym, wyludniajcej si wiosce g贸rniczej bez perspektyw",s92ULRB7dgE,2023-12-08T15:00:21Z
"Jak 偶yje i walczy Niewielsk, sachaliskie miasteczko poo偶one 7000km od linii frontu [PODCAST]",mz0jFm_Dx7Q,2023-12-06T15:00:01Z
Rosyjski ekspert ostro krytykuje Polsk za ch kupna wycofywanego kr偶ownika Ticonderoga [PODCAST],vXzfjsbtwLU,2023-12-04T15:01:07Z
Syberyjski Chemiczny Czarnobyl. Katastrofa ekologiczna 150km od Bajkau,EJuV8utuE0M,2023-12-02T14:01:07Z
"""Po nas tylko cisza"". Jak 偶yje miasto U偶ur, gdzie bd rozmieszcza pociski balistyczne [PODCAST]",WdqGGL7Psjs,2023-11-30T15:01:17Z
Co si dzieje po odejciu dyktatora w autorytarnych pastwach postradzieckich? [PODCAST],axmv6Htdpaw,2023-11-28T15:01:05Z
Najwikszy dom komunalny Rosji. Jak 偶yj mieszkacy ogromnego domu komunalnego w centrum Petersburga,ibeWJbRLpZ4,2023-11-26T14:01:15Z
Sie kolejowa i energetyczna - cele drugorzdne jako klucz do rosyjskiego zwycistwa? [PODCAST],rAC5tQ_45GI,2023-11-24T15:01:30Z
"Norylsk: 偶ycie por贸d niegu, lodu i katastrof ekologicznych na dalekiej p贸nocy Rosji",s5qWcQ7o-7E,2023-11-22T15:01:11Z
"""Ju偶 偶yjemy w rezerwacie"". Jak 偶yje, jakie ma problemy i za co walczy Republika Ataju [PODCAST]",xXnZNHgt12Y,2023-11-20T15:01:10Z
Ukraina nadal utylizuje radzieckie pociski balistyczne. Problematyczny i kosztowny spadek po ZSRR,Oo6gCCgdieI,2023-11-18T14:01:34Z
"""Przecigajcy si konflikt jest dla nas zgubny"" - ostrze偶enia i analityka Igora Girkina [PODCAST]",0ZCl9pxeU68,2023-11-16T15:01:19Z
Jak do miasta wojskowych Bierdska po raz kolejny przysza wojna. Reporta偶 z serca Syberii [PODCAST],fUXYE89E0Y0,2023-11-14T15:01:02Z
Rozsypujce si i ponce domy Archangielska. 呕ycie w nieoficjalnej stolicy rosyjskiej p贸nocy,-utSGRiHquI,2023-11-12T14:01:13Z
"Historie rosyjskich uczestnik贸w specoperacji, kt贸rym nie wypacono obiecanych pienidzy [PODCAST]",VRpSZmM9TZg,2023-11-10T15:01:12Z
Rosyjskiemu ekspertowi marzy si sojusz z Polsk i obalenie z jej pomoc Unii Europejskiej [PODCAST],yoAdYSfejGk,2023-11-08T15:01:14Z
"Jak 偶yje 呕ydowski Obw贸d Autonomiczny w czasie wojny. May obw贸d, du偶e problemy [PODCAST]",OJGaF0KYQZ8,2023-11-06T15:01:17Z
"呕ycie w wyludniajcych si, zapomnianych rosyjskich wioskach w pobli偶u kosmodromu Plesieck",-8xFmECs2X4,2023-11-04T14:01:10Z
"Mn贸stwo swoich problem贸w, a pomagamy innym. Jak 偶yje i walczy g贸rnicze miasto Prokopjewsk [PODCAST]",aIh2O8LVcnE,2023-11-02T15:01:09Z
Z pustymi rkoma na misny szturm. Rosyjski zmobilizowany o nastrojach i realiach walk [PODCAST],zq9POiRHSxY,2023-10-31T15:01:20Z
呕ycie w rozsypujcych si poniemieckich domach. Batyjsk - najbardziej zachodnie miasto Rosji,kpFRF1QD9iw,2023-10-29T14:01:53Z
Rosyjski bud偶et w 2024. Skd wzi pienidze na militaryzacj spoeczestwa? [PODCAST],cx3NE4UBc-Q,2023-10-27T14:01:31Z
"Historia obrocy Azowstalu, kt贸ry jako jedyny nie podda si i przedosta na teren Ukrainy [PODCAST]",kmWEL4x-IFM,2023-10-25T14:01:09Z
"Trzech ju偶 wr贸cio ze specoperacji w ""cynku"". Reporta偶 o 偶yciu w wiosce na skraju Rosji [PODCAST]",hX9FiVvLyQE,2023-10-23T14:02:04Z
Drony FPV na su偶bie wojsk rosyjskich. Demonstracja zdolnoci produkcyjnych i zaplecza szkoleniowego,lN73eUrk0XY,2023-10-22T14:01:17Z
"Realia 偶ycia w drewnianych rosyjskich barakach, w najwikszym miecie Syberii - Nowosybirsku",DGlGiEwcBHU,2023-10-21T13:01:29Z
Gdzie w Rosji s burzone pomniki represjonowanych Polak贸w i co wiadomo na ten temat? [PODCAST],AiyTNuw1UHk,2023-10-19T14:00:03Z
Jak rosyjska propaganda produkuje fikcyjne historie bohaterskich wyczyn贸w swoich 偶onierzy [PODCAST],B8S3QGosmWQ,2023-10-17T14:01:10Z
Rosyjska telewizja o polsko-ukraiskim ochodzeniu dyplomatycznym i polskich planach wobec Biaorusi,9njqkuL3Tvw,2023-10-15T13:01:19Z
"85 dni Igora Girkina w areszcie: listy otwarte, opacanie adwokata, ksi偶ki, pomoc 偶ony [PODCAST]",pRUKFX68rcc,2023-10-13T13:01:02Z
Rosyjski poborowy opowiada o dowiadczeniach z Ukrainy i jak go potraktowa rosyjski MON [PODCAST],W2jfs9z4PqM,2023-10-11T14:01:01Z
Arestowicz o polsko-ukraiskich zgrzytach dyplomatycznych i rzekomym zwrocie Ukrainy na Niemcy,cGUWzbKwl6Q,2023-10-10T14:01:01Z
"Analiza rosyjskiego syndromu postimperialnego i mit贸w propagandowych, zwieczona skandalem [PODCAST]",XWECPFLWNWY,2023-10-09T14:01:12Z
Ruiny i g贸ry mieci na rosyjskich Wyspach Kurylskich. Realia 偶ycia na spornym rosyjskim terytorium,r_szBtVF3qA,2023-10-07T13:01:15Z
Ukraiski dow贸dca skar偶y si kierownictwu Uralwagonzawodu na nisk jako i problemy z T-72B3M,xaHskdL_gFk,2023-10-05T14:01:02Z
AHS Krab oczami rosyjskich ekspert贸w i dziennikarzy. Krytyka i zaniepokojenie zdolnociami [PODCAST],_JBmcAZnGiA,2023-10-03T14:01:14Z
Rosyjski propagandysta Soowjow robi awantur z powodu wysokich cen paliwa i jego brak贸w w Rosji,3w1EM1g60p4,2023-10-01T13:01:21Z
"Najnowszy wywiad udzielony przez Wadymira Kwaczkowa. Mo偶liwe, 偶e ostatni w tym roku [PODCAST]",R4byqqo3htk,2023-09-27T14:02:02Z
Rosyjski ekspert wymienia powa偶ne problemy i sabe strony rosyjskiej artylerii [PODCAST],VK3nwZDFW8w,2023-09-25T14:01:38Z
M1 Abrams czy T-90M? Rosyjska telewizja tumaczy kt贸ry czog zwyci偶y w pojedynku,xms2lNneq-4,2023-09-23T13:01:08Z
"Jak w dobie specoperacji 偶yje Jurga, syberyjskie miasto rosyjskich wojskowych [PODCAST]",Sbh6JcrNka4,2023-09-21T14:01:34Z
Rosyjski ekspert skrupulatnie opisuje wsp贸czesne Wojsko Polskie i wyciga typowe wnioski [PODCAST],KdYVhFAX5Nw,2023-09-19T13:58:46Z
Rosyjski propagandysta ma ju偶 po prostu dosy medialnych sukces贸w SZU,XalYbhwIGr0,2023-09-18T14:01:15Z
"Rosyjska telewizja o zdolnociach przemysowych, nauczkach specoperacji i ulepszeniach dla T-80BWM",0Lkjkts36ZY,2023-09-17T15:01:06Z
Katastrofalne zu偶ycie i zacofanie maszyn ogranicza produkcj w zakadach zbrojeniowych [PODCAST],gJ-B0bSQU64,2023-09-15T15:09:16Z
"Ojciec i syn, kt贸rzy nigdy si nie spotkali i polegli w dw贸ch rosyjskich konfliktach [PODCAST]",00PK5VapVA4,2023-09-13T14:01:07Z
Rosyjski dziennikarz Aleksander Niewzorow namiewa si i drwi z Kremla i rosyjskiego spoeczestwa,W7nqCtADRJA,2023-09-11T15:00:50Z
"Dyskusja propagandysty Soowjowa z amerykaskim popularyzatorem teorii spiskowych, Alexem Jonesem",3HH2LbtAzMk,2023-09-09T14:01:07Z
"Rosyjski ekspert uparcie szuka minus贸w haubicy M777, zani偶ajc jej zasugi w su偶bie SZU [PODCAST]",mPozpKm8T_w,2023-09-07T14:01:09Z
Rosjanie wieszcz kolejny rozbi贸r Polski oraz konfrontacj Polski z Rosj i Niemcami [PODCAST],3S0LAkGV6zw,2023-09-05T15:30:39Z
"Historie trzech skazanych, kt贸rzy pojechali walczy pod Bachmutem i zostali ""bohaterami"" [PODCAST]",PoDr0tSOQ4U,2023-09-03T14:01:15Z
"Igor Girkin chce by prezydentem, zobaczy lekarza i wr贸ci do domu. Miesic w areszcie [PODCAST]",fYt2Bj527Z8,2023-09-01T14:01:14Z
Jakie hasa zaczli wyszukiwa Rosjanie po rozpoczciu konfliktu. Badania socjologiczne [PODCAST],yRSsc_9m6kg,2023-08-30T14:01:24Z
"Historia rodziny, kt贸ra stracia na froncie dw贸ch syn贸w i walczy o powr贸t trzeciego [PODCAST]",rW-XiQHTSmw,2023-08-28T14:01:06Z
Rosyjska propaganda komentuje ostatni lot Prigo偶yna. Wybielanie Putina i oskar偶anie Zachodu,eg3s4R5JdRQ,2023-08-26T15:01:11Z
Rosyjska ekonomistka opisuje obecny stan rosyjskiej gospodarki i robi prognozy na 2024 [PODCAST],fZfeW2OiKuc,2023-08-24T14:01:04Z
Jak rosyjscy m偶owie jad na specoperacj i zostawiaj swoje rodziny [PODCAST],zgwkv44vwY8,2023-08-22T14:01:02Z
Rosyjska telewizja o polskiej historii - rosyjskie spojrzenie na biografi Wojciecha Jaruzelskiego,t6MY3ulYOkw,2023-08-20T15:01:03Z
Sfrustrowane i rozemocjonowane rosyjskie media komentuj i krytykuj defilad w Warszawie [PODCAST],rScnvoXNuhw,2023-08-18T14:01:01Z
Ukraiskie media zbaday telefon rosyjskiego ochotnika i opowiedziay jego histori [PODCAST],vF-UyO-LvdM,2023-08-16T14:01:02Z
Rosyjski ekspert bez entuzjazmu komentuje pojawienie si polskich Rosomak贸w na Ukrainie [PODCAST],ZJNfFE04LCc,2023-08-14T14:01:03Z
Rosyjska turbopatriotka opowiada o katastrofalnej sytuacji w Doniecku. Tatiana Montian,bfQKkgLnKgw,2023-08-12T15:01:22Z
Dlaczego Rosja wykorzystuje przestarzay sprzt i czy zdoa wygra konflikt na wyczerpanie [PODCAST],gz5gjtgKaqI,2023-08-10T14:02:59Z
"Tragiczne historie Rosjan, kt贸rzy uwierzyli Putinowi i poszli walczy na Ukrainie [PODCAST]",KnuDNcqGQdM,2023-08-08T14:00:46Z
"Rosyjska telewizja opowiada o niewdzicznej Polsce, kt贸ra zakazaa tranzytu rosyjskich ci偶ar贸wek",v2fomrOB0Ao,2023-08-06T15:00:10Z
Rozmowa z najemnikiem przez aplikacj randkow oraz analiza wypowiedzi ukaszenki o Polsce [PODCAST],1J18SgXubKA,2023-08-04T14:12:50Z
Zatrwa偶ajca korupcja w wojsku rosyjskim i zmobilizowani 偶onierze oszukani przez Putina [PODCAST],U8sUtCzbBQM,2023-08-02T14:01:57Z
"Ostatnie publiczne wystpienie Igora Girkina w petersburskiej ksigarni, z wykadem o Prigo偶ynie",rfDeuyHcNhA,2023-07-31T16:01:03Z
Jak mieszkacy Czukotki walcz na Ukrainie i czym si to dla nich koczy [PODCAST],1IOblEQGLsA,2023-07-29T14:00:35Z
"Rosyjscy propagandyci dyskutuj o polskiej polityce, historii i rzekomych prezentach terytorialnych",5f6U2sqvmjQ,2023-07-27T16:00:06Z
Zmobilizowany Buriat opowiada o dziewiciu miesicach walk na Ukrainie [PODCAST],Ww_AvP7f_p0,2023-07-25T14:00:40Z
Wszystko co musisz wiedzie o zatrzymaniu Igora Girkina [PODCAST],OtRFjQ37qgM,2023-07-23T10:00:02Z
"Przegld reakcji rosyjskich medi贸w propagandowych, zwizany z Mostem Krymskim",_tuoOYjqS24,2023-07-21T16:02:38Z
Dlaczego mieszkacy maej syberyjskiej mieciny Jaszkino jad walczy na Ukrainie [PODCAST},m_Q4r-Ts1BY,2023-07-19T14:01:51Z
Rozczarowany i zmartwiony Igor Girkin kieruje mocne oskar偶enia pod adresem Putina,EhFJmcMNOrM,2023-07-17T16:00:06Z
Rosyjscy wolontariusze o katastrofalnych problemach i brakach w zaopatrzeniu wojsk rosyjskich,qnDnGwYD1Bg,2023-07-15T16:00:09Z
Poziom rosyjskich strat i sposoby szacowania w realiach cisej cenzury - metodyka i dane [PODCAST],CbfIFK5UQCY,2023-07-13T14:00:46Z
Rosyjski ekonomista studzi nastroje co do rychego upadku rosyjskiej gospodarki [PODCAST],6NrZ7KLaSyY,2023-07-11T13:00:21Z
Jak Igor Girkin wypowiada si o specoperacji 500 dni temu? miae analizy i niespenione prognozy,D51oGgnsVc4,2023-07-09T16:00:08Z
Su-35 kontra samoloty NATO. Rosyjski ekspert o przekazaniu Ukrainie samolot贸w F-16 [PODCAST],pslirpEb_Fg,2023-07-07T12:01:29Z
Co jest nie tak z MSBS Grot - ocena ukraiskich u偶ytkownik贸w po roku eksploatacji [PODCAST],ARkl54k8Gv8,2023-07-05T13:00:29Z
"Igor Girkin o sytuacji spoeczno-politycznej w Rosji. Stan pastwa, demografia i sytuacja na froncie",tR1MioRREXM,2023-07-03T16:00:27Z
Rosyjski pukownik GRU przeprowadza analiz operacji Prigo偶yna. Kwaczkow o stanie pastwa i wojska.,GGppDujl3jQ,2023-07-01T16:01:21Z
Ewolucja reakcji rosyjskiej propagandy w zwizku z buntem Prigo偶yna. Od rozpaczy do rozczarowania,wnV3LR1tx9M,2023-06-29T16:00:13Z
"Igor Girkin o konsekwencjach nieudanego buntu, problemach na froncie i sytuacji wojskowo-politycznej",xF5PCBEqhIQ,2023-06-27T16:01:08Z
Bunt Prigo偶yna jako symptom rosyjskiej smuty. Ostatni wywiad z Prigo偶ynem i reakcja turbopatriot贸w,XDHfS_JMEIA,2023-06-25T09:00:15Z
"Rosyjski intelektualista Niewzorow o cerkwi prawosawnej, opozycji i rosyjskim spoeczestwie",RiozPH3LepM,2023-06-23T16:01:04Z
Koncepcja migowca szturmowego zderzya si z ukraisk rzeczywistoci: rosyjski ekspert [PODCAST],Sr8YGrgrxA8,2023-06-21T16:01:02Z
Rozczarowany i smutny Igor Girkin m贸wi o sytuacji wojskowo-politycznej w Rosji. Monolog Piwniczny,COeIVEn4o0E,2023-06-19T16:01:04Z
Rosyjski program propagandowy opowiada o polskich ambicjach zwizanych z odbudow Rzeczpospolitej,FABTwzwnC4o,2023-06-17T16:01:05Z
"Ukraiski 偶onierz ""Predator"" opowiada o intensywnym starciu z przewa偶ajcymi siami wroga [PODCAST]",41jXyZQMMPw,2023-06-15T16:01:28Z
"Igor Girkin komentuje ukraisk kontrofensyw, zniszczenie tamy i opisuje rosyjsk smut",pLhg5MupcWg,2023-06-13T16:01:11Z
Przegld reakcji rosyjskiej propagandy na wa偶ne wydarzenia ostatnich tygodni - Wodzimierz Soowjow,e2pMpFCS2vw,2023-06-11T16:01:01Z
Rosyjski ekspert wojskowy komentuje brytyjsk analiz rosyjskich zdolnoci [PODCAST],d4k_YfjV5iM,2023-06-09T15:59:49Z
Igor Girkin komentuje ostrzay rosyjskiego terytorium oraz analizuje sytuacj wojskowo-polityczn,BlPnyST06iw,2023-06-07T15:59:57Z
"G贸wne problemy rosyjskiej gospodarki - deficyt kadrowy, doek demograficzny i may biznes [PODCAST]",NiXCX7X4obo,2023-06-05T15:59:37Z
Rosyjski ekspert wojskowy o sensownoci montowania pancerza reaktywnego na Leopardach 2A4 [PODCAST],9z1-_6msiMQ,2023-06-03T16:00:00Z
Prigo偶yn ociepla sw贸j wizerunek m贸wic o problemach z rosyjsk elit i robic deklaracje polityczne,ELC7DZaNzWc,2023-06-01T16:03:06Z
Igor Girkin czuje zapach smuty w powietrzu oraz komentuje wydarzenia w obwodzie biegorodzkim,q-3PTH8Ehi0,2023-05-30T16:08:03Z
"Wielkorusy i turbopatrioci komentuj zdobycie Bachmutu. Kwaczkow, Girkin i sp贸ka [(P)PODCAST]",iNA40D4FN2Y,2023-05-28T16:00:34Z
Q&A - Pytania i odpowiedzi. Bardzo prosz o zadawanie pyta ,5K0nxRARJa0,2023-05-27T15:59:39Z
Rosyjski dziennikarz Aleksander Niewzorow celnie i bezlitonie komentuje rosyjskie spoeczestwo,gQ3y3lbwBGc,2023-05-25T16:00:15Z
Rosnce problemy rosyjskiego spoeczestwa przez napyw broni z Ukrainy [PODCAST],4cdA5m86u3U,2023-05-23T15:59:11Z
Europejskie firmy kt贸re mimo sankcji nadal wsp贸pracuj z rosyjskim przemysem obronnym [PODCAST],2g2F-CSIz3w,2023-05-21T15:59:09Z
Igor Girkin nie szczdzc krytyki m贸wi o obecnej sytuacji w Rosji i na froncie. Monolog Piwniczny,CpFbYCN3fi4,2023-05-19T15:59:04Z
Igor Girkin i jego koledzy robi swoj pierwsz konferencj w ramach Klubu Rozsierdzonych Patriot贸w,-CqxTj42YEU,2023-05-17T15:59:13Z
Rosjanie o polskich generaach udzielajcych si w mediach i zapdach imperialistycznych [PODCAST],mxh2sLXwMXs,2023-05-15T15:58:40Z
Rosyjski ekspert analizuje rosnce zagro偶enie ze strony Si Zbrojnych Ukrainy [PODCAST],7QxA-6fpCaY,2023-05-13T15:59:35Z
Rosyjski ambasador w Polsce 偶ali si rosyjskiej propagandzie na polski rzd i polskie spoeczestwo,G0bXtDo-rhk,2023-05-11T15:59:28Z
"Prigo偶yn opowiada o brakach amunicji, problemach w wojsku i zaniepokojeniu kontrofensyw Ukrainy",76CveoyTA1Q,2023-05-09T15:59:34Z
"Dlaczego Rosji bdzie o wiele trudniej przetrwa sankcje ni偶 Iranowi, ChRL, Kubie czy KRLD [PODCAST]",tGY2v0I7yKg,2023-05-07T16:31:22Z
"Rosyjska telewizja o Polsce w materiale polityczno-historycznym. Polska ""instrumentem"" Zachodu.",e0rFet4zBgA,2023-05-05T17:03:03Z
Rosyjskie straty gospodarcze spowodowane przez zajte terytoria Ukrainy [PODCAST],qta3yGesdYc,2023-05-03T16:01:15Z
"Rosyjski deputowany, gen. Gurulow, na amach propagandy nawouje do wprowadzenia stalinizmu w Rosji",WKm4vpLfITA,2023-05-01T16:02:25Z
Rosjanie o polskich zapdach imperialnych. Polska jako agresywne imperium [PODCAST],nYLNTed-3UA,2023-04-29T16:03:36Z
"Igor Girkin dyskutuje o specoperacji w czasie panelu dla organizacji ""Rosyjskich Przedsibiorc贸w""",o5LG_jmvhXU,2023-04-27T16:01:54Z
Ukraiska gospodarka po roku wojny - ogromne wyzwania i drzemicy potencja inwestycyjny [PODCAST],GCx49H_wFOE,2023-04-25T16:05:01Z
"Rosyjski ekspert opisuje histori polskich zbroje, a Runet komentuje polskie zakupy [PODCAST]",VQHMvogvbe8,2023-04-22T16:01:47Z
"Rosyjski weteran opowiada o pierwszych dniach walk o Chark贸w, swoich prze偶yciach i dowiadczeniach",FTl2pgzZhuU,2023-04-20T16:02:53Z
Propagandowy wywiad z pilotem Su-34 i jego skrupulatna analiza przez Igora Girkina [PODCAST],CBEEVrhq1oo,2023-04-18T16:00:44Z
Rosyjska profesor geografii ekonomicznej przedstawia stan rosyjskiej gospodarki [PODCAST],2RW06i2Xalc,2023-04-16T16:01:36Z
Rosyjski propagandysta Soowjow dowiaduje si o realiach rosyjskiego systemu biurokratycznego,EK7XxU1LT1I,2023-04-13T16:00:53Z
Igor Girkin analizuje zdolnoci Ukrainy i prognozuje jak bdzie wyglda wiosna. Monolog piwniczny,YGOYi-YD7uE,2023-04-11T13:59:39Z
"Igor Girkin opowiada o swojej pracy w Czeczenii, jako funkcjonariusz operacyjny FSB [PODCAST]",ieR8hMNt18I,2023-04-09T14:28:33Z
"Girkin zakada klub rozsierdzonych patriot贸w, a Niewzorow to komentuje i wbija szpile",0IlsFBI8DBk,2023-04-07T14:00:03Z
Problemy rosyjskiego przemysu pancernego - kr贸tka charakterystyka obecnych zdolnoci [PODCAST],VK5oxKqagyQ,2023-04-05T14:03:59Z
Wielkoruski oficer lamentuje o Polsce i przedstawia swoj wizj Europy. Pukownik Wadymir Kwaczkow,Qq_79pA6IE0,2023-04-03T14:05:34Z
"Historia rosyjskiej demografii i nadchodzce, katastrofalne prognozy [PODCAST]",qzk1zdDExaQ,2023-04-01T14:35:29Z
Debata polityczna Girkin kontra Nawalny,G6076K0HGnE,2023-03-30T14:09:19Z
Ukraiska ofensywa: rosyjskie prognozy i mo偶liwe warianty rozwoju sytuacji wiosn-latem [PODCAST],6cV8L1hjq74,2023-03-28T14:03:56Z
Rosyjski intelektualista Niewzorow komentuje wschodni rzeczywisto i rosyjskie spoeczestwo,5FHATCQJHKQ,2023-03-26T13:00:45Z
Igor Girkin w ostrych sowach zwraca si do Putina. A tak偶e stawia prognozy. Monolog piwniczny,1mhm7SBFnIs,2023-03-23T15:00:03Z
Rosyjska interpretacja dlaczego wiat anglosaski jest atrakcyjniejszy od rosyjskiego [PODCAST],1iVanY2hr7I,2023-03-22T15:06:56Z
Igor Girkin tumaczy w 12 punktach jak w gwarantowany spos贸b przegra wojn [PODCAST],bdtAb-y2_9o,2023-03-20T15:02:55Z
Weteran wojny na Ukrainie podsumowuje stan rosyjskiego wojska i sytuacj na froncie,wKszGSNbS3Q,2023-03-18T15:01:33Z
"Znany rosyjski turbopatriota wylewa swoj frustracj, bojc si ukraiskiej ofensywy [PODCAST]",nrQGzr1qmJU,2023-03-16T15:07:24Z
Igor Girkin podsumowuje kampani zimow i dyskutuje o problemach z W. Grubnikiem. Debata Piwniczna.,xkkVNocQfk8,2023-03-14T15:37:53Z
Rosyjski g贸d amunicyjny - jak walczy bez pocisk贸w? Brak mo偶liwych rozwiza problemu [PODCAST],y_b9fUXHeLE,2023-03-11T15:02:55Z
"Chiny w rosyjskiej propagandzie od Soowjowa - nadzieje, oczekiwania, ocena potencjau militarnego",J71HJXbDqTg,2023-03-09T15:35:16Z
Polska jako przeciwnik Rosji. Rozprawa historyczno-polityczna w rosyjskiej prasie i stylu [PODCAST],XzKfcGIUpdU,2023-03-06T16:05:43Z
Rosyjskie problemy gospodarcze i kreatywne pomysy rzdu na zaatanie bud偶etu [PODCAST],A5__GVLBdLw,2023-03-04T17:15:49Z
"Girkin i Michajow podsumowuj rok specoperacji, chiski Lend-Lease, wystp Putina. Debata Piwniczna",uYBDyQVHBio,2023-03-02T16:45:09Z
Igor Girkin i Klimow dyskutuj o obecnym stanie wojska i zdolnociach ofensywnych. Debata piwniczna,mk11KcwDmyo,2023-02-27T17:50:33Z
Bdne prognozy i prawidowe punktowanie rosyjskich niedostatk贸w - rosyjska analiza z 25 lutego 2022,sJ22x1RRm5c,2023-02-24T15:28:26Z
"Rosyjski artylerzysta walczcy na 2S3 ""Akacja"" opowiada o licznych problemach [PODCAST]",-PIThOnze5k,2023-02-22T17:43:47Z
Biaoruski propagandysta opowiada o Polsce i jej zamiarach rosyjskiemu propagandycie Soowjowowi,IOU-BVBnlT4,2023-02-20T15:31:29Z
Potencjalny konflikt na Tajwanie oczami rosyjskiego eksperta wojskowego [PODCAST],MRm50Mf08_0,2023-02-17T17:09:13Z
Rosyjski ekspert wojskowy reaguje na polskie plany modernizacyjne [PODCAST],qJGv6AmiNZA,2023-02-16T16:16:04Z
Igor Girkin polemizuje z rosyjskim dziennikarzem Muchinem na temat patriotyzmu. Debata piwniczna,za9JCGH1LjI,2023-02-15T15:06:45Z
Czego mo偶emy dowiedzie si o Igorze Girkinie analizujc jego poczt [PODCAST],2EbWiPNF0Pg,2023-02-11T17:56:50Z
Emocjonalna polemika Igora Girkina z Jewgienijem Prigo偶ynem,hD2XNbpWW_M,2023-02-09T17:32:11Z
Schematy i procesy mylowe jakie towarzysz Rosjanom w temacie Ukrainy [PODCAST],D9dQgCQ6VLI,2023-02-06T16:02:12Z
"Rosyjska gospodarka: cyberwojna, tworzenie pienidzy z niczego i bdy w prognozach na 2023",oIR-pgGPzWY,2023-02-05T15:11:28Z
Igor Iwanowicz podsumowuje sytuacj na froncie i odpowiada na pytania. Monolog piwniczny 30.01.2023,swzbpzwt4nM,2023-02-02T17:48:32Z
Wodzimierz Rudolfowicz komentuje decyzj o wysaniu Leopard贸w i Abrams贸w,fHkxUaUu9K8,2023-01-30T15:48:42Z
Rosyjski intelektualista Aleksander Niewzorow komentuje rosyjsk rzeczywisto,jLlv4xsb7Do,2023-01-28T14:04:43Z
Rosyjskie nadzieje zwizane z Chinami [PODCAST],qX2adVYXCc4,2023-01-24T16:18:57Z
Igor Girkin i Wadymir Kwaczkow dyskutuj o zmianach kadrowych 13.01.2023,drHE2F913GU,2023-01-20T14:57:43Z
"Wywiad mobilizacyjny: ""Czowiek, kt贸ry chce broni ojczyzny nie zadaje pyta jakie jest pastwo""",lc9TZJp2Tw4,2023-01-17T16:05:18Z
"Rosyjskie spoeczestwo, biznes i gospodarka, a sankcje i mobilizacja. Natalia Zubarewicz. Cz 2/2",1ieY1cqtL9o,2023-01-14T16:11:18Z
"Wadymir Kwaczkow kpi sobie z obywatela Szojgu i podsumowuje ""sukcesy"" rosyjskiego or偶a w 2022",QL_YciaqOZE,2023-01-12T14:25:27Z
"Nietrafione prognozy gospodarcze w 2022, kt贸re bd aktualne w 2023. Rosyjska gospodarka cz. 1/2.",n63tEw0srmU,2023-01-11T18:01:55Z
Igor Girkin robi podsumowanie 2022 i daje prognozy na 2023. Monolog Noworoczny 29.12.2022 ,4JQGCMgLn28,2023-01-06T14:48:14Z
"Gdzie jest T-14 Armata, opinia Rosjan o T-62M i s贸w kilka od Girkina o sytuacji mobik贸w z L/DNR",CX0EVg5TfdE,2023-01-03T15:24:40Z
"Polak o pseudonimie ""Lipton"", walczcy rami w rami z Siami Zbrojnymi Ukrainy pod Bachmutem",QuC2rR4QL-E,2023-01-01T14:16:25Z
