Title,Video ID,Published At
"Blac Chyna REMOVES TATTOOS, Finds Religion! SimpCast with Chrissie Mayr, Dick Masterson, Anna TSWG",LNyUJle2vQM,2023-05-02T19:30:01Z
Chrissie Mayr’s Dad Shakes Her Down For Suit Money! Who Should Pay? Cecil Reacts! Comment Below!,fTnKPJdksEQ,2023-05-02T14:00:32Z
Trans TikToker Kelly Cadigan Gets HATE For NOT Playing Pronoun Game! On Chrissie Mayr Podcast,G470FMADNkU,2023-05-01T16:15:00Z
"SimpCast LIVE in Las Vegas! CROWDER DRAMA! Chrissie Mayr, Ariadna Jacob, Keanu, That Tugg Life, Lila",CxW07xjB-CI,2023-05-01T04:42:35Z
"Brittany Venti's TAKEDOWN of Pearl aka Pearly Thingz! Thoughts? SimpCast, Chrissie Mayr, Lila Hart",dTOAQLLMlq4,2023-04-30T16:30:10Z
"Las Vegas Day 4! Pool Stream! Chrissie Mayr, Lila Hart, Keanu Thompson!",ovS6up2FHks,2023-04-29T22:36:19Z
"Bobby Lee LIED! Changes Story of ABUSE! SimpCast- Chrissie Mayr, Lila Hart, Brittany Venti, Tuggs",qHKlRXpYB3A,2023-04-29T19:45:02Z
"James O'Keefe VS Dylan Mulvaney! Hotel in Beverly Hills! SimpCast with Carmen Studer, Chrissie Mayr",Pc1-A06Yaao,2023-04-29T15:00:15Z
"College Athlete Riley Gaines ASSAULTED by Trans Activists! SimpCast Chrissie Mayr, Brittany Venti",RnKKusgVerU,2023-04-28T18:30:19Z
Blue Jays Pitcher Anthony Bass CRIES to United on Twitter! Lazy Wife WON'T Clean Mess! Chrissie Mayr,9Dfp_sWUzII,2023-04-28T15:00:05Z
"Dylan Mulvaney Signs with Nike AFTER Bud Light? SimpCast with Chrissie Mayr, Brittany Venti, Lila",05dJQPWmpKY,2023-04-27T19:30:00Z
NYPD Officer Promotion Cancelled After Stuffing Undies In Officers Mouth! Chrissie Mayr & Cecil,NV4UhnGD8mM,2023-04-27T14:00:11Z
"Las Vegas Day 1! LIVESTREAM Chrissie Mayr, Lila Hart, Keanu Thompson! Friday Night Tights Meetup!",5TE2bMMGl8w,2023-04-26T23:26:16Z
"SimpCast Reacts to Blaire White Twitter Attacks! Chrissie Mayr, Brittany Venti, Anna, Ariadna, Keanu",tg58y0IZ4Ms,2023-04-26T17:00:37Z
"Is Cenk Uygur of The Young Turks Pro Bestiality? Anthony Cumia, Eric July, Alex Stein, Owen Shroyer",Tv-LLxV8LaM,2023-04-25T17:00:14Z
"Anthony Cumia KICKED From Comedy Cellar in NYC! Bill Burr Beef! Chrissie Mayr, Alex Stein, Karl WATP",8qjDtDNlZ5Q,2023-04-24T15:00:05Z
"SimpCast 73 Razorfist, Kelly Cadigan, Freely Ashley, Chrissie Mayr, Haley Kennington, Brittany, Anna",egDYdGY8YeE,2023-04-24T04:34:53Z
Chrissie Mayr Reflects on WHAT HAPPENED with Brittany Venti & Alex Stein On Her Stream,EkLzdVQMTNo,2023-04-23T17:00:05Z
"Brittany Venti Explains Goblin Style Dating to SimpCast! Chrissie Mayr, Ariadna, Anna TSWG",JuH3INyKPRU,2023-04-22T16:00:14Z
Steven Crowder Details Exposed! Chrissie Mayr Breaks Down the Dave Landau & Michael Malice Podcast!,VI6kiy1OIIM,2023-04-22T05:05:46Z
Adam Johnson aka The Podium/Lectern Guy Explains January 6th & The Iconic Photo! Chrissie Mayr Pod,SzoE5EG1Lwk,2023-04-21T18:00:20Z
"Chrissie Mayr in the Morning - Trans Athletes, Alexandra Cooper, Gay Throuple Parents, Rich Dating",ZaND_LAzGRU,2023-04-21T17:14:02Z
"LIVE Chrissie Mayr Podcast with Kyle Becker! Becker News, GOP Trans Bill, RFK , BuzzFeed News",kc1It4cK6x4,2023-04-21T10:14:49Z
"Asa Akira is Over! Chrissie Mayr, Brittany Venti & Alex Stein Discuss David Choe led DVDASA Pod Clip",YyyEC8P4V1U,2023-04-21T03:35:35Z
Greg Gutfeld & Geraldo Rivera Have Spat on FOX News' The Five! Chrissie Mayr Reacts!,QlCal5UwAZA,2023-04-20T16:14:00Z
LIVE Chrissie Mayr Podcast with Freely Ashley!,oTwa49IrzOo,2023-04-20T02:36:34Z
"LIVE Chrissie Mayr Podcast with Josh Lekach- Host of Wrong Opinion, Censorship, Censored.TV, Gumroad",z4mpOTk-ZyA,2023-04-19T22:50:12Z
"Chrissie Mayr in the Morning - Mailbag, Mandalorian Finale, Anthony Bass, McDonald's Fries, Disney",15k-kdp_ZAY,2023-04-19T18:16:50Z
Dylan Mulvaney & Jeffrey Marsh Have Become Creepy Child Grooming Duo! Kelly Cadigan & Chrissie Mayr,hBP6NR_R8z8,2023-04-19T18:00:18Z
Bud Light VP Thrown Under The Bus! Dylan Mulvaney Plot Thickens! Chrissie Mayr Reacts!,Q2mjYMuUCpc,2023-04-19T01:30:06Z
LIVE Chrissie Mayr Podcast with Buck Angel,hiudaeTa4ik,2023-04-19T00:04:43Z
"Chrissie Mayr in the Morning! Haribo, Digital Hoarding, Kylie Jenner, Arnold Schwarzenegger, Sephora",Zo7tRN7a6p4,2023-04-18T16:43:29Z
Elon Musk & Many Others Trying To Stop The Growth Of AI! Skynet is Coming! Chrissie Mayr & Cecil,9fouYGMIWNs,2023-04-17T16:00:05Z
"SimpCast 72! Jalisa Danielle, Carmen Studer, Chrissie Mayr, LeeAnn, Brittany Venti, Nina, Anna",7wurVfcoqN8,2023-04-17T06:23:35Z
Chrissie Mayr's Waxer Does What?! Cecil Learns About Her STRANGE Brazilian Wax Experience!,q2lBmlMPvjM,2023-04-16T15:00:38Z
Chicago Crime Going Down! Latin Down Syndrome King ARRESTED for Murder! Chrissie Mayr & Cecil React,fcCFBJt0aPk,2023-04-15T15:00:26Z
Is The TikTok Ban aka The Restriction Act The New Patriot Act 2.0 On Steroids? Chrissie Mayr Reacts,EUNn8kp0hmg,2023-04-14T19:45:00Z
Are Tom Brady & Reese Witherspoon Dating? Chrissie & Cecil React! Is Gisele Sad?,MIFWTj7fIZs,2023-04-14T17:00:20Z
"Chrissie Mayr in the Morning with Cecil and Nina Infinity! Greg Gutfeld, Geraldo Rivera, Woke Alerts",Tzhf3Tt7i9g,2023-04-14T16:26:16Z
LIVE Chrissie Mayr Podcast with Adam Johnson aka The Podium Guy,69rQ7-9BH_k,2023-04-14T03:27:31Z
"SimpCast Reacts to Dylan Mulvaney Bud Light Ad! Chrissie Mayr, Lila Hart, Keanu Thompson",NTiiBTFhIu0,2023-04-13T17:00:20Z
"Chrissie Mayr Podcast 600 Episode Stream! Anthony Cumia, Eric July, Alex Stein, Anna TSWG, WATP",uQN0t3g-CP8,2023-04-13T07:38:46Z
Is Dylan Mulvaney Just Trolling The World? Chrissie Mayr & Cecil Discuss the Bud Light Partner,7PXexdf6KKU,2023-04-12T15:15:00Z
"LIVE Chrissie Mayr Podcast with Kelly Cadigan! ""Wrong"" Opinions on Trans Community!",lWHzkKi-RRQ,2023-04-12T02:28:30Z
LIVE Chrissie Mayr Podcast with George Papadopoulos! Author & Donald Trump Advisory Panel Member,66OJB0WOhv8,2023-04-11T21:23:58Z
Disney Mandalorian CRINGE! Lizzo & Jack Black Star In WORST Star Wars Episode! Chrissie Mayr & Cecil,LFe4yHVSZpE,2023-04-11T17:00:12Z
Chrissie Mayr in the Morning! Mailbag Day!,5BdH_-wEo7Y,2023-04-11T16:53:38Z
"What Does Perry Caravello WANT in a Woman? SimpCast with Chrissie Mayr, Brittany Venti, LeeAnn Star",X8yFja3iQwo,2023-04-10T15:15:01Z
"SimpCast 71- Kara Lynne, Tuggs, April Imholte, Chrissie Mayr, Brittany Venti, Lila Hart, Nina",lxNw6U0EFaw,2023-04-10T06:24:29Z
What Inspired Leonydus To Go Against Wokeism! Chrissie Mayr Podcast,G6O0BYN-47o,2023-04-09T15:00:09Z
Forest Mommy Running For City Councilmp4,JdY0rSEA6nY,2023-04-08T17:00:14Z
"Alex Stein TAKES OVER New York City! CNN, Trump Indictment & Gregg Opie Hughes? Chrissie Mayr",XaUSNMLlbxM,2023-04-07T17:00:16Z
Chrissie Mayr EXCLUSIVE! Vegas Workers Offer Jimmy Garoppolo FREE S_x! Caitlin Bell & Alice Little,sIA5u39EViw,2023-04-07T02:44:06Z
The Gwyneth Paltrow Case Is Finally Over! Chrissie Mayr Reacts to Goop Founder’s Court Victory,t0HrGqlhItM,2023-04-06T18:00:20Z
"Chrissie Mayr in the Morning - Brittany Venti, Lizzo, Mandalorian, Tom Brady, Reese Witherspoon",-bi0dbBD3l4,2023-04-06T17:07:36Z
Exclusive: Billboard Chris Assaulted By Trans-Activists While Police Laugh! Chrissie Mayr Podcast,nR5CCEJg6K8,2023-04-05T22:00:07Z
Brit Leilani Dowding Shares Her Spicy Takes on Prince Harry & Meghan Markle... What Are They Up To?!,-UhF4Rzuh8c,2023-04-05T04:00:00Z
Chrissie Mayr in the Morning,M38uxaGLQg4,2023-04-04T16:03:01Z
Isabella Recapping Her James O'keefe Post Project Veritas Interview & The Shocking Staff Betrayal,A8NwUWYUHJU,2023-04-04T15:30:03Z
Amouranth wants to make Family Friendly Content on OF,fy7fNUvcKBs,2023-04-03T14:30:12Z
"SimpCast 70! Xia, Lila Hart, Keanu, Chrissie Mayr, Brittany Venti, Anna TSWG! Dylan Mulvaney Chat!",L732khSgBQg,2023-04-03T05:15:46Z
"LIVE Chrissie Mayr Interview with Billboard Chris! Assaulted by Trans Activist in Vancouver, Canada",KWm1jKQ1dcc,2023-04-02T23:39:59Z
"James O'Keefe Starts New Group ""OMG""! SimpCast Reacts! Chrissie Mayr, Melonie Mac, Geno Bisconte",ZMCT2V631ic,2023-04-02T20:00:18Z
Keri Smith & Chrissie Mayr React to Nashville Tragedy... Is Trans A Topic Needing A Convo?,WhPJzZeHrtM,2023-04-02T15:00:20Z
"Twitter Fight! Isabella Riley VS Iggy Azalea! SimpCast Reacts! Chrissie Mayr, Brittany Venti, LeeAnn",Q1x_jDPzOVo,2023-04-01T18:15:00Z
"Kang the Conqueror Actor Jonathan Majors ASSAULT UPDATE! SimpCast- Chrissie Mayr, Ashton, Anna TSWG",EEyWl4iGcFU,2023-04-01T14:00:08Z
Stormy Daniels is Being USED By Media to HURT Donald Trump! Chrissie Mayr Reacts to Latest News,z4_GZ0km57w,2023-03-31T19:00:07Z
"Chrissie Mayr in the Morning - Trump Indicted, Lindsay Graham, Mark Wahlberg, Gwyneth Paltrow",4xqdQOrBeQw,2023-03-31T16:50:37Z
"SimpCast Reacts to HILARIOUS Gwyneth Paltrow Ski Accident Court Case! Dick Masterson, Chrissie Mayr",Mm1kMrO_g-o,2023-03-31T13:30:08Z
Donald Trump Arrested! Chrissie Mayr & Aydin Paladin React Live During Stream!,_ZVXmcUlsVM,2023-03-31T02:00:10Z
LIVE Chrissie Mayr Podcast with Aydin Paladin! Eliza Bleu Breakdown and Reaction,iEGGAnixrUg,2023-03-30T23:44:03Z
"Chrissie Mayr in the Morning - Cecil and Ashton! Stopping AI, Khloe Kardashian, NYPD, Trump, Nebula",49cRRDQPt9Y,2023-03-30T16:48:50Z
Steven Crowder & Mug Club MOVE to Rumble WITHOUT Dave Landau! Chrissie Mayr Reacts,fO7bD6r_nUE,2023-03-30T13:30:23Z
LIVE Chrissie Mayr Podcast with Keri Smith! Deprogrammed!,gq18NljH7IM,2023-03-29T19:58:08Z
"Chrissie Mayr in the Morning - Sympathy for the Shooter, Drew Barrymore, Gwyneth Paltrow, Matt Damon",wGyMevkk8_8,2023-03-29T17:17:10Z
Chrissie Mayr Gets a Strike! Brittany Venti's Channel Removed From YT! Has YouTube gone TOO FAR?!,KTS35wMgIw8,2023-03-29T13:30:08Z
LIVE Chrissie Mayr Podcast with Isabella Riley! Conservatives! Iggy Azalea!,RpxsM36uk_Y,2023-03-29T02:32:12Z
Geno Bisconte Recaps Episode 1000 of In Hot Water on Compound Media w/ Chrissie Mayr & Cecil React,LsANYwpZ0EQ,2023-03-28T21:00:09Z
LIVE Chrissie Mayr Podcast with Monique from Radio Gunk! Howard Stern & Stuttering John Updates,lqx_WJ29pSw,2023-03-28T20:24:08Z
"SimpCast Reacts to NEW Little Mermaid Trailer! Chrissie Mayr, Brittany Venti, Ariadna, Anna, Keanu",sZfOQZWxWug,2023-03-28T13:30:18Z
Blaire White & Morgan Ariel BEEF On Twitter Over Conservative Values! Chrissie Mayr Reacts!,agFHNpYB5WY,2023-03-27T17:00:01Z
"SimpCast 69 Dick Masterson, Ashton, LeeAnn Star, Chrissie Mayr, Brittany Venti, Forest Mommy",IhJYByT2PXw,2023-03-27T05:49:22Z
Meghan Markle & Harry KEEP COMPLAINING!! Chrissie Mayr Reacts to the Royals Whining!,sgBeA0Q_HTI,2023-03-26T16:00:28Z
Chrissie Mayr Saturday Live Stream! Joined by Cecil & Geno Bisconte! John Fetterman's Lump & Clone!,VlnCWbhBOXE,2023-03-25T22:17:52Z
Chrissie Mayr & Nina Infinity React to ELIZA BLEU GRIFT Accusations! Should Fans Dictate Content!?,ntZjnPAfLZ8,2023-03-25T14:00:33Z
"SimpCast Reacts to Woody Harrelson SNL Monologue! Chrissie Mayr, Lila Hart, Anna TSWG, Nina Infinity",z8Zrk5o4rW0,2023-03-24T14:00:29Z
"SimpCast 68! Geno Bisconte, Erik Nagel, Carmen Studer, Melonie Mac, Brittany Venti, Chrissie Mayr",Vddzs-BiZh4,2023-03-24T01:00:06Z
"Chrissie Mayr in the Morning - Brittany Venti Struck, Crowder, Mug Club, Rumble, Gisele, Tom Brady",h7pZyMR-ygg,2023-03-23T19:19:57Z
Chrissie Mayr TRIES To Hang New Neon Sign with Dental Floss!? This won't end well. Fealty SuperCut,Hlu4CnhOx20,2023-03-23T18:00:12Z
WTF Happened to Bridget Fonda?! At 58 Is She Even The Same Person?! Chrissie Mayr Goes Blind!!!,IntQ_E895OM,2023-03-23T02:30:14Z
School Lunch Lady ARRESTED for Serving Up HOT DISHES to Students! Chrissie Mayr Reacts,bFohGm_btsM,2023-03-14T13:30:14Z
"Can Joe Rogan's New Comedy Club in Austin, Texas SAVE Cancelled Comedians? Chrissie Mayr Reacts",k1Pp0zvj-vM,2023-03-13T15:00:37Z
"SimpCast 67 - Perry Caravello, LeeAnn Star, Chrissie Mayr, XRay Girl, Brittany Venti, Anna TSWG",GCcsI6cUwDo,2023-03-13T07:40:48Z
Lila Hart MISTAKES Bobcat Goldthwait for a SimpCast Fan! Chrissie Mayr & Anna That Star Wars Girl,tk2E4v79Uu8,2023-03-12T16:15:02Z
"REDEMPTION! Heckler From Chrissie Mayr's San Diego Show, Matt Baker Responds Live!",8w_TkhSmiAo,2023-03-11T19:30:01Z
"Chrissie Mayr in the Morning! Trump, Stormy Daniels, Seth Rogan, CT Lunch Lady",szjdY-sjXAA,2023-03-10T17:10:26Z
Seth Rogen's New Teenage Mutant Ninja Turtles and April O'Neil REACTION by Chrissie Mayr,MX5qkRMEzYo,2023-03-10T14:45:01Z
LIVE Chrissie Mayr Podcast w/ Jay Drunk 3PO! Galactic Starcruiser! Gina Carano! Disney News,ftxdK4v2kRw,2023-03-10T04:26:34Z
"Chrissie Mayr in the Morning! Pronoun Lawsuit, Joe Rogan's New Club, Chris Rock, Pete Davidson",H4bUGbiCRPM,2023-03-09T17:49:14Z
Only Caviar! Hilary Duff Says NO to ANY Other Snacks for Her Kids?! Chrissie Mayr Reacts!,VYtV6T_vKjo,2023-03-09T14:30:15Z
LIVE Beer Tasting & Chrissie Mayr Podcast with Allie Rae! Tap That with Allie!,t06jakrS-ng,2023-03-09T04:19:41Z
LIVE Chrissie Mayr Podcast with Chase aka Sovereign Brah from Whatever Podcast,EwAnlDGPH8E,2023-03-08T23:51:40Z
"Chrissie Mayr in the Morning! Blair White vs. Morgan Ariel, TMNT, April O'Neil, Mean Girls",9D0_077cgAU,2023-03-08T17:31:30Z
Dilbert Creator Scott Adams CANCELLED! Chrissie Mayr & Leonydus Johnson React! Who is REALLY Racist?,YDXZKX0uUDY,2023-03-08T14:15:01Z
"LIVE Chrissie Mayr Podcast with Leilani Dowding - LockdownFiles, Mark Steyn, Matt Hancock",DaWT7Y3rTTY,2023-03-08T03:36:53Z
"LIVE Chrissie Mayr Podcast with Jess Gill - Religious Freedom vs. Creative Expression, Quran Boy",GdOmVOkJm2k,2023-03-07T21:40:06Z
"Chrissie Mayr in the Morning! Geno Bisconte, Cecil, Fealty! Holly Hendrix Recap! Pete Davidson",_dNkFEij1m0,2023-03-07T18:44:18Z
"SimpCast Reacts to ""Epstein Flight Log""! Is it REAL? Chrissie Mayr, Melonie Mac, Chicks on the Right",Br5qC8h2jc4,2023-03-07T18:40:00Z
"Eliza Bleu Reference in Chrissie Mayr Crowd Work at her Comedy Show in Pasadena, California!",wNSkk52yGoQ,2023-03-06T18:31:01Z
"SimpCast 66 - Ariadna Jacob, Keanu Thompson, Mandy Summers, Chrissie Mayr, Brittany Venti, Anna TSWG",gyY3vcUeuTY,2023-03-06T06:24:38Z
"Chrissie Mayr & Lila Hart Recap Pasadena, California Stand Up Comedy Show In Cosplay on SimpCast!",36WIssJ4lOs,2023-03-05T15:45:00Z
Chrissie Mayr & Lila Hart Discuss Stand Up Comedy HECKLER in San Diego! InfoWars Matt Baker!?,VLjM2Wu_Cio,2023-03-04T21:30:02Z
"Chrissie Mayr Deals with Laughing Heckler at Mic Drop Comedy Club in San Diego, California",Bm0J0QI3yEI,2023-03-04T16:30:02Z
"Chrissie Mayr in the Morning! Billie Eilish, Is UNC Anti-Woke?, NJ Cat Woman, Hilary Duff, Hershey",t5XY9S3clSQ,2023-03-03T17:06:33Z
Rest In Peace Raquel Welch! Hollywood Icon Passes Away at 82. Chrissie Mayr Reacts to the News,5AvwYMd68hY,2023-03-03T14:15:00Z
LIVE Chrissie Mayr Podcast with Megan Fox,E9lgGX9MDRc,2023-03-03T04:44:15Z
LIVE Chrissie Mayr Podcast with Leonydus Johnson!,qjIzb2RyWys,2023-03-02T21:53:31Z
"CREEPIEST Heckler Laugh! Chrissie Mayr Stand Up Comedy in San Diego, California",f3qZVlodA8s,2023-03-02T19:00:14Z
Is This The End of Eliza Bleu’s Twitter Meltdown? Chrissie Mayr Reacts to Latest Cringe,03tFIon9dJw,2023-03-02T14:30:00Z
LIVE Chrissie Mayr Podcast with Matt Baker of InfoWars,8d21ZYfVtHg,2023-03-02T03:44:17Z
"Chrissie Mayr Shot Hesitancy! Stand Up Comedy from Mic Drop Comedy Club in San Diego, California",Sex9Wgt5hO4,2023-03-02T01:00:16Z
LIVE Chrissie Mayr Podcast with Misty Winston! Free Julian Assange!,NgSZI2SQrSE,2023-03-01T21:50:59Z
Holly Treats KICKED OFF TINDER For Being TOO HOT! From Chrissie Mayr's Wet Spot on Compound Media,1B0qjetj0TM,2023-03-01T18:00:01Z
"Chrissie Mayr on Vaccine Push! Stand Up Comedy Clip! Mic Drop Comedy Club in San Diego, California",SY1Dnm7gchs,2023-02-28T20:30:05Z
Eliza Bleu Officially CANCELS Upcoming Minds Event Appearance! Chrissie Mayr & Nina Infinity React,JJ-aBJ7McAw,2023-02-28T18:45:00Z
Chinese Spy Balloons! English TikTokers Troll China Embassy In Revenge? Chrissie Mayr Reacts,6Z9iXlbt_Fo,2023-02-27T16:30:02Z
"SimpCast 65 - LIVE From California! Chrissie Mayr, Lila Hart, Anna That Star Wars Girl",JUDBhrO4QcE,2023-02-27T05:50:33Z
"SimpCast Embarrassing P Stories! Chrissie Mayr, Olivia Rondeau, Brittany Venti, Carmaxlla!",EwRQ_QYexuk,2023-02-26T16:00:12Z
"WHY Do We Cover Eliza Bleu? Chrissie Mayr, TBYS, Lauren, Radix, Greg Hoyt Art Respond!",AsADKdsYGXA,2023-02-25T17:30:02Z
Why is Chat GPT Censoring Hunter Biden New York Post Article!? Chrissie Mayr Reacts,wLqhTTmSsK0,2023-02-25T17:15:03Z
"How Opie & Anthony Cumia TROLLED Tony Danza! SimpCast with Chrissie Mayr, Brittany Venti, Anna TSWG",c8WjnPOPTpE,2023-02-25T17:00:31Z
California Post Show Wrap Up! Chrissie Mayr and Lila Hart! Pasadena and San Diego,tOxrp0MnO5A,2023-02-25T08:27:16Z
Elon Musk's New Twitter Safety Head Ella Irwin is BRUTAL! Anthony Cumia & SimpCast React!,f_vb8i16SmI,2023-02-24T20:30:07Z
"Chrissie Mayr Has NAUGHTY DREAM of Tim Pool! SimpCast with Melonie Mac, Tree of Logic, Anna TSWG",z5WylDCnbTc,2023-02-24T15:30:12Z
Chrissie Mayr Reacts to CRINGE Comedian Chelsea Handler Viral Video! “Girl Boss”? FAIL,0YXSwsjgYYI,2023-02-24T02:00:07Z
YouTube CEO Susan Wojcicki Stepping Down? Sister Owns 23 & Me?! They Are Worth Hundreds of Billions?,SinzN4GNa7s,2023-02-23T19:30:02Z
"Swimmer Lia Thomas Creepy Behavior Called Out by Teammates! SimpCast w/ Chrissie Mayr, Melonie Mac",HEl99Qy7BBg,2023-02-23T15:30:05Z
"Is Eliza Bleu LYING About ""Black Eyes""? Anthony Cumia, Chrissie Mayr Anna TSWG & SimpCast Speculate",FEOAHB8xpfQ,2023-02-22T23:45:00Z
"Melonie Mac Stalker Taking HER To Court? She Updates SimpCast, Chrissie Mayr, Tree of Logic, & Anna",BE-3S1tpZy0,2023-02-22T21:30:02Z
"Chrissie Mayr in the Morning - California Edition - Eliza Bleu, Mask Mandates, Pixie Curtis, Ball",2cqJLp8i1Eg,2023-02-22T20:32:54Z
"Prince Harry & Meghan Markle SUING South Park! SimpCast, Chrissie Mayr, Tree of Logic, Melonie Mac",bahkwPANd_g,2023-02-22T15:45:01Z
"Aidan Kearney OPENS UP About Eliza Bleu, Tim Pool, & The TimCast Reaction! On Chrissie Mayr Podcast",9VZ9fR7Lo7Y,2023-02-22T00:00:08Z
"Influencer Diana Deets aka Coconut Kitty Passes. SimpCast Reacts, Chrissie Mayr, Melonie Mac, Anna",ztXqkpuwwaE,2023-02-21T20:00:14Z
"Anthony Cumia, Chrissie Mayr, Brittany Venti & SimpCast React to O&A's WORST GUEST: Paris Hilton!",rfWd4OvFvH8,2023-02-21T15:30:21Z
Chrissie Mayr Reacts To Growing Ohio Tragedy in Palestine. Resident Interviewed With Shocking News,zS1aOx-cJFI,2023-02-20T20:15:01Z
LIVE! Eliza Bleu Investigators Explain their Stances and Opinions! Chrissie Mayr & Faran Balanced,ogmom4q_U1Y,2023-02-20T18:56:21Z
"SimpCast 64 Chicks on the Right, Tree, Chrissie Mayr, Brittany Venti, Melonie Mac, Anna TSWG",bDhvmSqwzOk,2023-02-20T08:38:51Z
George Soros Funded Global Disinformation Index! The ESG of Global News! Chrissie Mayr Reacts,MAqvOt0zdCI,2023-02-19T16:45:00Z
"Trans Figure Skater from Finland ROASTED By Anthony Cumia, Brittany Venti, Chrissie Mayr, & SimpCast",uh9lflt4Jlg,2023-02-18T21:00:19Z
Eliza Bleu For for Minds Event Debating Content Moderation? Chrissie Mayr Reacts to Libby Emmons,OM4uhH_8VfQ,2023-02-18T16:30:02Z
"Former Police Officer Meagan Hall Claims She Was Groomed! Chrissie Mayr, Defango & SimpCast React",wtpHdcwjTP4,2023-02-17T19:30:08Z
Anti-Trafficking Advocate SPEAKS OUT About Eliza Bleu! Carmen Studer on with Chrissie Mayr,trRae0xgisE,2023-02-17T16:00:06Z
Pediatric Gender Clinic Whistle Blower!  Chrissie Mayr Reacts to HEARTBREAKING Admissions,ioj9zNnPbmI,2023-02-16T22:00:15Z
LIVE Chrissie Mayr Podcast w/ Aidan Kearney! Doctor Turtle Boy! Shane Cashman & Eliza Bleu Breakdown,5ceV-1NvUWA,2023-02-16T21:15:48Z
"Chrissie Mayr in the Morning! Chelsea Handler, Chis Cuomo, Raquel Welch, Sam Brinton, Susan Wojcicki",W6HMdu7RF6M,2023-02-16T18:03:29Z
"Secret Eliza Bleu Blog Discovered by Lauren! SimpCast Reacts! Chrissie Mayr, Nina Infinity, Defango",AA63ennsTLY,2023-02-15T22:00:10Z
LIVE Chrissie Mayr Podcast with Carmen Studer! Chelsea Handler Cringe! Eliza Bleu Chat! MORE,OWcaIrdTafc,2023-02-15T21:57:27Z
"Chrissie Mayr in the Morning! Chinese Spy Balloon Prank, ChatGPT, Alec Baldwin, Elon Musk",WKMSOs_LAFI,2023-02-15T17:41:01Z
"Gavin McInnes FREAKS During Alex Stein Blaze Show! Chrissie Mayr, Aly Drummond & SimpCast React!",MgItyZy3qz8,2023-02-15T14:30:12Z
Steel Toe LOST VIDEOS Because Of Eliza Bleu! Then SUSPENDED For Project Veritas Clip! Chrissie Mayr,Boh0WtF_Stg,2023-02-14T22:00:05Z
"Chrissie Mayr in the Morning! Eliza Bleu, Minds, Defango, Global Disinformation Index, Ohio",hFlAhPEJz5c,2023-02-14T18:53:54Z
Will Defango SUE Tim Pool over Shane Cashman's Eliza Bleu Story? SimpCast & Chrissie Mayr React!,Al2Jl_zcutk,2023-02-14T14:30:06Z
Haley Kennington Gives Her Insights about Eliza Bleu's Twitter Rant Blaming PR Bots to Chrissie Mayr,icq4Quf4eLA,2023-02-14T04:30:09Z
Twitter Executives Get GRILLED by House Oversight Committee! Chrissie Mayr Reaction,_Zz8r3lCR8s,2023-02-13T20:15:00Z
Eliza Bleu Movie Full Cast Revealed! Fields of Bleu! Chrissie Mayr & Faran Balanced React to Casting,GM8BHNlVhFQ,2023-02-13T15:00:10Z
"SimpCast 63! ELIZA BLEU NEWS Alex Stein, Chrissie Mayr, Brittany Venti, Anna TSWG, Aly, Mandy, XRay",fz9ACRCTW7A,2023-02-13T07:12:55Z
Tim Pool & Chicks on the Right are Being ATTACKED for NOT Covering Eliza Bleu? Chrissie Mayr Reacts,-2TKvD-25E4,2023-02-12T19:30:09Z
"Eliza Bleu CHANGES HER STORY Again! Chrissie Mayr Reacts to BIZARRE Direction ""Stay Focused!""",Pc-daJ2UU_4,2023-02-12T15:30:10Z
"OFFICIAL Eliza Bleu LOLCOW Debate! FUNDRAISER! Chrissie Mayr, Faran, Dick Masterson, Harlow, Haley",oaMYx5L00Lo,2023-02-12T04:42:54Z
"Adults Treating Dolls Like REAL BABIES! SimpCast w/ Chrissie Mayr, Nina, LeeAnn, Lila, Keanu",2eeG2TRazKE,2023-02-11T19:45:00Z
Is Chrissie Mayr Obsessed with Eliza Bleu? Obsessions VS Concern! What is REALLY Important?,yw1RILZjOEM,2023-02-11T18:30:09Z
"SimpCast Reacts to Melonie Mac's Infamous ASMR! Brittany Venti, Chrissie Mayr, Ashton, Anna",l0Wr6X-DH_4,2023-02-11T14:30:11Z
"SWATTER Who Went After Chrissie Mayr, Bob Levy, & Steel Toe Sees JUSTICE! Aaron & April Give Update",KJnnKoshby4,2023-02-10T20:00:11Z
"Chrissie Mayr in the Morning! Eliza Bleu, Meltdowns, TimCast, and more!",BpFouhOA96M,2023-02-10T19:34:07Z
Blaire White DESTROYS Eliza Bleu in NEW video! Chrissie Mayr plus Aaron & April of Steel Toe React!,T0ClBypQ5oA,2023-02-10T14:30:12Z
"Kardashian & Jenner Family WITHOUT Plastic Surgery! SimpCast w/ Chrissie Mayr, Brittany Venti, Xia",ff_YERACC04,2023-02-09T20:30:07Z
"Chrissie Mayr in the Morning! Eliza Bleu, Twitter, Gender Clinic Whistleblower, NYC Migrant Crisis",DMlH3GYFVFY,2023-02-09T19:25:43Z
Eliza Bleu IGNORED Andrew Tate “Victims”! Ashton Birdie Opens Up to Chrissie Mayr & Nina Infinity,63r9i7U-_Ww,2023-02-09T14:30:01Z
"LIVE Chrissie Mayr Podcast with Haley Kennington - Eliza Bleu Tweets, Daily Wire, What Is A Woman?",tZNX8DXojFg,2023-02-08T18:31:39Z
"SimpCast Reacts to Baby Talk Fetishes! Chrissie Mayr, Brittany Venti, Melonie Mac, Anna TSWG, Ashton",JSE7z8s_4dw,2023-02-08T15:45:01Z
LIVE Chrissie Mayr Podcast w/ Aaron & April: Steel Toe Morning Show! Eliza Bleu News! Blaire White!,Ssu_rv2vX7Q,2023-02-08T06:14:27Z
Eliza Bleu Article by Tim Pool’s TimCast Journalist Shane Cashman Released! Chrissie Mayr Reacts,NjGGL9_4qeM,2023-02-08T05:15:11Z
"Chrissie Mayr in the Morning! Shane Cashman's Eliza Bleu article, New Etiquette Rules",_E-pGEqrUBI,2023-02-07T18:56:20Z
"Simpcast Talk About Seeing Their Parents Making Love! Chrissie Mayr, Brittany Venti, Rekieta, Faran",LBMPWjcCf14,2023-02-07T14:45:02Z
Should YOU Pay for Overweight Airline Passengers Extra Seats? Chrissie Mayr Explains!,EnAAzagwgSo,2023-02-06T15:00:08Z
"Comedian Lila Hart ARRESTED! SimpCast Learns the Small Tale! Chrissie Mayr, Faran, Tree, Defango",tTMG82BjDP4,2023-02-05T18:00:31Z
"DabbleCon Afterparty! Chrissie Mayr, Anthony Cumia, Karl, Vinnie, Who Are These Podcasts!",en38MFvDVQY,2023-02-05T05:08:03Z
Simpcast Discovers Turkiish Oil Wrestling,D6qJY8RuggY,2023-02-04T18:45:00Z
Eliza Bleu Ruined Limp Bizkit's Fred Durst Night!? Chrissie Mayr EXPLAINS This INSANE Story! LMAO,kSiz0eRGW_A,2023-02-03T19:00:18Z
Liberty Lockdown’s Clint Russell EXPLAINS his Eliza Bleu “Child Consent” Viral Clip w/ Chrissie Mayr,jlcBPl-Dbx0,2023-02-03T16:00:07Z
The Hill Covering Eliza Bleu! Chrissie Mayr LIVE Watching with YOU! Nina Infinity Joins in!,1L8il5MqUqs,2023-02-03T00:24:01Z
Honeysuckle Weeks Drives Drunk To Avoid Threesome?! Serial Drunk Driver! Chrissie Mayr & Cecil!,Ln-dQkhykYs,2023-02-02T19:30:01Z
"Chrissie Mayr in the Morning! M3GAN Movie Review, Eliza Bleu, Fred Durst, NYC Migrants, Frosk,",-WKAVmA5sS0,2023-02-02T19:27:02Z
"Transphobia ERASING Women Spaces! SimpCast w/ Arielle Scarcella, Eva Lovia, Brittany Venti, Chrissie",BmDkEehDEro,2023-02-02T14:30:03Z
Eliza Bleu REAL TIME Twitter Following Social Blade to LoFi Beats,ozCuMWnvM3A,2023-02-02T04:49:46Z
Josie The Red Headed Libertarian & Chrissie Mayr React to The Quartering's Eliza Bleu Files!,AL7Ee6ZZvNc,2023-02-01T20:30:06Z
"Daily Beast Article FINISHES Eliza Bleu! Chrissie Mayr Reacts to Escort Past, Old Friends Speak Out",RXudxubFl54,2023-02-01T17:01:17Z
TimCast Employee Josie The Red Headed Libertarian & Chrissie Mayr Discuss Tim Pool & Eliza Bleu News,Nteo85vMy1c,2023-02-01T14:31:09Z
Clint Russell RESPONDS to Eliza Bleu Podcast with Chrissie Mayr! Josie & Forest Mommy Join!,6JXCZpIxO0k,2023-02-01T05:42:33Z
Eliza Bleu Advocates For Child Consent?! Chrissie Mayr & Josie TRHL React to Liberty Lockdown Clip,WPVdYBJ0wJc,2023-02-01T01:00:07Z
"SimpCast Reacts to Vice Feminism Panel of Sydney Watson & Pearly! Chrissie Mayr, Arielle Scarcella",BiisIBoSDyQ,2023-01-31T20:30:00Z
LIVE Chrissie Mayr Podcast with Josie the Red Headed Libertarian,HfASkXbKY-Q,2023-01-31T19:42:42Z
"Chrissie Mayr in the Morning! Eliza Bleu, Twitter Censorship, Faran Balanced, Tree of Logic",3ki8fV1-X5A,2023-01-31T17:53:50Z
New York City Mayor Eric Adams PLEADING Against Migrants! Chrissie Mayr Reacts!,5ngAwKowM7s,2023-01-30T14:30:01Z
"Simpcast 2022 Recap & Looking Forward to 2023! Chrissie Mayr, Nick Rekieta, Alex Stein, Faran, Venti",lMg-uL6LPlw,2023-01-29T18:15:02Z
Eliza Bleu CAUGHT Stealing from Local Lodge & Charity! Receipts Provided! Chrissie Mayr & Faran,GfYQ7AGQ6kU,2023-01-28T16:00:09Z
