Title,Video ID,Published At
Airplane Girl Tiffany Gomas Finally Speaks! TMFINR! Chrissie Mayr & SimpCast React!,MV5OLfE7OkE,2023-08-27T15:00:10Z
The BarbienHeimer Phenomenon?! Chrissie Mayr Reacts to Barbie & Oppenheimer Box Office Failure?,XUxyaX9rZXk,2023-08-26T15:00:19Z
The Witcher Writers EXPOSED by Az aka Heel Vs Babyface on the Chrissie Mayr Podcast,fBd0CIzOimk,2023-08-25T17:00:32Z
Tampa Bay Rays All Star Shortstop Wander Franco Accused of Underage Relationships! Chrissie Mayr,Sc5h-Hl0SCM,2023-08-24T17:00:14Z
Whatever Wednesday! Chrissie Mayr & Fealty BREAK DOWN the Whatever Podcast!,iFcpusHgCw8,2023-08-24T08:25:04Z
"Roger Stone UNLOADS on Hunter Biden, Ukraine Corruption, Obama Chef’s Death! Chrissie Mayr Podcast",Uh0u5BFrS8Q,2023-08-23T17:00:29Z
BIZARRE BTS Treatment of Guests at the Whatever Podcast! Anna That Star Wars Girl on SimpCast,BBUuGX9jMfU,2023-08-22T15:00:08Z
Az aka Heel VS BabyFace Tells his INCREDIBLE Health and Hoarding Journey to Chrissie Mayr,Vb1boXulxYY,2023-08-21T17:30:03Z
"SIMPCAST 89 - Chrissie Mayr, LeeAnn Star, ThatTuggLife, Carmen Studer - Wander Franco, Garth Brooks",ImAsyJdt3Go,2023-08-21T04:21:37Z
"Carol Roth Author ""You Will Own Nothing"" on the Chrissie Mayr Podcast",18HHXF5RPNE,2023-08-20T16:45:00Z
"Melonie Mac OPENS UP on SimpCast about Lust and Desires! Chrissie Mayr, XRay Girl, LeeAnn Star",wv53H8EGaDU,2023-08-19T17:30:06Z
Comedian Chrissie Mayr Reacts To SAG-AFTRA Writer's Strike! Hollywood is BURNING DOWN!,ikGT4Y3qcO4,2023-08-18T16:15:03Z
Artificial Intelligence AI TAKES OVER Model Influencer & OnlyFans Worlds! Men Get Duped! SimpCast!,NvtFocWkN3Y,2023-08-17T17:30:05Z
"Mia Khalifa's VIRAL TikTok Marriage Video Sparks Debate! SimpCast with Chrissie Mayr, Melonie Mac",ehFFT7qgdoY,2023-08-16T23:00:17Z
"Former Exotic Dancer OPENS UP About Experience with Hunter Biden! SimpCast with LeeAnn Star, c",L1txZTiXyxI,2023-08-16T17:00:11Z
Rachel Zegler & Snow White DESTROYED at Live SimpCast Panel During Anime Matsuri Convention!,kN9W60EAwE4,2023-08-16T00:00:11Z
"Anita Sarkeesian's Woke ""Feminist Frequency"" CLOSES!  SimpCast with Chrissie Mayr & Melonie Mac",0sVOpkIiZgo,2023-08-14T18:00:09Z
"SimpCast 88 LIVE FROM HOUSTON, TEXAS! Anime Matsuri! Chrissie Mayr, Melonie Mac, Lila Hart, Brittany",of3raFVHYQ8,2023-08-14T03:19:25Z
"SimpCast Panel at Anime Matsuri in Houston, Texas! Chrissie Mayr, Melonie Mac, Brittany Venti, Lila",wouYLThl6KU,2023-08-13T19:28:14Z
"Is JustPearlyThings In It For The Money? Or is she Honest? SimpCast with Chrissie Mayr, Xia, Anna",TsdaagmaoP0,2023-08-13T17:00:14Z
"Az aka Heel Vs BabyFace & Chrissie Mayr: In Defense of The Barbie Movie! Greta Gerwig, Margot Robbie",2hIOOUhYDf8,2023-08-13T00:00:06Z
"Chrissie Mayr LIVE from Anime Matsuri in Houston, Texas! Lila Hart, Nick Rekieta, Critical Drinker",CAaSkDpcM7Q,2023-08-12T18:51:47Z
"Man Spends $14k To Become A Dog! Simpcast with Gothix, Chrissie Mayr, and Stef the Alter Nerd React!",iEA4iIqMdaE,2023-08-11T15:00:37Z
McDonalds Food Contest! Chrissie Mayr's Wet Spot on Compound Media! Sponsored by Kushy Dreams,bXhVD4DsT0g,2023-08-11T00:00:08Z
"Chrissie Mayr & Lila Hart LIVE in Austin, Texas! Post Show Recap and Catch Up!",CDORFscN1nM,2023-08-10T04:58:19Z
Kill Tony Guest Leonarda Jonie Cancelled For Jokes! Triggering the Ukraine! With Chrissie Mayr,A3gOeIVVj88,2023-08-09T22:00:06Z
"Elon Musk is TAKING OVER YOUR LIFE! SimpCast with Gothix, Stef the Alter Nerd and Chrissie Mayr",g7O5Y1k7W-Y,2023-08-07T15:00:37Z
"SimpCast 87- Candice Horbacz, Radix, Melonie Mac, Chrissie Mayr, XRay, LeeAnn Star, Cecil",DJXvZ18UZa8,2023-08-07T05:11:09Z
Teachers RESTRAINING and NOT TEACHING Our Kids! Salty Cracker & Chrissie Mayr React,lGjcivwOAew,2023-08-06T17:00:20Z
"LIVE Chrissie Mayr Podcast with Az (Heel Vs. Babyface), Kai Cenat, Cashless Society?, Barbie",VuRx-7L4BWI,2023-08-05T16:49:50Z
Roger Stone CALLS OUT Florida Governor Ron DeSantis! Lies EXPOSED on Chrissie Mayr Podcast,fk4xU-IWdS0,2023-08-04T18:00:15Z
LIVE Chrissie Mayr Podcast with Comedian and Ventriloquist April Brucker!,m70VCRffDFs,2023-08-04T02:34:50Z
LIVE Chrissie Mayr Podcast with Vic Mignogna! Anime Matsuri in Houston Coming Up!,uVdsupuyIDE,2023-08-03T16:14:07Z
Whatever Wednesday! Chrissie Mayr & Fealty BREAK DOWN the Whatever Podcast!,QaSoPXP8X8g,2023-08-03T06:33:36Z
Comedian & Ventriloquist April Brucker Can't Find A Boyfriend?! Chrissie Mayr Reacts,YckCOHCUeUs,2023-08-02T15:15:01Z
LIVE Chrissie Mayr Podcast with Comedian Leonarda Jonie! Kill Tony Backlash!,ZdlS4XWf6fA,2023-08-02T04:07:58Z
"LIVE Chrissie Mayr Podcast with Roger Stone! Trump, Biden, DeSantis, 2024 Presidential Race",zEgDbtMWrBA,2023-08-02T01:32:42Z
"The Barbie Movie: SimpCast Reactions & Debate! Chrissie Mayr, Brittany Venti, Monica Paige, Wicked",AQlN5w5k4tE,2023-08-01T17:00:08Z
Chrissie Mayr's Wet Spot Post Show Livestream! From Compound Media in New York City and Sullivan's,2coNbtLyCuE,2023-08-01T01:18:43Z
Manatee Murder in Florida Aquarium! Death by Brotherly Love? WEIRD & SAD Story! Chrissie Mayr Reacts,PVBmS--jP28,2023-07-31T15:00:14Z
"SimpCast 86 - Gothix, Ashton Birdie, Stef the Alter Nerd, Chrissie Mayr, Brittany Venti, Anna TSWG",BFSnkD4Nj0c,2023-07-31T05:06:11Z
Chrissie Mayr BOAT STREAM! Long Island Sound,eAb0nZehCSU,2023-07-30T20:58:46Z
Harry & Meghan Getting Divorced! Stef the Alter Nerd SPILLS THE TEA on the Royals with Chrissie Mayr,CaT3NdtSSM0,2023-07-30T15:00:07Z
Chrissie Mayr Saturday Mailbag Stream! THANK YOU to the Greatest Fans!,PDXEmLQFLsw,2023-07-30T00:35:27Z
Chrissie Mayr LIVE on a Hike in Westchester,bulU0relG9A,2023-07-29T19:23:50Z
The View Virtue Signals Over Jason Aldean Song... Small Towns Are Now The New Racism?!,TkcSChLV4Nw,2023-07-29T15:00:18Z
Rest in Peace Tony Bennett! Chrissie Mayr Reacts to the Passing of the Legendary Singer,_iIo7d5-8Zg,2023-07-28T17:00:32Z
"Chrissie Mayr in the Morning! Manatee Mishap, Mail Bag, Ventriloquist Cant Find Love, Dumpster Diver",ieQb3TgCvDk,2023-07-28T16:08:10Z
"Chrissie Mayr & SimpCast PRANK CALL Keanu as RFK Jr. Robert F Kennedy Jr! Melonie Mac, Tree of Logic",LXMArJoY1Nw,2023-07-27T15:00:15Z
Whatever Wednesdays! Chrissie Mayr & Fealty BREAK DOWN the Most Talked about Podcast in the Country,VebKWOHawkA,2023-07-27T05:46:22Z
"INVASION of GYM KARENS! Men are NOT Safe at the Gym! SimpCast Chrissie Mayr, Xia, X Ray Girl, Anna",53m8ZTpxE8g,2023-07-26T15:00:06Z
Journalists ATTACK Chrissie Mayr & Friday Night Tights for... Anti-Semitism!?,MJnEBVtJczE,2023-07-25T14:00:16Z
Do Dogs LOVE or HATE Fireworks? Chrissie Mayr Discusses the 4th Of July Tradition and it's Effects,TR9Ey2xe2LE,2023-07-24T15:00:30Z
"SimpCast 85! Chrissie Mayr, Wicked Virtue, Monica Paige, Brittany Venti, Lauren, - Barbie, Whatever",cfLF2o2-0BA,2023-07-24T04:52:18Z
"LIVE Barbie Movie Review & Reaction from the Alamo Drafthouse! Chrissie Mayr, Xia, Keanu, & Lindsay",8fQlWogc6qs,2023-07-23T23:02:12Z
Chrissie Mayr at the Orange County Fair in New York! Petting Zoo Time!,XQyXiDKecpk,2023-07-22T19:37:36Z
Disney Theme Parks In Trouble! Disney World Attendance FALLING! Chrissie Mayr Reacts,9V6hJ21rV0E,2023-07-22T15:00:07Z
Playboy Founder Hugh Hefner's Ex Comes Out With MeToo Allegations! Chrissie Mayr Reacts,mAulaVAlM0g,2023-07-22T13:30:15Z
Disgraced Jackass Star Bam Margera Being Sued By Ex-Wife! Chrissie Mayr Reacts,tv2CBEG57MM,2023-07-21T17:00:37Z
"Chrissie Mayr in the Morning! Tim Dillon, Hollywood, SDCC, The View, RIP Tony Bennett",-H3N1ZNmX3g,2023-07-21T15:48:13Z
"LIVE Chrissie Mayr Podcast with Carol Roth - You Will Own Nothing, Social Credit Scores, Wealth, WEF",gZrTEY5VNik,2023-07-21T10:19:36Z
"LIVE Chrissie Mayr Podcast with Stef the Alter Nerd - YouTube, Harry and Meghan, Royals, Bonus Holes",DJq4lKKpNQY,2023-07-20T20:37:35Z
"Just Pearly Things & Matt Walsh Kick Off Twitter Battle! SimpCast Reacts! Chrissie Mayr, Melonie Mac",P7gv5wtL_O8,2023-07-20T15:00:16Z
"LIVE Chrissie Mayr Podcast with Frank Valbiro of Quite Frankly - Roseanne, The Ocean",syh8BL9wOZk,2023-07-20T08:09:29Z
"Whatever Wednesday! Chrissie Mayr & Fealty Recap! Anna TSWG, Brittany Venti & TBYS",w15EP02KdiI,2023-07-20T05:00:02Z
"Chrissie Mayr in the Morning! Jason Aldean, Barbie, BarbenHeimer, Famous Armless Man, Roseanne",Or9zpq0gRzU,2023-07-19T16:13:02Z
LIVE Chrissie Mayr Podcast with Salty Cracker!,p_df0ZmNNec,2023-07-18T20:57:57Z
"Disney's Snow White DISASTER! Chrissie Mayr, Lila Hart, and Cecil React to NEW Set Photos!",NV1SKN3qg4I,2023-07-18T16:30:02Z
"Chrissie Mayr in the Morning! Offended By Jokes! Sofia Vergara, Joe Manganiello, Lena Plug, Adam22,",uo2gETauU7s,2023-07-18T15:49:58Z
WORST Name EVER! Stand Up Comedian Chrissie Mayr Crowd Work in New Jersey,DQb0DZL8PWk,2023-07-17T17:00:13Z
Owen Benjamin Reveals Behind the Scenes DETAILS from Steven Crowder! Chrissie Mayr Podcast,UXMTO79TpDI,2023-07-17T15:00:21Z
"SimpCast 84- Perry Caravello, Chrissie Mayr, Lila Hart, LeeAnn Star, Tuggs, Courtney Michelle",obEs2CHuWg8,2023-07-17T05:07:14Z
"WHY is Keanu Reeves' Publicist Sending DM's to Chrissie Mayr? SimpCast React! XRay Girl, LeeAnn Star",_q6jDt6hfPs,2023-07-16T15:00:25Z
"Pearly Thingz Gets BACKLASH! SimpCast with Chrissie Mayr, XRay Girl, Xia, Anna TSWG , LeeAnn Star",LfQaHNBISog,2023-07-15T15:00:16Z
Agent Sebastian of Cart Narcs Had a Gun Pulled on Him! Chrissie Mayr Podcast,Mp4IQJAknLU,2023-07-14T18:00:09Z
Chrissie Mayr in the Morning: Lila Hart's Birthday Stream,lE-58S_byO0,2023-07-14T16:19:09Z
"Chrissie Mayr's Mission Impossible Dead Reckoning Movie Review! Tom Cruise, Mantis, & The Entity",XqBRVD2LuTg,2023-07-14T02:58:21Z
"Chrissie Mayr Podcast with Candice Horbacz AKA Eva Lovia - Femininity, Masculinity, Culture",yoCPyUqQrQA,2023-07-13T19:32:46Z
"Jonah Hill Texts EXPOSE His Unhinged Ex! SimpCast- Chrissie Mayr, Melonie Mac, Tree of Logic, Misty",YRRSQdRjRtA,2023-07-13T15:30:08Z
"Chrissie Mayr Podcast with Courtney Michelle! Pearly Thingz, Kevin Samuels, Viral Wakanda Video",LF7XavKdL8E,2023-07-13T14:31:50Z
Whatever Wednesday! Chrissie Mayr & Fealty REACT to the Whatever Podcast! Guest: Keanu Thompson,sW2F4ixuyDE,2023-07-13T04:55:05Z
HILARIOUS Crowd Moment! Stand Up Comedian Chrissie Mayr at Tiff's Comedy Club in New Jersey! Heckler,qZkCcRfkdSY,2023-07-13T00:50:00Z
"Lena The Plug & Adam22 Drama EXPLAINED! SimpCast w/ Chrissie Mayr, Melonie Mac, Tree of Logic, Keanu",xiGg-N9zyPM,2023-07-12T18:00:34Z
"Chrissie Mayr in the Morning! Tom Holland, Emily Blunt, Disney, Kevin Costner, Bam Margera",xYT9t9OYSvk,2023-07-12T16:19:29Z
"Chrissie Mayr Podcast with Monica Paige from OAN! Becoming an Anchor/Reporter, Trump, Biden, Ukraine",waBOjLOeKxA,2023-07-12T14:19:29Z
Chrissie Mayr Hiking Stream! Ask Me Anything & Chat Catch Up! Rockefeller State Park in Westchester,kUK7tcyxDso,2023-07-11T23:21:10Z
"Chrissie Mayr in the Morning! Sarah Brady, Jonah Hill, Dave Portnoy, Sonja Morgan, Bethenny Frankel",3gUurykxMr0,2023-07-11T17:33:53Z
CHAOS! Perry Caravello FINALLY Confronts The Cart Narcs' Agent Sebastian on Chrissie Mayr Podcast,9TgehemTikY,2023-07-11T17:30:02Z
Will Owen Benjamin Debate Anthony Cumia about Flat Earth!? Owen Explains on Chrissie Mayr Podcast,LcRUnbcCrgE,2023-07-10T15:00:25Z
"SimpCast PAJAMA PARTY! Chrissie Mayr, Melonie Mac, Tree, Kara, Misty, Missy, Brittany Venti, Carmen",-1Iuk9PGy78,2023-07-10T05:39:33Z
"Have The Simpcast Ladies Ever Been ROOFIED? Chrissie Mayr, LeeAnn Star, Brittany Venti, Jalisa",-mQLBh6aq60,2023-07-09T16:15:00Z
"Steel Toe’s April Not Being Pleased By Aaron?! SimpCast with Chrissie Mayr, Mandy Summers, Keanu",nuTe1CyDbZo,2023-07-08T15:00:36Z
The FED Is To Blame For The Sinking of The Titanic?! Zach Vorhies on Chrissie Mayr Podcast,uNFiKnYhDg8,2023-07-07T15:00:48Z
"SimpCast Weighs In: Is Geno Bisconte Secretly Gay? Chrissie Mayr, LeeAnn Star, Nina Infinity, Keanu",_XgsmOnWhkk,2023-07-07T00:15:01Z
"Chrissie Mayr Podcast with Jackie ""The Joke Man"" Martling! ""Joke Man"" Doc! Howard Stern!",Lo_0-JLQmcw,2023-07-06T22:24:42Z
Chrissie Mayr Podcast with Megan Fox! CENSORED! DEMONETIZED! Megan Fox Explains YouTube Issues,CEyWX2gz20c,2023-07-06T16:24:17Z
"Megan Fox DISTURBING Family Details EXPOSED! SimpCast with Chrissie Mayr, Anna TSWG, Carmen Studer",-DugCXRc0cM,2023-07-05T15:00:00Z
Top 20 Triggered Malaysian Comments | Jocelyn Chia & Chrissie Mayr Situation Gets WEIRD,lUQC2DWq0BY,2023-07-04T15:00:27Z
Chrissie Mayr Gives a Tour of Her Honeymoon Suite at Pocono Palace in Pennsylvania!,rgS6JtP6We4,2023-07-03T20:00:15Z
"Melonie Mac CONVINCES SimpCast to go Carnivore! Chrissie Mayr, LeeAnn Star & April from Steel Toe!",mCvhwBxDhe0,2023-07-03T15:00:36Z
"SimpCast 82 Chrissie Mayr,  Xray Girl, Xia, LeeAnn Star, Brittany Venti, Anna That Star Wars Girl",n31s_PRp0_o,2023-07-03T05:23:52Z
James O'Keefe Exposes BlackRock! Google Whistleblower Zach Vorheis on Chrissie Mayr Podcast,mciSYSaivKo,2023-07-02T17:00:24Z
Blaire White VS Kelly Cadigan EXPLAINED! by Rita Love on the Chrissie Mayr Podcast,XhGQUriBKhc,2023-07-01T18:00:12Z
New York City Mayor Eric Adams STOPPING Pizzeria's From Using Coal & Wood Fire Ovens! Chrissie Mayr,AmZvGYePt3I,2023-06-30T20:00:05Z
"Just Pearly Thingz EFAP! Is she GRIFTING? SimpCast with Chrissie Mayr, Nina Infinity, Keanu, April",Ptt5iAObnuU,2023-06-30T16:00:31Z
LIVE Chrissie Mayr Podcast with Cart Narcs Agent Sebastian! PLUS Perry Caravello Drops in!,PkH-8-EUESA,2023-06-30T03:13:21Z
"SimpCast Recaps Who Survived Chrissie Mayr's Bachelorette Party in Atlantic City! Xia, Keanu, Amy",rlKCBFBkF8g,2023-06-29T18:30:52Z
"Chrissie Mayr in the Morning! Madonna, July 4th Tips, Vanna White, Bucees, J.Lo, Ben Affleck",pJUcpH-sq2E,2023-06-29T17:22:58Z
Chrissie Mayr Podcast w/ Owen Benjamin! Flat Earth Stuff! Steven Crowder! Anthony Cumia! Censorship,FDO3Czn3LcA,2023-06-29T01:58:55Z
Trans Activist Rita Love ASSAULTED at Pride Event for Wearing A MAGA Hat! Chrissie Mayr Podcast,UWKZR-sG2No,2023-06-28T20:00:08Z
LIVE Chrissie Mayr Podcast with Radix Verum - FBI and Governor Whitmer Kidnapping,5GJCy-6rnYs,2023-06-28T19:12:11Z
LIVE Chrissie Mayr Podcast with Mary Morgan - Pop Culture Crisis! Whatever Podcast Experience,fSXu9qFOvHc,2023-06-28T02:39:44Z
Kurt Metzger & Chrissie Mayr Discuss The Tall White Aliens! These Extra Terrestrials are HERE!,MvmFWm7sjwA,2023-06-27T19:00:10Z
"Chrissie Mayr in the Morning! NYC Coal Pizza Crisis, Rob Schneider, Negging, Cougars",0bDgPrNwWvU,2023-06-27T17:14:40Z
Laura Loomer UNLOADS on Florida Governor Ron DeSantis! Details CORRUPTION on Chrissie Mayr Podcast,LqGCa1GqNEY,2023-06-26T15:30:11Z
"SimpCast 81 - LeeAnn Star, Mandy Summers, April, Chrissie Mayr, Keanu Thompson, Nina Inifnity",4xF0ORrwoDE,2023-06-26T05:49:01Z
Live from the boat,KNnfM3-V-m8,2023-06-25T19:58:32Z
"BEST & WORST Hairstyles of SimpCast! Chrissie Mayr, Xia, Melonie Mac, LeeAnn Star, Keanu, April",inymjHMrksM,2023-06-25T15:00:37Z
"Chrissie Mayr Movie Review: Wes Anderson's Asteroid City! Tom Hanks, Scarlett Johansson, Ed Norton",PdnYyOLCNdY,2023-06-24T16:04:31Z
Spitting On Brides is CUSTOMARY! Chrissie Mayr & SimpCast React to International Wedding Customs!,_jA40pyNjwI,2023-06-24T15:00:33Z
Chrissie Mayr Podcast with Zach Vorhies! Titanic Conspiracy Theory! OceanGate Titan Tragedy!,3QFA1f0kCK0,2023-06-24T04:28:07Z
"Chrissie Mayr's Wedding Recap - Melonie Mac, Ari Jacob, Keanu Thompson, Geno Bisconte & more!",xDEDf_qfk0o,2023-06-23T04:42:47Z
"SimpCast SWOONS Over Tucker Carlson & Roger Stone! Chrissie Mayr, LeeAnn, Lila Hart, Misty Winston",8JNIDGR7NhE,2023-06-22T15:00:10Z
POV Honeymoon Excursion with Chrissie Mayr! SCARY Golf Cart Experience in Pocono Mountains!,Gn9hl7iTb-Y,2023-06-21T15:00:12Z
New Hampshire Libertarian Party Ran Some Questionable Candidates! Reed Coverdale and Chrissie Mayr,YeMibhTAgnQ,2023-06-20T16:30:05Z
"Keanu Thompson TRIGGERED Over Marshall Sink Pissing! SimpCast with Xia, Chrissie Mayr, Anna TSWG",cKCaGIjHnm8,2023-06-19T18:00:18Z
Donald Trump Speech at Chrissie Mayr & Frank’s Wedding at the Bear Mountain!,QTiY1UErDFY,2023-06-19T17:00:07Z
"Super SimpCast Intro Show! Chrissie Mayr, Brittany Venti, Melonie Mac, Lila Hart, Alex Stein, Xia",CUJ2_d9IKxs,2023-06-19T01:00:11Z
"Should FAT PEOPLE Get Extra SEATS on Planes? SimpCast w/ Chrissie Mayr, LeeAnn Star, Brittany Venti",9VP4gCTCWn0,2023-06-18T19:00:04Z
Laura Loomer CONFRONTS James Comey In Public over FBI Corruption! Chrissie Mayr Podcast,h4gBb-TElY4,2023-06-17T15:00:28Z
Kurt Metzger Shares World History Through AI Art on the Chrissie Mayr Podcast,Tj_je_bNIGw,2023-06-16T19:45:01Z
"Chrissie Mayr's Poor Strip Club Etiquette! SimpCast Discusses! Carmen Studer, X Ray Girl, Anna TSWG",rX8RueJXllE,2023-06-16T15:00:42Z
"Malaysia & Singapore CANCELLING Comedian Jocelyn Chia! SimpCast w/ Chrissie Mayr, Xia, Megan Fox",8mnVDS35X3Q,2023-06-15T21:00:03Z
"Chrissie Mayr, Back In The News… Again. Infuriated ALL OF MALAYSIA! SimpCast with Xia, Megan Fox",2Jbc9sWKK-c,2023-06-15T16:30:00Z
"That Star Wars Girl ENRAGES Drunk Streamer w/ Nick Rekieta! SimpCast with Chrissie Mayr, Xia, Keanu",KmAv-Y2IjaQ,2023-06-14T18:00:14Z
Chrissie Mayr Podcast with Jocelyn Chia! Viral Video! Malaysian Reactions!,TR4CYPb2-4g,2023-06-14T16:51:52Z
Chrissie Mayr Podcast w/ Alex Stein! Brittney Griner Reaction! Blaze! Malaysians! Keith Olbermann!,5LD8iDSo81c,2023-06-14T02:48:37Z
Spider-Man's Into The Spiderverse's Gwen Stacy is TRANS?! Chrissie Mayr Reacts to the Marvel Hero,Ana4-QWp9P8,2023-06-13T18:15:00Z
Chrissie Mayr in the Morning - Best of Malaysian Insults,0kkiPDwoocg,2023-06-13T16:37:15Z
"SimpCast Reacts to Whatever Podcast! ABUSED! Chrissie Mayr, Brittany Venti, Anna That Star Wars Girl",GPKFpjttW30,2023-06-12T18:15:00Z
"SimpCast 80 Chrissie Mayr, Carmen Studer, Megan Fox, Anna TSWG, Keanu Thompson, Xia Anderson",sA7Do4CsTvA,2023-06-12T05:14:43Z
"Why Is Fried Chicken Racist?! SimpCast Reacts to Food Stereotypes! Melonie Mac, Chrissie Mayr, Xia",ChJrVUucJwo,2023-06-11T17:00:09Z
"Eliza Bleu Is BACK! Grifting off the Daily Wire! SimpCast Reacts! Chrissie Mayr, Melonie Mac, Xia",IJCt_FXzz6s,2023-06-10T17:00:07Z
Leftists CAN NOT HANDLE Stand Up Comedy! Chrissie Mayr & Lila Hart Discuss,-Ghbl1WsGvA,2023-06-09T15:00:10Z
Chrissie Mayr Podcast with Rita Love! Assaulted at Pride for being a Trump supporter! Kelly Cadigan,q3gfdG-2agI,2023-06-09T02:30:02Z
"Chrissie Mayr Podcast with Chandler Juliet, Comedy, Babylon Bee, LA, Triggers, Losing Friends",fOqw_xF09wA,2023-06-08T23:17:26Z
Chrissie Mayr OWNS Keith Olbermann! Melonie Mac & SimpCast Reacts to Former ESPN Anchor's Meltdown!,Ynf4bhVbOpk,2023-06-08T18:00:20Z
"Chrissie Mayr in the Morning - Melonie Mac, Spider-Verse Gwen is Trans?! Uber Eats, Chelsea Handler",x6PYO1IE0Lk,2023-06-08T17:17:24Z
Chrissie Mayr Podcast with Laura Loomer! Censorship! James Comey Confrontation! Ron DeSantis! Trump,fJNs_AsCsds,2023-06-08T02:29:02Z
Trans Studies Shows Shocking Information! Autism Link? Dr. Peter McCullough Talks with Chrissie Mayr,d21rnB9afY8,2023-06-07T17:00:26Z
Chrissie Mayr in the Morning,kDwHS9HwVlU,2023-06-07T04:28:08Z
Target Loses $12.7B Billion As Pride Month Begins! Oli London on Chrissie Mayr Podcast,eU3JQVr4M0A,2023-06-06T19:00:17Z
"Anna That Star Wars Girl VS Twitter's Ella Irwin! SimpCast Weighs In! Chrissie Mayr, Brittany Venti",cMWKhzl3SNg,2023-06-05T16:15:04Z
"SimpCast 79 - Xia, LeeAnn Star, April Imholte, Melonie Mac, Chrissie Mayr, Brittany Venti, Anna TSWG",IGoCOun87CI,2023-06-05T05:10:34Z
"SimpCast Goes DEEP with Astrology! Chrissie Mayr, Xia, Anna TSWG, Keanu Thompson, Lauren, Haley",9NIYlRQsP9Q,2023-06-04T15:00:07Z
"Chrissie Goes On EPIC Rant About SUNDAY WEDDINGS! SimpCast- Brittany Venti, Haley Kennington",ta7GxiZ-pts,2023-06-03T17:00:28Z
"Mysterious Animal Deaths Due To Skinwalkers? SimpCast with Razorfist, Chrissie Mayr, Brittany Venti",5LaYQg6aYg8,2023-06-02T18:00:03Z
Chrissie Mayr Podcast with Dr Peter - Medical Misinformation!? Censorship! Pushback! Medical Freedom,DHuEISoUqXI,2023-06-02T14:00:59Z
Chrissie Mayr Podcast with Jamie Kennedy! Scream! Hollywood! Comedy!,EYY2Rwt9KNY,2023-06-01T22:37:02Z
Chrissie Mayr Podcast with Kay Smythe! DailyWire Twitter Drama!,sEpNV7ftKok,2023-06-01T20:34:23Z
LIVE Chrissie Mayr Podcast with Lila Hart! Offensive Stand Up Comedy! LA vs Texas! Documentaries,7GqwgDeDkjM,2023-05-31T20:11:13Z
"Chrissie Mayr Podcast with Oli London -  Target Boycott, GLSEN, LA Dodgers Pride Night",ENem4oBacrI,2023-05-31T16:24:50Z
"SimpCast React to OnlyFans Model Who's Biggest Customer Is Her STEPDAD! Chrissie Mayr, Xia, Keanu",VcV5oBOINqQ,2023-05-30T17:00:30Z
"Chrissie Mayr in the Morning! Gen Z Bed Rotting, Beauty Pageant Rage, Is JK Rowling Based?",kJ4GsAeTAd0,2023-05-30T16:39:38Z
"Special Memorial Day Wet Spot! Chrissie Mayr, Frankie Macdonald, Andrew Harms",TOCTH8RYGPA,2023-05-30T00:56:37Z
"Chrissie Mayr WRECKS Woke Journalist on Twitter! SimpCast, Lila, Xia, Keanu, Brittany Venti, Anna",eO5dxw2M9YQ,2023-05-29T17:30:04Z
"SimpCast 78 - Chrissie Mayr, Carmen Studer, XRay Girl, Anna TSWG, Brittany Venti, Freely Ashley",IIUvWtx-0Cs,2023-05-29T05:46:26Z
The Devil Was Thwarted At Target! Alex Stein & The Internet Come Together! Chrissie Mayr & Anna,Fc5EFkVCL7A,2023-05-28T16:45:00Z
"Target Sets Sights on CHILD PRIDE Community With Tucking Clothes? SimpCast, Chrissie Mayr, Xia, Anna",-PS4BGt6uq0,2023-05-27T15:15:09Z
Chrissie Mayr Movie Review of Disney's Live Action Remake of The Little Mermaid!,4wSB-5M4ImA,2023-05-26T20:11:45Z
"Buck Angel OPENS UP About Trans Athletes, Lia Thomas & Riley Gaines on Chrissie Mayr Podcast",jaaPNsxmNMQ,2023-05-26T15:00:28Z
"Babylon Bee, Tim Pool, & Minds Suing California For Totalitarian Censorship Law! Chrissie Mayr",b2ez6DObFmg,2023-05-25T15:00:25Z
"CMP Live with Kurt Metzger - Aliens, Hecklers, Stand Up Comedy, Jimmy Dore Show & more!",0VeJI2wmlSo,2023-05-24T18:41:55Z
"Chrissie Mayr in the Morning with Anna TSWG - Target Faces Backlash, Bud Light, ESG, Mail Bag",aXMVphrU2tc,2023-05-24T16:23:25Z
"Brandi Love Boycotts Lingerie Company for Male Models! SimpCast w/ Chrissie Mayr, Brittany Venti",vRMHZ-7K9yI,2023-05-24T15:00:45Z
"Is The USA The Most Propagandized Country In The World?! SimpCast with Chrissie Mayr, Lila Hart",Y0HU_JO5fsE,2023-05-23T17:00:31Z
SimpCast Reacts to Chrissie Mayr HIT PIECE! Dylan Mulvaney Viral Video TRIGGERS Left Wing Journals,mNkc9j5kal0,2023-05-22T17:00:26Z
"SimpCast 77 - Chrissie Mayr, Xia, Candice Horbacz, Brittany Venti, Anna TSWG, Ashton, Haley, Lauren",biqyJCsAZ1Y,2023-05-22T06:16:53Z
"Netflix Cleopatra Went WOKE! Richard Dreyfuss Wakes Up! SimpCast w/ Chrissie Mayr, Lila Hart, Misty",IY2NzrJHZsU,2023-05-21T17:30:01Z
"Chrissie Mayr Reflects on Comedy & Culture After Viral Video on SimpCast! Lila Hart, LeeAnn Star",OIoyyCe7Gr4,2023-05-20T16:15:01Z
"SimpCast Reacts to Old Man Playing with Dolls! Chrissie Mayr, Razorfist, Brittany Venti, Lila Hart",CzP0Akf9VEg,2023-05-19T15:00:13Z
How Elizabeth Duffy Left the Democratic Party and Became Libertarian! Chrissie Mayr Podcast,vqCtX9wfDec,2023-05-18T17:00:38Z
"Aubrey Plaza Wood Milk Ad Backlash! Chrissie Mayr, Lila Hart, Misty Winston, LeeAnn, SimpCast Reacts",Kwpkh4NMKyo,2023-05-17T17:00:11Z
The Shocking Things Cecil & Chrissie Mayr Did At Their Old Jobs! BAD BOYS AND GIRLS,_45JzbKnHa4,2023-05-16T18:00:21Z
"Chrissie Mayr in the Morning - Mailbag! Professional Jessica Rabbit, Trans Sorority Sister, Kim K",ajRErd9fp-c,2023-05-16T17:55:15Z
"FULL VIDEO! Chrissie Mayr Triggers Leftist Heckler in Dallas over Dylan Mulvaney Joke! ""Transphobic""",_o9s7F5qNSo,2023-05-15T17:00:10Z
"SimpCast 76! Cripp Daddy, Misty Winston, Chrissie Mayr, LeeAnn, Lila Hart! Dylan Mulvaney Reactions",WNHaGeI2cyw,2023-05-15T05:01:18Z
Project Veritas Style Honey Pot Could Not Fool George Papadopoulos! Chrissie Mayr Podcast Clip,OCI19qM-6us,2023-05-14T18:30:31Z
"Simpcast Girls Love Trad Wives! Chrissie Mayr, Dick Masterson, Ashton, Nina Infinity, Anna TSWG",73KoQloMhEU,2023-05-13T17:30:00Z
Harry Potter Theme Wedding? Chrissie Mayr Reacts,T9Hd5NlZfnU,2023-05-12T15:00:19Z
President Joe Biden Hires Team of Influencers & Celebs For 2024 Run! Chrissie Mayr & Freely Ashley,k6dgVwDJjV4,2023-05-11T15:00:34Z
Chrissie Mayr Podcast with Reed Coverdale! What's Going on with Libertarian Party of New Hampshire,cNp_9tRcH3U,2023-05-11T13:34:55Z
Chrissie Mayr Podcast with Elizabeth Duffy of Tax This Podcast! Libertarianism and OnlyFans Fun!,F71YeHKJcEk,2023-05-11T07:53:18Z
Chrissie Mayr & Keanu Thompson EXPLAIN American Airlines Story on SimpCast w/ Brittany Venti & Lila,H1UZZrTtd-E,2023-05-10T15:30:08Z
Chrissie Mayr Meets Goats at Rockwood & Rockefeller Park on the Hudson River in Westchester New York,HCqMdfJdR4k,2023-05-09T21:00:55Z
"SimpCast Reacts to New Rising Star in Fat Activism! Chrissie Mayr, Anna TSWG, Ashton, Nina Infinity",mtw5HaGBt5U,2023-05-09T20:00:12Z
"Chrissie Mayr ROASTS Birthday Fan at Hyena's Comedy Club in Dallas, Texas!",mM13cDzUQQQ,2023-05-08T15:30:11Z
"SimpCast LIVE in Dallas! Chrissie Mayr, Lila Hart, Keanu Thompson, Brittany Venti, Keri",FyJoanrqmiI,2023-05-08T04:52:39Z
"Anthony Cumia's Compound Media Super Fan Stories! SimpCast- Geno Bisconte, Erik Nagel, Chrissie Mayr",klRb6_RPXyA,2023-05-07T19:45:02Z
"Dylan Mulvaney Conspiracies! Why are They Being Propped Up? SimpCast w/ Razorfist, Chrissie Mayr",F7qK8gZGp-s,2023-05-07T15:00:11Z
"Keanu Thompson Gets Geno Bisconte Tattoo in Vegas! SimpCast w/ Chrissie Mayr, Tugg, Lila Hart, Xray",C4xeI-_ECOg,2023-05-06T19:45:00Z
Budweiser Goes ULTRA Patriotic After Dylan Mulvaney Fallout! Razorfist on SimpCast w/ Chrissie Mayr,2CylBbU4WHE,2023-05-06T15:00:02Z
"Former Chrissie Mayr Podcast Guest Wants CLIPS REMOVED! SimpCast Reacts! Nina Infinity, Lila, April",_og75MAAbRA,2023-05-05T15:00:33Z
"SimpCast in Vegas RECAPS Steven Crowder Ring Camera Video! Chrissie Mayr, Lila Hart, Keanu Thompson",DPjceLQC9Lw,2023-05-04T16:05:07Z
"A quick update from The Blaze! Chrissie Mayr, Keanu Thompson, Lila Hart",jAD0Ntpkfi4,2023-05-03T22:44:04Z
"How the Simpcast Ladies Met Their Men! Chrissie Mayr, Lila Hart, Nina Infinity, Carmen Studer",cLvd0MXlWDs,2023-05-03T15:00:32Z
