Title,Video ID,Published At
"New Years Eve SimpCast! Chrissie Mayr, Xia Anderson, Cecil, Anna TSWG, Kim Coulter, Lila Hart, Nina",2iU3iGyNtt8,2023-12-31T23:13:44Z
"What Does Your Mistress Get For Christmas? SimpCast with Chrissie Mayr, Xia, Lila Hart, Mike Harlow",Akskuv8Sad8,2023-12-31T16:00:07Z
LGBTQIA COMMUNITY STRIKES BACK! Review Bombs Daily Wire’s Lady Ballers!,KAVnzb9pE34,2023-12-30T20:00:07Z
Best or Worst? COMMENT! Chrissie Mayr Reacts to a Christmas Lights Life Hack from TikTok,Z5GHDx3tviI,2023-12-30T16:00:23Z
Chrissie Mayr & Keri Smith Attempt The Oreo Christmas Cookie Train! Content House Clip,iNVC-o-lf64,2023-12-29T17:00:10Z
LIVE Chrissie Mayr Podcast with Seth Weathers! Calendar Gate! Ultra Right Beer!,DCVvmXs9-ck,2023-12-29T03:20:05Z
"Chrissie Mayr Podcast LIVE with Jeremy Griggs of Geeks & Gamers and Friday Night Tights, Trump",mU7J1Up2OC0,2023-12-28T18:51:59Z
“Dual Income No Kids”The DINKs Are Our Future?Childless Couples. Chrissie Mayr Explains,IndYu6kTK4s,2023-12-27T16:00:19Z
Chrissie Mayr Podcast LIVE with Jazmen Jafar! Lawyer turned OF Creator! Whatever Podcast!,G5F9LMlyR5k,2023-12-27T04:20:54Z
"Chrissie Mayr Podcast LIVE with Tiffany Fong! Crypto Influencer, Sam Bankman-Fried Trial, Celsius",QsBXDjo383U,2023-12-26T22:32:01Z
Satanic Temple Opens Abortion Clinic? Rituals Available?! Chrissie Mayr Reacts,Wu44f_p2HsI,2023-12-26T19:00:10Z
Disney Snow White Rachel Zegler is a FAKE! Chrissie Mayr & Disparu Discuss the Controversial Actress,WY4S2B2MrAY,2023-12-25T19:00:06Z
"Christmas Eve SimpCast - Chrissie Mayr, Xia, Lila, LeeAnn, XRay Girl, Keanu, Carmen, Forest Mommy",y5wSsvLH4IY,2023-12-25T07:11:07Z
"Chrissie Mayr in the Afternoon! Mailbag, Keanu Thompson, Anna TSWG, UK Schools Done w/ Pronouns",HFlVJPb04kE,2023-12-22T19:55:04Z
Brittany Venti Breaks Down Shocking Viral Gym Video! Married Man CRINGE! SimpCast with Chrissie Mayr,wJB3nqEPJEs,2023-12-22T16:00:07Z
"LIVE Chrissie Mayr Podcast with Ian Crossland of Tim Pool's TimCast IRL! TPUSA America Fest, Tucker",KNWhNtIxcqk,2023-12-21T23:53:49Z
"Jake The Shaman with Chrissie Mayr! Discusses J6, Imprisonment, Solitary Confinement. Truth VS Lies",KEh1jyyiQK8,2023-12-21T01:00:11Z
Chrissie Mayr Podcast LIVE with Disparu! Rachel Zegler is OVER! Disney FAILURES!,KYEhlh14zqY,2023-12-20T21:22:20Z
"Tiny Bouncer Saves CRINGE Mom From Grinding at Party! Chrissie Mayr, Brittany Venti, Tree of Logic",mRd80Fs1FJg,2023-12-19T21:00:22Z
LIVE Chrissie Mayr and Ryan Kinel at Turning Point USA AmFest Day 4,4gzkJr3MWpE,2023-12-19T19:08:52Z
"Chrissie Mayr LIVE From Turning Point USA's America Fest! Tucker Carlson, Donald Trump Jr., Vivek",2A-d3eBTVJ8,2023-12-18T22:45:17Z
"SimpCast Live! Turning Point USA's AmFest! Phoenix! Chrissie, Lauren DeLaguna, Jake the Shaman, Ari",wTu7o6nSJpQ,2023-12-18T04:25:12Z
Turning Point USA American Fest  Day 2 - Chrissie Mayr & Ryan Kinel Live from Phoenix!,JYmfTM0Cako,2023-12-17T23:15:28Z
"Destiny & Melina Heading for DIVORCE! SimpCast Reacts! Chrissie Mayr, Brittany Venti, Tree of Logic",_LFwQ1kn3_4,2023-12-17T18:00:17Z
"Is Mercedes Blanche The Most BRILLIANT Woman on Twitter? SimpCast w Chrissie Mayr, Brittany Venti",uhCwRFyX8Cc,2023-12-16T23:00:33Z
Chrissie Mayr Previews Turning Point USA's America Fest! SimpCast with Carmen Studer & Tree of Logic,TYktMfV3AU0,2023-12-16T17:00:32Z
"Chrissie Mayr Content House AFTER HOURS! Xia, Keanu, Geno, Camelot, Karl, Keri Smith",zU_dXZ41wJQ,2023-12-16T12:12:12Z
Xia and X Ray Girl Visit Friendly's in the Pocono's! Chrissie Mayr Content House,upkgZbb6hSU,2023-12-16T08:49:24Z
"Good Morning Geno Bisconte! Cigars, Coffee, & Screaming! Part of Chrissie Mayr's Content House",U_DBNIGAips,2023-12-16T07:21:17Z
"Chrissie Mayr's Christmas Content House! Xia, Geno, Who Are These Podcasts, Camelot, Keanu, Keri",J_phmq9nNwQ,2023-12-16T06:18:37Z
"ESCAPE ROOM LIVE! Chrissie Mayr Content House with Geno Bisconte, Keri Smith, Xia, Keanu, Camelot",FO1m4pZPaKQ,2023-12-16T03:42:47Z
Who Are These Podcasts! Chrissie Mayr Content House Special! WATP,6GBF3aGDvyo,2023-12-15T23:08:51Z
"Chrissie Mayr's Christmas Content House! Geno Bisconte, Xia, Keanu, Karl WATP, X Ray Girl,",9XFhJ6cf83A,2023-12-15T19:08:20Z
"Chrissie Mayr Christmas Content House PART 2! Camelot, Keanu, Geno, Keri, Amy, Xia, Karl WATP",ILb4-7axH-o,2023-12-15T07:25:50Z
"Chrissie Mayr Christmas Content House! X Ray, Xia, Geno, Keri Smith, Camelot, Amy, Karl WATP, Keanu",spZGbY-B_3M,2023-12-14T20:38:50Z
"Brittany Venti Explains to SimpCast Japan’s CHEATING PROBLEM! Chrissie Mayr, Tree of Logic, Keanu",t_1-gs_Oq5U,2023-12-13T16:00:29Z
Chrissie Mayr Messing Around with Elon Musk & Twitter's Grok AI System! Send in your Questions,pkNqp8KOv74,2023-12-13T01:21:54Z
LIVE Chrissie Mayr Podcast with Chris Gore! Film Threat! LA Comic Con! Award This!,T7HoLXuQIXc,2023-12-12T19:03:28Z
Did The Marvels Sneak In LGBTQ Content? POC’s Just USED! Chrissie Mayr Reacts,ybs25ROzgAA,2023-12-11T16:00:43Z
"SimpCast 105 - Chrissie Mayr, Tree of Logic, Carmen Studer, Brittany Venti, Keanu Thompson",sTbmxzm8Db4,2023-12-11T06:12:31Z
"Chrissie Mayr Christmas Movie Watch Along! Home Alone! Macauley Culkin, Joe Pesci, Catherine O'Hara",rTpfrrYpwe0,2023-12-09T17:17:03Z
Chrissie Mayr Reacts to News That Former MTV Jackass Star Steve-O Went 431 Days Celibate!,gnVMdgS7evo,2023-12-08T18:00:20Z
"Whatever Thursday with Chrissie Mayr, Fealty and Keanu Thompson! Is Corn Bad for Society?",b5z79xm6cqo,2023-12-08T06:58:45Z
Climate Change! John Kerry CAUGHT On Hot Mic Sending Gas Into Atmosphere! Chrissie Mayr Breakdown,5qSQttLrzPE,2023-12-07T16:00:08Z
"LIVE Chrissie Mayr Podcast with Jimmie Lee The Jersey Outlaw, Howie Mandel, Ethan Klein, H3 Podcast",jz8egDnN6-Y,2023-12-07T15:38:58Z
Chrissie Mayr in the Morning: Let's talk about DINKS,N3IPBMcFors,2023-12-06T18:04:51Z
Paris Hilton Pulls Ads From Twitter After Elon Musk’s Comments! Chrissie Mayr Reacts,JAaT1dvz1rg,2023-12-06T14:31:00Z
"Have YOU Heard THIS? Rules For Xmas Gifts? Too Many, too few? Unwanted or New? Chrissie Mayr Reacts!",eAqGOVZFmcY,2023-12-05T20:00:22Z
"Chrissie Mayr in the Morning! TPUSA AmFest, Lady Ballers Backlash, Did John Kerry Fart?, Elon Musk",5w_7aHWx8yE,2023-12-05T17:33:24Z
The BIG Airplane Seat Switching Fights & Debate! Did Family Guy Cause This? Chrissie Mayr Reacts,yaeuyxdfdiY,2023-12-04T16:00:42Z
"SimpCast LIVE from Tampa Florida! Chrissie Mayr, Keanu Thompson, Ashton Birdie!",C8x3E45ShVs,2023-12-04T07:43:09Z
"Food Deserts: REAL or Democrat LIE? SimpCast w/ Chrissie Mayr, Melonie Mac, Keanu, Lauren DeLaguna",yP5WgvXsEXQ,2023-12-03T16:00:40Z
"Chrissie Mayr and Keanu Thompson! Livestream from Tampa, Florida",cg01ZkdSBUY,2023-12-03T06:29:33Z
Chrissie Mayr Reacts To Javier Milei Winning Argentinian Presidency. Make Argentina Great Again?,vmPThSrmgzs,2023-12-02T19:00:21Z
"Meta/Facebook Is Generating INSANE Celebrity A.I.; SimpCast with Chrissie Mayr, Melonie Mac, Keanu",q6boceO79TY,2023-12-02T16:00:27Z
"Chrissie Mayr Christmas Movie Watch Along! Star Wars Holiday Special 1978! Luke, Leia, Chewbacca",bFkbh7o5Vbs,2023-12-02T05:27:48Z
"Simpcast Searches For The Best Christmas Gifts For Men! Hotep Jesus, Lila Hart, Chrissie Mayr",If-LpjRrSfU,2023-12-01T19:00:09Z
Toho's Godzilla Minus One Movie Review! Chrissie Mayr says GO SEE THIS MOVIE!,RYHxSDpSMrw,2023-12-01T15:18:11Z
Whatever Thursday with Chrissie Mayr & Fealty!,JIHznR9lu2c,2023-12-01T05:48:31Z
Chrissie Mayr Reacts to the Latest Blue Collar TikTok Trend,dLCNMzHKepk,2023-11-30T16:00:21Z
"LIVE Chrissie Mayr Podcast with Brad Polumbo! Based Politics, Biden, Irish Lives Matter, Elon Musk",hkf6WRJQI4Y,2023-11-30T15:38:01Z
"LIVE Chrissie Mayr Podcast with Jay aka Drunk3PO! Disney Park Disasters, Park Hoppin, Star Wars",Uf30oujDt-U,2023-11-29T21:07:16Z
"How Men Are Misled By Andrew Tate, Jordan Peterson & The Manosphere. Chrissie Mayr & NotSoErudite",IwLCropwXNE,2023-11-28T16:00:11Z
"Ann Coulter Breaks Down The US Migrant Crisis to Gavin McInnes, Chrissie, Alex Stein and Melonie Mac",h1HEdwXofks,2023-11-28T01:00:15Z
"Chrissie Mayr LIVE Reaction to The Daily Wire's NEW Comedy ""Lady Ballers!"" Ben Shapiro, Brett Cooper",qi9vnShtSkc,2023-11-27T19:16:56Z
Chrissie Mayr in the Morning! Mail Bag! Airplane Seat Debate! Best Way to Argue!,aTh3qSvN3OU,2023-11-27T16:54:38Z
"SimpCast 103 - Melonie Mac, Chrissie Mayr, Lauren DeLaguna, L Some Bitch I Know, Keanu Thompson",6g-MEZU575s,2023-11-27T05:50:20Z
"Vex Electronica Fined $10,000 To Return To Canada For Being Unvaccinated! Chrissie Mayr Podcast",2rTeub84HsE,2023-11-26T16:00:02Z
Bulmau Saga Continues! Fan Won’t Stop Messaging Chrissie Mayr About Fake Eva Lovia Scams! CATFISHED,iG5p_2JN66M,2023-11-24T16:00:33Z
Comedian Matt Rife Most Savage Troll Ever! ZERO Apologies! Chrissie Mayr & Vex Electronica React,BccVH4Kwnm4,2023-11-23T22:00:06Z
NOW ON SALE! Black & Handicap Santa Claus at Target! Is it Racist & Pandering? Chrissie Mayr Reacts,Me7zGpzlleI,2023-11-23T16:00:12Z
So Proud of Will Smith! Alleged Gay Affair During Fresh Prince! Jada is MAD! Chrissie Mayr Reacts!,-Km-ECt8mdE,2023-11-22T20:00:10Z
Live Chrissie Mayr Podcast with Vex Electronica! The Marvels! MCU! Brie Larson! Matt Rife!,EvUe8S2F2GY,2023-11-22T09:15:11Z
Bulmau The Crazy Fan Wont Stop Messaging Chrissie Mayr!,l77T9MOwqso,2023-11-21T17:14:09Z
Halloween Trick-Or-Treat Candy Thieves Caught! Family Steals Bucket of Candy! Chrissie Mayr Reacts,yphDyvsrYYQ,2023-11-20T16:00:44Z
"SimpCast 102 - NotSoErudite, Kim Coulter, Misty, Stef, Chrissie Mayr, Anna TSWG, Keanu Thompson",VkyLfTexD8M,2023-11-20T06:11:16Z
Stephen Colbert Replaces James Corden With Stand Up Comedian Taylor Tomlinson! Chrissie Mayr Reacts,Kk_BRwC_o44,2023-11-19T16:00:21Z
Fan Calling FBI on Chrissie Mayr Because of Eva Lovia SCAMS! Insane Messages Revealed!,TSCgLwVAZ9s,2023-11-18T19:10:53Z
"Did Kat Von D Find God? Or is it a GRIFT? SimpCast with Chrissie Mayr, , Mint Salad, Brittany Venti",xrl-6Te10Vo,2023-11-17T16:30:09Z
What’s it Like Being The Child Of Legendary Comic Kevin Meaney! Kate Meaney on Chrissie Mayr Podcast,_HfMmpFHTe0,2023-11-16T16:00:09Z
Whatever Wednesday with Chrissie & Fealty!,vlCnDVGQcSY,2023-11-16T04:49:29Z
Star Wars Theory Under Attack! DM’s Leaked by Former Editor! Chrissie Mayr Reacts,ioTHXgskCuE,2023-11-15T20:00:06Z
Chrissie Mayr in the Morning! Target steps in it AGAIN! Is Will Smith Gay? Marvels TANKED! Hochul,jvfYDGuAN_c,2023-11-15T17:55:27Z
"Bill Burr's Wife Nia CRINGE! Flips off Trump at UFC Event. SimpCast w Chrissie Mayr, Anna, Venti",z9gov1DydTA,2023-11-15T14:15:06Z
"LIVE Chrissie Mayr Podcast with Keri Smith! Jubilee, Christians, Conservatives, Liberals!",zgmDfnEdfd0,2023-11-15T04:05:08Z
"""…God Does Not Exist"" - Megan Rapinoe Final Match Ends In 6 Minutes! KARMA! Chrissie Mayr Reacts",UQwbv19CYuk,2023-11-14T20:00:11Z
Mr Beast Brings EVIL Water To The People In Africa! How Did This Go Wrong? With Chrissie Mayr,UWX-hYqcfqI,2023-11-14T16:00:10Z
"WIN! South Park Panderverse Discussed w/ Nerdrotic, Larry Sharpe, Venti, Anna TSWG, Chrissie Mayr",N8O4M0hsKko,2023-11-14T03:00:10Z
"Pearly Thingz Has Another Tone Deaf Marriage Take! SimpCast w/ Chrissie Mayr, Brittany Venti, Anna",2pmBCpysCv0,2023-11-13T19:00:02Z
Chrissie Mayr in the Afternoon!,uMEROup2Mfs,2023-11-13T18:52:50Z
Steven Crowder Released the Nashville Covenent School Shooter’s Manifesto. Chrissie Mayr Reacts,jZCHuQ7NyfQ,2023-11-12T16:00:34Z
Chrissie Mayr Reacts to the Mean Girls & GhostBusters Trailers! HARD NO from Chrissie!,1mtpbrOpt98,2023-11-10T16:00:02Z
Whatever Thursday! Chrissie Mary & Fealty Recap Fresh & Fit and Whatever Podcasts,80tWtYL-Erc,2023-11-10T06:35:43Z
Internet OUTRAGED Over Target Locking Up Basic Supplies! Chrissie Mayr Reacts,qgwORY69eT8,2023-11-09T15:00:43Z
LIVE Chrissie Mayr Podcast with Dinesh D'Souza! Police State Movie!,vIUexQ-o3j4,2023-11-08T23:17:05Z
"Chrissie Mayr in the Morning! Star Wars Theory Drama, Mia Khalifa vs. Gal Gadot, Mr. Beast backlash",_npQ5qwgj_U,2023-11-08T17:09:51Z
LIVE Chrissie Mayr Podcast with Kate Meaney! Compound Media! Kevin Meaney's Kid!,NI1YAdGv79M,2023-11-08T15:33:43Z
"Beer from Amouranth’s Own Yeast?! SimpCast with Mary Morgan, Chrissie Mayr, LeeAnn Star, Radix, Nina",4EpyroRaQ3Y,2023-11-07T20:00:02Z
"Chrissie Mayr in the Morning! Tranifesto Released, Target, Blue Collar TikTok, Vegas Comedy Scam",HurGLY2Swho,2023-11-07T19:06:55Z
"Mary Morgan REVEALS DETAILS from Whatever Podcast with Dave Rubin! SimpCast with Chrissie Mayr, Nina",hblQVNyHD6o,2023-11-06T16:00:33Z
"SimpCast 100! Chrissie Mayr, Ann Coulter, Gavin McInnes, Gary Buechler, Brandi Love, Alex Stein",ddo9zS8bfNs,2023-11-06T06:56:04Z
Pregnant Chrissie Mayr GOES OFF About Pregnancy Halloween Costumes on SimpCast! Mary Morgan & Xia,8n1WeVAfsZk,2023-11-05T16:00:04Z
"Canada Shop Teacher GREATEST TROLL! SimpCast w Chrissie Mayr, Mary Morgan, Xia, Nina, Anna, LeeAnn",ZqPrv7eMAy8,2023-11-04T18:00:28Z
Gina Carano Destroys Kathleen Kennedy & Disney Star Wars In Epic Twitter Rant! Chrissie Mayr Reacts,s7vFOLKzSZA,2023-11-03T15:00:48Z
"LeeAnn Star Communicates with Spirits! SimpCast with Mary Morgan, Radix, Nina, Chrissie Mayr",bQ6w6d2xv18,2023-11-02T20:00:13Z
"Chrissie Mayr in the Morning! Taylor Tomlinson to Replace James Corden, Racist Birds, Candy Faux Pas",ANmexXXqGrE,2023-11-02T16:31:37Z
SNL Alumni Kevin Brennan UNDER FIRE for Matthew Perry Tweet! TMZ Cringe! Chrissie Mayr Reaction,3yCRr3LVhMw,2023-11-01T14:00:06Z
Marry One: Jada Pinkett Smith or Amber Heard?! COMMENT BELOW! SimpCast with Anna That Star Wars Girl,rcJ_GXC6jgU,2023-10-31T15:00:49Z
"Zimbabwe Miss Universe Sparks Uproar For Being White! SimpCast with Chrissie Mayr, LeeAnn, Anna TSWG",zab1aVOAj4o,2023-10-30T19:00:35Z
"Chrissie Mayr in the Morning! Gina Carano TORCHES Disney! Fan Messages, Mail Bag, Life Updates",jBgFvbcgaWA,2023-10-30T17:45:27Z
"SimpCast 99 - HALLOWEEN SPECIAL! Mary Morgan, Xia Anderson, LeeAnn Star, Chrissie Mayr, Radix Verum",45V0wbtq4po,2023-10-30T05:49:49Z
Chrissie Mayr Retells her Crappy Upstate New York Stewart’s Shops Story on SimpCast! NSFW! LeeAnn,G_7J6HBIgN8,2023-10-28T22:00:07Z
Shad Brooks CANCELLED By FRIEND!? Christian Beliefs Attacked Shadiversity on Chrissie Mayr Podcast,E7Eh99oeorw,2023-10-27T17:00:08Z
Whatever Thursday! Chrissie Mayr & Fealty Recap Whatever Podcast AND Fresh & Fit,gveTJCgfReQ,2023-10-27T01:54:11Z
Live Chrissie Mayr Podcast with Comedian Erica Rhodes,UH--9QE68oY,2023-10-24T20:51:48Z
"Men VS Women at Bar Pickups! Chrissie Mayr & NotSoErudite Discuss Lines, Skills, and Failures",ptLH7bKaDE4,2023-10-23T17:00:28Z
"Hotep Jesus RUNS INTO Pearly in Miami! SimpCast FULL REACTION! Chrissie Mayr, Jazmen, LeeAnn, April",Q8d89fljwWU,2023-10-21T17:00:15Z
Chrissie Mayr Guest Hosts for Anthony Cumia- Nick Rekieta Takes On the Eric July V Dick & Vito Story,ekDLa0bUOiw,2023-10-20T17:00:09Z
"Chrissie Mayr BIG Announcement LIVE on SimpCast! LeeAnn Star, April, Olivia Rondeau, Jazmen Jafar",jmYqhwESTY4,2023-10-20T02:00:07Z
"Rest In Peace Suzanne Somers. SimpCast Reacts- Chrissie Mayr, Keanu Thompson, Leonarda Jonie",WMQHwIJSAU4,2023-10-19T15:00:21Z
"SssniperWolf STALKS & Doxxes JacksFilms Home! SimpCast Reacts! Chrissie Mayr, LeeAnn, Jazman, April",9s_RYcwTY20,2023-10-18T15:00:09Z
"LIVE Chrissie Mayr Podcast with NotsoErudite! Man O Sphere, MGTOW, and MORE",PO7Ixl_QPwQ,2023-10-18T02:42:52Z
LIVE Chrissie Mayr Podcast with Holly Treats! Social Media Star! Instagram Influencer!,VIWEWmV4tcU,2023-10-17T22:38:14Z
LIVE Chrissie Mayr Podcast with Aidan Kearney aka Turtle Boy. ARRESTED!?,sEDJnUcNE8U,2023-10-17T03:44:46Z
"Do Black Guys go “Downtown”? SimpCast Chat! Camelot, Chrissie Mayr, Xia; X Ray Girl, Keanu, Tuggs",1EdoEuyhRMs,2023-10-16T15:00:04Z
"SimpCast 97 - Jazmen Jafar, Oliva Rondeau, LeeAnn, Anna TSWG, Chrissie Mayr, April, Leonarda Jonie",E9WJFsrBGvQ,2023-10-16T04:53:12Z
"Tuggs Is Officially That Van Life! She Explains Her Move! SimpCast with Chrissie Mayr, Keanu, Anna",hCGrAHyiSNM,2023-10-13T15:00:35Z
"Whatever Thursday! Chrissie Mayr, Fealty, Nina Infinity, & Keanu Break Down Whatever and Fresh & Fit",HXCRfOtv0bU,2023-10-13T05:23:25Z
Chrissie Mayr Hiking in the Morning! Ask me anything!,80C0oBj__IU,2023-10-12T03:56:20Z
Live Chrissie Mayr Podcast with Joshua Smith from Break The Cycle! Libertarian POTUS Candidate,earIbS589yE,2023-10-11T13:47:04Z
"Its Pearly Thingz MELT DOWN over SimpCast clips! Chrissie Mayr, Lauren DeLaguna & Nina Infinity",x3rF8qAjgwo,2023-10-11T04:02:17Z
"White VS Black People takes on Hiking! Hotep Jesus on SimpCast with Chrissie Mayr, Lila Hart",D6E9AX6YxAM,2023-10-10T17:00:09Z
"SimpCast 96 - Camelot, Xia, X Ray Girl, Chrissie Mayr, Keanu, Tuggs",-Owg9wnEYtI,2023-10-09T04:28:12Z
"JustPearlyThings Get SimpCast to Debate Over Marriage & Happiness! Hotep Jesus, Lila, Chrissie Mayr",dbB0qi1z-SY,2023-10-08T15:00:23Z
"Shad Brooks & Chrissie Mayr Discuss the REAL PROBLEMS with Girl Bosses in TV, Film, and Life!",tdxiUXERQCg,2023-10-07T15:00:07Z
Canada's Just For Laughs Comedy Festival EXPOSED as WOKE Propaganda! Ben Bankas with Chrissie Mayr,poUoEUNhgXM,2023-10-06T15:15:03Z
LIVE Chrissie Mayr Podcast with Australian Stand Up Comedian Isaac Butterfield!,XefdEoGml1s,2023-10-05T22:48:09Z
"Why Men Think About the Roman Empire? SimpCast reacts! Chrissie Mayr, LeeAnn Star, Mint Salad, Anna",nbJzZW8m4FM,2023-10-05T15:00:40Z
Whatever Wednesday,1uJLGunexgQ,2023-10-05T04:32:05Z
LIVE Chrissie Mayr Podcast with Shad Brooks! Friday Night Tights! Cancel Culture!,ci2X9bft12k,2023-10-05T02:37:33Z
Streamer “Meatball” Incites & Streams The Philadelphia Looting Spree & Riots! Chrissie Mayr Reacts!,HTKnfDnjiM8,2023-10-04T15:00:13Z
LIVE Chrissie Mayr Podcast with Ben Bankas! Cancelled Toronto Stand Up Comedian,UoVFbGxUDLo,2023-10-04T10:31:45Z
LIVE Chrissie Mayr Podcast with Chandler Remington! Law stuff Trevor Bauer OUTRAGE and DETAILS,jJGqeZUTdeQ,2023-10-04T02:19:02Z
Chrissie Mayr Angers Infamous Stand Up Comedian Tom Myers! Leftist Comic has Twitter Meltdown,y5m3qLAtRQI,2023-10-03T15:00:47Z
Brittany Venti & Chrissie Mayr Explain the Martina Markota Situation,jtxSw1-VtMw,2023-10-03T04:21:55Z
"SimpCast 95 - Hotep Jesus, Lauren DeLaguna, Keanu, Misty Winston, Chrissie Mayr, Lauren, Lila Hart",Ug5jsAKkoec,2023-10-02T04:45:16Z
Author Chadwick Moore Gives Details on Tucker Carlson's Last Days At FOX News! Chrissie Mayr Podcast,KwdzxrgvwEg,2023-10-01T18:00:07Z
Damage Caused by Eliza Bleu on Trafficking Survivors!  Connections to Polaris Project & Clinton’s,-PWrO3odU3c,2023-10-01T02:00:09Z
"SSSniperWolf Hatred! Making Money & Stealing Content! Chrissie Mayr, Mint Salad, LeeAnn, Anna TSWG",P_M6QWYwFXY,2023-09-29T15:00:21Z
"Whatever Thursday! Chrissie Mayr & Fealty Break Down Whatever Podcast, and Fresh & Fit",kj16k4aY2c0,2023-09-29T04:22:11Z
Chrissie Mayr Reacts to Bert Kreischer’s “The Machine” Film! How WOKE is it?,Y-OuDvdMSuI,2023-09-28T15:00:23Z
"Chrissie Mayr in the Morning! Mailbag, Philly Looting, Britney Spears, Haters, Pink, Taylor Swift",Y6ssi1fWmEQ,2023-09-27T16:34:56Z
"LIVE Chrissie Mayr Podcast w/ Chadwick Moore, ""Tucker"" author; an Inside Look at Tucker Carlson",qmm8MVk-UBM,2023-09-27T10:17:35Z
"Sperm Donor Kyle Gordy Fathers 69 Kids! SimpCast with Chrissie Mayr, X Ray Girl, Keanu Thompson",lut49n0pBJ0,2023-09-26T17:30:10Z
"Is Disney Star Wars Ahsoka Just Feminism?! SimpCast with Critical Drinker, Daisy Cousens, Chrissie",OrmgShMEVGQ,2023-09-25T15:00:29Z
"SimpCast 94- Mint Salad, Waifu Chron, Chrissie Mayr, LeeAnn Star, Anna TSWG, Forest Mommy",khVm3S7ZGpE,2023-09-25T05:54:04Z
Cardiff Electric Helps Explain the Stuttering John Dabbleverse & his Origin with Chrissie Mayr,8GFuXrv--iA,2023-09-24T19:00:11Z
Pie Season!!! Josie The Redheaded Libertarian Shares Tips To Make The Best Pies with Chrissie Mayr,Vucsoiu3FD4,2023-09-23T15:00:31Z
"Texas ""Housing Development"" Colony Ridge Is An Entirely Lawless Migrant Owned & Built Town?",B1dZZmClGQs,2023-09-22T15:00:07Z
"Russel Brand Under Attack! Chrissie Mayr, Critical Drinker, Daisy Cousens, & X Ray Girl REACT",K0DPZMz1Pss,2023-09-21T18:30:11Z
"LIVE Chrissie Mayr Podcast with Rachel Wilson! Feminism, Patriarchy, Witches, Vasectomies",iYMK3YqLpkE,2023-09-21T17:20:21Z
"SimpCast FULL REACTION to Lauren Boebert Situation! Chrissie Mayr, Daisy Cousens, and X Ray Girl",f9CRYMzC9cY,2023-09-20T18:00:10Z
"LIVE Chrissie Mayr Podcast with Natly Denise! Border Crisis, Micro Psyops, Sound of Freedom, Polaris",xiurt13Yl-g,2023-09-20T14:42:51Z
ALL BUC-EE'S!!! Chrissie Mayr Reacts To The Random Things At The Ultimate Texas Gas Station,t8UE6Ig4IUY,2023-09-19T18:00:21Z
"Live Chrissie Mayr Podcast with Cardiff Electric! Dabbleverse, Stuttering John, WATP!",ot0_IviNgKU,2023-09-19T04:04:42Z
"BREAK DOWN: Az aka HeelVSBabyFace  Starfield Rant! Bethesda's New Game! Melonie Mac, Chrissie, Venti",XFtssOh9hQo,2023-09-18T16:00:33Z
"SImpCast 93- Critical Drinker, Mary Morgan, Daisy Cousens, Chrissie Mayr, X Ray Girl,",CxOcwX7c7lo,2023-09-18T03:24:05Z
Is Garth Brooks a Serial Killer?! Mysterious Disappearances Follow Him! SimpCast with Chrissie Mayr,NW4-nxdOPD0,2023-09-17T15:00:13Z
"SimpCast Recaps Viral Punch From Chrissie Mayr LA Show! Fan Joins the Stream! Anna TSWG, Lila, Nina",F4qESSwFSp8,2023-09-15T18:00:10Z
Whatever Thursday! Chrissie Mayr and Fealty Breakdown the Whatever Podcast,jNOZe88nKL4,2023-09-15T06:07:39Z
"Drunk Heckler KNOCKS OUT Fan at Chrissie Mayr Stand Up Comedy Show in Los Angeles, California",lpusKLaflbQ,2023-09-15T01:00:11Z
Chrissie Mayr in the Morning! Alien Corpses! Gays Against Groomers Protest! Gen Z Embraces Boobs!,qqSFLHJoqDo,2023-09-13T20:47:22Z
Disney Snow White’s Rachel Zegler Sparks Debate; Feminine VS Masculine Ladies! Chrissie Mayr & Keanu,VNyP2AIrSgY,2023-09-13T18:00:11Z
LIVE Chrissie Mayr Podcast with Aidan Kearney aka Turtle Boy! Karen Read Case,Ew_Zaz2v1jE,2023-09-13T02:53:05Z
Chrissie Mayr & ThatTuggLife Are Gangstas From Da Streets!!! They Have Many Black Friends! ThugCast!,M9eyhmujnHo,2023-09-12T15:00:15Z
In Memory of Comedian James Raniolo. Clips from Chrissie Mayr’s Wet Spot on Compound Media,Hl-9wgpn5xw,2023-09-11T17:00:07Z
"SimpCast LIVE from LA! Chrissie Mayr, Jasmin St Claire, Lila, Nina Infinity, Anna TSWG, Keanu",XXs5UVcms28,2023-09-11T04:56:49Z
"Jimmy Fallon EXPOSED By Former Staff! Tonight Show Host, A Drunk Bully? Chrissie Mayr & Keanu",X8yLb-Ps8yw,2023-09-10T15:00:18Z
"Chrissie Mayr Live! Uncut, Uncensored, Unedited at The Secret Group Comedy Club in Houston, Texas",kyDKWUWO_1I,2023-09-10T01:30:09Z
CLEAN THE HOUSE! Wife Punishes Husband For Not Doing Enough In Relationship & TikToks The Outcome,LI9omCrqP2M,2023-09-09T15:00:15Z
"Dillon Danis EXPOSES Logan Paul Fiance Nina Agdal! SimpCast w/ Melonie Mac, Chrissie, Tree of Logic",gRmdzgoBVmU,2023-09-08T19:00:31Z
"Chaos at Burning Man! FEMA & Ebola? Simpcast Reacts! Melonie Mac, Chrissie Mayr, Stef, LeeAnn, Anna",UTz7lT5zBRc,2023-09-08T15:00:30Z
"Chrissie Mayr & Keanu Thompson POOL LIVE STREAM from Los Angeles, California",z3gLHkMcWAw,2023-09-07T21:46:26Z
"SimpCast Discusses Penis Enlargement Surgeries “On The Rise!” X-ray Girl, Chrissie Mayr, Xia, Anna",i-ACCdAPp0s,2023-09-07T15:00:30Z
"New York City has 104,000 Migrants! Sanctuary City CRISIS! Riss Flex and Chrissie Mayr Discuss",m7QJ1xpzygI,2023-09-06T15:00:43Z
Vivek Ramaswamy EXPOSED as a FRAUD! Allegedly Received George Soros Money! Riss Flex & Chrissie Mayr,ryF3aU1LYHE,2023-09-05T15:00:41Z
"Man CAUGHT Sniffing Butts At Barnes & Nobles! SimpCast Reacts! Chrissie Mayr, LeeAnn Star, Tuggs",iyytM5pbIG4,2023-09-04T19:00:25Z
The Best Way To Save Money At... Or Outside Starbucks?! Savvy Customers Know Where The Best Deal Is!,79blAuf-aIg,2023-09-04T15:00:04Z
"SimpCast 91! Chrissie Mayr, Melonie Mac, Tree of Logic, Stef Alter Nerd, LeeAnn Star, TSWG, Venti",8Yf67n05vXg,2023-09-04T04:54:06Z
Is Mini-Golf Really All It Is Cracked Up To Be?! Chrissie Mayr Falls in Ocean City Maryland!,cwo40XsLIgc,2023-09-03T15:00:34Z
"Strike Force Five! Chrissie Mayr, Karl from WATP, and Ryan Kinel EFAP! Fallon, Kimmel, Colbert",Yh6UmoReJA8,2023-09-03T02:49:02Z
Mary Morgan From Tim Pool’s Timcast Recaps Her Whatever Podcast Experience with Chrissie Mayr,HdDhBg_DNpE,2023-09-02T15:00:22Z
"Whatever Podcast Viral Video Resurfaces, Craziest Guest ? SimpCast w/ Chrissie Mayr, Ashton, Lila",2QaumEXWs5M,2023-09-01T18:45:00Z
Uber Scam Exposed?! Uber Eats Customer's Food Held Hostage For Gas Money Just To Complete Order,fAmYyXo8WXo,2023-09-01T14:30:10Z
Chrissie Mayr Called RACIST Again! Blue Beetle Review on Friday Night Tights,6H6Q_eV0cvI,2023-09-01T03:47:05Z
LIVE Chrissie Mayr Podcast with Josie the Red Headed Libertarian,dXmulM1n-pk,2023-09-01T01:48:19Z
"Nick Rekieta Says Dior Has “No Case!” Against Gigi Dior! SimpCast- Chrissie Mayr, Xia, Nina Infinity",eeoVZeRHHqE,2023-08-31T17:30:09Z
LIVE Chrissie Mayr Podcast with Legal Vices! Origin! Korea! Mormon Roots! Anime Matsuri! LawTube!,Bpu2FxjpZzM,2023-08-31T16:58:11Z
"Whatever Wednesday! Chrissie Mayr & Fealty! PLUS Isabella Deluca, Kristy Saint Regis, and Brenna!",Rzqc7kKV_Pw,2023-08-31T05:38:18Z
Vegas Got A Giant $1.2 BILLION Ball... Not The Type You Are Thinking! It Caused Multiple Accidents!,CABQ69GW58s,2023-08-30T18:00:05Z
"LIVE Chrissie Mayr Podcast with Riss Flex - J6ERS, Vivek Ramaswamy, The Border, NYC Migrant Crisis",nCGZES2qo1c,2023-08-30T15:35:01Z
Chrissie Mayr Mail Bag Livestream! Catching Up! Comedy Dates,0CbSc7D8z1w,2023-08-29T16:20:55Z
"Driverless Cars are a DISASTER! SimpCast reacts! Chrissie Mayr, LeeAnn Star, Carmen Studer Tugg Life",fGGRryBh6sk,2023-08-29T15:00:33Z
"Wheel of Fortune Bringing In Ryan Seacrest, But Has Vanna White Turned Her Last Vowel?!",_y8VwzXfqa8,2023-08-29T15:00:23Z
"Chrissie Mayr's Wet Spot Vacation Stream! Compound Media is Away! Drew, Jordan, Jimmy, Andrew",9sGKh_vS8uA,2023-08-29T01:57:38Z
Chrissie Mayr & Megan Fox React to Sex and The City's And Just Like That!,uy9EcRBtnkc,2023-08-28T18:00:32Z
"SimpCast 90! Nick Rekieta, Xia, Keanu Thompson, Chrissie Mayr, Nina Infinity, Anna TSWG, Cecil, Gigi",Apd7yc_8fBE,2023-08-28T05:10:55Z
