Title,Video ID,Published At
Proof of Eliza Bleu's PURPOSEFULLY MISLEADING Words! This Changes Everything! Chrissie Mayr,7gmADNosJAU,2023-01-27T19:00:03Z
Prostitutes & Escorts RUNNING WILD in Davos for World Econimic Forum! Chrissie Mayr Reacts,wMee_169DHk,2023-01-27T14:30:13Z
BREAKING ELIZA BLEU STORY! GOFUNDMES Found! Chrissie Mayr! Lying about Money. Ripping off Charity!,xJ2Hn6dxONs,2023-01-27T08:12:25Z
LIVE Chrissie Mayr Podcast with Ali Alexander! Twitter! January 6th! Stop The Steal!,UlyK0LNWLDQ,2023-01-27T00:55:33Z
"Tim Pool's TimCast IRL ""Problematic"" Guest List from 2022! James lindsay & Chrissie Mayr React!",toyR-HsUswA,2023-01-26T15:00:38Z
Has Eliza Bleu Been Running a FAKE CHARITY? Humanity House?! Chrissie Mayr Explore Possibility!,1WIcId95-t4,2023-01-26T06:00:10Z
LIVE Chrissie Mayr Podcast with Bryson Gray! MAGA Rappers!,L90nVwphfVE,2023-01-26T04:00:26Z
LIVE Chrissie Mayr Podcast with Kara Lynne! BREAKS SILENCE on Limited Run Games,V0TM5s8fdvU,2023-01-25T23:13:34Z
Renie Draws Explains What is Going on with China and Taiwan,VGNI3c7ab7w,2023-01-25T19:15:01Z
Chrissie Mayr in the Morning! Eliza Bleu Humanity House MISSING? New IG Found!,8xz6wZQggiY,2023-01-25T17:33:55Z
"Is Disgraced WNBA Player Brittney Griner a Woman? SimpCast Discusses! Rekieta, Faran, Chrissie, Lila",D841sVwrp4M,2023-01-25T14:30:07Z
LIVE Chrissie Mayr Podcast with Blonde in the Belly of the Beast!,eBQzrBOuc8w,2023-01-25T03:13:38Z
Alec Baldwin & Female Armorer CHARGED in Killing on Rust Set! Chrissie Mayr Reacts!,u81f8HCUgl4,2023-01-24T20:15:02Z
LIVE Chrissie Mayr Podcast with Konstantin Kisin! Cancel Culture! Woke Leftists! Comedy Industry,hfEAt3haTsc,2023-01-24T18:09:20Z
Cecil Recaps Alex Stein Trip to Washington DC! Confronting Ukraine Protesters! Chrissie Mayr,2CxVqLmlTnQ,2023-01-24T15:15:00Z
Eliza Bleu's Alleged High School Boyfriend CALLS HER OUT on Chrissie Mayr's Compound Media Show!,koO-tI9a0Ns,2023-01-24T02:30:10Z
"Eliza Bleu CAUGHT LYING! Paid for Music Video! SimpCast w/ Chrissie Mayr, Faran, Tree, Lila, Defango",m8EPAxfPNBE,2023-01-23T19:15:01Z
Did The FBI Kill Martin Luther King Jr? Libertarian Spike Cohen Exposes TRUTH to Chrissie Mayr,6WZ2-lsFZtQ,2023-01-23T15:16:01Z
"SimpCast 60- ELIZA BLEU! Vic Mignogna, Tree of Logic, Mandy, Chrissie, Venti, Anna, Forest, Faran",demT78nfwqw,2023-01-23T09:02:34Z
Tennessee Police Officer Maegan Hall Slept w/ ENTIRE Station! Chrissie Mayr Reacts to Cop Gone Wild!,5J7nZeysOW4,2023-01-22T15:00:03Z
Kanye West Has New SECRET WIFE! Bianca Censori! Chrissie Mayr Reacts to Ye News Post Kim Kardashian,8mIf1QQMUDI,2023-01-21T20:00:03Z
Amouranth Asked! A Day with Her OR a Free PS5!? RESULTS ARE IN! Chrissie Mayr is SHOCKED!,_bRLJKcG7KY,2023-01-21T16:00:16Z
"Former G4 & XPlay Host, Frosk QUITS The Gaming Industry! Chrissie Mayr Reacts to Tweets!",AuUG0FZiZzY,2023-01-20T15:00:11Z
G4TV Adam Sessler HATES Gamers & Blames Trump?! Chrissie Mayr Recaps Dick Masterson & Vito Interview,xUhMbkQetck,2023-01-20T00:00:20Z
"Dylan Mulvaney Getting AGGRESSIVE in Videos! SimpCast with Rekieta, Faran Balanced, Chrissie, Lila",yxjZTBUsu48,2023-01-19T21:00:33Z
LIVE Chrissie Mayr Podcast with Maryam Henein,TkIc--58rnA,2023-01-19T20:53:54Z
"Chrissie Mayr in the Morning! Frosk leaving the industry, Carole Baskin, Hoes in Davos, Alec Baldwin",N6TNbTRc_Hw,2023-01-19T17:36:43Z
NFL Star Tom Brady has a New Love! Who is She? Bye Bye Gisele! Chrissie Mayr & Cecil Discuss!,J9Ga4pOgSEU,2023-01-19T14:30:04Z
"LIVE Chrissie Mayr Podcast with Finn McKenty of Punk Rock MBA! Tom MacDonald, Bryson Gray, Sugar Ray",Y962A79iGUU,2023-01-18T20:46:59Z
"Chrissie Mayr in the Morning! Amouranth or PS5? Adam Sessler hates Gamers, Michael Bay, Drunk 3PO",ItwzoJEA70s,2023-01-18T18:55:11Z
New York Governor Kathy Hochul Gives DELUSIONAL State of the State! Chrissie Mayr Reacts,9RkC_c4BUZY,2023-01-18T14:45:00Z
LIVE Chrissie Mayr Podcast with Spike Cohen! Libertarianism! Founder of You Are The Power,CyGAVK-BFMY,2023-01-17T21:28:58Z
"SWATTER Who Went After Chrissie Mayr, Bob Levy, & Steel Toe ARRESTED! Insane Twist!",raCN5DUblZw,2023-01-17T14:30:24Z
Alison Morrow Explains Her Origin Story! Former Mainstream Media Reporter on Chrissie Mayr Podcast,ezYK2U844pA,2023-01-16T15:45:01Z
"Hot Tub Stream!! Chrissie Mayr, Gigi Dior, Keanu Thompson, Lindsay and MORE!",7jPIDBMvXGA,2023-01-16T06:53:54Z
"SimpCast LIVE From The Poconos! Chrissie Mayr, Gigi Dior, Lindsay, Keanu Thompson, Venti, Anna",_mT92huqEQM,2023-01-16T05:45:11Z
Chrissie Mayr Reacts To Elvis’ Austin Butler’s Golden Globe Win & Girlfriend Falling Asleep On Him,BPyJdx33JDo,2023-01-15T20:00:04Z
"Gary ""Nerdrotic"" Beuchler Shares Wisdom Learned From Being Incarcerated! Chrissie Mayr Podcast",Yt3UlRnEDas,2023-01-15T16:00:27Z
Chrissie Mayr Sends Angry Email to Mars Co. Over Woke M&M's! SimpCast w Melonie Mac & Brittany Venti,Vu4O8nf8qko,2023-01-15T00:30:13Z
"Simpcast Uses The Delusion Calculator! Chrissie Mayr, Melonie Mac, Brittany Venti, Aly Drummond",TS1Va2mjli0,2023-01-14T19:00:15Z
"Batman's Robert Pattinson's CRAZY STALKER! SimpCast- Chrissie Mayr, Melonie Mac, Brittany Venti, Xia",AFYHQhBJXCs,2023-01-14T15:15:00Z
"James Lindsay EXPOSES Leftist Philosophy While He Destroys Hegel, Marx, & Hermeticism! Chrissie Mayr",e8ueCaUuIic,2023-01-13T19:00:06Z
Former SNL Star Pete Davidson Is A Legend! | Royce Lopez of Revenge of the Cis with Chrissie Mayr,aZb5r0qL6l4,2023-01-13T14:30:00Z
LIVE Chrissie Mayr Podcast with Forgiato Blow! MAGA Hip Hop Artist,eQDZ6fSHxbE,2023-01-13T03:50:01Z
Model Vogue Williams FLIPS OUT & Fights over Plane Seat Holders! w/ Geno Bisconte & Chrissie Mayr,FqGitTeYu_U,2023-01-12T20:00:03Z
Chrissie Mayr in the Morning! New GF for Tom Brady? Canadian Shop Teacher Update! Kanye!,equu1Y1WcYo,2023-01-12T19:11:13Z
"SimpCast BEAT Frosk & G4! Chrissie Mayr, Melonie Mac, Brittany Venti, LeeAnn Star, Xia Anderson",-UBrQj6qSGo,2023-01-12T14:30:00Z
RIP to Diamond of Diamond & Silk | Chrissie Mayr & Cecil Respond To Passing Of Outspoken Entertainer,YKlc207qh14,2023-01-11T21:00:11Z
"LIVE Chrissie Mayr Podcast with Kellie-Jay Keen - Women's Rights, LetWomenSpeak Tour, Tucker Carlson",AK76XErKdjo,2023-01-11T20:19:30Z
"Chrissie Mayr in the Morning - My Swatter Arrested, NYC Migrant Crisis, Naughty Cops, Prince Harry",4h0qRp5OVbA,2023-01-11T17:47:35Z
Cardi B Gets Red Pilled By Joe Biden Inflation?! Chrissie Mayr Reacts,IzjGYIfY6VA,2023-01-11T14:30:06Z
"Chrissie Mayr in the Morning - RIP Diamond, Prince Harry, Naughty Cops, Mel Gibson,",kGYUrGtU2VU,2023-01-10T18:04:53Z
Libertarian Angela McArdle Weighs in on Birthing Freedom & Civil Liberties on Chrissie Mayr Podcast,WGMlWX9GZJQ,2023-01-10T14:30:16Z
"Teacher FIRED for not Meowing at Student! SimpCast w/ WATP's Karl, Chrissie, Tuggs, Venti, Xia, Lila",cKIe69Eb62Q,2023-01-09T15:15:04Z
"SimpCast 58- Arielle Scarcella, Candice Horbacz, Melonie Mac, Tuggs, Chrissie, Anna, Venti, Ashton",3nH4SFjtSv8,2023-01-09T06:26:47Z
Alex Stein RETURNS to City Council Meeting as a Dog! Chrissie Mayr Reacts!,0OCd280KJbw,2023-01-08T16:00:00Z
Chrissie Mayr New York City Post Comedy Show WRAP UP! Grisly Pear Comedy Club,xz5jl-fSLCk,2023-01-08T05:13:22Z
The Andrew Tate Flaunted His Cars To Greta Thunberg... Now Has All Cars Confiscated By Romanian Cops,kP4SVH1gcpw,2023-01-07T23:31:00Z
"The Ethnicities of Simpcast! Melonie Mac, Aly Drummond, Venti, Anna, LeeAnn, Ariadna, Chrissie Mayr",Mr2OYsFSlpU,2023-01-07T16:00:14Z
"LIVE Chrissie Mayr Podcast with Sam Tripoli - Hollywood, Flat Earth, Damar Hamlin, Joe Rogan",wtka8C9Px7E,2023-01-06T18:49:30Z
"Chrissie Mayr & Alex Stein at Ann Coulter's Bday Party! Recap on SimpCast w/ Rekieta, Faran, Venti",lVhpMZKTRoE,2023-01-06T18:45:01Z
"Former Twitter Employees MELTING DOWN over Elon Musk! SimpCast w/ Melonie Mac, Chrissie Mayr, Cecil",_3Cma8AnSCI,2023-01-06T14:45:01Z
LIVE Chrissie Mayr Podcast with Rian Stone,0ENbFQXe6PA,2023-01-06T04:42:21Z
"Andrew Tate Trafficking News! SimpCast REACTS Melonie Mac, Chrissie Mayr, Brittany Venti, Xia, Cecil",wWdx5sNBkS0,2023-01-05T19:00:30Z
"Chrissie Mayr in the Morning! Big Thank You, Cardi B, Prince Harry, Emily Ratajkowski, Pete Davidson",BvpFRV0jRLk,2023-01-05T17:51:54Z
"Simpcast Reacts: Taylor Lorenz Cringe Complaint Video! Chrissie Mayr, Olivia Rondeau, Brittany Venti",pYnLwRnYdRw,2023-01-05T14:25:00Z
LIVE Chrissie Mayr Podcast with Brett Ambler aka The Kazoo Kid!,-EpkF7eyaM8,2023-01-05T03:29:57Z
"SimpCast Reacts to Melonie Mac's STALKER! Brittany Venti, Chrissie Mayr, Xia, LeeAnn Star",Wr788F2fWFo,2023-01-04T22:00:11Z
LIVE Chrissie Mayr Podcast with Brittany Pettibone (Sellner),Nc_Wu_ZM-FQ,2023-01-04T20:54:58Z
"Chrissie Mayr in the Morning! Andrew Tate, Jeremy Renner, Khloe Kardashian, Mindy Kaling's Velma",IPbp_ydjHzk,2023-01-04T18:11:39Z
CEO of UFC Dana White & Anne SLAPPING Video! Zeek Arkham & Chrissie Mayr Break Down Clip & Apology,9AFEIbAtmXo,2023-01-04T14:30:03Z
"LIVE Chrissie Mayr Podcast with Jasmin St Claire! Adult Content Creator, Actress, Wrestler!",C3XBodhrMsQ,2023-01-04T03:25:34Z
LIVE Chrissie Mayr Podcast with Zeek Arkham,whA9j8xyZpo,2023-01-03T18:42:06Z
"Aly Drummond on Marrying Older Men! SimpCast -Chrissie Mayr, Melonie Mac, Anna, Venti, Ariadna Jacob",gd2_L_s1ncc,2023-01-03T15:15:01Z
Chrissie Mayr Tries To Save Anna TSWG! Details of The Red 40 Bowel Diseases! That Star Wars Girl,mGczuIZ4w1Q,2023-01-02T22:00:15Z
Ethan Ralph of KillStream Going After Comic Lila Hart Because of Alex Stein?! Chrissie Mayr Reacts,JF6vV5_Bq_g,2023-01-02T19:00:06Z
Kirk Cameron Denied Ability To Read Religious Book At Scarsdale NY Public Library! Chrissie Mayr,HJas0kPT9IQ,2023-01-02T15:00:07Z
"SimpCast 57- Xia Anderson, LeeAnn Star, Chrissie Mayr, Melonie Mac, Brittany Venti, Cecil",IZ8ov1j9_Rc,2023-01-02T08:50:54Z
Melonie Mac Stalker EXPOSED! Chrissie Mayr BREAKS IT DOWN & Then The Stalker Shows Up In The Chat!,MZxCsK3b4qI,2023-01-01T19:00:07Z
"SimpCast Debates the old Michael Jackson Accusations! Vic Mignogna, Brittany Venti, Nina Infinity",vq6JWkbDdrM,2023-01-01T15:00:27Z
"Best of SimpCast Intro Clips from 2022! Chrissie Mayr, Brittany Venti, Rekieta, AZ, Stuttering John",JoNDWPDVYNo,2023-01-01T03:00:08Z
