Title,Video ID,Published At
NICKMERCS is Gamergate! Or something.,YDNzFX24Cok,2023-06-16T18:16:40Z
HOLY SH*T! The Disney CFO Just QUIT?!,U8KYnhQ9w5Y,2023-06-15T21:04:08Z
COMICS IS DED,gvph_6x-XUI,2023-06-15T20:26:05Z
Disney Gets Its @$$ Kicked!,SwxBbMBItnY,2023-06-15T19:36:31Z
"Netflix RENEWS XO, Kitty But CANCELS Lockwood & Co.?!",CIplPEIfoKw,2023-06-15T02:36:03Z
Elemental is Yet Another Disney F*CK UP.,fHFU75i4IfA,2023-06-15T00:43:40Z
WotC WINS?! New TSR Files for Chapter 7 Bankruptcy!,JWO4FZuM0ZU,2023-06-14T18:28:28Z
Disney DELAYS Almost ALL Movies?! Marvel and Avatar PUSHED BACK!,tZ-eNLW_wMk,2023-06-14T00:55:37Z
Disney Put an ADULT FILM STAR in The Little Mermaid?!,El-NxSTdSIM,2023-06-13T23:19:03Z
The Little Mermaid is Now Black FOREVER?,GN_ufPeZhqM,2023-06-13T17:04:15Z
Lord of the Rings' New Owner is GOING BROKE?! Embracer Announces MASSIVE Cutbacks!,rL9TvCBYd5Y,2023-06-13T16:02:12Z
The Internet Learns About Capitalism the Hard Way.,F5e2hl3ZZVw,2023-06-12T22:47:48Z
Disney DUMPS Marvel Shows Off Disney Plus and Hulu!,VVuEdLbtq0A,2023-06-12T21:31:09Z
The Little Mermaid WON'T Break a Billion! Aladdin Star Was RIGHT!,Gx3Rk1a10Gg,2023-06-12T18:52:33Z
Comics Broke Them!,SnB5sYwohrQ,2023-06-12T01:09:33Z
Call of Duty BACKLASH! Dr Disrespect and TimTheTatman Support NickMercs!,AvKmICH3zrA,2023-06-11T18:07:17Z
MCU Namor Actor Accused of ASSAULT?! Namor No More?,ttWC39VvFxI,2023-06-11T17:55:08Z
R.I.P. Reddit.,fKxXa7KKUW4,2023-06-10T23:21:07Z
NickMercs CANCELED?! Call of Duty BOYCOTT Begins!,j3JXlbSVY8Q,2023-06-10T20:55:20Z
Dream Wants to UNDO that Face Reveal.,IbfDH61by4g,2023-06-10T20:47:29Z
Disney's Elemental SLAMMED as a Bad Racism Allegory?!,H7mxJIuhIco,2023-06-10T19:36:37Z
Disney is RECASTING Princess Leia?! Is Disney SELLING Star Wars to George Lucas?!,mPatIAwc4cw,2023-06-09T23:51:01Z
Disney Director Launches GoFundMe as WGA Strike Gets Projects Cancelled!,M7YhH6NTpZ0,2023-06-09T20:49:54Z
Twitch Commits Seppuku.,gDKn0bSlkrM,2023-06-09T19:42:14Z
Disney's Magic: the Gathering Knock Off Triggers LAWSUIT!,va6BZQk7gBA,2023-06-08T20:55:23Z
Indiana Jones 5 Will Only Open to $60 MILLION?!,i3PIC0EOJpw,2023-06-08T18:26:33Z
Twitch F*CKS OVER Its Creators Again! Boycott Incoming?!,0VvBtlE6rtw,2023-06-07T23:55:50Z
CNN Boss FIRED as Twitter Eats its Lunch!,tRLV24ZKqps,2023-06-07T23:21:56Z
The Little Mermaid's FAILURE Could End ALL Disney Live-Action Remakes?!,RIqWtsS1I-E,2023-06-07T22:56:53Z
The Flash SLAMMED by Top Critics! Tracking for Only $70 Million Opening?!,Nf-Tv6M66r4,2023-06-07T21:29:31Z
"Disney Plus Ultra on Apple's $3,500 VR Headset?!",HV1oVlGM0CU,2023-06-07T00:16:48Z
Marvel is a JOKE Now. Even Kids Think So.,1OUcOHDlDWM,2023-06-06T21:35:49Z
"""The Little Mermaid ONLY Flopped Overseas Because RACISM.""",w1Fszh0aMcc,2023-06-06T20:06:37Z
"""I'm Sorry I Killed CNN.""",xHg69JtkLjY,2023-06-06T02:10:32Z
Disney and Comcast are FIGHTING Over Hulu!,odgOdpVChpQ,2023-06-06T01:47:40Z
Comic Book and Video Game News Sites Will END Soon.,CDIHzlvlc8Q,2023-06-06T01:20:27Z
The Little Mermaid's Tail Got KICKED by Spider-Man: Across the Spider-Verse!,TQOlsjPQ35c,2023-06-05T19:55:13Z
MSM is DED.,t-hgrKGj9X8,2023-06-05T00:20:41Z
Little Mermaid DAMAGE Control: Disney ADMITS Remakes are About Diversity!,07HkqPB7-Dc,2023-06-04T20:35:18Z
They Think Gwen Stacy is TRANS?!,zrChMmb6HI4,2023-06-04T18:37:03Z
Disney FIRED Lightyear Bosses! Could Pixar Get GUTTED Next?!,nHxEe1ARqdU,2023-06-04T15:21:24Z
Twitter is for 'Nazis' Now and You Need to Leave!,ibX0Ijkvmxo,2023-06-04T03:28:21Z
X-Men '97 Showrunner QUITS Twitter Over Sunspot Casting Backlash?!,H4EksCMUoic,2023-06-03T22:53:59Z
Across the Spider-Verse DESTROYS Box Office as Little Mermaid SINKS in Week 2!,uP2_TjUytI8,2023-06-03T18:31:46Z
Gaming Journos: Cammy is TOO HOT and Street Fighter is TOO HARD.,Z4xcQZYF3Ck,2023-06-03T03:05:59Z
Leave Kathleen Kennedy Alone!,NGXAPlN9KHM,2023-06-03T02:40:42Z
Image Comics Union MAD They Can't Solicit on Company Time?!,QY6KI_0Wz-Q,2023-06-02T21:10:08Z
Little Mermaid Fan Artist BLASTED for Making Ariel White?!,SxtINetdyh0,2023-06-02T17:45:47Z
Twitter is a Dangerous Far Right Hellscape Now. Or Something.,BL3P36hKibk,2023-06-02T01:31:13Z
The Little Mermaid Doesn't Have Enough SLAVERY Says Activist!,-zlaq3vSAYY,2023-06-01T20:25:06Z
Disney Tries to BOOST Its Disney Plus Numbers with Indiana Jones Merch?!,bLJVNENWvgU,2023-05-31T19:47:27Z
Black Aragorn BACKFIRES! WotC Fans Still FURIOUS About the Pinkertons!,NjIIns86gcM,2023-05-31T17:22:47Z
Sell Your Disney Stock NOW Warns Investment Website!,g8LsRV1N1cI,2023-05-31T03:35:55Z
Ezra Miller STAYS for a Flash Sequel?! No One is Better Than Ezra!,b7s2hLo8pTg,2023-05-31T01:29:47Z
CBR IMPLODES! Comic Book News Site GUTS Leadership and Will Refocus?!,npg_sgDkCks,2023-05-30T22:00:59Z
Top K-Drama Picks from Geeky Sparkles!,b1RjCgSHGjU,2023-05-30T04:27:26Z
"Finally, Aragorn is Black!",G4Gqm4xU7w0,2023-05-30T03:43:03Z
The Little Mermaid SINKS in China! WORST Disney Opening EVER?!,CI2_fe_sGaA,2023-05-30T02:59:48Z
It's OK to Dunk on Captain Marvel Now.,llwYsVFXk0A,2023-05-30T00:14:41Z
The Little Mermaid Audience Score LOCKED at 95%? Something Smells FISHY!,-3NOgKuBFm0,2023-05-28T23:54:34Z
The Gollum Video Game is Getting a FOLLOW UP?!,cGMK4leSIys,2023-05-28T17:02:58Z
Disney DISASTER Incoming: Elemental Reviews are NOT GOOD!,ZlzK61OlGD0,2023-05-28T16:49:54Z
Webcomic Accused of Using AI to STEAL from Anime Series?!,ktxTgwkGA8c,2023-05-27T19:56:47Z
The Flash Might FLOP HARD! Box Office Projections HALVED?!,K2Lw3FCNVOE,2023-05-27T19:41:02Z
The Gollum Game is SO BAD the Company Just APOLOGIZED For It!,C5ElOgV_ZCg,2023-05-27T17:23:28Z
The Little Mermaid Needs to Make HOW MUCH to Break Even?!,uIB1uIqO6iw,2023-05-26T23:23:42Z
Netflix DOUBLES DOWN on The Witcher Without Henry Cavill?!,-Aq4ETkbq9E,2023-05-26T22:26:19Z
The Flash's HUGE Secret Cameo SPOILED by the Director?!,7-QCua3GXhU,2023-05-26T15:37:18Z
Somehow Princess Leia's Dress Returned... and Might Sell for $2 MILLION at Auction?!,4kJq-Azl0BU,2023-05-26T02:32:42Z
Wizards of the Coast INFURIATES DnD Players Yet Again!,D7R2jRjQa30,2023-05-25T23:31:44Z
Disney Chose to SHUT DOWN Star Wars: Galactic Starcruiser Instead of FIXING IT?!,5s6iG3-yQl0,2023-05-25T21:26:35Z
Amazon Lord of the Rings Cast Needed THERAPY Because of 'Racist Trolls?!',lRzQMbRDKCc,2023-05-25T18:54:23Z
X-Men Hellfire Gala Happening for REALSIES at San Diego Comic-Con?!,UYqS20_kIJc,2023-05-25T01:57:55Z
Disney is More Politically POLARIZING than Pfizer?!,scP-yo8g_tM,2023-05-24T22:05:37Z
Hasbro CEO Blames FOOD PRICES for Its Failure?!,lYaz4TgR47g,2023-05-24T19:08:15Z
Comcast Could Stick it to Disney AGAIN?!,f4-Jgd0gX8k,2023-05-24T02:13:38Z
Disney vs. DeSantis Drama DIDN'T Hurt Disney World Attendance AT ALL?!,wvH_i7SW1r4,2023-05-23T22:57:13Z
Disney BLOODBATH Part 3! Thousands More Disney Employees Get CHOPPED!,_lzTHV6R_fw,2023-05-23T21:08:10Z
Disney's Next BOX OFFICE BOMB is Elemental?!,woqu--T_UUc,2023-05-23T03:27:12Z
GameStop Employees WALK OUT on Zelda: Tears of the Kingdom Release Day!,mDs3ta3il7g,2023-05-23T00:35:45Z
The Little Mermaid: WORST OPENING EVER in China for Disney Hollywood Release?!,hPyKX1Hwhms,2023-05-22T19:51:30Z
"Clownfish TV Has Over 300,000 Subs on YouTube?! [LIVESTREAM REUPLOAD]",9tuVXtXFX-A,2023-05-22T04:47:11Z
Indiana Jones and the Dial of DISAPPOINTMENT.,jZqQWsQCvEg,2023-05-21T17:30:09Z
Florida DID What Disney DIDN'T! Reedy Creek Firefighters FINALLY Get New Vehicles!,i2CB4rnP_Z4,2023-05-21T16:35:04Z
Hollywood Studios WANTED the Writers Strike to PURGE Content?!,kMEyAueGnvM,2023-05-20T23:33:47Z
Disney Called 'Anti-LGBTQ' Over WILLOW Being Yanked Off Disney Plus?!,rNebidfwVjQ,2023-05-20T22:46:31Z
The Geeky Button: A Clownfish TV Comic Strip,HeuH1gl4qfg,2023-05-20T20:33:13Z
Disney's Galactic Starcruiser Employees BLINDSIDED by Sudden Closure!,FYfhbFbtNGQ,2023-05-20T19:30:17Z
Disney DUMPS Willow and More Off of Disney Plus!,pe_SCWxzLKQ,2023-05-19T18:20:09Z
Indiana Jones 5 is ROTTEN.,z4EzLffnWWA,2023-05-19T17:01:15Z
Disney CANCELS Lake Nona Project! DeSantis Blamed?!,HVQKCiDmxGg,2023-05-19T01:37:53Z
Disney SHUTS DOWN Star Wars Hotel! One of Disney’s Biggest FAILURES Ever!,s0LcX4JXs4s,2023-05-18T20:33:26Z
Ms. Marvel is DEAD! Twitter Stans LOSE IT!,rVb5Xc5pPt4,2023-05-18T16:38:48Z
Henry Cavill Did Nothing Wrong! The Witcher Co-Star DESTROYS Media Narrative!,6uYzwAIIDlI,2023-05-18T02:25:59Z
'Anti-Capitalist' Coffee Shop Goes BROKE and Goes OUT OF BUSINESS!,kLpjsmHxmzY,2023-05-17T22:26:51Z
Disney World BRAWL! Another Fight Breaks Out in Magic Kingdom!,9O2CfXgsp4E,2023-05-17T20:23:09Z
Guardians of the Galaxy Vol. 3 Box Office DIDN'T Drop Off a Cliff in Week 2?!,6kjllhnYEgU,2023-05-16T17:29:23Z
Disney Gets STUCK with the Check! Comcast Might FORCE Them to Buy Hulu!,oEGzIjLjX14,2023-05-16T16:12:32Z
Community Star DEFENDS Banned Dungeons & Dragons Episode!,-l1zL5Fxcqg,2023-05-16T14:30:13Z
Vice Media Goes BANKRUPT and Will Sell for DIRT CHEAP!,ewUSA2hjOz0,2023-05-16T14:10:43Z
Disney ACCUSED of LYING About Disney+ by Shareholders in New Lawsuit!,6MTpCb8j908,2023-05-16T00:24:51Z
Aladdin Actor QUITS TWITTER After Little Mermaid Stans Attack!,JvaprliYgn4,2023-05-15T18:59:23Z
MrBeast CANCELED for Buying Houses for His Staff?!,FykpVOAe-Q0,2023-05-14T19:58:57Z
Manga is Outselling Comics. Media is Slow on the Uptake.,QhKTjmKJJOE,2023-05-14T03:29:49Z
Journos FURIOUS That YouTubers are 'Anti-Union'?!,Y1jXTO4lyvk,2023-05-13T20:47:04Z
Netflix to SLASH $300 Million in Costs! It's a BAD Time for Hollywood to Go on Strike!,P0o2wCf_HpU,2023-05-13T04:24:52Z
Kotaku Just ENDED Itself Over Tears of the Kingdom...,ZbgyIaiVSrQ,2023-05-13T04:02:02Z
Kathleen Kennedy Says Rian Johnson is TOO BUSY for Star Wars Right Now?!,gIKEPobo4S4,2023-05-12T18:35:56Z
Disney STRIP Mines Fox IP: The Full Monty Gets a Disney Plus Sequel Series?!,zrama9JPuVk,2023-05-11T20:16:55Z
Star Wars: The Acolyte Might Be VERY Campy and VERY Queer.,eUz0K1HjERM,2023-05-11T19:44:32Z
Disney Stock PLUMMETS After Disney+ Lost MILLIONS of Subscribers!,Uks_ruIVxvI,2023-05-11T19:10:59Z
Disney Plus Lost MILLIONS of Subscribers! Hulu and Disney Plus MERGE! Price Hikes Announced!,Gq9wNVvWhO8,2023-05-11T00:30:46Z
Disney CEO THREATENS DeSantis During Disney Q2 Earnings Call?!,NWQOG09t-64,2023-05-10T23:54:58Z
Disney Almost Bought BuzzFeed?! MTV News Gets SHUT DOWN!,m2F8rMqVfko,2023-05-10T21:22:33Z
Andor Showrunner Called a SCAB?! WGA Writers Send HIT SQUADS to Stop Productions!,vXrvOuXFJMc,2023-05-10T18:48:16Z
"Simu Liu FURIOUS He's Being Called a ""Thirst Trap?!""",S1rYKkeA8RM,2023-05-10T02:53:07Z
Disney Made Scarlett Johansson Sad.,E1Xe9WI137s,2023-05-10T00:38:20Z
The Little Mermaid Early Reactions are MIXED! Critics Say it Looks WEIRD?!,bgB-EHx6Ob4,2023-05-09T21:43:55Z
"Zod Actor Says Everyone is ""Picking On"" Ezra Miller?!",wqHC8yrr8uc,2023-05-09T03:23:58Z
Tech Goes Bust. Hipsters Go Broke.,KSwmzP2wi-4,2023-05-09T02:52:47Z
Disney Dining Plan Returns?! Is Disney World DESPERATE for Attendance?,83e0yMyQEYk,2023-05-08T20:13:45Z
Guardians 3 Box Office ISN'T the Win the MCU Needed.,RrKzcRk4bVo,2023-05-08T18:12:13Z
TA-DUMB! Yahoo Bought TUMBLR Instead of NETFLIX?!,6yH8Qr7HjgA,2023-05-08T14:41:24Z
Hogwarts Legacy x Tom Felton? Draco ISN'T Ashamed of Harry Potter!,smFW_KQnk3k,2023-05-08T02:45:28Z
Richard Dreyfuss SLAMS Oscar Diversity Requirements! Says It Makes Him VOMIT?!,85RAvdvAH3w,2023-05-07T23:23:33Z
Disney Wants to OWN Actors' Voices for AI Performances?!,fz2OYrJ-17o,2023-05-07T16:51:31Z
AI Makes BETTER Star Wars Than Disney?,lJ2YuczUH64,2023-05-06T18:24:14Z
Hollywood Strikes Back HARD Against Striking Writers! Studios THREATEN Job Losses!,G2gjZCHsG0U,2023-05-06T17:21:02Z
Hogwarts Legacy SUCCESS Made Gaming Journos IRRELEVANT.,6vNjIKl9cpc,2023-05-06T15:32:59Z
Amazon Lord of the Rings Season 2 Filming WITHOUT Showrunners Due to WGA Strike?!,darGL-MIXIY,2023-05-06T02:56:17Z
Another L for Disney?! DeSantis SIGNS Bill to VOID Disney's Reedy Creek Agreement!,G9LUQ4qrHkQ,2023-05-05T22:06:00Z
Disney THREATENS Showrunners! Demands They VIOLATE WGA Strike Terms or ELSE!!,MbSe8FysnS0,2023-05-05T20:43:37Z
Disney REPLACING Marvel Writers for Phase 5 After Phase 4 DISASTER?!,_qW4GyHUbFE,2023-05-05T02:14:32Z
Disney Star Wars Sequels BTFO'd by the Media on May the 4th?!,nNxAuNbpAwQ,2023-05-05T00:06:59Z
Guardians 3 Box Office Projections DROPPING! Rocket's TRAGIC Backstory to Blame?,UcTiI4iDR6U,2023-05-04T16:16:35Z
MODOK Gets FIXED with the GAOMON PD2200 Drawing Tablet! (Review),xbHwlmKb34E,2023-05-04T14:11:42Z
"No Trump, No Views! Journos Blames LACK of Trump for Digital Media Implosion?!",4fS6ciABF-k,2023-05-03T19:20:28Z
"SNL, Fallon, Colbert & Kimmel OFF THE AIR Because of Hollywood Writers' Strike!",O00M1jwltik,2023-05-03T18:34:42Z
The Flash: SO GOOD You'll FORGET About Ezra Miller's Abusive Behavior?!,q3zQM7bUUIg,2023-05-03T02:25:41Z
WGA Strike: Do Hollywood Writers Still Think It's 2007?,H9EJLdHFdG8,2023-05-02T20:05:09Z
Vice News is Going BANKRUPT! Your Digital Journalism is WORTHLESS Now!,1okC1Y64fzE,2023-05-02T16:49:23Z
Guardians of the Galaxy Vol. 3 is the WORST Rated?! Box Office Tracking LOWER Than Vol. 2!,du6ln-wiivA,2023-05-02T15:53:15Z
The Little Mermaid Could Go BELLY UP at the Box Office?,Is4XZ9ZekYo,2023-05-01T21:11:07Z
'Anti-Capitalist' Gaming News Site SHUTS DOWN! Developers REJOICE!,KtjPKLoJKqs,2023-05-01T18:56:47Z
DeSantis' Board to COUNTERSUE Disney?! The Reedy Creek Drama Continues!,AVM7D6iXlhY,2023-05-01T17:52:28Z
'Comics Have NEVER Been Better!' (And Other LIES.),AdZVJ9wxXKc,2023-05-01T03:06:54Z
Alita 2 is HAPPENING! Because of Avatar 2?!,5K3yRblhe14,2023-04-30T18:37:28Z
MARVEL CASTING COUCH! Matthew Lawrence FIRED by Agency for Not Stripping for a Marvel Role?!,0g1v8hfZ-pE,2023-04-30T17:25:49Z
WGA Strike: Do Hollywood Writers NOT Understand Basic Economics?,mC1LpCiLMtQ,2023-04-30T03:56:37Z
Jada Pinkett Smith SLAPPED AWAY by Facebook! Her Show is CANCELED!,_X_OChKKXv0,2023-04-30T02:47:21Z
Disney's Peter Pan & Wendy PANNED by Audiences on Rotten Tomatoes.,5RIEh27_eeM,2023-04-29T22:32:27Z
Winnie the Pooh Gets BAKED in a New (NON) Disney Movie?!,7gAMsGf5Skw,2023-04-29T03:09:02Z
Lindelof Was FIRED Off the Rey Star Wars Movie?!,BEwiDrSI5Xs,2023-04-29T00:15:22Z
Miyamoto: Media Backlash HELPED Super Mario Movie Hit $1 Billion!,w6ppWnf7s_M,2023-04-28T18:13:29Z
Nintendo BLACKLISTS Anti-Gamer Site Kotaku from Zelda: Tears of the Kingdom Advance Coverage!,aOAJA92th_Y,2023-04-28T01:08:24Z
IDW Publishing DELISTED from Stock Exchange?! 39% of Staff FIRED!,I4WAKGrl6gQ,2023-04-27T23:58:01Z
Hasbro NUKES Remaining Fan Goodwill! WotC Has Pinkerton Connections?!,Sil0xrurPMQ,2023-04-27T19:27:19Z
Disney is BIG MAD at Florida! DeSantis SLAMS Disney in Statement!,e6B4wyInAGA,2023-04-27T17:24:17Z
New Batman Cartoon Gets ROASTED on Twitter.,DNBeVkYPdlM,2023-04-27T02:34:00Z
Steven Spielberg REGRETS Taking Guns Out of E.T.! SLAMS Movie Censorship!,8ZiY5KogiL0,2023-04-26T19:01:35Z
Disney Just SUED Ron DeSantis Over Reedy Creek Debacle?!,8wye77s-wog,2023-04-26T17:50:58Z
Netflix is REPLACING Hollywood Writers with K-Dramas and Other Korean Shows?!,_8Ar3R3gYRI,2023-04-26T05:00:36Z
Disney vs. DeSantis Goes Off the Rails?! State Monorail Inspections Coming Soon??,vsftG4XlvGY,2023-04-25T23:40:41Z
Boba Fett Got CUT?! Temeura Morrison NOT ASKED to Come Back to Star Wars?!,XFYirKVAlrM,2023-04-25T20:30:44Z
Wizards of the Coast Sent GOONS to YouTuber's House Over MTG Card Leaks?!,C2F7RKt4oQg,2023-04-25T03:23:46Z
Disney Dirtbag CAUGHT in Lewd Act on Ratatouille Ride!,4Chy-sD-qbk,2023-04-25T01:45:24Z
"Disney LAYOFFS Resume! 4,000 Jobs Slashed! ESPN Gutted!",YvgEnJPTZIk,2023-04-25T00:31:17Z
The Witcher Season 3 is Coming and NOBODY Cares.,_j9Qad-JqcY,2023-04-24T22:20:17Z
Disney BURNS! Disneyland Dragon Catches ON FIRE During Live Show?!,GBrVm3gc9N8,2023-04-24T16:34:40Z
Black Hermione is PROBLEMATIC Now.,bz8zElOB1-0,2023-04-23T23:08:49Z
Disney Creep BUSTED for Filming 'Upskirt Videos' in Star Wars: Galaxy's Edge!,zj3hounZnO8,2023-04-23T15:51:39Z
Mario SMASHES More Box Office Records! Could Beat E.T. and Jurassic World?!,Xn5knamVdFY,2023-04-23T01:28:37Z
JK Rowling TROLLS Activists Over Harry Potter TV Series WIN!,qp7VdJi_s64,2023-04-22T23:12:28Z
Disney CANCELS National Treasure Series Without Nic Cage After Only ONE Season!,Y8OXQw_Zqzk,2023-04-22T18:48:23Z
Dungeons & Dragons Movie Was Supposed to SAVE Hasbro’s Falling Stock?!,mpeAGGskSjQ,2023-04-22T17:03:36Z
Disney RECASTS Lilo & Stitch Actors Already?! Twitter Wants MORE Gone!,R8NSQlWiEnU,2023-04-22T02:17:16Z
Disney PAYS OFF Fired Marvel Exec Victoria Alonso!,vfHCTwT6j0g,2023-04-21T21:34:10Z
Gamers NEED Game Journos Says Game Journo.,gxMDlrqC5To,2023-04-21T20:49:35Z
Disney BLOODBATH Coming Next Week! Animation Could Get GUTTED?,xY_xl5cSEDE,2023-04-21T18:04:00Z
SURVIVAL MODE: Journos FREAK OUT on Twitter About Media Layoffs!,LMUN0EC6N1g,2023-04-20T22:03:28Z
Disney Lawyers Got BUSTED Writing the Reedy Creek Loopholes?!,uKIfVl62EBk,2023-04-20T19:55:22Z
BuzzFeed SHUTS DOWN Newsroom?! They're DONE!,1uaw_XdKeSg,2023-04-20T16:59:36Z
Cobra Bubbles LIVES! Lilo & Stitch Casting Director Gets DEATH THREATS on Twitter?!,39KZPlLJrcQ,2023-04-20T02:18:49Z
Hollywood REPLACED? Writers Strike for MORE Money During a Downturn!,oo9ZWYuZGWE,2023-04-19T17:16:11Z
Hogwarts Legacy Sold 256% MORE Than Predicted?! Rowling is UNCANCELED!,olApKBYrP-o,2023-04-18T22:09:16Z
Dungeons & Dragons Got STOMPED by the Mario Bros Movie!,Kc5wTmk9tBw,2023-04-18T20:07:50Z
Disney ERASES Cobra Bubbles from Lilo & Stitch Live-Action Remake?!,aiOQQnYdMiY,2023-04-18T18:35:22Z
Jonathan Majors REPLACED as Kang?! But Ezra Miller STAYS??,TVGK2Lp2PeY,2023-04-18T14:00:11Z
Disney in DeSantis DAMAGE CONTROL Mode?!,MnT6KsSAvgQ,2023-04-17T22:28:35Z
DeSantis Could UNDO Disney's Sneaky Reedy Creek Loopholes?!,W0NXEHKjhZA,2023-04-17T19:24:19Z
DeSantis' REVENGE for Disney Embarrassment?! This Could Get MESSY for the Mouse!,_X4OSBbFEzQ,2023-04-17T15:11:23Z
Disney LOST Over $100 Million on Lightyear and $150 Million on Strange World!,Lq1886v7M_Y,2023-04-16T20:43:38Z
Netflix One Piece Test Screening DISASTER! Live-Action Series is AWFUL!,UUhkSZBCcc8,2023-04-16T17:56:24Z
Disney CEO Gets GRILLED Over CCP Connections!,OdnVqXNfCEY,2023-04-16T16:54:27Z
The Marvels is the Most DOWNVOTED MCU Trailer EVER?!,_-6LKqafptc,2023-04-15T23:33:53Z
Harry Potter and the Shield of Diversity?,oUQaigIXclc,2023-04-15T21:20:18Z
Dungeons & Dragons DROPPED Off a Cliff!,ILX7y5VEzgE,2023-04-15T20:13:33Z
Lilo & Stitch Twitter OUTRAGE! Nani's Actress is Too LIGHT-SKINNED?!,Fc3sc_zYHj4,2023-04-15T01:59:29Z
Harry Potter Backlash IGNORED! HBO Does NOT Care if You Hate JK Rowling!,klSy6e5nVH0,2023-04-14T21:57:44Z
Mario Could Deal Another BLOW to Disney and Marvel!,zqBTLvbZyj4,2023-04-14T02:48:23Z
PBS and NPR Rage Quit Twitter After Getting Labeled as 'Publicly Funded!',EoiPaqVpKv4,2023-04-14T02:02:49Z
Disney vs. DeSantis DAMAGE CONTROL: Iger Gets ANOTHER Article in Time?!,Ove6s0WrqLc,2023-04-13T17:38:35Z
Facebook HUNGER GAMES: Tech Workers Furious the FREE CEREAL Perk is Gone?!,JhS9QFpvcGw,2023-04-13T01:02:19Z
Harry Potter REBOOT Confirmed! Twitter FURIOUS JK Rowling Isn't Canceled!,1sVClTtx2XE,2023-04-12T20:14:22Z
Pedro Pascal OUT After The Mandalorian Season 3?! Star Wars is FEMALE Going Forward!,XeK5S0YcxE8,2023-04-12T16:34:24Z
Amazon's Lord of the Rings Was a FAILURE Confirmed! Only 37% Watched to the End!,mJ_KtXcwggE,2023-04-12T02:19:20Z
Disney Just RIPPED OFF Magic: The Gathering?!,I3nUomqOX4U,2023-04-12T00:29:35Z
The Marvels Trailer Drops. The Downvoting Begins.,GxcCni3gCvI,2023-04-11T20:58:14Z
DeSantis Strikes Back at Disney with SUPERIOR AUTHORITY?!,z_b9FFDVdhU,2023-04-11T20:00:24Z
Dungeons & Dragons DROPS Over 60%! WotC Gets ROASTED by DnD Influencers?!,272HoerOwHo,2023-04-11T01:51:00Z
Super Mario Bros. SMASHES Box Office Records! Look Out Disney!,w781XLb6LbY,2023-04-10T21:11:05Z
WTF Even is Disney Star Wars Now?!,8FodjS36hXU,2023-04-10T20:44:34Z
Did Hogwarts Legacy Help END Corrupt Video Game Journalism?,I4dCF9p21vY,2023-04-09T00:58:42Z
Mario STOMPS Disney's Frozen 2 Box Office Record!,nJ9-G7dIjR0,2023-04-08T17:51:22Z
DeSantis Could SLAP Disney with Tolls and Taxes as PAYBACK for Reedy Creek?!,ab-dwiRPND0,2023-04-07T20:44:39Z
Twitter vs. Substack! Elon Musk NERFS Substack Links on Twitter?!,Lx2UVYHVPVI,2023-04-07T18:58:09Z
Disney DOUBLES DOWN on Rey in New Star Wars Movie Announcements!,2u-efgP5nzg,2023-04-07T14:06:02Z
Disney vs. DeSantis DAMAGE CONTROL: Time Magazine's Bob Iger Puff Piece!,wAdX13Y5aVs,2023-04-06T23:39:07Z
Twitter Labels NPR as State-Affiliated PROPAGANDA?!,PXhDYpUCEVo,2023-04-06T22:37:11Z
Mario is Gonna Eat Disney's Lunch and Critics CAN'T STAND IT!,0mwcPdqTROo,2023-04-06T18:55:15Z
Dungeons & Dragons Says Half-Elves are RACIST Now.,S3XRHhRuzjo,2023-04-06T01:54:37Z
The Mandalorian JUMPS THE SHARK with Lizzo and Jack Black Cameos!,tgcPN-69SgU,2023-04-05T16:56:58Z
The Little Mermaid Live-Action CHANGES the Music Because it's PROBLEMATIC?!,GfQdg79O-n4,2023-04-05T16:56:57Z
Dungeons & Dragons is a Bigger FLOP Than Shazam 2?!,64mRkgJgDms,2023-04-05T01:32:04Z
Elon Musk SNAPS The New York Times' Twitter Bluecheck!,CIxCMvesLpY,2023-04-05T00:40:29Z
BAT-FASH?! Batman Called a 'Fascist' in Blue Beetle Trailer!,6HEMwQDvEj8,2023-04-04T21:29:52Z
Harry Potter REBOOT Confirmed? Original Trio Could Get REPLACED!,3Zdy6xRXklg,2023-04-04T18:53:04Z
Disney CEO Backhands Florida Government During Annual Shareholder Meeting!,b9DuPemln6o,2023-04-03T21:52:33Z
Media Admits FAILURE Over Hogwarts Legacy Boycott! Says J.K. Rowling WON?!,TcDrpNBfpAY,2023-04-03T16:39:58Z
The Dungeons & Dragons Movie Got a SAVING THROW?!,T8TMiutFJa4,2023-04-02T20:09:44Z
The Comic Book Industry is Going Bust.,LktmaIGonFM,2023-04-02T18:45:47Z
People are OVER Star Wars. Mando Viewership TANKS.,RBB1KeIhQp4,2023-04-02T18:42:03Z
News Media COLLAPSES! Not Even Disney is Safe!,vlQ24qbRYHM,2023-04-01T22:44:03Z
Sonic Found DEAD Days After Chris Chan Released on Bail!,wrHJWAH2hSg,2023-04-01T18:09:18Z
Game Over for E3.,JMq0g2a8hYI,2023-03-31T18:44:53Z
Disney Pulled a FAST ONE on DeSantis! Now There's H*LL to Pay!,unpGrjpp09A,2023-03-31T16:01:16Z
Teen Pokémon TCG Player DISQUALIFIED from Tournament Over PRONOUNS?!,0KyD31ji4Js,2023-03-30T20:29:07Z
Meritocracy Returns: Tech Layoffs are Just a Course Correction.,7fgYURits0k,2023-03-30T18:12:55Z
Jonathan Majors Has the RECEIPTS! Girlfriend's Texts Says He SHOULDN'T Be Charged!,moY0ySiQRJo,2023-03-30T15:51:43Z
Blockbuster Video is Returning?!,lpRWQiG2YT8,2023-03-30T01:28:06Z
Dungeons & Dragons & DESPERATION: DnD Movie Has LOW Box Office Projections!,sQUjJU4NB_4,2023-03-30T00:55:46Z
Disney Got BUSTED Trying to STICK IT to the State of Florida!,oxLZshCqn6g,2023-03-29T21:59:40Z
TikTok Trojan Horse: The RESTRICT Act Gives Government MORE Control of the Internet!,HKa_6k2w0gg,2023-03-29T17:47:50Z
Twitter Goes Pay-To-Win.,Tpwd04mFInA,2023-03-28T23:56:04Z
Disney Discounts FAILING Star Wars Hotel. AGAIN.,wErzClERlnc,2023-03-28T21:07:16Z
The Disney Purge Begins.,naYZEXf0xF0,2023-03-28T17:36:32Z
"Facebook Paid This Woman $190,000 to Literally Do NOTHING!",GZVOGjexIs8,2023-03-28T02:44:07Z
Agatha Christie Books CENSORED by Sensitivity Readers!,hu-YugCktvI,2023-03-28T02:20:55Z
CNN Gets ROASTED for 'Digital Blackface' Story! Memes are Racist Again?!,WgUoqSbjKUY,2023-03-28T00:05:33Z
"Disney Starts Chopping 7,000 Jobs! 2023 is Off to a DISMAL Start for Disney!",wnbSAu51qqo,2023-03-27T22:15:43Z
Twitter Bluechecks are CANCELED! They'll Have to PAY for Verification Now!,cE8WY5_fY2A,2023-03-27T01:59:58Z
Funko POPS Mondo! Is Funko Burning Down in Real Time?!,ic4_loKQoyA,2023-03-27T01:32:08Z
Jonathan Majors' Accuser RECANTS Allegations! Kang is SAFE in the MCU?,D7PscQbGs_A,2023-03-26T19:59:58Z
Shazam 2 Flopped Because it Wasn't POLITCAL Enough?!,PU0YhKPHJVw,2023-03-26T02:52:29Z
Jonathan Majors ARRESTED! Kang Gives Disney Another PR Black Eye?!,F2249UNcvgw,2023-03-26T01:20:05Z
Dungeons & Dragons Movie Could BOMB HARDER Than Shazam 2?!,JC-4XsYKM2s,2023-03-25T18:01:24Z
Victoria Alonso Could SUE Disney and Marvel for Firing a 'Gay Latina!',YJ7y7eWjD_0,2023-03-25T17:34:33Z
"NPR Reports NPR is in Deep, Deep Sh*t.",3diSFfFCmFY,2023-03-25T14:49:36Z
Gina Carano DEFENDS Her 'Replacement' After Kotaku Editor Puts a Target on Her.,z47AeJibpK0,2023-03-25T00:58:44Z
That TikTok Hearing Was a Trainwreck.,HeMkURRAfxY,2023-03-25T00:00:07Z
Marvel FIRED Victoria Alonso for Breach of Contract!,H2faGf0yE9I,2023-03-24T22:52:01Z
Kathleen Kennedy Could Be Fired from Star Wars for REAL... in 2025?!,jz6vXN29gPk,2023-03-24T19:18:05Z
JK Rowling Could Help KILL Disney?!,C0s0YUXFGlM,2023-03-24T00:31:20Z
Rian Johnson OUSTED from Star Wars. For Real This Time.,_pVlMB8ZDw0,2023-03-23T21:42:29Z
The Rock Blamed for TANKING Shazam 2?!,2RvZBZ4u_bk,2023-03-23T04:00:10Z
Marvel Didn't Care About Her 'Diversity Shield' and Journos are MAD.,GxXu2l_V4hk,2023-03-23T03:40:12Z
Rick and Morty's Justin Roiland CLEARED of All Charges! Cartoon Twitter is FURIOUS!,Vp62K_NXjRU,2023-03-22T22:30:39Z
Could Amazon SELL Twitch... to Rumble?!,tpDG84lbN0A,2023-03-22T18:53:24Z
Mattel DUMPS He-Man Toy Announcements! Is the the END of the Line?,l4TmYr3uTLM,2023-03-22T02:07:37Z
Fired Marvel Exec Victoria Alonso was TOXIC Says VFX Artists!,9rGpEfeVktw,2023-03-21T23:11:48Z
"Disney to Cut 4,000 More Jobs!",8Mf9mmEQJOU,2023-03-21T20:35:03Z
"Amazon GUTS Twitch in Latest Round of 9,000 Layoffs!",pXsHmc0loo4,2023-03-21T19:39:05Z
Willow is CANCELED. The Media is in DENIAL.,nKcCJudFiu8,2023-03-20T22:08:15Z
Marvel Exec OUSTED After Phase 4 Disaster! Victoria Alonso is GONE!,53232CEwjBk,2023-03-20T21:20:05Z
Shazam 2 is a MASSIVE Flop! Box Office WORSE Than Predicted!,q1MfHx8MzMw,2023-03-20T18:06:39Z
Hogwarts Legacy Was a MASSIVE Success and Journos Can't STAND It.,NtmmXKw9qGk,2023-03-20T17:37:47Z
Willow ISN'T Canceled. It's Just Very Badly Burned.,9VNFXC_oqw0,2023-03-18T22:14:40Z
Wednesday Actress Called TOXIC by Netflix Producer!,b8zUd3aklHg,2023-03-18T19:53:04Z
