Title,Video ID,Published At
"Disney LOSES Mickey Mouse on January 1, 2024...",ztVMeEAviv8,2023-12-31T23:30:12Z
End Stage Kotaku.,zFnd3FTrr64,2023-12-31T04:48:40Z
Hollywood Keeps Losing.,-T9pKvMo4eI,2023-12-31T02:55:44Z
‘Cancel Pigs’ Finally ADMIT the Comic Book Industry is BROKEN.,ZlqJ5LKoHuk,2023-12-30T05:15:36Z
Reylo is OVER! No More Star Wars for Adam Driver?,tucTLz4Fz-4,2023-12-29T21:31:56Z
Doctor Who Doesn’t Want YOU Watching Anymore.,E5t_sAUMOYM,2023-12-29T19:16:38Z
Western Anime Localizers GET REKT by AI...,RMc9biXYKuc,2023-12-29T04:17:26Z
Nobody is Watching Your Dumb Netflix Show.,D8o49QMF69o,2023-12-29T04:05:10Z
Doctor Who Christmas Special BOMBS. Fans Blamed AGAIN.,Yh3lAuyiub8,2023-12-29T00:29:29Z
Disney Takes a Small Business to the Cleaners!,ngBRCklbF-w,2023-12-28T03:55:33Z
Amazon Makes YOU Pay for More Lord of the Rings!,NQ3iV0VhI-M,2023-12-28T03:24:25Z
Aquaman 2 Gets DESTROYED at the Box Office by The Color Purple?!,LihGf0diic4,2023-12-28T00:17:07Z
Apple Could END Video Game Journalists FOREVER!,SUKOhSLPtc8,2023-12-27T17:05:39Z
Hogwarts Legacy Just Won 2023. The Boycott FAILED.,hnz8oG9bI58,2023-12-27T04:46:46Z
Hollywood Gets a Reality Check...,WpcfuP9Efc0,2023-12-26T23:26:24Z
Christmas Unboxing 2023!,jfPI4RDYliY,2023-12-25T05:00:10Z
Gaming Journos DEFLECT Criticism After Insomniac Hack...,xoyNNpfn5G8,2023-12-24T04:59:21Z
Aquaman 2 Flops HARDER than The Marvels and The Flash!,jtOdU72dwAI,2023-12-24T01:13:11Z
Hasbro is DESPERATE!,rPPh5sTc5Kg,2023-12-23T04:15:03Z
Disney SLAMMED by Gundam Creator! Anime Legend Calls Them BORING?!,1nq0N1XvWPg,2023-12-22T22:48:07Z
Harley Quinn Creeps on KID Poison Ivy in Suicide Squad: Kill the Justice League?!,TNBqHMb2Z1M,2023-12-22T18:24:52Z
Aquaman 2 is ROTTEN!,8PKKM5qsTjs,2023-12-22T03:08:19Z
WTF is Happening with Disney Star Wars?!,eMab9grsyp4,2023-12-22T01:13:39Z
Marvel Hits a New LOW...,Wa-WuKM7vE0,2023-12-21T23:30:32Z
The TRUTH About Disney Star Wars is Coming Out.,kZB0Fuassz4,2023-12-21T04:11:04Z
Doctor Who BACKFIRE! Showrunner Called TRANSPHOBIC by Twitter?!,DkAgB1H5dmo,2023-12-21T03:35:27Z
The Aquaman 2 Review Embargo Smells Fishy...,XqgvzTOfLps,2023-12-21T03:13:39Z
Rooster Teeth is Going BROKE.,VWBYcGvMVlQ,2023-12-20T23:43:38Z
Warner Bros. and Paramount Could MERGE?!,kZMd8aeQDTU,2023-12-20T22:41:51Z
Game Journos Get REKT.,8V73d4qYdBk,2023-12-20T00:10:54Z
Disney FIRED Jonathan Majors! Is Kang OUT of the MCU for Good?!,o8W7icNBl6I,2023-12-19T20:39:24Z
Doctor Who Keeps Losing Viewers...,ynKkB3eZBvs,2023-12-19T20:29:48Z
Twitch Views EXPLODED When They Unbanned LEWD ART!,8WK0iV_SmEQ,2023-12-19T03:10:20Z
Disney Doesn't Want to Pay Taxes.,WrAkEbAKA0c,2023-12-19T02:00:48Z
Jonathan Majors Found GUILTY! Disney's MCU Kang Plans are DOOMED?!,5NcuDuAEFhA,2023-12-18T21:59:54Z
A Eulogy for Disney.,4Uf8QU07v1U,2023-12-18T01:28:54Z
Aquaman 2 is DEAD in the Water?,bUNCT05NpGo,2023-12-17T20:54:44Z
Doctor Who DOUBLES DOWN? David Tennant STAYS According to Showrunner?!,KKxsLyTmdUc,2023-12-17T19:57:37Z
Activision Blizzard Pays Women $55 MILLION?!,aYWCpoytQjM,2023-12-17T03:45:23Z
Hasbro FIRED Most Key Dungeons & Dragons Staff?!,tI01UburyqI,2023-12-16T18:22:49Z
Twitch Has INSTANT REGRET.,WHiufS0bkDA,2023-12-16T02:33:04Z
Warner Bros. Has a 60% Chance to GO BANKRUPT?!,Dh9-YtWQJM8,2023-12-15T19:47:25Z
Doctor Who Viewership Numbers FUDGED by the BBC?!,AXrTGBuTUwY,2023-12-15T18:14:08Z
Hasbro GUTS Dungeons & Dragons and MTG Teams During Layoffs!,QPIppkl753A,2023-12-15T03:34:44Z
Comic Book Pros Would Rather BURN DOWN Comics Than Save It?!,h3zp1kWF54A,2023-12-15T02:09:16Z
Disney Drops X Advertising to Back The WRONG Horse with Meta?,KvFZhjFGzDE,2023-12-14T23:52:40Z
Former Disney CFO and Nelson Peltz TAG TEAM Disney Boardroom!,LiLgNcXzGuA,2023-12-14T20:49:58Z
Media TURNS on Doctor Who?!,qlI9fqNKKQ8,2023-12-14T04:12:15Z
Twitch is Just a Cam Site Now...,Qp8Kayp8fRY,2023-12-14T03:51:09Z
Vulgar Disney World Line Jumper Gets BUSTED by TikTok Users in 4K!,3eURBf236AM,2023-12-14T03:30:46Z
Hasbro OUTSOURCES Action Figures to McFarlane Toys?!,DuVjk05L1iA,2023-12-14T00:44:12Z
Doctor Who x MTG Bi-Generates Another Hasbro Failure?,I2MrMasGrtE,2023-12-13T03:37:36Z
Disney Wants to Buy EA Now?!,i11luatNuyY,2023-12-13T03:18:57Z
The 'Cancel Pigs' of the Comic Book Industry Get THEMSELVES Canceled!,gVUYdaqEWOM,2023-12-13T01:19:26Z
Press F for E3.,n90Udo9poac,2023-12-12T22:37:52Z
Fake E-Girls Will REPLACE OnlyFans Models?!,4lDFpUFrKF0,2023-12-12T03:16:04Z
Hasbro is F*CKED! Lays Off 20% of Staff! CLOSES OFFICE!,e7y4OeY4ubM,2023-12-12T02:28:26Z
Dungeons & Dragons Hits the DISCOUNT BIN as Hasbro Doubles Down!,Rc13D1TouU4,2023-12-12T00:26:52Z
Doctor Who Goes FULL CRINGE with Goblin Song! Is Disney to Blame?,SFsns8JEQQE,2023-12-11T22:21:12Z
"Former Disney Execs Run Cocomelon, Blippi Studio Into the Ground?!",fmx0y7prSic,2023-12-11T02:35:17Z
'Home Alone' Fans SHOCKED at the 250% Inflation Since 1990!,vXVv3cynWWo,2023-12-11T02:20:35Z
Disney World Now Has a Giant VA-JAY-JAY?!,kqqOTnB6_n4,2023-12-11T02:05:21Z
Doctor Who Tries to SPLIT the Fandom? #RIPDoctorWho ?,8Z06fEhunUA,2023-12-10T19:50:56Z
Disney Gets TROLLED by Mainstream Media!,OXMJHJCHXyI,2023-12-09T22:21:07Z
More BAD NEWS for Gaming Journalists and Comics Journalists...,2_TZkWUeonA,2023-12-09T18:40:36Z
Spider-Man Lawsuit SETTLED! Is Miles Morales Still Miles Morales?,KrCBZswblzI,2023-12-09T04:05:41Z
Doctor Who Showrunner WANTS to Upset Longtime Fans?!,S6HdTwO65MQ,2023-12-09T02:03:36Z
Women are Suing Disney!,-oheCH60d0I,2023-12-08T23:07:31Z
"Baldur's Gate 3: You CAN'T Mod Away ""the Gay"" on Nexus Mods?",0ezeSmLik4M,2023-12-08T03:56:53Z
Toy Aisles Must Now Be GENDER NEUTRAL by Law!,bkbhUDz60VQ,2023-12-08T02:28:12Z
Elon Musk Wants Disney CEO Bob Iger FIRED!,1a5TeH0kylo,2023-12-07T22:47:30Z
Comic Book Retailer DOGPILED by Salty Comic Pros! It BACKFIRES!,cyQ4_xaMNCQ,2023-12-07T03:43:50Z
Godzilla Minus One DESTROYS Records! US Theatrical Release EXTENDED!,OdZbrNlAIxs,2023-12-07T03:00:47Z
Disney is Gonna Get SPANKED by Its Investors...,xKDAxoPgx74,2023-12-07T00:56:02Z
Disney is BROKE and Has to Pay BILLIONS!,1P6sEaMZyQ4,2023-12-06T03:16:00Z
"Media: Queer Doctor Who ISN'T the Problem, the FANS Are.",_nDg4Suv_NY,2023-12-05T22:09:37Z
Deadspin Might Get SUED After Accusing a CHILD of Being a RACIST?!,PUPVMGc-xF4,2023-12-05T21:28:06Z
The Streaming Wars are ENDING and PlayStation Users Get F*CKED!,0tDy-C6myi4,2023-12-04T19:08:50Z
Disney Just GAVE UP on The Marvels!,jnRP3VkZB8I,2023-12-04T18:46:58Z
Godzilla Minus One: They're SALTY That YouTubers LIKED It?!,M1yWovqfGRE,2023-12-04T05:00:09Z
Doctor Who is Gay.,JZCdOmL8ikY,2023-12-04T04:03:19Z
TOO WHITE! Indie RPG Publisher ATTACKED Over Lack of Diversity?!,NrLGQNYVK0Y,2023-12-03T21:32:08Z
Disney's 'Wish' Did WORSE than Strange World! Drops 64% in Week 2!,U9Zm56rHUuQ,2023-12-03T20:27:11Z
More Journalists UNEMPLOYED! Vox Media LAYOFFS Continue?!,v1R3ItjAxQA,2023-12-03T03:46:23Z
Media Still COPES with The Marvels FAILURE.,MW5btxBnANs,2023-12-03T00:45:19Z
Marvel RETCONS X-Men! Nightcrawler Has Two BIO Moms?!,Ov28Fm5uba0,2023-12-01T22:26:14Z
"Disney Plus Lost 23 MILLION Subscribers Overnight Because of Elon Musk?! (No, Not Really.)",CUBPAs_D_cE,2023-12-01T20:31:35Z
The Marvels Director THROWN UNDER THE BUS by Disney CEO Bob Iger!,uGDb7X56Lt0,2023-12-01T01:14:05Z
Disney Proxy War is BACK ON! Disney Blames Marvel Boss' Vendetta?!,bN4UhY8lGuE,2023-11-30T17:44:44Z
"Disney and Lucasfilm Should Be Very, VERY AFRAID!",bPExlHuqAkc,2023-11-30T05:03:27Z
Somehow Jezebel Returned...,IEbjLVJOij4,2023-11-30T04:32:27Z
Elon Musk Tells Disney CEO to 'GO F*CK YOURSELF!' Literally!,z_uHSqX5SfU,2023-11-30T02:42:40Z
Ms. Marvel Actress is TOO HONEST About Why the MCU is Failing?!,ruj_oojD3DQ,2023-11-29T04:22:45Z
Aquaman 2 Will BOMB HARDER Than The Marvels?!,C5N3zIHyMQY,2023-11-29T02:41:03Z
Doctor Who Writers SCREWED OVER by Disney?!,dmci7mFBWd0,2023-11-28T19:33:14Z
A Disneyland STREAKER Caught on Camera at Its a Small World?!,iLatoDFnSA0,2023-11-28T04:50:52Z
Disney BROKE Kingdom Hearts with Wish...,AeZrQHxZQkU,2023-11-28T03:39:49Z
Gen Z HATES The MCU?! The Marvels Hasn't Hit $200 Million Globally!,Zh5OY-_CPwE,2023-11-28T00:07:05Z
Disney WON'T Fire You for Drug Use or Embezzlement?!,SVAtDj6kpeg,2023-11-27T04:26:50Z
Hall & Oates Get 'Divorced' and a RESTRAINING ORDER Was Filed?!,GWp250HxX7I,2023-11-27T02:05:52Z
Doctor Who is DEFINITELY Dead.,Esk2HdWmBAM,2023-11-26T23:14:01Z
Disney DISASTER: Wish Could Come in THIRD Place on Opening Weekend?!,ZL7vBWW_Ti0,2023-11-26T03:58:42Z
Netflix IGNORED The Witcher Creator's Input?!,5MbsvHWsgwM,2023-11-26T03:29:27Z
The Marvels Director SNUBBED from Screening! Was She FIRED?!,mysWj6XRoqM,2023-11-26T01:57:49Z
Disney ROASTED for Posting AI Artwork on Thanksgiving...,KjNRxOoOFXo,2023-11-25T04:54:59Z
Wish: Another Disney DUD?,iIotvXWsv-s,2023-11-25T04:20:11Z
Superman Legacy: Jimmy Olsen is a GINGER Again?!,46WndIPEKqE,2023-11-25T02:13:54Z
Disney BIG MAD About Fake AI Disney Pixar Movie Posters?!,Impy4aQg9ps,2023-11-23T02:35:32Z
Dave Filoni PROMOTED at Lucasfilm? This WONT Fix Star Wars.,w1vwQFz2Ecg,2023-11-23T01:14:07Z
"Dungeons & Dragons BANS More Words: FAT, SLAVE and INSANE?!",9e8Pq_WlAgk,2023-11-23T00:46:18Z
Disney CEO Bob Iger ROASTED and GRADED by the Media!,yd27fz92Zfw,2023-11-22T04:56:32Z
Scott Pilgrim Writer DEFENDS the Netflix 'Bait and Switch!',gGjX2SKdPE4,2023-11-22T01:36:50Z
Disney Will Make The Silver Surfer A CHICK in the MCU?!,uDte4l5sIaM,2023-11-21T23:25:46Z
Social Media Addicts are SUING TikTok and Facebook...,1QGLpCT_Vn0,2023-11-21T02:35:07Z
The Marvels Drop WORSE Than Morbius?! Biggest DROP EVER!,2cnKolTthac,2023-11-21T01:26:14Z
Gen Z TikTokkers Want Hired for PERSONALITY and NOT Qualifications?!,3EdUfGz6z4s,2023-11-20T02:33:58Z
"The Marvels Star: Movie Failure is BOB IGER'S Problem, Not Hers!",2-Msqg0SR8M,2023-11-19T19:12:25Z
Scott Pilgrim vs. The Fans: A Netflix Bait and Switch?!,F3d_7HL0Lvg,2023-11-19T18:13:33Z
Wish Review SLAMS Disney as a 'Conservative' Company?!,alKVCXbAC0g,2023-11-19T04:05:24Z
Doctor Who Villain CHANGED to Be More INCLUSIVE?!,sNnPNXpqcEw,2023-11-19T03:47:08Z
The Marvels DROPS 87% in Week 2! Rachel Zegler STRIKES OUT Too?!,kqyTMOuxgFg,2023-11-18T21:32:01Z
Wish Reviews Are NOT Good! Another Disney DISASTER Incoming?!,51KAUovcO_o,2023-11-17T23:56:40Z
Hollywood Will NEVER Be the Same After the Strikes.,kNN2fd4LyYM,2023-11-17T18:00:32Z
The Marvels Will Get BURIED in Week 2! Third or Fourth Place?!,HWijsGlK__M,2023-11-17T16:56:46Z
Disney Announces 'Frozen 4' Before 'Frozen 3' is Even Out?!,Zm9wmKFQ-cs,2023-11-16T20:49:16Z
Pedro Pascal is Mr. Fantastic in MCU Fantastic Four Reboot?!,4Q5fh5aoqb4,2023-11-16T20:28:44Z
More Fan BACKLASH for Wizards of the Coast...,DNPhB5HDr2M,2023-11-16T03:27:08Z
R.I.P. Digital Comics.,y6XbunKDhpo,2023-11-16T02:58:17Z
Disney in the CROSSHAIRS of ANOTHER Activist Investor!,oHpEmC3z1ko,2023-11-16T02:18:09Z
Marvel is Officially OVER.,xz9EdNZz-UY,2023-11-15T21:10:26Z
Coyote vs. Acme Gets UN-Cancelled After MASSIVE Backlash!,lRjRAKX0b_E,2023-11-14T23:51:15Z
Desperate Disney Pins its Future on NFTs?!,oA5WQOu5Nec,2023-11-14T21:59:49Z
Women Didn't Watch The Marvels. Men Still Blamed.,GwuYrGafpfU,2023-11-14T19:35:04Z
Comic Books in 2023: There is No Fixing This.,0FjMDh3yK74,2023-11-13T22:48:02Z
Rick and Morty Fans HATE the New Voices...,0iU7Db-qPv4,2023-11-13T20:25:16Z
The Marvels FAILURE Could Get Kevin Feige FIRED?,Bsqcnw8ruyc,2023-11-13T19:08:23Z
Thin-Skinned HBO Exec ROASTED for Using Twitter Sock Puppet Accounts!,qF3scoOokwQ,2023-11-12T23:28:21Z
The Marvels Only Made $47 Million?! Toxic Masculinity Blamed (Again!),C1D5h2PIhfE,2023-11-12T21:11:37Z
Disney Employees are OVER Bob Iger?,wCPPHqh3mvs,2023-11-12T03:36:03Z
"Inside Out 2 Main Character MUST Be Non-Binary or Bi, Says Media.",29wEWnQhLmE,2023-11-12T03:07:24Z
The Marvels Has the LOWEST Opening EVER for an MCU Movie!,zYQ-cNoBtnU,2023-11-12T00:44:39Z
Kotaku Might Be the Next Site to Get SHUT DOWN?,AJgLftIvFYU,2023-11-11T04:06:00Z
Captain America 4 Test Screening DISASTER! Delayed Because Audiences HATED IT?!,C6L3m-pVrwY,2023-11-10T23:35:59Z
The Marvels Only Made $6 MILLION for Thursday Night Previews?!,JCx22tTkKt4,2023-11-10T23:03:57Z
John Cena Movie CANCELLED as a Tax Write-Off?! RIP Coyote vs. Acme!,uRWBz6HapWs,2023-11-10T03:33:46Z
Disney is Going Turbo!,NFjrmksmqVY,2023-11-10T02:48:43Z
Jezebel SHUT DOWN! Is Kotaku Next?,p2IZxEYF4to,2023-11-10T01:50:34Z
The Hollywood Strike ENDS.,a7iuuSKUgHk,2023-11-09T15:23:13Z
Ghostbusters 2016 is Now DOUBLE DEAD.,PvbDE8DD3E4,2023-11-09T01:10:01Z
The Marvels is ROTTEN and Headed for DISASTER of a Box Office Opening!,cCJOqsBCx5Q,2023-11-08T20:09:07Z
Disney Isn’t “Fixing” Rachel Ziegler’s Snow White?!,zsd2vSHjIAM,2023-11-08T02:42:02Z
'The Marvels' Final Trailer Looks DESPERATE! Whatever It Takes to SAVE It?!,F7sBvljgjM4,2023-11-08T02:10:10Z
Hollywood Strike Negotiations BREAK DOWN Because of AI?!,MSYL_1brOnA,2023-11-07T21:49:28Z
R.I.P. Gaming Journalism: The Escapist IMPLODES?!,EVWUo-Lzr2E,2023-11-07T21:31:30Z
Disney's New CFO is a Pepsi Man.,DNkqRPNX-z4,2023-11-07T03:33:22Z
Disney is Full of Sh*t.,SFYnt06rVtU,2023-11-07T00:26:37Z
'Miles Morales is Miles Morales' Makes Gaming Journos BIG MAD.,GYA1FV6ICSg,2023-11-06T23:08:30Z
Disney Nerfs The Simpsons Again! Homer Can't Choke Bart Anymore?!,LFdID3Zf5dc,2023-11-06T20:18:20Z
MEN Use Wonder Woman Comics to Fight the Patriarchy?!,ZXBfsB7jKk0,2023-11-05T22:00:11Z
FNAF Movie Breaks $100 Million in Theaters WITH Streaming!,6NGTn11ZUUg,2023-11-05T21:00:02Z
'The Marvels' Ticket Presales WORSE Than The Flash and Black Adam?!,XOJNT9t41UY,2023-11-05T20:00:11Z
Hollywood Actors Get Their LAST and FINAL Offer?!,ke3o5Dg0mlw,2023-11-05T18:51:25Z
The Funko Bubble Pops.,pdswA1LoDgk,2023-11-05T02:24:45Z
The Doctor Who Retcon WON'T Be Undone.,DN7De5krSns,2023-11-05T01:55:45Z
'The Marvels' is for Cat Ladies and Wine Aunts.,PUhOWWsSRH0,2023-11-04T21:13:03Z
Ahsoka Ratings Were WORSE than Andor?!,0UTk3vi2lCw,2023-11-04T02:38:36Z
Hollywood's Below-the-Line Workers are FED UP With Actors Guild!,Bk9LExItGwk,2023-11-04T00:55:34Z
Wish Might Be Disney's Next Big FLOP?!,LAi38St7vJ0,2023-11-03T21:07:00Z
HBO Boss ADMITS They Used Fake Twitter Accounts to Silence Critics!,6BdWrrNU_dA,2023-11-03T03:44:02Z
Dear Diary: Hollywood is Having an 'Existential Crisis.',T7VqJ-YeqHM,2023-11-03T03:25:25Z
Disney's 'Blade' MCU Reboot Was Mostly About WOMEN?!,2giqF_TVlzU,2023-11-03T00:39:51Z
'Marvel is Truly F*CKED!' According to Hollywood Insiders...,ToImdWW3XXo,2023-11-02T02:44:29Z
'The Marvels' Box Office Outlook is WORSE Than Originally Thought!,Je2OYpWq54M,2023-11-01T23:41:47Z
Hollywood BUSTED in 4K! HBO Used FAKE Twitter Accounts to Silence Critics?!,-xwyPhM6TTM,2023-11-01T20:13:58Z
The Simpsons Predicts Elon Musk Will SELL Twitter/X for CHEAP?!,YlgY_Bl3-bQ,2023-10-31T23:35:51Z
Remote Work ENDING? Get Back to the Office or Get FIRED!,qt-QyAzM5n4,2023-10-31T22:25:54Z
"Kathleen Kennedy is Just a JOKE Now, Thanks to South Park.",CQrQ2Q3K9V0,2023-10-31T16:57:11Z
Hollywood Still 'Far Apart' from Ending the SAG-AFTRA Strike?!,CBNgpxz_tA8,2023-10-31T16:41:20Z
They're Changing Sesame Street FOREVER.,P3w4lO-iRMI,2023-10-31T02:51:22Z
Disney World Attendance DROPS OFF!,i4tAVUhEzRk,2023-10-31T00:17:05Z
Disney in DEEP SH*T! Nelson Peltz Now Has 33 MILLION Shares of DIS Stock?!,hh5r65t4Cvk,2023-10-30T17:51:40Z
Gina Carano SLAMS Kathleen Kennedy After South Park Panderverse Episode!,oHZPUcJcYO4,2023-10-30T00:26:53Z
Disney is in Trouble and THIS is Why! Media REFUSES to Admit It!,_pdqxzEhUzs,2023-10-29T20:33:02Z
SNL Slams Hollywood Actor Strike and Fran Drescher?!,hHIQ0ebBxQU,2023-10-29T19:14:29Z
FNAF Beats Super Mario Opening Day DESPITE Rotten Critical Score!,s6DTr63tMGk,2023-10-28T20:52:40Z
South Park: 'Both Sides' Claim the Panderverse?!,jY-2JAWxX1Y,2023-10-28T18:28:16Z
Disney CHANGES Snow White! Adds CGI Dwarfs and Delays Release Until 2025!,-EZ8G-VNAWA,2023-10-27T22:54:33Z
'Scalper' is an Racist Term Now?!,Xc9Y-Wks9jo,2023-10-27T15:36:59Z
Hollywood Actors Willing to Stay on Strike FOREVER?!,kDdCr5Tyrlo,2023-10-27T15:22:14Z
This Era of Animation is Officially OVER.,MlML4_hiogA,2023-10-26T21:51:40Z
FNAF is the Worst Movie of the Year?!,lerd1vzCrew,2023-10-26T21:13:11Z
Hollywood Could Be SHUT DOWN Until NEXT YEAR?!,Oz2H6VFk0pA,2023-10-26T19:13:27Z
Canadian Men CHARGED for Simply Talking on Train?!,Nb_ywRnhFKo,2023-10-26T03:16:08Z
"Teens DON'T Want Ships or Reboots, UCLA Study Says.",aynKyA9gapg,2023-10-26T03:03:38Z
"Good Luck With That, Wizards of the Coast...",-N4SWTULXnA,2023-10-26T00:09:18Z
It Just Got WORSE for The Marvels...,UpLeYxLQ_FI,2023-10-25T21:28:27Z
Netflix Nabs Former Pixar Boss and They're BIG MAD!,Uf9pefdUxcU,2023-10-25T03:21:16Z
Sick Daycare Workers TERRORIZED Kids and Are Going to JAIL!,K1MiK-qaWgc,2023-10-25T02:54:25Z
Voice Actors ANGRY They Can Only Play Same Race Characters Now...,sGVAkpg0cC4,2023-10-24T23:15:53Z
Hollywood is SICK of Fran Drescher...,hqfMhU7TaKI,2023-10-24T21:32:07Z
Jon Stewart CANCELED by Apple... Because of China?,8K7aanjjhd8,2023-10-24T03:23:23Z
Disney SABOTAGED Marvel and Star Wars?!,j4ni-cr-MgM,2023-10-24T01:10:44Z
Dungeons & Dragons is STILL Racist. Or Something.,N30J-VRDWXU,2023-10-23T01:22:58Z
Hollywood Will NEVER Be the Same After the Strikes End...,keu5H4mAbH4,2023-10-22T20:38:35Z
Hollywood's Silly Bullsh*t: SAG-AFTRA Gets SLAMMED by Former Union President!,r0kapHsWtF0,2023-10-22T02:05:38Z
Disney Hired ANOTHER Diversity and Inclusion Officer...,XgE67YgK9GQ,2023-10-21T22:23:10Z
Japan HATES Politically Correct Peach...,zy2Gf6oLeQ0,2023-10-21T20:02:22Z
Hollywood Actors TURNING on Each Other Over the Strikes?!,hh_dFzPXzdk,2023-10-20T19:43:39Z
Disney's $500 Ewok Plush Looks Dead Inside...,lwjqE0VnOJg,2023-10-20T19:00:53Z
They're BIG MAD About Hogwarts Legacy Again...,muiXRbDK7qI,2023-10-20T17:54:05Z
'Superhero Fatigue' Blamed for The Marvels' DISMAL Box Office Forecast?!,hEleW1yYbik,2023-10-20T03:00:09Z
Hollywood Union ROASTED by Actors for Halloween Costume Ban!,SXC7piLtBdI,2023-10-20T01:45:01Z
Netflix RAISES PRICES After Hollywood Strike Talks Break Down!,3k5jrWdEoyg,2023-10-19T22:25:21Z
Hollywood A-Listers Will PAY OFF the Union to End the Strike?!,UO-m5ro_XtA,2023-10-19T18:30:48Z
Hollywood is Eating Itself Over THAT Levy...,72zIkKZRkwg,2023-10-19T03:48:00Z
Shadowbinders Vol. 3 Campaign Launched... but NOT on Indiegogo!,OPpqPamNI4E,2023-10-19T02:54:42Z
Disney FREAKING OUT About The Marvels Box Office Predictions?!,s7WNwDNTZDk,2023-10-18T23:05:54Z
Disney Might RESKIN The Star Wars: Galactic Starcruiser Hotel?!,-utPl7sukXE,2023-10-18T20:21:47Z
A Psychic Told Millie Bobby Brown She Had to Be a Feminist?!,Bsa-Ub0Ol-A,2023-10-18T03:21:58Z
Pepper X is The World's Hottest Pepper and It Will DESTROY You!,DjXHf7YIWEk,2023-10-17T21:24:20Z
Disney Raises Prices at the WORST Possible Time...,viiCkLqN9ek,2023-10-17T20:25:00Z
End Stage Comic Book Industry.,NH92a6xePJE,2023-10-17T14:45:01Z
Hollywood Union Wants YOU to Pay Protection Money?!,6o6ig04xO5Y,2023-10-17T02:05:43Z
Willow Star SLAMS Disney! It's EMBARRASSING It Was Canceled!,VDAH-LQwpqc,2023-10-17T00:02:21Z
Nerd vs. Nerd: When Fandom is Ackchyually Toxic.,Lx70ZliFUp0,2023-10-15T20:13:41Z
4th Graders Watch Winnie the Pooh HORROR Movie in Florida Classroom?!,UmhdYDgCM6w,2023-10-15T03:12:00Z
RIP Nerd Culture.,Y-J1mySZ_2I,2023-10-15T02:37:26Z
Crunchyroll is Now FREE... for the Anime Curious.,xzwSydS8qFc,2023-10-15T00:07:15Z
The Marvels Will Be a MASSIVE Box Office Bomb! Less Than $200 Million?!,x7vvWadjymg,2023-10-14T20:54:39Z
"Hollywood Actor GREED Halted Talks, Claims Netflix Boss.",pVGQ39KAEG8,2023-10-13T20:21:58Z
R.I.P. to the L.A. Animation Scene...,aSb_IXbPAvY,2023-10-13T19:39:00Z
Ahsoka Was a Disney FLOP?! Watched 42% LESS Than The Mandalorian!,0VMeojtmrio,2023-10-13T17:35:42Z
Hollywood is STILL CLOSED! Union Talks BREAK DOWN!,auh9NruJJ0U,2023-10-12T22:04:06Z
Disney is NOT Special...,wR9nn3fbscM,2023-10-12T21:33:22Z
South Park DESTROYS Forced 'Diversity and Inclusion' Casting?!,a-ZMqHtJBGA,2023-10-12T18:20:02Z
DC Comics to Get SOLD OFF to Universal?!,sahk_M992fE,2023-10-12T17:52:55Z
WaPo Jobs SLASHED! Democracy Dies in Dumbness.,W1nRBGcIqTs,2023-10-12T00:05:02Z
Will Smith and Jada Have Been SEPARATED Since 2016?!,0r7wyGzw828,2023-10-11T23:32:41Z
Disney Bleeds Its Theme Park Customers Again...,zxaI691qVOs,2023-10-11T19:21:22Z
Daredevil: Born Again is SO BAD Disney is Starting Over!,5hEXEe1kkbQ,2023-10-11T18:43:04Z
Jason Momoa Tried to Flush Amber Heard from Aquaman 2?!,ykqYMiSDiuM,2023-10-11T15:41:32Z
Crunchyroll SOLD Your Private Data...,QOW8e88uOU4,2023-10-11T03:28:51Z
Bob Iger Can't Save Disney.,n4rzdvkJlNc,2023-10-11T00:35:30Z
Mary Jane is Ugly and Old.,hySI5lGWEIo,2023-10-10T22:07:41Z
DC Comics Almost Turned SuperBOY Into a SuperGIRL?!,6R276rAuLgw,2023-10-10T18:08:08Z
Rooster Teeth Just DELETED Its YouTube Content...,DjZEYK7cH6Q,2023-10-10T01:52:27Z
DreamWorks LAYOFFS! California Animation Industry OUTSOURCED?!,UDIsgfDnmpM,2023-10-09T22:18:17Z
Disney's WORST Nightmare! Nelson Peltz Returns After Disney FAILS!,QUV98yLYFhw,2023-10-09T18:53:21Z
Wizards of the Coast Burns Itself Alive...,G-wjvf52anY,2023-10-09T03:34:26Z
The Gollum Apology Letter Was FAKE AF...,OSHyN8bFpIw,2023-10-09T03:07:41Z
How Picard Ruined Picard.,ULR0atrDpsQ,2023-10-09T02:38:50Z
The California Animation Scene Got BAD NEWS...,lkkWWDmRXvU,2023-10-08T20:20:47Z
The Word 'Witch' Banned by Wizards of the Coast?!,2X3ZOxaZZt0,2023-10-07T23:07:08Z
You Can't Say 'Spooky' Anymore.,-XayMSzWqe4,2023-10-07T20:47:01Z
Patreon Should Just Delete Itself.,T5h4_HTj4So,2023-10-07T17:05:34Z
Disney is Trying to Make Ahsoka Happen.,xoyb7hQFUb0,2023-10-06T21:37:35Z
RIP Social Media.,mjizRHq_2SY,2023-10-06T17:43:05Z
Disney Changes Bambi Because It's TOO SAD.,9zAZyndG4Gc,2023-10-06T15:16:49Z
Hollywood Writers RAGE QUIT The Drew Barrymore Show?!,l_6j4eVuS_s,2023-10-06T01:33:33Z
They KNOW It's The End for Many Comic Book Pros...,cJQtkHn1MQ8,2023-10-05T21:32:41Z
Disney is in BIG TROUBLE! Will 'The Acolyte' Be Affected?,LoGiRELQrK4,2023-10-05T04:01:21Z
Bad News for Netflix and Disney Plus...,zUfm3Vg4khA,2023-10-05T02:03:21Z
Bungie DESTROYED Over 'Latinx' Tweet!,gWNyCvm71yM,2023-10-04T20:13:47Z
Netflix to RAISE Prices After Hollywood Strikes End?!,WwTTlq3FQBM,2023-10-04T03:21:34Z
Disney's Downfall.,R-GvIUtGE8g,2023-10-04T02:49:51Z
Emergency Alert System Starts THE PURGE IRL at 2:20 PM on October 4th?!,uM8iclyTegQ,2023-10-03T20:54:11Z
Barney Movie is About 'Millennial Angst' and Will Be 'Culturally Oriented'?!,W2lLs1ecOYI,2023-10-03T03:24:12Z
Dungeons & Dragons Just PURGED the AI Artwork from its Rule Books?!,XDd2V7uOtaQ,2023-10-03T02:44:47Z
Hollywood Highlander! WGA Writers Will Have to FIGHT for Work?!,VjBz2y1ah6I,2023-10-03T00:30:36Z
It Just Got WORSE for Hollywood Writers...,B0eEFV1d9jA,2023-10-01T17:20:42Z
Disney SUED Over a WEDGIE?! Woman's Vejayjay Injured in Disney Water Park!,rWAcOMTIVI4,2023-10-01T02:39:05Z
"Superman Would BEAT UP Captain Marvel, Says Dean Cain!",a0O8A8kSiYI,2023-10-01T02:05:38Z
Ahsoka Apathy.,p2NWSFaEJWw,2023-09-30T02:01:28Z
Epic FAIL! Fortnite Game Publisher Lays Off 16% of Employees?!,c8AyT1dBQRE,2023-09-29T04:02:58Z
Kevin Smith He-Man Returns. And Nobody Cares.,7LzzSqyYc80,2023-09-29T03:27:50Z
R.I.P. Power Rangers...,XBu8Q_s0lYk,2023-09-29T02:14:54Z
Most Hollywood Writers Will Be UNEMPLOYED After the Strike Ends...,kWriqjVw6gQ,2023-09-28T00:45:06Z
Comics Can't Be Saved.,Fxvo7GTj_44,2023-09-27T20:24:07Z
"A FAKE Disney Office Cost $100,000 for Bob Iger’s MasterClass?!",fyahehKHAFk,2023-09-27T18:38:35Z
Hollywood Writers Got What They Wanted... Or DID They?,_rbpvMEty00,2023-09-27T18:09:43Z
Disney FIRED Rachel Zegler Off of Snow White?!,475N7RNmAnU,2023-09-27T01:25:24Z
Disney ROASTED by Rival Theme Park! Galactic Starcruiser Failure MOCKED!,6_xJUVmXGww,2023-09-27T00:24:14Z
Video Game Industry Strike AUTHORIZED by SAG-AFTRA!,WO_HBsKNwV4,2023-09-26T18:25:56Z
Google Could END Video Game News Sites Forever...,VT5rtKVxn3Q,2023-09-26T18:02:32Z
The Office REBOOT Announced Immediately After WGA Strike Ends?!,6HljugdIGxg,2023-09-26T01:38:20Z
"McDonald's NEW Japanese Halloween Ad: Oh, NOW They're Lovin' It.",7R4KfBOmjkc,2023-09-25T16:59:18Z
Hollywood Writers Get a Saving Throw! WGA and AMPTP Tentative Agreement Reached?!,gt9vpuKzwzo,2023-09-25T16:46:58Z
They're FLEEING OnlyFans and Patreon!,Hr3ljG_xsEQ,2023-09-24T15:35:31Z
Hollywood Writers Given FINAL Offer?! Take it Or Leave It!,3oi-gBK-O_c,2023-09-24T02:26:02Z
The Mainstream Comic Book Industry Keeps Losing MILLIONS!,sW5iLEs6I3w,2023-09-23T20:04:53Z
Disney CAN'T Cancel Snow White?! They'd LOSE Millions!,zrdey66SGBY,2023-09-23T18:27:43Z
Right Stuf Anime SHUTS DOWN?!,baty06iDeck,2023-09-23T03:05:09Z
McDonald's Japanese Ad Makes People FURIOUS?!,PcJ6r3OeLn0,2023-09-23T00:11:37Z
Disney Layoffs in China Because of Disney Plus SECURITY Concerns?!,ks-xPIJgKH0,2023-09-22T18:39:17Z
Celebrities AFRAID of Getting Cancelled by WGA Over Hollywood Strikes!,EfxsvteXv8Q,2023-09-22T03:21:15Z
Disney Wants to 'Quiet the Noise' in the Culture War?!,oc_xvsvCkGw,2023-09-22T00:20:03Z
Marvel's Avengers Game Publisher GUTTED by Embracer Group Layoffs!,S-vmD_Wr05U,2023-09-21T17:17:24Z
Disney Has NO Plan. Disney Shareholders Agree.,seWYHapy3WA,2023-09-21T02:40:10Z
The Marvels Cost Disney TWICE as Much as Reported?!,hEnky5sU5jM,2023-09-20T22:56:59Z
Achievement Hunter ENDS.,hToE46Lv9ew,2023-09-20T16:00:41Z
Aquaman 2 Test Screening DISASTER! Audiences WALKED OUT Over Baby Death?!,qNVbUd31o6E,2023-09-20T02:45:02Z
Bill Maher CAVES to Hollywood Writers?! Real Time is PAUSED!,_pmOxFHD12E,2023-09-19T22:55:07Z
Disney Dumping $60 BILLION into Theme Parks?! Stock PLUMMETS!,hk8fCC3ZfDE,2023-09-19T17:17:55Z
Disney World SHUTS DOWN Because of a BEAR?!,c9BdYoaUzw0,2023-09-19T15:37:22Z
The View Marked SAFE from Angry Hollywood Writers.,GeTlZtHXgYE,2023-09-18T22:27:49Z
Marvel's Avengers Game Delisted FOREVER! Final Fantasy 16 Blamed?!,WzH4FNsYVIQ,2023-09-18T20:41:31Z
