Title,Video ID,Published At
The Little Mermaid Trailer DAMAGE CONTROL! Disney in PR Panic Mode?!,1NTuhUCQd9I,2023-03-18T18:26:24Z
Media Worried a TikTok Ban Would Turn Young Voters Against Biden.,flVaG9wGv5Q,2023-03-17T18:55:31Z
SVB Files for Chapter 11! REMOTE WORK Blamed for Silicon Valley Bank Failure?!,eJm9IMw5WRA,2023-03-17T18:26:19Z
Disney DESTROYED Marvel and Star Wars. EVERYBODY Sees It Now.,GeLmd7RquQM,2023-03-17T17:39:12Z
BuzzFeed Journos Told to Write More CLICKBAIT to Save Their Jobs?!,9p2b2nN20sY,2023-03-16T23:50:08Z
Time's Up for TikTok?,wzN_MjmDFN4,2023-03-16T19:49:38Z
Willow CANCELED After One Season! Shippers Most Affected?!,vh1RR9_aM1Q,2023-03-16T17:35:25Z
Silicon Valley Bank Collapses. Wokeness Blamed.,6LSnuI-dhLY,2023-03-16T00:00:01Z
Disney Has NO PLAN for its Theme Parks.,MGX0zF28wO4,2023-03-15T23:12:41Z
Sensitivity Readers RUINED Dungeons & Dragons and Children's Books.,tQD5qfCeNH4,2023-03-15T19:33:42Z
BuzzFeed Bubble BURSTS! Silicon Valley Bank Had ALL Their Cash?!,sPAr9ghYM_Q,2023-03-15T01:02:50Z
Manga Creators OVERWORKED? My Hero Academia Creator Takes ANOTHER Break!,upyniFLZU44,2023-03-14T23:30:55Z
"Facebook Axes 10,000 More Employees as Silicon Valley CRASH Continues!",zf-LMxfkMc8,2023-03-14T21:26:42Z
Disney Goes NUCLEAR on Reddit and Google Over Ant-Man 3 Script Leaks?!,oZdlaDAfoA0,2023-03-14T02:51:02Z
WotC Buys Off DnD Influencers?! Dungeons & Dragons Summit SPLITS the TTRPG Community!,2-Y9Cj199dU,2023-03-13T23:28:17Z
Hogwarts Legacy is SAFE Now?! Never Forget the Drama!,rDH20DemWbA,2023-03-13T21:30:35Z
Now it's OK to Dunk on The Little Mermaid Trailer?,WHMliR6MEx0,2023-03-13T17:40:00Z
More Magic the Gathering Cards DUMPED at a Recycling Center! WTF WotC?,NFrh2HzyXIs,2023-03-13T03:05:00Z
"The Next VELMA? Flintstones Gets an ADULT Reboot, Too!",bHKwGWVNzSY,2023-03-13T01:16:37Z
Marvel FACES Failure? Ant-Man 3 is a MASSIVE Flop for Disney!,PuRAi-nN3WE,2023-03-12T20:47:03Z
Silicon Valley Bank COLLAPSES! Digital Media is DOOMED?!,vY_8EWP268E,2023-03-11T22:07:20Z
Disney CEO Says Disney is Too Expensive.,6M4Wi_aV2XQ,2023-03-11T17:08:42Z
Captain Marvel 2 is a SH*TSHOW! Brie Larson is FURIOUS About The Marvels?!,hytS1hr_pH8,2023-03-11T02:59:37Z
The Media Wants Twitter GONE.,lTsRiCYlFmQ,2023-03-10T19:24:24Z
J.K. Rowling Won. Deal With It.,JY1ekG3hpUM,2023-03-10T17:53:11Z
Lord of the Rings Leads to the Far Right?!,bgSJFzUKPjk,2023-03-10T14:53:34Z
Disney Could Lose MORE to Florida! Bay Lake and Lake Buena Vista DISSOLVED?!,VqFLKeDu6Ao,2023-03-10T02:35:09Z
Masters of the Universe is in TROUBLE? Teela RECAST! Toys CANCELLED?,1fSdeU1NeZs,2023-03-09T21:30:53Z
Star Wars LAWSUIT Over The Acolyte?! Another BLACK EYE for Disney and Lucasfilm!,Z4AYF88OKew,2023-03-09T20:52:09Z
Facebook is Burning.,dAe1ThViEJo,2023-03-09T00:20:50Z
Disney Cancels Star Wars.,7XcdWn6NRJo,2023-03-08T22:18:54Z
Elon Musk DRAGS Twitter Employee Publicly. Later Apologizes.,zPJzVoKmbPU,2023-03-08T17:54:21Z
Disney in PANIC Mode? Imagineering RESTRUCTURED! Reedy Creek DAMAGE CONTROL!,saZ5-vptVVI,2023-03-07T22:20:09Z
Disney's Star Wars Hotel CUTS BACK on Voyages?! Galactic Starcruiser Bookings in Trouble!,9PDSM0PCp7U,2023-03-07T20:58:16Z
Harry Potter Still Kids' FAVORITE Book Series! J.K. Rowling is NOT Cancelled!,eOgeCh0z6V4,2023-03-07T19:57:14Z
Goosebumps Author DIDN'T KNOW About Changes?! Is Goosebumps Getting Censored or Not?,d484_8I3Qno,2023-03-07T19:42:55Z
Gamers Called SPINELESS by Game Journos for Playing Hogwarts Legacy!,ALKRGBr9R5w,2023-03-07T04:53:43Z
Goosebumps Gets NERFED! Books Changed for SENSITIVITY?!,_m2FJADeqqw,2023-03-07T03:23:37Z
EVERYBODY Hates Disney's Peter Pan & Wendy Trailer.,zKRaeb1yZuA,2023-03-07T01:07:41Z
The WORST Disney Trips Ever?!,HbFufOm-uew,2023-03-05T21:03:35Z
Magic the Gathering is TRASH! $250K Worth of New MTG Cards Found in a LANDFILL?!,j3BThHRYZ0U,2023-03-05T03:48:06Z
VTubers FIGHT BACK Against Hogwarts Legacy Bullies! Pippa is a Wizard!,C9gN6FfJfUM,2023-03-04T17:52:33Z
"Anti Hogwarts Legacy Activists CANCEL Luna Lovegood, Pikamee and Binging with Babish!",Hp2JPoJvH2I,2023-03-03T22:45:34Z
Don't Say DeSantis? Florida Bloggers Could Get FINED for Writing About Politicians?!,1GH_n5PVcJs,2023-03-03T20:27:03Z
"Dungeons & Dragons Movie Will EMASCULATE the Male Lead, Director Says.",zg-VJJDL99Q,2023-03-03T20:09:12Z
They Want to MOVE Disney World Because of DeSantis?!,3fYEFyvidoE,2023-03-03T01:49:02Z
Funko Pop Bubble POPS? Funko CAN'T SELL Inventory! Layoffs Announced!,5Ne0X0MJ5YY,2023-03-02T21:57:28Z
TikTok Ban is One Step Closer to Happening in the US?!,Ux0mM0IL0No,2023-03-02T03:22:25Z
VTuber Pikamee QUITS! Hogwarts Legacy BULLYING Blamed!,eyTYV4zhYd0,2023-03-02T00:51:49Z
Video Game Journalists are Obsolete.,AQi6vTmDBoY,2023-03-01T17:40:20Z
He WON'T Apologize for Family Guy! Patrick Warburton ISN'T Sorry for Joe Swanson!,Yrr9Phc7bXQ,2023-03-01T03:16:26Z
Disney is TERRIFIED The Marvels Will Bomb! Test Screenings Were ABYSMAL?!,pQMnH7vr46M,2023-02-28T21:24:26Z
Sebastian from Disney's Live-Action The Little Mermaid Looks REALLY BAD.,7aI2BQnWgAY,2023-02-28T03:12:38Z
Dungeons & Dragons Boss: Dark Sun is TOO PROBLEMATIC for Today's Tabletop Gamers!,x_zaF7DzPR0,2023-02-27T23:27:18Z
Disney Fooled Around and Found Out in Florida.,HUePBTq53Cc,2023-02-27T19:32:05Z
South Park Lawsuit is ON... but it's NOT Harry & Meghan.,nE5BsoMRPRc,2023-02-27T03:42:51Z
Hogwarts Legacy Made $850 MILLION in Two Weeks! 12 Million Copies Already Sold?!,YlzrMgdiLwI,2023-02-27T03:12:12Z
Woody Harrelson and SNL BLASTED by the Media for Calling Out Big Pharma on SNL!,4tfC1r9vfxQ,2023-02-26T23:45:17Z
Ant-Man 3 Has BIGGEST Drop in MCU History. Cocaine Bear Blamed.,s5t80Qpe9Ls,2023-02-26T20:58:57Z
Ben Stiller REFUSES to Apologize for Tropic Thunder!,UQriSMNi7Ys,2023-02-25T18:41:29Z
Roald Dahl Censorship WALKED BACK! New Grinch Sequel Book Announced?!,VD3QFXmDjMY,2023-02-24T23:49:41Z
"NEW Lord of the Rings Movies Announced: Somehow, Sauron Returned?!",IT02FYLsQlQ,2023-02-24T22:29:06Z
Spider-Man Says MJ is Like a SISTER Now?! Peter Parker FRIEND ZONES Mary Jane!,xPzph-tRJ_0,2023-02-24T20:19:41Z
"Silvervale TELLS OFF Hogwarts Legacy Bullies! Activists Attack Babish, Too?!",ECJ3yoR1NiE,2023-02-24T19:03:35Z
Disney's Star Wars Hotel is Now HALF PRICE?! Is The Galactic Starcruiser Failing?!,spLijewuSyw,2023-02-23T20:34:56Z
"Buying Hogwarts Legacy is UNFORGIVABLE, Says Gaming Journos.",jkDjtxs4wFA,2023-02-23T19:54:31Z
Warner Bros. is a DUMPSTER FIRE Right Now!,u-U22us_Xqc,2023-02-23T18:37:00Z
Crunchyroll LAYOFFS! Posh San Francisco Anime Offices Most Affected?!,SlPBFKHZPWg,2023-02-22T20:32:55Z
Atomic Heart Must Be BANNED?! It's Hogwarts Legacy 2.0!,gzNOLzKcNLo,2023-02-22T20:11:04Z
Lightyear FLOPPED and Pixar Boss Blames the AUDIENCE for Not 'Getting It?',F4mSRKkz1TQ,2023-02-22T19:01:10Z
Ant-Man 3 FLOPS in China! Media WORRIED About MCU Phase 5?!,UhtWVL7Fo6I,2023-02-22T03:59:06Z
BBC Forced to APOLOGIZE to J.K. Rowling for the SECOND Time in One Month?!,6BM33P3D3GY,2023-02-22T00:53:29Z
Disney Hiring CHEAP TikTok Influencers to Help Boost Theme Park Attendance?!,w5RrI7geXGU,2023-02-21T21:20:29Z
Willy Wonka Gets CENSORED! Roald Dahl Books CHANGED by Sensitivy Readers!,Jpdnu6SpRB0,2023-02-20T21:58:50Z
South Park SAVAGES Meghan Markle and Prince Harry! They're Going to SUE?!,Xgc9EeRbNE0,2023-02-20T20:35:00Z
Hogwarts Legacy PURCHASE SIMULATOR Game Tries to TALK YOU OUT of Buying Hogwarts Legacy?!,GXOKdimGh5g,2023-02-20T16:42:57Z
Hogwarts Legacy and FNAF are BANNED from Video Game Charity Events!,pY85MEq8QYg,2023-02-20T04:24:14Z
Saints Row Reboot LOST $100 MILLION?! Embracer May END the Series!,wz0GJQV_Ffc,2023-02-20T02:30:53Z
Disney Employees REFUSE to Return to Office After Working at Home for Two Years!,drPefPccRgI,2023-02-19T20:56:52Z
Silvervale BREAKS DOWN Over Hogwarts Legacy Harassment on Twitch! This is NOT Okay!,IzgXSlF2_1w,2023-02-19T03:15:49Z
Captain Marvel 2 in TROUBLE?! Disney Delays The Marvels AGAIN!,vExc21-5qOI,2023-02-18T20:19:43Z
"Hogwarts Legacy Haters Will Boycott Super Nintendo World Too, Right?",kd5719yGqro,2023-02-18T03:54:33Z
Comic Book Journos Finally AGREE With YouTubers?! The Comics Industry is BROKEN!,7LIhFMVCQhA,2023-02-18T03:22:07Z
J.K. Rowling DEFENDED by The New York Times and Their Activist Journos are FURIOUS!,crB3cKLt_WU,2023-02-17T22:27:26Z
Ant-Man 3 is ROTTEN! Quantumania is BORING AF According to Rotten Tomatoes Critics!,blrI2iccHl0,2023-02-17T18:37:17Z
Dungeons & Dragons & DISASTER! Hasbro LOST $129 Million! Addresses DnD OGL 1.1 Debacle!,YhQVxpU9HzU,2023-02-17T01:03:29Z
"Marvel Phase 4 FAILED! Disney to PULL BACK on MCU Content for Phase 5, Says Kevin Feige!",kSUr-nVifwo,2023-02-16T21:57:13Z
YouTube CEO Steps Down! Will YouTube Censorship Get WORSE?!,zNkMfNRYNW8,2023-02-16T19:22:48Z
Disney CEO ADMITS They Bet Heavy on Disney+ and Got BURNT?!,cA97b5AmTNw,2023-02-16T03:59:17Z
J.K. Rowling Threatens to SUE Twitter Activists Who LIE About Her!,xu2b35DwsT8,2023-02-16T02:09:14Z
Universal DOES What Disney Don't! RAISES Employee Pay as Disney FIGHTS Unions!,72TO8TiwMQI,2023-02-15T19:44:41Z
Disney CANCELS Scrooge McDuck?! Don Rosa Comics are Now BANNED!,9SSlbgm3xk4,2023-02-15T19:00:51Z
Velma LIVES... While The Hex Girls Got CANCELED?,b6ij0xuyWrI,2023-02-14T21:00:14Z
Disney DELAYS 'Carl's Date' Short? They WON'T Ruin 'Up' for Valentine's Day?,ewvEzGAeVrA,2023-02-14T18:57:43Z
"Disney SLAMMED for $7 Million Super Bowl Ad After Laying Off 7,000 Workers!",XAkIeOCkzdE,2023-02-14T18:21:51Z
Hogwarts Legacy Outsold Elden Ring in its First Week?! The Boycott Did NOTHING!,2AjrNW2xLhE,2023-02-13T22:22:11Z
Comic Book Industry DAMAGE Control! Another Crash CAN’T Happen?!,UWdeb7bW7Is,2023-02-13T20:51:41Z
Velma RUINS The Mystery Machine! Media Uses 11-Year-Old Fan to Defend the Show?!,ZxIkS-pzNfY,2023-02-12T20:18:12Z
Hogwarts Legacy 1/10 Review DEFENDED by WIRED Editor-in-Chief?!,6cmWF9qC5D8,2023-02-11T19:28:16Z
Disney LOST Reedy Creek to the State of Florida! DeSantis DEFEATED Disney?!,vHiOkRiW8Es,2023-02-11T18:44:55Z
Video Game and Comic Book Reviewers MUST LIE to Keep ACCESS and FREEBIES?,FKRUYOtGMV8,2023-02-10T23:10:18Z
"Disney is DESPERATE and Might SELL Hulu, According to Disney CEO Bob Iger!",eWPmhhLWVeo,2023-02-10T20:16:24Z
Hogwarts Legacy REVIEW BOMBED by Activist Game Journos! Wired Gave it a 1/10?!,0Z1cEcIeFeA,2023-02-10T16:10:55Z
Dungeons & Dragons DAMAGE CONTROL Inflicts MORE Damage to WotC!,W5MyOdKI4oE,2023-02-10T03:46:33Z
Disney REHIRES Tim Allen as Buzz Lightyear! Toy Story 5 Announced?!,qzzfHZT46FA,2023-02-09T19:47:27Z
"Disney CHOPS 7,000 Jobs! Nelson Peltz BACKS OFF After Disney Q1 Earnings Call?!",3NoPeJM7kFo,2023-02-09T18:29:28Z
The Simpsons BANNED in China?!,mP_EPtL7PqQ,2023-02-08T22:44:44Z
Hogwarts Legacy BREAKS Twitch Records! Elected Officials Want Streamer BLACKLISTS?!,dE5olzPlnGs,2023-02-08T20:04:04Z
The Comic Book Industry CAN'T Lie Anymore! Manga is DESTROYING Marvel and DC Sales!,4AJIq2e50rc,2023-02-08T19:03:00Z
Rick & Morty Staff DOGPILE Justin Roiland! Is His Career OVER?,X3vyXlv7uEM,2023-02-08T01:52:16Z
"Dungeons & Dragons FAILS Again! WotC Exec Says White Men ""Can't Leave Soon Enough!""",H42EYmHCmwU,2023-02-07T21:01:37Z
Hogwarts Legacy WITCH HUNT! Activists STALK and HARASS Streamers and VTubers?!,-lCNgH_Audg,2023-02-07T18:20:00Z
Disney vs. DeSantis ESCALATES! Reedy Creek Could Be SEIZED by the State of Florida?!,UWgTF0nMr2I,2023-02-07T15:14:14Z
Desperate AMC Theatres to Charge More for GOOD Seats?!,uh6oo7_tyXY,2023-02-07T02:31:09Z
AI Seinfeld Animated Series BANNED by Twitch for Being Transphobic?!,mWcGJIrHJac,2023-02-07T00:18:15Z
Hogwarts Legacy Players Being HUNTED DOWN by Activists and Game Journos?!,qmf71QXOQa4,2023-02-06T20:21:55Z
Hogwarts Legacy Reviews: Game Journos LOVE IT and They HATE Themselves For It!,RiCo-M8GnRU,2023-02-06T17:29:28Z
BuzzFeed REPLACES Its Writers with an A.I. Chatbot.,6Sy4ilQmF2I,2023-02-06T02:51:23Z
Twitter Will PAY YOU for Mean Tweets?!,Htv3CDlwPT4,2023-02-05T18:41:22Z
Failing CNN Brings in BILL MAHER?! Twitter and the Media Has a MELTDOWN!,6NQqf2M87aM,2023-02-05T17:50:07Z
Disney Rant: Disneyland SLASHES Prices While Disney World Keeps Gouging!,7zZOD7tgfpM,2023-02-05T04:21:15Z
Disney So DESPERATE Its SELLING OFF Content to Competitors?!,lyX0Bntaj3g,2023-02-04T22:56:09Z
Tech Sector's 'Adult Daycares' are ENDING.,NcbzmO_U0sc,2023-02-04T18:09:31Z
Dungeons & Dragons is DAMAGED! Players Still Don't Trust WOTC After OGL Backlash!,XL_FcBqpx14,2023-02-04T02:18:26Z
Too FAT for Nintendo?! Universal Accused of FAT SHAMING Theme Park Guests!,6p_K04Z9ae8,2023-02-03T22:24:55Z
Wookiepedia Pushes PRONOUNS and Star Wars Fans STRIKE BACK!,W5jK6fO8uTg,2023-02-03T21:39:41Z
This Netflix Anime Was Made with A.I. Art and Real Artists are FURIOUS!,GpPA9I79l0k,2023-02-03T03:48:25Z
Disney Board in a FIGHT for Its Life?!,c8yiQh3iJJI,2023-02-03T02:17:14Z
Halo is RUINED! TV Series Boss OUSTED from 343 Industries?!,M4YvACaPeAc,2023-02-02T22:08:39Z
Peacock ENDS the Free Tier! Paramount Plus MERGES with Showtime!,O0G6ney_x04,2023-02-02T03:36:32Z
Velma is HARMFUL?! Mindy Kaling BLASTED Over Sickle Cell Joke!,0dXiwphZsQk,2023-02-02T03:12:34Z
Doctor Who Showrunner SLAMS 'Diverse' Writers?!,kvj8qt_gh20,2023-02-01T22:32:48Z
Gawker Shuts Down AGAIN! PayPal Lays Off 7% of Staff?!,OWDWZqbofas,2023-02-01T21:49:50Z
Disney's WORST Mistake Might've Been Buying Fox?!,jKlidJzfmhc,2023-02-01T00:49:04Z
Gunn's DCU is DOA? Ezra Miller STAYS?! Henry Cavill NEVER Considered!,IsA0dMOmny8,2023-01-31T19:18:06Z
Hogwarts Legacy Players ATTACKED?! J.K. Rowling Says Eff Your Feelings!,XasIku3wfXo,2023-01-30T20:57:21Z
"Velma BLAME GAME?! Warner Execs LOVED What They Did, Says Mindy Kaling!",mkSEWWSC7vg,2023-01-30T20:13:38Z
Disney RUINS Up?! Carl Starts DATING in Valentine's Day Disney Plus Short?!,3Ni-0hPUKs0,2023-01-30T17:54:35Z
Disney Lets Rich Guests BULLY Their Cast Members?,hvxxkqlVpw8,2023-01-29T20:53:52Z
SHAZAM! Zachary Levi CANCELED for Tweets Criticizing Pfizer?!,xmYmAorsu9Q,2023-01-29T18:36:31Z
CNN is DYING! CNN's Ratings Plummet to NINE YEAR Low!,NJfF_oB3fZM,2023-01-29T03:06:57Z
Dungeons & Dragons OGL Victory?! WotC WALKS BACK OGL 1.0a Changes After Backlash!,BQknqZlqqOc,2023-01-28T22:26:03Z
Tomb Raider RAIDED by Amazon and Fleabag! Phoebe Waller-Bridge is in Charge?!,1CKD6iD4cDQ,2023-01-28T19:16:10Z
Cowboy Bebop Creator HATED Netflix Live-Action Adaptation!,0TgLquKhfKE,2023-01-28T00:55:04Z
Hasbro TERMINATES 15% of Employees After Dungeons & Dragons OGL Backlash!,lH7vlB4M-3s,2023-01-27T22:27:28Z
Disney LAYOFFS Loom as Disney DOUBLES DOWN on Luxury During a Recession!,5GdUQiyopio,2023-01-27T21:47:39Z
Rooster Teeth is OVER? RWBY Moves to Crunchyroll for Volume 9!,X-R4Ffw8k4s,2023-01-27T17:21:37Z
Hogwarts Legacy is BANNED But is Still #1! J.K. Rowling DISCLAIMER in Every Review?!,IHjDCM_Jry4,2023-01-26T19:03:36Z
Velma is a HUGE HIT Despite Being the WORST RATED Animated Series EVER!,JVJPR4l1vis,2023-01-26T17:48:55Z
"Google ENDS Free Massages for Employees... and FIRES 12,000 of Them!",Du5XL_Mgvcg,2023-01-25T19:53:23Z
Justin Roiland FIRED from Solar Opposites After Losing Rick and Morty!,TlGqZC3iYuY,2023-01-25T19:24:12Z
Gaming Journalists FIRED in Droves and the WORST is Yet to Come!,lAH_m3cjICs,2023-01-25T17:25:24Z
Love Disney's Splash Mountain? You're a BAD Person!,cb0UdFHal9w,2023-01-25T03:57:25Z
Justin Roiland FIRED from Rick and Morty After Abuse Allegations!,-UELX9d-GXw,2023-01-24T22:52:30Z
The Media is DONE with Disney?! TURNS on Marvel and Star Wars!,-mE3YeSmq8I,2023-01-24T17:46:39Z
Limited Run Games UPDATE! Fired LRG Community Manager Speaks Out!,Rdr1lLpT6Kg,2023-01-23T22:19:42Z
Velma ROASTED by Daphne Blake VA?! Grey DeLisle DUNKS on Velma Disaster!,SoGlNyRNSlQ,2023-01-23T20:35:34Z
Vox Media is Going BROKE.,68SLPy-jMjI,2023-01-23T18:27:15Z
M&Ms Drops the 'Woke' Cartoon Candies After MASSIVE Backlash?!,NgxIS23o754,2023-01-23T18:12:19Z
Fish Plays Pokémon and Buys Nintendo Store DLC?! Not a Joke!,wrF88olHqL4,2023-01-23T04:35:52Z
Marvel Fatigue DENIED! Kevin Feige DEFENDS MCU Phase 4?!,nBjcohBaCrQ,2023-01-23T03:42:19Z
"Velma CROSSED the Line, Says Media! It's the WORST Cartoon Ever?!",BOz_01Tk3KU,2023-01-22T22:14:09Z
Disney Tells MCU Actors to SHUT UP About China to Save Chinese Box Office?!,b-coUFo0RMM,2023-01-21T21:42:08Z
Comic Book Industry Eulogizes Itself as ComiXology is Effectively DEAD.,KqniR_c8Qdg,2023-01-21T17:18:09Z
Disney CANCELS Star Wars Galactic Starcruiser Voyages?!,Vfq7DExnKSo,2023-01-21T04:19:24Z
Poly GONE: Polygon LAYOFFS Hit as Video Game News Sites IMPLODE!,qNmN1aRWqAU,2023-01-20T21:58:05Z
Velma Was REVIEW BOMBED?! Mindy Kaling's Past is PROBLEMATIC and She's Getting Cancelled?!,uBhIRuP-eeI,2023-01-20T21:30:06Z
Xbox Boss Wants to END Cancel Culture and Politics in the Video Game Industry?!,jioNCtgE1l4,2023-01-20T04:35:53Z
"Video Game Journalism IMPLODES! Layoffs Hit GameSpot, Giant Bomb and More!",Y3Avpavb270,2023-01-20T00:17:24Z
Frosk RAGE QUITS the Video Game Industry! Blames G4 TV Co-Workers?!,OTMIDmAcUTk,2023-01-19T21:52:31Z
Dungeons & Dragons Players BOYCOTT DnD Movie Over OGL 1.1 Backlash?!,jdUWoFSsfvw,2023-01-19T21:19:26Z
Disney Discounts FAILING Star Wars Galactic Starcruiser Hotel. Sort Of.,b3Ckvjg4cGg,2023-01-19T17:21:45Z
A.I. Art Generators Get SUED by Comics Artists?!,CaaoOwuhJ18,2023-01-19T04:06:46Z
"Microsoft Lays Off 10,000 including 343 Industries and Bethesda Employees!",EESSX5SAGzA,2023-01-19T00:58:15Z
"Twitter WANTS You to Be Angry, Confirmed! Elon Musk Sells Off Twitter Office Furniture!",GLCDDt2DvnQ,2023-01-18T23:18:40Z
Dungeons & Dragons is DONE! WotC Apologizes for OGL 1.1 as Players and Publishers MOVE ON!,bkgYWo3Z2Ho,2023-01-18T20:05:31Z
Disney Board Battle is REVENGE by Ousted Marvel Boss Ike Perlmutter?!,XL2z0iwJ0nY,2023-01-18T01:58:16Z
Velma is a Right Wing TROLL?! Scooby-Doo is NOT a Black Woman After All?,GM2kY_EPOrs,2023-01-17T20:36:03Z
A Hogwarts Legacy Boycott Does NOTHING... But Sell MORE Copies!,H-OnyaFIDoY,2023-01-17T18:55:08Z
They WON'T Quit Twitter! Mastodon Users Already FLEEING!,wtGqWyCRc_o,2023-01-17T05:01:06Z
Velma Gets WORSE? Scooby-Doo is a Black Woman Now?!,rZcLg8_YDHM,2023-01-17T00:46:07Z
Marvel VFX Artists DONE with Disney! MCU Might Need to Deal With a UNION Now?!,C-ckZAtiN-s,2023-01-16T21:31:23Z
Hogwarts Legacy VA Attacked on Twitter! Heartstopper Star Gets CANCELLED!,5sOmGCcUtuc,2023-01-16T03:58:50Z
Velma Hated by EVERYONE! Mindy Kaling CANCELLED by Her Target Audience?!,2EeeR88nwT0,2023-01-16T00:22:33Z
NBC News Hires Johnny Depp's Lawyer... After Their Reporters ATTACKED Depp YouTubers!,ZEkF3mFomAU,2023-01-15T19:44:57Z
Gaming Journalists for Sale DIRT CHEAP?! More Trash Websites Up for Sale in 2023!,SUxF3pL5efI,2023-01-14T23:27:29Z
Rick and Morty Co-Creator Justin Roiland is in BIG Trouble!,lzxir1bi0ac,2023-01-14T22:05:31Z
Critical Role Fans CRITICAL of Their Dungeons & Dragons OGL 1.1 Statement?!,xlj9MKuD3RE,2023-01-14T20:57:06Z
A Dead End for Tumblr Animation?,FDVcXHbErTI,2023-01-14T17:15:41Z
Adam Sessler Dishes on G4TV Shutdown... and DUNKS on Gaming Journalists?!,qOBT_c4l81s,2023-01-13T20:27:00Z
DnD Begone! WotC Walks Back OGL 1.1 as Dungeons & Dragons Players REVOLT!,RbYHMnaoG5Y,2023-01-13T18:07:19Z
Ezra Miller Gets Off! The Flash Actor is NOT Going to Jail!,ZBjU9TDuEz8,2023-01-12T21:33:57Z
Velma Trailer DOWNVOTED to Oblivion and DESTROYED on Rotten Tomatoes!,Mz8KLs4XnhU,2023-01-12T20:27:44Z
Disney's Lunch Gets EATEN by Universal and Nintendo! More Theme Parks Announced!,DLxZvUTs_k8,2023-01-12T17:34:07Z
Disney Boardroom BLOWOUT! Disney in a Proxy Fight Over Company's Future?!,0o4El3IfJsI,2023-01-12T02:59:34Z
Dungeons & Dragons BURNS DOWN as WotC Goes into Radio Silence on OGL 1.1!,KIt0R4w3Taw,2023-01-11T21:55:00Z
Velma Sounds AWFUL! Netflix CANCELS Animation AFTER It’s Greenlit?!,feb1plzUQxs,2023-01-11T17:42:26Z
Dungeons & Dragons OGL 1.1 Could Let WotC RAID Fan Content for IP?!,T8t1njN_nPA,2023-01-11T04:25:31Z
Limited Run Games Bet on the Wrong Pony.,rpGFxDawlR8,2023-01-11T01:48:38Z
Hogwarts Legacy Boycott BACKFIRES! Pre-Orders TOP Steam Sales Chart!,uTqo6OJG7vY,2023-01-10T23:45:09Z
Disney CEO: Get Back to Work in Office or ELSE!,xiq6RmDmFm4,2023-01-10T05:02:57Z
G4TV's Adam Sessler HATES Gamers?! Has ANOTHER Twitter Meltdown!,mwe-Hnp0Q3Y,2023-01-10T03:40:56Z
One D&D OGL 1.1 is Online! Dungeons & Dragons Fandom BETRAYED by WotC!,in-HB8LVue0,2023-01-09T22:02:39Z
G4 TV Got More Views Than Kotaku Does.,6c6LX6Ebdys,2023-01-09T01:03:06Z
Limited Run Games DESTROYED by BronyCon Founder?! LRG FIRED an Employee Over a 2016 Tweet!,172fJew0Ft4,2023-01-08T20:36:06Z
Animation Cancelled. Sexism Blamed.,XWdVUuFtbew,2023-01-08T05:54:21Z
Liking Hogwarts Legacy Got Her FIRED?! Kotaku DEFAMES Hogwarts Legacy Lead Developer?!,93TdV6BZmjU,2023-01-08T04:03:37Z
Disney's FAILING Star Wars Galactic Starcruiser Could CHANGE? Something's Up!,-z6Ma1cbomM,2023-01-07T05:23:08Z
They're DONE with DnD! WotC Infuriates Dungeons & Dragons Players with New OGL!,NG5Lqnl8lrE,2023-01-07T04:39:01Z
Hogwarts Legacy Pre-Orders SKYROCKET and Twitter is FURIOUS!,I_uFM5Is59o,2023-01-07T01:55:45Z
Game Journos TRIGGERED by MAGFest Convention Sign Dunking on Kotaku!,JYRii7Bwims,2023-01-06T04:26:13Z
Ezra Miller STAYS in the DCEU After The Flash?! Cavill and The Rock are OUT!,M7DvudvVko4,2023-01-06T01:38:14Z
Hasbro NUKES Dungeons & Dragons Fan Content from Orbit! WotC Yanks the OGL?!,mraO-veKWaQ,2023-01-05T18:29:39Z
Disney is in WORSE Shape Than Most People Realize!,5FzHWacvcQY,2023-01-04T22:07:49Z
The Joker is PREGNANT?! DC Comics is Beyond Parody!,Bz8t8TGsPDQ,2023-01-04T20:08:33Z
Dungeons & Dragons Creator and OSR Fans ATTACKED by PBS News Hour?!,Yv2UfahOrDI,2023-01-04T17:50:35Z
THE AXE FALLS: Media and Tech Layoffs Will Be MASSIVE in 2023!,tlYwGtuum3s,2023-01-04T04:15:30Z
Fans Called Hateful by Hate-Fueled 'Fan' Website.,XoZJIBFhWfY,2023-01-04T01:33:08Z
Toy Story Director HATED Lightyear.,_OYv0hXB55s,2023-01-03T23:17:37Z
TikTok Banned by Biden.,BnI5cq4XEMA,2023-01-02T20:34:20Z
YouTube Won't Let You SWEAR Anymore?! Creators DEMONETIZED by New YouTube Rules!,Gh9xuVVYV7w,2023-01-02T19:22:01Z
Disney Stock PLUMMETS 44%! DIS is Downgraded to SELL!,kzE2voHjp3U,2023-01-01T04:47:59Z
