Title,Video ID,Published At
Unity Apologizes. It's Too Late for Them.,iUJ30HmB_aE,2023-09-18T19:21:04Z
ABC News Staff FREAK OUT as Disney Might SELL THEM OFF!,iSpUgrvIucM,2023-09-18T18:14:55Z
Drew Barrymore BULLIED Off the Air by the WGA!,VZs71EYQp0g,2023-09-17T16:00:29Z
Hollywood Writers and Actors Get UNEMPLOYMENT While Striking?!,5HrpH-VwPBM,2023-09-17T01:05:50Z
Google Stops Recruiting USELESS Employees?,harJaw6Elj4,2023-09-16T22:30:23Z
Unity DESTROYS Itself! Gamers United AGAINST Unity Engine!,mR2nmfY2RPk,2023-09-16T21:01:00Z
Drew Barrymore DEFENDS Herself as Hollywood Writers DOGPILE Her!,kImdREFILkQ,2023-09-16T01:40:12Z
'Fables' Creator STICKS IT to DC Comics! Releases Comic Book Series Into PUBLIC DOMAIN?!,khgN_vvJ36A,2023-09-15T22:57:31Z
Disney DUMPING its TV Channels for $10 BILLION Bucks?!,q5no-YXe_-M,2023-09-15T20:56:41Z
Bill Maher Just STEPS OVER the Hollywood Writers Strike.,3uTcHAX-tDQ,2023-09-15T00:50:09Z
Publishers Only Want 'Diverse' Authors Now?,C_o4pYkpd8U,2023-09-15T00:31:12Z
Disney in Talks to SELL ABC to The CW Owner?! More Hollywood Deals CANCELED!,XQIGGzc1bX8,2023-09-14T21:05:27Z
Scooby-Doo Voice Actress Peddles AI Art After SLAMMING Animator for Using AI Voices?!,CRUJ8NH2B9M,2023-09-14T02:52:45Z
Drew Barrymore FIRED from Awards Show Due to Hollywood Writers' Strike?!,VgyXie-Lcb0,2023-09-14T02:28:43Z
"Disney Charges Almost $100,000 for a Cruise Ship Cabin?!",BvHbi1jBPrY,2023-09-13T19:14:32Z
"Disney BLACKLISTED Frank Oz Because He ""Won't Follow Orders?!""",cP9iPCoV9AA,2023-09-12T18:48:12Z
Starfield Pronouns CAN'T Be Modded Out on Nexus Mods?!,EVParjQniH8,2023-09-12T14:07:12Z
Hollywood IMPLODES! Showrunners FURIOUS and Want to QUIT the Union?!,CL5eEtwJvyU,2023-09-12T04:30:52Z
Hollywood Writers TURN on Drew Barrymore!,fgigRvr0GCg,2023-09-12T03:09:59Z
Disney and Spectrum Settle Dispute! Disney Selling a $1500 Blu-ray Set?!,11HOVSAMHvE,2023-09-12T01:51:44Z
Valaverse Owner BOBBY VALA on the Toy Industry [D-Rezzed Podcast Episode 07],j86V3jjj59Q,2023-09-11T17:59:52Z
Disney SETTLES One of its Lawsuits! $9.5 Million for Magic Key Passes?!,xlLR-3lxhuI,2023-09-10T20:19:00Z
Hollywood Writers Try to DIVIDE and CONQUER the Studios?!,hw6cWO6MGqg,2023-09-10T19:33:18Z
Aquaman 2 Gets ABANDONED by Warner Bros?!,iKufcJ9xYho,2023-09-10T18:03:02Z
Disney's Dismal D23 Announcements: Are They Going BROKE or What?!,8LBQIfdg7KE,2023-09-09T20:29:43Z
Warner Bros. Signs First AI Pop Star?! She's Taking Our Jerbs!,Zt-ZsJ-7VFU,2023-09-09T18:11:59Z
Warner Bros. CANCELS Mindy Kaling and J.J. Abrams Deals!,9iuT3l-RlH4,2023-09-08T19:28:01Z
Hollywood Writers Target DISNEYLAND Next?! They Want UNEMPLOYMENT Benefits!,6fImW4IUxMc,2023-09-08T19:10:11Z
Baldur's Gate 3 Patch Makes it HARDER to Do It With Bears?!,URm5ONVb6Eo,2023-09-08T03:58:41Z
Disney Stock Drops UNDER $80! Disney Plus Tries to PUMP Numbers!,KkaAGJehwAQ,2023-09-07T18:13:27Z
Disney Lorcana Cards Led to VIOLENCE at Gen Con?!,q7wxr62Ghvw,2023-09-07T03:17:56Z
Disney Could GO BROKE Paying for Hulu?!,3MhTuaR7mZI,2023-09-07T01:28:02Z
Rotten Tomatoes is CHEATED! Studios are PAYING for Good Reviews?!,Q71ny-0Mhmo,2023-09-06T23:59:24Z
How Disney Chose Death.,XCqowJ0B6yA,2023-09-06T21:30:13Z
"Toll Booths INSIDE Disney World?! (No, Not Really.)",enFQOvMZ9X4,2023-09-06T03:58:17Z
Hogwarts Legacy TOPS Sales Charts Again! It Beat STARFIELD?!,3ogegi6BevU,2023-09-06T03:10:34Z
AI Won't Replace Hollywood Writers Says Stephen King.,Bi6zDd9isac,2023-09-06T00:12:00Z
The Hollywood Writers Think They're WINNING?!,1gX9KpcURG8,2023-09-05T03:31:33Z
Oprah and The Rock SLAMMED Over Maui Wildfire Relief Donation!,P4xrtAEKgV0,2023-09-05T02:23:46Z
Disney SLAMMED Over Charter Spectrum Carriage Blackout!,7HG5LKpfbg0,2023-09-04T23:32:18Z
Disney Lorcana CHAOS! Gamers are FURIOUS Over Price Gouging!,Kk1ww9h3gpg,2023-09-04T03:31:10Z
"Women Flee the ""M-She-U!""",9zAF94D0HyY,2023-09-03T23:37:24Z
Dirty Disney TikTok Account Makes Company FURIOUS!,_a0Y7BdMb94,2023-09-03T20:52:49Z
Taylor Swift Just DESTROYED Star Wars!,g3jQISpEMDw,2023-09-03T02:58:49Z
Starfield BURNS Gaming Journos! Bethesda DENIED Them Review Codes?!,NOvoAqL0-cI,2023-09-03T02:17:32Z
Ironheart DROPPED From Disney Plus Marvel Schedule?!,y8vy3-fb2DE,2023-09-02T20:53:25Z
SAG-AFTRA Wants the Video Game Industry to Go on Strike Too?!,df2xrZMz28g,2023-09-02T20:13:31Z
Saints Row Reboot Developer SHUT DOWN as Video Game Industry Goes on STRIKE?!,HWab8QYLsNw,2023-09-02T03:31:05Z
Hollywood Union Lets AMC's The Walking Dead Cross the Picket Line?!,ZnFG8VUgRVg,2023-09-02T03:07:59Z
Disney's Snow White 2024 Remake Has BANDITS Instead of DWARFS?!,8Qa4ec6SzHk,2023-09-01T21:14:55Z
Disney Stock Drops to $80 After ESPN Pulled Off Spectrum!,Ua9qo1TKx2I,2023-09-01T18:40:56Z
They're All Turning on Disney as DIS Stock Hits NINE-YEAR Low!,Hb_ozuk86G4,2023-09-01T01:45:33Z
The End of CNN.,pOZ2GzdQbLg,2023-08-31T21:38:01Z
Netflix BLAMES The Witcher's FAILURE on DUMB Americans and Season Split?!,ZZaamRG6iug,2023-08-30T22:28:44Z
Disney Sued AGAIN by Investors Over FRAUDULENT Streaming Numbers?!,15-_mJG2zDg,2023-08-30T19:45:26Z
Disney Might Make She-Hulk Season 2 to SMASH the Patriarchy?!,xMrfd8fajIc,2023-08-30T16:02:51Z
Metal Gear Solid Needs a TRIGGER WARNING Now?!,THiIYAS86aI,2023-08-30T00:51:13Z
The Cleansing Fire Torches Video Game Journalism.,zUC3JiGjts0,2023-08-29T23:44:37Z
Disney CANCELS Splash Mountain Characters from Disneyland?!,EalFyMQDkNg,2023-08-29T19:31:23Z
"Wizards of the Coast BANS Word ""Tribal"" in MTG Because It's Offensive?!",0THa7Y98mTA,2023-08-29T19:03:30Z
Disney Star Wars COLLAPSE! Ahsoka Viewership DOWN 50% From Obi-Wan?!,dxiDlVWRr10,2023-08-29T15:50:19Z
Elon Musk BOOED at Valorant Tournament and Kotaku CHEERS!,hUcboKRZqo8,2023-08-29T03:43:07Z
Disney DUMPS More Disney Plus Shows as Iger Tries to Save Cash!,U4Qw3bOK2Sk,2023-08-29T02:29:16Z
Marvel and DC Comics Need a Kick In the A$$!,6MQ3ywO3ovY,2023-08-28T02:00:02Z
K-Drama Picks by Geeky Sparkles!,YlFbiwav82s,2023-08-28T01:08:05Z
Disney Should DUMP Its Theme Parks Analyst Says!,eIo8DdygKoQ,2023-08-28T00:55:05Z
Disney Might KICK Snow White to a Later Release Date?!,TzoxJXerclk,2023-08-27T17:31:11Z
DC is F*ckin' DONE! Blue Beetle PLUMMETS in Week 2!,tL75W46v15w,2023-08-27T00:48:22Z
Animation Industry APOCALYPSE?! Cartoon Layoffs Keep on Coming!,YEXSwjCHnAE,2023-08-26T23:09:42Z
Disney CEO is HATED the Most by Hollywood Writers!,2nPzKBA-VO8,2023-08-26T20:59:17Z
CNN Has to Be GIVEN AWAY with Max.,gynKjhuHNvY,2023-08-25T22:22:21Z
Netflix One Piece FIXES Cowboy Bebop F*CKUP?!,fyVWZGH6ycY,2023-08-25T20:22:11Z
The Marvels a WIN for Disney?! Hollywood Strike Delays Dune 2 Until 2024!,4sazNtDo87Q,2023-08-25T20:02:50Z
Disney in PANIC Mode! Makes Theme Park Announcements to Save DIS Stock Price?!,w3i1bv022Eo,2023-08-25T17:56:33Z
Disney is F*CKED! Dis Stock PLUMMETS to 9 YEAR LOW?!,-FGZPSXlOak,2023-08-24T21:05:17Z
OG World of Warcraft Team Lead GRUMMZ Interview [D-Rezzed Podcast Episode 06],DxvC9MaD7Co,2023-08-24T15:45:08Z
"Hollywood Writers Offered $11,000 Per Week by Studios and They're INSULTED?!",DirO1dnyL3M,2023-08-24T00:12:05Z
CBR Twitter HIJACKED by Rogue Journos as Digital Media Keeps IMPLODING!,D_KFNGyGjOg,2023-08-23T23:25:53Z
Blue Beetle Box Office Bomb BLAMED on Hurricane Hillary?!,wcQRCy-ZZ0M,2023-08-23T21:38:44Z
Hollywood Strikes Will HELP the MCU?!,WSt-UTIis_U,2023-08-23T15:35:23Z
Fyre Festival 2: They're Doing ANOTHER One?!,xz2hBSCSX6M,2023-08-23T15:14:00Z
Hollywood Writers are SAD Because Writers' Rooms are NOT Necessary?,wQ5841IQ6gA,2023-08-22T21:52:14Z
A.I. Art CAN'T Be Copyrighted... or CAN It?,neUmZ0vEmWE,2023-08-22T16:03:08Z
Japan HATES Fable.,-7O5F1eB5Yo,2023-08-22T03:56:40Z
Disney FIRED Cast Member for Standing Up to BULLY Theme Park Guests?!,YfZ_sJMRKzk,2023-08-22T00:53:38Z
Charles Martinet Isn't Mario Anymore.,gUJlNcK63k0,2023-08-21T16:45:30Z
More Bad News for Kotaku and Polygon...,_12RSlwSRr8,2023-08-21T03:44:40Z
Disney Legend SLAMS Snow White?! Tim Rice Says Remakes are Unnecessary!,CFsNE6vrLoc,2023-08-21T03:41:24Z
Disney Could Get SPLIT in Half?!,9b8EfISIsuU,2023-08-20T20:19:23Z
Blue Beetle BOMBS?! Lowest Preview Night For a DC Comics Movie!,uGiVtXskvME,2023-08-19T22:13:09Z
No More BLOCKING on Twitter?! Musk Nixes it on X!,DAzegNF1Kw0,2023-08-19T20:23:04Z
Walt Disney is SPINNING in His Grave?! Son of Snow White Director SLAMS Disney Remakes!,na0_dtwNpWg,2023-08-19T20:00:54Z
Hasbro Might STOP Making Toys Someday?!,5XETm-Iqvsg,2023-08-18T22:59:50Z
Hollywood Showrunners DON'T WANT So Many WGA Writers on Staff!,M9VgQQc6u08,2023-08-18T20:42:25Z
Disney in CRISIS MODE Over Snow White?! Rachel Zegler is Box Office Poison!,WF-TUd5SBEs,2023-08-18T19:52:40Z
Blue Beetle Could BEAT Barbie at the Box Office?!,it0C-wibkG8,2023-08-17T23:57:54Z
Leonard Bernstein's Family DEFENDS Bradley Cooper's Fake Nose?!,VZaDktYLZEw,2023-08-17T23:17:04Z
YouTube Animator EAGAN TILGHMAN Interview [Clownfish TV D-Rezzed Podcast Ep. 05],j4G7vFlXklk,2023-08-17T19:34:15Z
Disney Sued AGAIN! Accused of SELF-DEALING in Fox Deals!,HurtKjsoQMU,2023-08-17T03:07:58Z
Scooby-Doo AI Animator BLOWBACK! They Had to APOLOGIZE to Him?!,XQtnN59p7vU,2023-08-17T01:00:56Z
Kotaku Just FIRED Its Editor-in-Chief Over Tears of the Kingdom!,s6h5Wiu56ds,2023-08-16T22:49:19Z
Hollywood Unions BACKPEDAL on Agreements After MASSIVE Backlash?!,hMLlaeehdBU,2023-08-16T01:44:20Z
Disney’s Snow White Needed FIXED with a Remake! The Original Was PROBLEMATIC?!,CcC5M7pAen8,2023-08-16T01:22:53Z
JK Rowling ERASED from Museum as Hogwarts Legacy Sales SKYROCKET!,soFLPWDLmrY,2023-08-16T00:59:36Z
Disney Plus CRASH! 'Cancel Disney Plus' Trends as Subscribers QUIT!,_yKUZ7ETYcY,2023-08-16T00:28:09Z
Disney is DYING and EVERYBODY Sees It Now.,9xIjWNlyN6Q,2023-08-15T19:39:33Z
Scooby-Doo x FNAF Fan Animator BLACKLISTED by Hollywood Voice Actors Over AI?!,4f2SQ-zp_R0,2023-08-15T01:00:28Z
Hollywood Movies are GARBAGE Says Zachary Levi!,MAz2oaujcMk,2023-08-14T23:26:32Z
Hogwarts Legacy Producer TROY LEAVITT Interview [Clownfish TV D-Rezzed Podcast Ep. 04],UrKcxYRNGtQ,2023-08-14T16:00:09Z
"The Marvels Will Be WACKY and SILLY, Says Director.",KZmO4iBHiLM,2023-08-13T20:30:13Z
Snow White Actress Calls The Prince a STALKER?!,Fk89aQDB3rk,2023-08-13T20:01:15Z
POWER-CON 2023 Walk Around Day Two! MASSIVE Toy Show! MOTU and More!,CW7ZMShJ1MM,2023-08-13T02:23:01Z
Vice News' Hit Piece on Manga Gets an EMMY Nomination?!,B77CT1M79So,2023-08-13T01:57:25Z
Reddit Owner Says Reddit is FINE.,KT-i6IfjJ0Y,2023-08-12T02:06:57Z
Threads PLUMMETS 82% in One Month! Facebook's Worst FAILURE?!,Z0pLCFvZeXA,2023-08-12T01:52:19Z
POWER-CON 2023 Day One! Huge Toy Show!,gTMoWz3ZF-Y,2023-08-11T23:27:14Z
Hollywood Writers HATE YouTube! They're Gunning for Us?!,GYWoXZ88Fmk,2023-08-11T12:42:45Z
Hollywood is EATING Itself?! Writers FURIOUS Over Interim Agreements!,fibRwZtJ3PI,2023-08-11T03:07:52Z
White April O'Neil TMNT Mutant Mayhem Toy is 100% REAL?!,i_acM0jBHAg,2023-08-10T23:05:41Z
Bill Maher Was Mean to Barbie. People are Mad.,BIAApDlqGzI,2023-08-10T15:59:39Z
Funko is IMPLODING! Could GAMESTOP Buy Them Out?!,cyo-29J33eg,2023-08-10T03:52:55Z
Disney's Star Wars Galactic Starcruiser is Just a TAX WRITEOFF Now!,SdAAgZ1XdHw,2023-08-10T03:20:01Z
Disney STRIKES OUT in Q3! Raises Disney Plus Prices AGAIN!,6QFXZKd0A5U,2023-08-10T02:04:59Z
The END of Social Media.,Uukrk-1iks8,2023-08-09T02:46:48Z
IDW is a Comic Book Industry CLUSTERF*CK!,619BaFgvwas,2023-08-09T02:09:23Z
Disney is DEFINITELY for Sale?!,N-_jIq9H2xo,2023-08-08T23:48:48Z
Animation is OVER.,QHt1J0GMvzc,2023-08-08T23:20:30Z
Hollywood is PURGING Writers with the Strikes.,fhDD75ZZrU0,2023-08-08T03:45:05Z
WotC Game Revenue TANKS! Hasbro WRITES OFF Dungeons & Dragons Movie?!,Ybmqog26mjU,2023-08-08T00:43:39Z
April O'Neil is WHITE Again?!,uY115qOTkv8,2023-08-07T21:51:21Z
WotC BUSTED Using AI Artwork in Dungeons & Dragons Sourcebooks?!,boVjMb8Fcgw,2023-08-06T20:56:24Z
Disney Fans are DONE with Snow White! Should Disney CANCEL It?,ZicYbnFX6NM,2023-08-06T18:10:29Z
Disney's Next Earnings Report Might Be REALLY F*CKIN' BAD!,1l_Owi8Xeaw,2023-08-06T02:38:42Z
Hollywood Writers STRIKE OUT! No Immediate End to WGA Strike in Sight!,5_6y_OJRejI,2023-08-05T22:48:24Z
Barbie Movie Made Women DUMP Their Boyfriends?!,2nScFwmGxTc,2023-08-05T22:32:58Z
Minecraft is Officially DEAD.,1W5fJTyl9ro,2023-08-05T18:22:52Z
Zachary Levi CANCELED for Hollywood Strike Joke?!,ew6HoIO5_UM,2023-08-04T22:28:14Z
DC Comics is THIS DESPERATE for Blue Beetle to Succeed?!,8QH1W2CU3ec,2023-08-04T22:16:46Z
Disney Might NUKE the MCU and Reboot Marvel Completely?!,A5WMevN1loY,2023-08-04T03:09:50Z
Warner SAVED $100 MILLION Because of the Hollywood Strikes?!,MNFIyXaMJqI,2023-08-04T02:57:23Z
Hasbro SOLD Dungeons & Dragons Movie Studio to Chase VIDEO GAMES?!,HOn9jjb9EIk,2023-08-03T21:01:05Z
Patreon Just F*CKED OVER Its Creators. Again.,ZWqeKZTO8xM,2023-08-03T20:36:11Z
Blue Protocol CENSORED by Amazon?! Japanese RPG WON'T Have Jiggle Physics in the US!,jcQFQgAbPXg,2023-08-03T02:57:13Z
Threads is FAILING?! Zuckerberg Admits HALF of Users Already QUIT!,dH_wJ77cgfw,2023-08-03T02:38:56Z
Media ADMITS Marvel Sucks Now!,u_VHW8jTD0A,2023-08-02T22:58:23Z
The Witcher Season 4 Could Be CANCELED? Media Says Pull the Plug!,zXJ90JrRP-c,2023-08-02T14:44:01Z
Is Disney THIS Desperate to Sell Off Assets?!,1f4eAUrJRAQ,2023-08-02T14:24:08Z
Stephen Amell SLAMS the Strikes! Hollywood Makes Him APOLOGIZE?!,-ZbhjdbpOdQ,2023-08-02T00:49:44Z
Game Over for Feminist Frequency.,_vxCZxFnalg,2023-08-01T21:47:41Z
Secret Invasion Director DOESN'T CARE What the Audience Thinks!,xbPagtdQQxc,2023-07-31T20:34:58Z
Hollywood HYPOCRITES?! Union Lets SOME Work While Others Go Broke!,YiLrMRYKovo,2023-07-31T19:23:02Z
Those Disney Plus Numbers Must Be HORRIBLE...,9MZeQ3dRoOc,2023-07-31T02:58:04Z
Disney DOUBLES DOWN on AI Jobs During the Hollywood Strikes?!,2P4uxlvKwtg,2023-07-31T02:11:23Z
Hollywood A-Listers STILL WORKING During the Strike?! Sarah Silverman is P*SSED!,prvzTlckQYI,2023-07-30T21:08:48Z
Barbenheimer is Hollywood's LAST Gasp?! Disney FLOPS are the New Normal!,3Og_ma3xy2g,2023-07-30T20:29:39Z
Hollywood's GREAT RESET?! Strikes Trigger MASS Cancellations!,n3Uss48HkKw,2023-07-29T20:08:04Z
Disney's Haunted Mansion Movie REVIEW: It's Actually GOOD?!,cAZRol2BgSE,2023-07-29T19:42:17Z
Back to the Future Creator DOESN'T Want Reboots or Sequels!,skl6n8RGC1k,2023-07-29T16:16:50Z
Hollywood Won't Give YOU Their Crumbs.,mSC4unIqnVk,2023-07-29T01:39:30Z
The Comic Book Industry ADMITS YouTubers Were RIGHT!,VgnoNdFZ_Jc,2023-07-28T19:00:25Z
Disney's ONLY Way Out...,rJ_tEcPusPg,2023-07-28T17:50:38Z
The Twitter TRASH is Moving to Threads!,S9_fVCJFBc8,2023-07-28T03:20:21Z
Hollywood Writers FURIOUS to Find Out They're NOT Special.,n_3jgLRvZbU,2023-07-27T18:54:52Z
Disney Sells EMPTY BOXES for Marvel Disney Plus Shows! Pink Ladies DUMPED on DVD!,Bsc6fbC4sbk,2023-07-27T15:53:28Z
Marvel's X-Men Hellfire Gala at SDCC Looked X-tra Sad.,L6RSv_bjE28,2023-07-27T03:46:12Z
Disney's Haunted Mansion Will BOMB! Barbenheimer Was Hollywood's LAST Chance?!,sae6GBD0FWE,2023-07-26T23:46:32Z
Disney is BROKEN and Going BROKE! Sell Your Shares NOW!,hx12VTr9tQw,2023-07-26T23:16:52Z
UFOs are Real. Maybe.,VOOAxlKfBXU,2023-07-26T19:24:10Z
Disney's Splash Mountain is HAUNTED and REFUSING the Refurb?!,xXpJzeQpPNY,2023-07-26T03:42:16Z
CODA: Comic Book Industry Internet DRAMA is Finally ENDING?,LjWrWNKiGCk,2023-07-26T00:19:40Z
Mortal Kombat 1 Tanya Redesign Gets MASSIVE Backlash from Gamers!,YQFSE2eG1WI,2023-07-25T16:40:33Z
Hollywood Unions BLACKLIST YouTube and TikTok Influencers Over the Strike?!,wnflOlLbUn4,2023-07-25T03:07:33Z
Disney CALLED OUT for 'Wokeness' by the Wall Street Journal?!,2_XfRAja_7A,2023-07-25T01:31:06Z
RIP Twitter. Long Live X.,Jp04P_1Jo0Q,2023-07-24T21:02:55Z
Twitter is Officially DEAD! Elon Musk Rebrands it as X?!,xMWRxffHhvQ,2023-07-24T03:31:38Z
PROOF That MANGA Keeps WESTERN Comics in Business?!,CymQsDiO27o,2023-07-24T03:07:22Z
Hollywood Needs to MOVE ON? Barbenheimer DESTROYS Box Office!,SXuG-VNNHxA,2023-07-23T20:16:16Z
Star Trek: The Musical.,3z_3g24GMYU,2023-07-23T19:49:21Z
Facebook's Threads App is DOA? Did Musk Already PUMMEL Zuckerberg?!,RBsHQEQ6XGc,2023-07-23T02:32:21Z
Barbie Movie FAILS the Bechdel Test?!,FXCbntMeMDg,2023-07-23T01:03:58Z
The Comic Book Industry is a Green-Eyed MONSTER.,hIIKyRmnMp8,2023-07-22T20:08:28Z
Hollywood DUMPS DEI to Chase PROFIT.,v5txhMqc9QM,2023-07-22T16:59:56Z
Barbie Movie REVIEW: Barbie Fights the PATRIARCHY?!,myh4XYaDS68,2023-07-21T21:55:55Z
Blue Beetle: Another DC Comics Movie BOMB Incoming!,txguGa_S23k,2023-07-21T20:44:23Z
Polygon Says You CAN Cosplay During the Hollywood Strikes!,Gz5BvtW52Ek,2023-07-21T17:31:29Z
Video Game Journos are F*CKED! Most Sites Will NOT Survive Through 2024?!,4wjqPas8aTs,2023-07-21T16:36:49Z
Blame KEVIN SMITH for Netflix He-Man Movie Cancellation?!,Int62wx8ey8,2023-07-20T21:49:47Z
Twitter HATES Ms. Marvel Now! Fans FURIOUS She's a Mutant!,yUxZbZWYaNE,2023-07-20T21:14:41Z
"Baldur's Gate 3 is So ""Diverse and Inclusive"" It HURTS.",IHINWT-Vj0A,2023-07-20T15:58:38Z
Hollywood EATS Itself! Disney CEO Put on Blast by Fran Drescher?!,3KNZUpUocck,2023-07-20T02:33:00Z
Comic Book Crowdfunding: We Needed a Backup Plan!,y9QVPkoVR5o,2023-07-20T00:02:04Z
He-Man Gets CANCELED by Netflix!,VKWxQyG4ERY,2023-07-19T22:07:21Z
Disney Employees FREAK OUT Over Bob Iger's Disney Yard Sale!,1ijnVbyFhAE,2023-07-19T20:44:07Z
Nobody Would Even Miss Comic Books?!,rGQPFJGqyDg,2023-07-19T17:10:50Z
Dwarf Actor SLAMS Disney's Snow White and Wonka Casting!,QC-IRYkbOOU,2023-07-19T02:31:48Z
Disney's SH*T SHOW! Disney Stock Nears ROCK BOTTOM!,13Zeo9ULw0w,2023-07-18T23:54:18Z
Heavy Metal Magazine ENDS (in Tears?),45itA1F9wNY,2023-07-18T16:33:09Z
End Stage Rooster Teeth?,8dprMUbWWXo,2023-07-18T03:32:33Z
Media Claims Indiana Jones 5 BROKE EVEN Already?!,OzeGTFpm404,2023-07-18T00:22:00Z
Disney's YARD SALE! Bob Iger is SELLING Part of the Company?!,w6_DE8synTA,2023-07-17T18:27:06Z
The Utter State of TABLETOP Gaming! [Clownfish TV D-Rezzed Podcast Ep. 03],FfTx5Ln5N-4,2023-07-17T15:05:27Z
Mickey Mouse is a SCAB?! Disney SLAMMED for Haunted Mansion Premiere!,lgMfB2miGmo,2023-07-16T18:29:30Z
Disney is DESPERATE to Save The Marvels?! Ms. Marvel is on ABC Now!,z_WyqjWpMbI,2023-07-16T17:27:40Z
Disney CAN'T Fire Kathleen Kennedy?! Nobody Wants the Job?!,OTGtwbtOhO8,2023-07-16T03:15:35Z
San Diego Comic-Con is the Next E3? Will it Go BUST Without Hollywood?,4kxjyKGLAkw,2023-07-16T02:39:32Z
Hollywood is CLOSED!,0xh0IFGn5N0,2023-07-15T20:37:01Z
Disney's Snow WHITE LIE! Leaked Snow White 2024 Photo DAMAGE CONTROL!,JSIuEwI01BU,2023-07-15T17:58:15Z
Disney CEO Bob Iger ADMITS the MCU is FAILING?!,3wv2x1yqtEA,2023-07-14T21:06:19Z
Ms. Marvel Won't Stay Dead.,zrfrPqAGyQo,2023-07-14T20:28:08Z
"Disney F*cked Up Snow White, Too.",NXQjGicxFQ4,2023-07-14T17:35:50Z
Article SLAMS 'Toxic' Comic Book Fans Like it's 2017!,9bk5mpTjtYg,2023-07-14T03:44:11Z
'AI Turk Err Jerbs!',5QY-s-oaBXY,2023-07-14T02:44:04Z
"Disney CEO Bob Iger SLAMS Striking WGA Writers as ""Unrealistic!""",Ic1pgmmHZUI,2023-07-13T19:20:24Z
Disney Will Get SOLD in Less Than Three Years?!,bgQI8PpXrNE,2023-07-13T03:23:47Z
Vice Media F*CKED OVER its Writers Bigtime Before Going BANKRUPT!,B_mSRSIYczQ,2023-07-13T03:08:24Z
Disney EXTENDS Bob Iger's Contract for Two More Years!,1tHzSlK4Zoo,2023-07-12T23:13:36Z
The Flash is the BIGGEST BOMB EVER for Warner Bros.?!,ojAKCmyV81w,2023-07-12T23:07:04Z
Disney World is EMPTY.,1FfUbcjry_A,2023-07-12T15:12:04Z
Microsoft DESTROYS the FTC! Activision-Blizzard Sale is HAPPENING?!,wUtBxt8dTo4,2023-07-11T22:45:48Z
"Kathleen Kennedy SAVED Star Wars, Media Says!",k9eFcn1UGQI,2023-07-11T19:16:27Z
'Zuck is a CUCK!' Elon Musk SLAMS Mark Zuckerberg Over Threads Launch!,dopmhhnPLCQ,2023-07-11T03:31:34Z
Indiana Jones 5 Got WHIPPED in Its Second Weekend!,JXsQWERrbvY,2023-07-10T23:48:55Z
Wolverine in Yellow Spandex in Deadpool 3?!,hJsPfKtqy1I,2023-07-10T17:30:37Z
"Kathleen Kennedy MIGHT Get Gone, But Star Wars ISN'T Changing.",zsEYchmArT8,2023-07-09T18:30:53Z
Video Game Journalists Meet the REAL WORLD.,vA89Qxip9nc,2023-07-09T17:28:18Z
Dungeons & Dragons Video Game Lets You F*CK Bears.,d4fhAwhQW4k,2023-07-08T17:46:31Z
Gizmodo Journos FURIOUS Their Bosses Posted A.I. Articles Behind Their Backs!,yFQHOTLvLsk,2023-07-08T04:01:00Z
Bob Iger DESTROYED Disney! Now He Wants to EXTEND His Contract?!,9UNzWpYma4E,2023-07-07T21:28:09Z
This is WHY Pixar is Failing?,kyBo5ec38aM,2023-07-07T20:40:33Z
The Utter State of HASBRO Toys! [Clownfish TV D-Rezzed Podcast Ep. 02],WkDDcVyVgJg,2023-07-07T17:14:40Z
Superman Transforms Like Sailor Moon Now.,ii_x1At2hJ0,2023-07-07T14:37:13Z
CNN Going Up for SALE?!,ZqhBM3rs3Nc,2023-07-06T22:50:46Z
Dungeons & Dragons F*CKED UP Bigtime!,BMAXk2aK8Nw,2023-07-06T21:18:56Z
Facebook Now Identifies as Twitter.,GtiRnFC2Z28,2023-07-06T19:27:59Z
Blue Beetle Director Does DAMAGE CONTROL to Save Box Office?!,-CTh551NvFA,2023-07-06T03:34:08Z
It's OK to Criticize Disney Now.,TRbUeboHaTs,2023-07-06T03:02:10Z
"Indiana Jones 5 is Officially a BOMB, a FLOP and a FAILURE.",BmnDs5r6rf4,2023-07-05T22:33:38Z
Disney Stock DOWNGRADED as Disney World Attendance PLUMMETS!,dPK4W3R9hlA,2023-07-05T20:46:59Z
Spider-Man Kid Gets BULLIED and BEAT UP by Female Classmate!,736ED7zxWKE,2023-07-05T02:06:48Z
Disney SPINS Indiana Jones 5 Box Office as a WIN?!,mx-W1LCTDCc,2023-07-04T20:21:02Z
The END of Digital News Media.,6qFBrlvzu34,2023-07-04T02:49:25Z
Indiana Jones 5 Director Wanted Him SAD and BROKEN.,0jc7-jaOh8o,2023-07-03T23:17:51Z
Ruby Gillman: The WORST DreamWorks Box Office Opening EVER!,zOzFSYKJPLY,2023-07-03T20:14:53Z
They're MAD Captain Kirk and Spock Aren't Gay?!,ijqPDSFcAzA,2023-07-03T16:59:23Z
Indiana Jones 5 BOMBS and Will Lose MORE Money Than The Flash?!,0lK_YUHsebM,2023-07-03T00:55:18Z
Disney Turned Hillary Clinton Into Donald Trump?!,ZYRYac-dztU,2023-07-02T15:29:33Z
ESPN is F*CKED! 20 On-Air Personalities Get CHOPPED to Save Cash!,1Cl894K8UZM,2023-07-01T20:35:48Z
Netflix and Warner FIRED Their Diversity Bosses!,yd9h7_5BnHQ,2023-07-01T17:40:12Z
Disney GUTS National Geographic Magazine! Staff Writers FIRED!,pQKGfocVpV0,2023-06-30T23:37:42Z
Indiana Jones 5 is Gonna BOMB! Thursday Night Preview Box Office Were ABYSMAL!,GQkNcghgMO4,2023-06-30T22:59:04Z
Late Night TV Headed for OBLIVION Says WGA Writers!,UjgFZnJKZBU,2023-06-30T20:54:51Z
The Utter State of the Comic Book Industry [Clownfish TV D-Rezzed Podcast Ep. 01],LFr_jyfRTY4,2023-06-30T17:55:04Z
Jonathan Majors Gets Support from Captain America Star Anthony Mackie?!,trlp1mZU4Fc,2023-06-30T03:10:22Z
Mark Hamill Threatens to BLOCK This Comic Book Pro for Supporting Robert F. Kennedy Jr.?!,kDEziJ1EnJQ,2023-06-29T21:15:17Z
"Disney Star Wars is Moving BEYOND George Lucas, Says Kathleen Kennedy.",ZUMr42iCUdc,2023-06-29T15:55:19Z
Another YouTube Adpocalypse is Coming?!,WFPn21dqddc,2023-06-28T23:17:24Z
Warner Bros. Uses AI to Greenlight Movies After The Flash Disaster?!,TvbJS0OrfyA,2023-06-28T02:30:29Z
Netflix Might Buy Paramount Plus?!,Bhs6Gt1caTM,2023-06-27T22:25:44Z
Phoebe Waller-Bridge Thinks She's Getting MORE Indiana Jones?!,P-ggQB1sBEU,2023-06-27T20:23:36Z
Gaming Journos Get REPLACED with AI!,pr2vtfo4-68,2023-06-27T20:05:40Z
Spider-Verse Animators are Beyond FURIOUS! Sequel Delayed Until 2026?!,xyI3V5A27ZU,2023-06-27T03:15:54Z
Respect the Angry Birds' Pronouns!,YEGRXBUlIiE,2023-06-27T00:44:58Z
Disney Picks a FIGHT with Parliament Over Disney Plus?!,QVRakoqMfdU,2023-06-26T20:00:37Z
The Flash is One of the BIGGEST Box Office Bombs of ALL TIME!,OBr5BMwpEL0,2023-06-26T01:19:33Z
Hollywood Writers Strike LEFT BEHIND by Directors and Actors?!,MLuNrTH2Ans,2023-06-25T20:37:56Z
Pixar is Dying.,V4roUOppZEc,2023-06-25T20:14:19Z
The Flash Box Office DROPS 75% in Week 2?! That's Worse Than MORBIUS!,byLVh15jsNA,2023-06-24T17:50:40Z
Justin Roiland Replaced in an ICE COLD Way in Solar Opposites!,PxHHrylS4y4,2023-06-24T16:41:07Z
Netflix and Sony PULL OUT of Comic-Con! E3 is Done FOREVER?!,m7g055jc5pE,2023-06-24T02:35:18Z
Grease Prequel CANCELED! Pink Ladies DUMPED Off Paramount Plus!,_g0m_jj6zEs,2023-06-24T01:15:05Z
The Flash is F*CKED! Beaten by ELEMENTAL at the Box Office?!,UlaZeRp3OOU,2023-06-23T19:49:10Z
Disney SLAMMED for Using AI Art on Marvel 'Secret Invasion' Intro!,DkakX-ROT5Q,2023-06-23T02:53:49Z
New Clownfish TV Podcast?! [Clownfish TV D-Rezzed Podcast Ep. 0],Ep4aCr-HCOQ,2023-06-23T02:52:31Z
They're All TURNING on Disney as Stock PLUMMETS Again!,nQfPWEngUgI,2023-06-22T21:49:57Z
They Have to GIVE AWAY Free Tickets to Indiana Jones 5?!,8ApU7Bg_LGc,2023-06-22T19:05:30Z
Comic Cons are Kinda Pointless Now.,TQr59HyGHS8,2023-06-21T22:22:59Z
The END of Reddit?,6Svo6wfNQls,2023-06-21T16:30:30Z
Disney Just FIRED Their Diversity Boss?!,uqv1D_g1STk,2023-06-21T01:52:56Z
Disney's Reedy Creek Firefighter Pay Raise STALLED OUT?!,sVbV9pNfYm4,2023-06-20T16:47:43Z
LOTR: The Rings of Power Season 2 ANTI-Marketing Begins!,cPaFoVZLU8k,2023-06-20T13:20:25Z
They Want to BOYCOTT Final Fantasy 16?!,loaSeB2tvvE,2023-06-20T12:50:53Z
Elemental BOMBS at the Box Office! WORST OPENING EVER for a Pixar Movie!,N12f8s72BD4,2023-06-19T21:30:01Z
DISNEY DRUNK Fights with Guests at Walt Disney World!,kTJE0lbZlhY,2023-06-19T20:24:49Z
Twitch Got KICKed in the Nads! Amouranth Just LEFT Twitch!,znROMwgmCOc,2023-06-19T16:39:31Z
The Flash BOMBS Harder Than Black Adam! Writers Strike Blamed?!,RhpMPURKAvI,2023-06-18T16:21:05Z
"Disney's 'Oye, Primos!' Voice Actress SLAMMED for Smug Response to Critics!",WV8Qxi5sqLE,2023-06-18T15:13:53Z
F*CKING GRIFTERS! Harry and Meghan SLAMMED by Spotify Exec!,cFTXOzsVOYs,2023-06-17T22:22:00Z
Twitch is F*ckin' DONE.,p5HiIYkA-A0,2023-06-17T20:49:47Z
Disney's 'Primos' Cartoon SLAMMED for Being Racist AF?!,bWRWJuiiB3Q,2023-06-17T20:05:09Z
Disney Exec THROWDOWN: Disney CFO Was Fighting with Iger Before She Quit?!,WrqlOLEvXXc,2023-06-17T17:32:28Z
Pixar Boss SHOCKED by Bad 'Elemental' Reviews?!,_gUt9B6EyJo,2023-06-17T03:21:51Z
Disney is a RELIGION to Disney Adults.,8EXMUh890zA,2023-06-16T23:32:36Z
