Title,Video ID,Published At
The Final CobraCast of 2023 | Scan In 199,E4ENvmkT4so,2023-12-30T03:48:25Z
Maine Secretary of State Kicks Trump From 2024 Ballot | Emergency CobraCast,nqQo4Mj655I,2023-12-29T03:24:29Z
Michigan Supreme Court Gives Trump HUGE Win | CobraCast 199,FQCwdgWAQRA,2023-12-28T03:45:27Z
Supreme Court Gives Trump HUGE Win For 2024!,dOzJRlRyoXo,2023-12-23T16:04:55Z
Supreme Court DESTROYS Special Counsel - Huge Win For Trump 2024! | CobraCast 199,krdp85R51ro,2023-12-23T05:12:46Z
Steven Crowder DESTROYS Piers Morgan | Alex Jones Was Right,ITA5pxU21uk,2023-12-22T01:37:14Z
Ron DeSantis TURNS On President Trump and The American People | CobraCast 199,8AsVpP1d4BY,2023-12-21T03:57:11Z
Colorado Supreme Court BANS President Trump from 2024 Ballot!,5iVUZzNC1Pc,2023-12-20T02:00:37Z
Johnathan Majors FIRED and Found Guilty - Will Elon BUY Disney? | CobraCast 199,G5_dXghfFCs,2023-12-19T03:55:50Z
Democrats Are DISGUSTING | CobraCast 199,dXyjmVNgY8Q,2023-12-16T04:53:50Z
President Trump Gets GREAT News - MAGA 2024 | CobraCast 199,alsWD-txxoA,2023-12-14T03:56:57Z
Alex Jones RETURNS - Tucker Carlson's HUGE Announcement | CobraCast 199,Y7sCKe57G7Y,2023-12-12T03:15:07Z
Elon Musk Says He'll Go To PRISON To Stand For What's Right,YQd5FEcxO4g,2023-12-11T03:17:53Z
The Return of Alex Jones | Elon Musk Breaks The Internet,IGZAKdxapJ4,2023-12-09T20:40:12Z
Alex Jones Is Inevitable | CobraCast 199,jluDqk3QKYY,2023-12-09T04:24:17Z
Cringe GOP Debate REACTION | CobraCast 199,lFKFeQAKrX0,2023-12-07T04:05:40Z
Elon Musk's Master Plan To Destroy Wokeness,VhBTIWRmnzE,2023-12-03T05:13:21Z
The REAL Reason Elon Musk Called Out Disney | CobraCast 199,YlNHlntWgEk,2023-12-02T03:19:34Z
"Elon Musk SLAMS Disney, Other Advertisers - Deadspin Woke BACKFIRE - DeSantis Meltdown Over Trump",TgQYFBCBLl0,2023-11-30T02:19:30Z
CobraCast 199,aE-DXi8Qvb8,2023-11-28T03:43:31Z
Peak Case of Trump Derangement Syndrome | CobraCast 199,Trc6IYZ4rJs,2023-11-25T04:30:23Z
"""Dutch Trump"" Just Won A Landslide Election - MAGA is Unstoppable | CobraCast 199",a2Yt5YLAU7s,2023-11-23T03:39:00Z
Wow - President Trump and Elon Musk File UNPRECEDENTED Lawsuits Against Left Wing Media!,99CtqsnlZ9o,2023-11-21T06:16:45Z
Trump Wants To Create The American Avengers,mB1ULd_UOYk,2023-11-21T03:41:58Z
Trump Seriously Considering Tucker Carlson For VP | CobraCast 199,neb04Wsumeg,2023-11-21T03:12:56Z
Argentina's New President is BASED - This is Amazing!,Vi0oUTYeg_g,2023-11-20T03:38:02Z
CobraCast 199,dxovCsY1T2M,2023-11-20T01:34:14Z
MSNBC PANICS Over President Trump DESTROYING Biden in Polls,wYe3QRitrC0,2023-11-19T17:45:02Z
Trump Wins ANOTHER Huge Legal Battle in Colorado | January 6th Tapes RELEASED - CobraCast 199,DRJ6gfKQHds,2023-11-18T04:53:56Z
Michael Rappaport TURNS on Biden - Says He's Voting TRUMP 2024!,vhrWxYBWB8g,2023-11-17T07:17:54Z
The Rock Caught LYING To Joe Rogan,OJJhd31kvZQ,2023-11-17T03:24:26Z
Daily Wire DRAMA : Ben Shapiro vs Candace Owens | CobraCast 199,fZPYm7I2GjU,2023-11-16T03:38:53Z
Trump / Carlson 2024 To Save America | CobraCast 199,eZJWljViJK8,2023-11-14T03:11:19Z
Trump Laughs at Ron Desantis’ BOOTS 😂,TLJP1nbVxow,2023-11-11T22:35:18Z
MMA Fighter Just SCORCHED The Left - Wow!,VD0Z_UAG6hs,2023-11-11T21:47:33Z
Corrupt New York Judge Gets WRECKED | Trump is WINNING Bigly,-OKgSSgMZ68,2023-11-11T19:11:00Z
Trump DOMINATING Biden in National Polls - CobraCast 199,5uFPIEHGPYk,2023-11-11T04:24:02Z
Recap from Yesterday | CobraCast 199,ew6dndKHQ-s,2023-11-09T20:15:22Z
"LIVE TRUMP RALLY COVERAGE from Hialeah, Florida",HBhv2U6P9Z4,2023-11-09T03:11:42Z
New York Judge FURIOUS at Trump Dominating Presidential Polls | CobraCast 199,srYcs8AM54k,2023-11-07T03:09:12Z
Ron DeSantis Destroyed His Entire Political Career,AiMDePDmkbw,2023-11-06T00:56:34Z
CobraCast 199,7sAcARQdxaA,2023-11-04T03:13:43Z
BootGate ENDS Ron DeSantis Career | CobraCast 199,8WPR4_M7F_k,2023-11-02T01:48:59Z
DeSantis is DONE | CobraCast 199,MY8kXDTr184,2023-10-31T01:56:37Z
CobraCast 199,5qxI92pRApc,2023-10-28T05:43:01Z
CobraCast 199,G3krr-LpHqk,2023-10-26T02:10:16Z
MELTDOWN - Hillary Clinton DESTROYED By Democratic Audience Member!,nMMqVnzNLqI,2023-10-24T19:11:22Z
RINO McCarthy TURNS on President Trump | CobraCast 199,apfcXl5i6T4,2023-10-24T01:45:05Z
This is Embarrassing,AAKFWojdgG8,2023-10-23T20:38:18Z
The Difference between Trump Supporters and DeSantis Supporters,GzxoSG8IERA,2023-10-21T20:42:59Z
CobraCast 199,mTA1Ubun8WI,2023-10-21T03:46:20Z
Emergency CobraCast 199,cHh1Mjiz2Go,2023-10-20T01:30:15Z
CobraCast 199,a0TPx_UY81Q,2023-10-19T02:40:11Z
AOC Attacks My Channel - The End of CobraCast,CH9SvrYwjGA,2023-10-18T16:23:22Z
Biden Campaign in FULL PANIC Mode | CobraCast 199,wSWdYfL0i80,2023-10-17T03:21:42Z
Joe Biden Joins Truth Social - They Are DESPERATE!,d9-VDo0HV2w,2023-10-16T18:48:40Z
CobraCast 199,Yfhoj5TwQdk,2023-10-16T02:55:53Z
CobraCast 199 Take 2,y4U7RwMMZSw,2023-10-14T02:23:22Z
Trump Was Right | CobraCast 199,eNyK6-i6J5w,2023-10-14T01:06:15Z
We Need TRUMP Now | CobraCast 199,8249jujB-lk,2023-10-12T02:56:20Z
The World Needs Trump - CobraCast 199,vzscmChLXOI,2023-10-10T07:13:23Z
No Paywall For CobraCast 199 - Trump Keeps Winning,zekdcCEXNqc,2023-10-07T04:29:44Z
Trump Willing To Accept Speaker of the House | Emergency CobraCast 199,41cMqOPi_-w,2023-10-05T23:27:08Z
Speaker Trump - President Trump - King Trump - MAGA is WINNING | CobraCast 199,IgyfJ2jFjgg,2023-10-05T03:55:38Z
Trump DESTROYS Clown World Court Room - CobraCast 199,SSB-291iaiw,2023-10-03T06:29:40Z
Dems FREAK OUT Over RFK Jr Running Independent - Trump Keeps CRUSHING DeSantis | CobraCast 199,_720_0-poac,2023-09-30T06:12:31Z
Gavin Newsom To Replace Biden? | Trumps OWNS Republicans Again - CobraCast 199,Zk4m2F9yHBQ,2023-09-28T07:24:36Z
CobraCast 199 | Part 2,lCYTAHDBjXs,2023-09-26T09:31:50Z
Trump DESTROYING Biden in National Polls - MSM Freaking Out | CobraCast 199,ruKH4PZ2uOw,2023-09-26T07:17:12Z
Howard Stern Goes FULL Woke Beta | Trump Goes FULL Rockstar - CobraCast 199,qEoA9zh-YmY,2023-09-23T04:23:15Z
CobraCast 199,vXj1amG0xJw,2023-09-21T07:00:15Z
CobraCast 199,m7me2mfJPHM,2023-09-19T07:00:46Z
Trump Fights for Christians 🙏,Sn-te25QfWE,2023-09-16T14:38:41Z
CobraCast 199,-IUCx1XAAvg,2023-09-16T05:40:49Z
CobraCast 199,K7xHfdbUUmk,2023-09-14T06:03:16Z
Trump Says He’s Batman!!!!!,2kcccAX7_h8,2023-09-12T23:02:25Z
Never Forget - CobraCast 199,-XnXFtjfBD8,2023-09-12T07:14:22Z
Trump Mocks SJW 😂,BWd7PSE1CVo,2023-09-09T15:43:04Z
President Trump LIVE with Kristi Noem in South Dakota - CobraCast 199,fPvuiGpmJws,2023-09-09T05:22:31Z
Tucker Carlson Gives New Meaning To BLM | CobraCast 199,WOQdLXuMOiY,2023-09-07T07:03:30Z
What Did He Say? 😳,FERZ8WLheDw,2023-09-05T22:09:51Z
Major Drama on Twitter - CobraCast 199,0TL3Y7NEU94,2023-09-05T07:24:40Z
$10 Million Mugshot - President Trump Wins Again | CobraCast 199,_eHD4ef-bqs,2023-09-02T05:26:25Z
Trump Shows Off Mugshot,nKfwvCxKseA,2023-09-01T17:43:49Z
Tucker Carlson Gives SCARY Warning About Trump's Personal Safety - CobraCast 199,KgMnqGcg0V0,2023-08-31T06:36:21Z
Trump Keeps DOMINATING - Logan Paul Gets DESTROYED Forever | CobraCast 199,XRpD2WIRksY,2023-08-29T06:17:47Z
Trump Trial Date Set During GOP Primary - They FEAR MAGA w/ Salty Cracker | CobraCast 199,bvN2YletQxI,2023-08-29T00:18:24Z
When You Leave Your Room,v3iAo4qdPp0,2023-08-26T18:57:35Z
President Trump DOMINATES The Internet - CobraCast 199,2e27Li_bWzc,2023-08-26T05:23:48Z
Donald Trump Makes Fun of Joe Biden 😂,IJ-ojINLgXc,2023-08-25T16:41:05Z
Trump BREAKS The Internet - CobraCast 199,L1gI8Amkfvw,2023-08-25T06:45:47Z
TRUMP IS BACK ON TWITTER 🔥,LSeUk_yGeL4,2023-08-25T02:11:06Z
President Trump ARREST LIVE - CobraCast 199,Li1J2uo3t40,2023-08-25T01:28:55Z
Trump Makes Fun of Kamala Harris,KkqdVn5AzhA,2023-08-25T01:05:52Z
Anticipating President Trump in Georgia Live | CobraCast 199,6IY1pI0F-fc,2023-08-24T19:46:39Z
President Trump x Tucker Carlson Interview LIVE Reaction | CobraCast 199,HJVsnCiffIg,2023-08-24T03:10:55Z
"President Trump To Be ARRESTED Thursday in Atlanta, Georgia | CobraCast 199",IBcjbkJ8Nis,2023-08-22T06:22:44Z
CobraCast 199 | Square Up,gfeqFzZP1qo,2023-08-19T20:46:41Z
Trump DESTROYS Fox News with Tucker Carlson Interview | CobraCast 199,M2IUkgMSXug,2023-08-19T05:50:21Z
President Trump vs The Deep State | CobraCast 199,mCtRKh06ZTQ,2023-08-17T06:44:57Z
RIGGED - Georgia Charges Trump After Getting CAUGHT | CobraCast 199,c_7oKahtfek,2023-08-15T06:44:19Z
CobraCast 199,qGoLhJpdxC4,2023-08-12T05:22:35Z
MAGA is UNSTOPPABLE - CobraCast 199,ZuYVEkd_s7A,2023-08-10T07:29:32Z
Ne-Yo Stands Up To Cancel Mob - Rogan To Interview Trump | CobraCast 199,MOySuB_SrOo,2023-08-08T06:29:12Z
Trump Goes Full Ultra MAGA - Twitch Streamer Kai Cenat CHARGED For NYC Riots! | CobraCast 199,qgI872gzbHs,2023-08-05T04:22:31Z
Trump Arraignment LIVE - MAGA Gets STRONGER | Emergency CobraCast,UN3-wvyPsiA,2023-08-03T21:21:36Z
Trump is More POPULAR Than EVER - MAGA Won't Be Stopped | CobraCast 199,DaO5ZbPWSvU,2023-08-03T07:50:09Z
Trump ARRESTED Again - They Are SCARED |  Emergency CobraCast,InHvXhir6_E,2023-08-01T23:06:06Z
Ron DeSantis Says Trump DIDN'T Help Him Become Florida Governor - He's a LIAR,iB7L7clYoGQ,2023-08-01T17:55:21Z
Joe Biden EXPOSED - Trump 2024 is UNSTOPPABLE | CobraCast 199,TtdKpn5vYCE,2023-08-01T06:48:55Z
CobraCast 199,SjU550es7Rw,2023-07-29T05:05:04Z
CobraCast 199,LA0Lnf3k1hI,2023-07-27T06:58:14Z
Obama's Chef DEAD - Hunter Biden EXPOSED - Time To Arrest Trump Again | CobraCast 199,alEvyaKPTgA,2023-07-25T06:05:18Z
Trump Promises To Protect Children - Dems CENSOR RFK Jr During Censorship Hearing | CobraCast199,793FFtC8-sM,2023-07-22T04:34:59Z
MTG DESTROYS Hunter Biden - Trump Arrested AGAIN - DeSantis In BIG Trouble | CobraCast 199,LambhQ6pypY,2023-07-20T08:39:29Z
Turning Point Action Recap - Trump Keeps DOMINATING | CobraCast 199,eSW7l5LPPZs,2023-07-18T06:49:47Z
Tucker Carlson DESTROYS Mike Pence - Sound of Freedom Wins Again - Trump 2024 | CobraCast 199,WtZZPTvH41g,2023-07-15T03:43:03Z
Sound of Freedom Hits #1 at Box Office - Kamala Harris is Very DUMB - DeSantis in BIG Trouble,4JhOZbiv6y8,2023-07-13T06:24:54Z
Sound of Freedom DESTROYS Leftists | DeSantis Campaign Falling Apart - CobraCast 199,_mzjhD2ZgLQ,2023-07-11T07:32:02Z
Tucker Carlson Breaks The Internet - DeSantis Campaign is a DISASTER - CobraCast 199,z0dY2iP6z6c,2023-07-08T04:11:25Z
CobraCast 199,Q9uNACwIIVQ,2023-07-06T07:02:56Z
CobraCast 199 Post Gaming Stream - Make Gaming Great Again,xoCWt6SqsJc,2023-07-04T09:20:47Z
Emergency CobraCast 199 - We Have To Make NOISE!,ooyYvAwyYrQ,2023-07-04T04:20:08Z
CobraCast 199,YN_nMwfX3Sc,2023-07-01T07:46:49Z
CobraCast 199,z0WIbu8b3Z8,2023-06-29T06:54:47Z
CobraCast 199,cSJgnilGJcs,2023-06-27T08:04:51Z
CobraCast 199 Post Gaming Stream - Make Gaming Great Again,nLQ8yRm-xYw,2023-06-24T09:11:35Z
CobraCast 199,L3ATrWDjQfM,2023-06-24T04:11:15Z
CobraCast 199,eJ75yndRXGk,2023-06-22T07:32:46Z
DeSantis Getting DESTROYED By Trump - CobraCast 199,WFkTuAi016A,2023-06-20T06:51:09Z
CobraCast 199,8Tyoqq5mz84,2023-06-17T06:03:06Z
TRUMP Will NOT Be Stopped - MAGA Won't Be Stopped - CobraCast 199,FQuKh53IoEw,2023-06-15T06:46:28Z
CNN Meltdown After ACCIDENTLY Showing LOVE For President Trump,n8aAiMRW0XQ,2023-06-13T21:11:56Z
President Trump Arraignment LIVE,KNDO8r7cpi4,2023-06-13T20:30:00Z
Call of Duty GETTING Destroyed - Joe Biden EXPOSED | CobraCast 199,LCPhXFE2bEQ,2023-06-13T06:15:02Z
Call of Duty Goes FULL Bud Light - Trump Indicted AGAIN | CobraCast 199,VklFt2ZrMF0,2023-06-10T03:48:43Z
President Trump Indicted AGAIN - This is CRAZY |  Emergency CobraCast,3TK6X23UYwE,2023-06-09T01:05:09Z
MAGA Can't Be Stopped - Trump 2024 | CobraCast 199,n-NHCy-t9c8,2023-06-08T08:04:33Z
Let's Talk About Last Nights CRAZY Stream - CobraCast 199,VJmO1qNRliI,2023-06-06T20:12:52Z
They FEAR Trump - CobraCast 199,I2FUTNLRx40,2023-06-06T20:01:32Z
Elon Musk DESTROYS Wokeness - Biden Falls Down - Trump Goes Full MAGADONIAN | CobraCast 199,LtBnLEOKIOY,2023-06-03T03:45:48Z
DeSantis Getting WRECKED By Trump | AOC Is The Dumbest Person on The Planet - CobraCast 199,nPVNnotXsic,2023-06-01T09:00:30Z
AOC Gets DESTROYED By Obvious Parody Account,aVnvoqCFKv0,2023-05-30T18:38:39Z
The Babylon REEEEEE - CobraCast 199,JFCPkUGn7Xc,2023-05-30T06:28:00Z
Establishment Goes ALL IN For DeSantis - Trump vs The World | CobraCast 199,_6Noh2JBmmA,2023-05-27T04:27:46Z
Ron DeSantis Announces Presidential Run on Twitter Spaces with Elon Musk - CobraCast 199,J9hck1RvHWY,2023-05-25T01:36:56Z
CobraCast 199,zq-dGgS16Bg,2023-05-23T06:38:30Z
FBI Getting DESTROYED - Trump 2024 To Save America | CobraCast 199,hGAKgQWLdtE,2023-05-20T03:51:13Z
Trump Hits ALL-TIME High in Polls - CobraCast 199,Ng6JJk4Hl30,2023-05-18T07:15:47Z
Durham Report Proves Trump Right Again - CobraCast 199,cmziN-UqPJM,2023-05-16T07:30:07Z
Elon Musk Facing Major BACKLASH For New Twitter CEO Hire - CobraCast 199,EBeUjrRKJyY,2023-05-13T03:36:07Z
Anderson Cooper ATTACKS His Own Network - Trump Really Broke CNN Forever | CobraCast 199,Hzn_Xm1jhGU,2023-05-12T06:03:42Z
"Trump Destroys CNN, BREAKS The Internet - It's 2016 All Over Again | CobraCast 199",bDh3IZ4WnJA,2023-05-11T20:35:20Z
President Trump CNN Town Hall LIVE - CobraCast 199,KEw4_xHw8HY,2023-05-11T02:29:57Z
Tucker Carlson and Elon Musk BREAK The Internet - CobraCast 199,Qpt3BvSd8F0,2023-05-09T23:36:40Z
Bud Light vs The World - CobraCast 199,L2dnlcZB6kQ,2023-05-09T07:14:37Z
Bud Light's FAILURE and The Culture War - CobraCast 1️⃣9️⃣9️⃣,KLrXtYlTUqQ,2023-05-06T04:16:11Z
Matt Walsh vs Gamers - This is Why The Left Wins | CobraCast IRL,U1Xj8MCYY8I,2023-05-04T06:46:46Z
It's Time To Worry About 2024 - CobraCast IRL,mqAj2W7YNR4,2023-05-02T06:44:10Z
Tucker Carlson FIRED By Fox News - CobraCast IRL,P_OKiZ68R9U,2023-04-25T07:57:55Z
Tucker Carlson LEAVES Fox News | Don Lemon FIRED From CNN - Emergency CobraCast IRL,XCTxdr0PTtA,2023-04-24T17:39:17Z
"Matt Walsh HACKED | Elon Musk TROLLS Media Again | Trump Asks ""Where's Hunter?""",nDtv6nTEKnc,2023-04-20T18:14:37Z
Elon Musk Hits Microsoft with Major LAWSUIT - CobraCast IRL,eLQr_XkEerc,2023-04-20T06:57:03Z
MrBeast Controversy Getting WORSE | Elon Musk Talks To Tucker Carlson - CobraCast IRL,aBD6cW0UQw8,2023-04-18T07:38:06Z
MrBeast Story Getting CRAZY | Dylan Mulvaney RUINS BudLight | Trump Speech Reaction - CobraCast IRL,RWrxlM6P5rg,2023-04-15T04:53:17Z
Hasan Piker & Ethan Klein Target ME on H3 Podcast - CobraCast IRL,40MzMJP9m_E,2023-04-13T20:39:15Z
Elon Musk DESTROYS BBC Journo | Trump Talks To Tucker - CobraCast IRL,afqDEcymVHY,2023-04-13T07:10:56Z
Chaos! CobraCast IRL,pgkssnrivrY,2023-04-11T07:25:31Z
Trumps Wins Again | Stormy Daniels ADMITS He Did NOTHING Wrong - CobraCast IRL,AYRwV2aMj-w,2023-04-08T03:23:39Z
TRUMP 2024 To Save America - CobraCast IRL,cTOjJOOXlQ0,2023-04-07T05:54:36Z
Trump Arrest BACKFIRES | Democrats Panic - CobraCast IRL,U6vXZ54qcW8,2023-04-07T02:40:17Z
President Trump DESTROYS Alvin Bragg with Powerful Speech - CobraCast IRL,X7URJkeWtWo,2023-04-05T06:13:54Z
Trump's Arrest LIVE in Courtroom - New York CHAOS! Emergency CobraCast IRL,XVDc4cCs8YY,2023-04-04T21:26:33Z
President Trump Breaks The Internet as MAGA Dominates New York City | CobraCast IRL,M8eI80zcYXU,2023-04-04T07:19:40Z
CHAOS! Trump Indicted | Andrew Tate FREED | Man Actually Arrested For Memes - CobraCast IRL,NrImpHuNCXk,2023-04-01T04:37:39Z
Democrats Pathetic Attempt to ARREST Donald Trump Will BACKFIRE - Emergency CobraCast IRL,2-2SAZYziHE,2023-03-31T01:23:01Z
Democrats Are ARRESTING President Trump - USA Goes Banana Republic!,rw_uky22lDM,2023-03-30T21:52:46Z
Trans Activists Are DEFENDING Pure Evil | Trump Interview w/ Hannity - CobraCast IRL,DHsHXj0IhEo,2023-03-30T07:17:21Z
Mainstream Media IGNORES Nashville Tragedy - CobraCast IRL,PXSuRFvHeNI,2023-03-28T08:52:29Z
CobraCast IRL - Trump Hater Alvin Bragg Gets DESTROYED By Insane Deepfake Video,8NNYNYRCO90,2023-03-25T05:44:55Z
Trump DESTROYS Leftist Again - Pathetic Arrest Case IMPLODES | CobraCast IRL,2Kd7042PUKc,2023-03-23T07:34:38Z
Trump Arrest Insanity | DeSantis Facing BACKLASH | America Goes FULL Banana Republic,q2ikeYPYjC4,2023-03-22T18:31:19Z
Ron DeSantis SLAMS President Trump During Interview,WNUQPNHQBa4,2023-03-21T23:00:18Z
Trump ARREST Confirmed - USA Goes FULL Banana Republic | NYC Prepares For CHAOS,fd5s8qUkRGo,2023-03-21T20:08:49Z
"DeSantis ""Won't Get Involved"" with Trump Arrest | Get Ready For CHAOS - CobraCast IRL",q5M6fnp_RhY,2023-03-21T07:52:00Z
Ron DeSantis Goes SILENT Over Potential Trump Arrest - This Could END His Political Career,ElrPcq6xkow,2023-03-19T16:57:05Z
Elon Musk Predicts LANDSLIDE Victory if President Trump Gets Arrested,H_xS24eD1E0,2023-03-18T16:43:53Z
Democrats Threaten To ARREST President Trump NEXT WEEK - This Will DESTROY The USA | CobraCast IRL,I_UQlqAlh6g,2023-03-18T04:21:13Z
Jussie Smollett - 'MAGA Country' Brothers EXPOSE His Fake Hate Crime,nti-pMf3AtI,2023-03-16T23:04:08Z
Remember January 6th? Nope! Focus on Banks Now! Cobra Cast IRL,e-ne9fHPpus,2023-03-16T07:35:19Z
Elon Musk Makes Anthony Fauci Cry - This FRAUD Is Finally EXPOSED,fsze6lUue4o,2023-03-14T21:57:38Z
Dove Goes SUPER WOKE Over Brendan Fraser Oscar Win,k2kh8swQPGE,2023-03-14T20:07:33Z
Trump V DeSantis | Banks Are FAILING | Elon Musk DESTROYS Fauci - CobraCast IRL,NJFSqCTsZgo,2023-03-14T06:46:29Z
CobraCast IRL - Friday Night Tights Post Show!,F_aq4wV6VCg,2023-03-11T03:44:58Z
You Won't Believe What Jane Fonda Just Said....,mKxfQXpRIK4,2023-03-10T20:21:17Z
Keri Lake Just Did What Most Most Conservatives Can't Do,bCYxW4duhiM,2023-03-09T22:05:59Z
Elon Musk DESTROYS Chuck Schumer Over January 6th - LEGENDARY Troll Moment,quFax-5mjHQ,2023-03-09T19:04:44Z
January 6th BACKFIRE | Twitter Drama with Angry Joe | Birthday Stream - CobraCast IRL,L2WTtHUMBRM,2023-03-09T08:39:13Z
January 6th MELTDOWN Hits Insane Level - Tucker EXPOSES Truth | Elon Musk SLAMS Political Cover Up!,dGoaPYXeZCg,2023-03-08T19:48:17Z
2 Political ELITES Just Got EXPOSED - Tucker Going SCORCHED EARTH Tonight!,NKfV5BhDb2o,2023-03-08T01:02:09Z
Matt Walsh's Career is Over,Wg0mxgmU-5A,2023-03-07T19:53:35Z
Elon Musk Goes SCORCHED EARTH Over January 6th Footage - Media PANIC!,52Buh300RtU,2023-03-07T18:34:47Z
America Needs Trump as Democrats Are ABANDONING Creepy Joe Biden,96ZI6Anj56g,2023-03-07T16:09:38Z
Tucker Carlson DROPS MAJOR January 6th Bombshell - CobraCast IRL,4O2MJX4rekw,2023-03-07T07:39:44Z
Trump's Retribution | Chris Rock ENDS Will Smith | Joe Biden Has NO Support - CobraCast IRL,YfR-KMhf6Ho,2023-03-06T04:15:32Z
Every Man Should Be Worried About The Andrew Tate Story,LVijnICVb1w,2023-03-05T19:57:28Z
CobraCast IRL - AOC EXPOSED | Hershey Gets DESTROYED | Biden Has Cancer Removed,yzc_k6XnhcY,2023-03-04T05:51:51Z
CobraCast IRL - Lori Lightfoot FIRED | Joe Biden CRINGE Hits Another Level,s7SQPza2RaU,2023-03-02T07:53:04Z
CobraCast IRL - DeSantis DESTROYS Disney | Biden Continues To Embarrass America,W8yw_gRXRtI,2023-02-28T07:30:01Z
Hollywood Weirdo Has 2016 Meltdown - Trump 2024 Has Them TERRIFIED,CyKjX-GK4eA,2023-02-26T22:32:04Z
Woody Harrelson SHOCKS The World on SNL - Elon Musk Co-Signs | Mainstream PANICS!,FZsxHqMFLxo,2023-02-26T19:05:43Z
"CobraCast IRL - Right Winger Tries To Educate Me on ""Woke"" - Fails Miserably",rFI5HSISDYc,2023-02-25T21:08:27Z
"CobraCast IRL - Joy Behar HATES America | Timcast Writer Calls Audience ""Godless Freaks""",5sXptvsl79o,2023-02-25T06:23:47Z
"TimCast Writer SLAMS Audience as ""Godless Freaks"" | Ignores Eliza Bleu Cencorship Again!",xiPAMrGg-TQ,2023-02-24T20:58:01Z
Joy Behar BLAMES Trump Voters For Ohio Train Disaster - These People Are SICK,glcuFdxB9HU,2023-02-24T19:17:15Z
Things Are Getting VERY Weird,KaMbbBTnL6g,2023-02-23T20:55:15Z
CobraCast IRL - Trump DESTROYS The Haters | PROVES He's What America NEEDS,ck7IAdhtoPU,2023-02-23T09:39:24Z
Trump Says WW3 is Closer Than Ever | Biden Keeps IGNORING Ohio | Total Chaos!,J2mShNs7Ruc,2023-02-22T19:16:46Z
CobraCast IRL - James O'Keefe FIRED | Biden IGNORES Ohio | Don Lemon DONE at CNN?,HC9LurXH0e0,2023-02-21T09:06:09Z
"Don Lemon SUSPENDED For ""Sexist"" Remarks - CNN PANICS!",rm861GmUEiw,2023-02-20T01:58:10Z
CobraCast IRL - Trump DESTROYS Biden | Tucker Carlson EXPOSED? | More Eliza Bleu CRINGE,dRhxP0fuWH0,2023-02-18T07:22:35Z
CobraCast IRL - Chris Cuomo is CRAZY,NxqScitmzVY,2023-02-16T07:59:44Z
CobraCast IRL - Joe Biden is DESTROYING America,L4o0V74Tfmg,2023-02-15T07:00:57Z
CobraCast IRL Does What Timcast IRL Don't - FREE CHAT For All Voices,1hSJUsRLn_Q,2023-02-14T08:42:44Z
Cobra Cast IRL | Tim Pool DELETES Eliza Bleu Article and Blames AUDIENCE For Backlash,pqnBhibG0Po,2023-02-13T08:07:50Z
Cobra Cast IRL : Ep #2 - Tim Pool REMOVES Eliza Bleu Article on TimCast Website,nPgUQmpkiZU,2023-02-12T04:00:57Z
Cobra Cast IRL : Ep #1 - We Read Super Chats | Right Wing Media is DYING,cllUUnOIoXw,2023-02-11T07:05:59Z
Eliza Bleu CHANGES Her Story - TimCast IRL and Daily Wire Call Her Out!,r90qABSXdiw,2023-02-10T19:22:58Z
Timcast IRL STILL Doesn't Get The Eliza Bleu Story - It's About CENSORSHIP,1noVZV8MjOQ,2023-02-10T05:13:04Z
Tim Pool FINALLY Calls Out Eliza Bleu CENSORSHIP Scandal,p-uREyXD91A,2023-02-10T01:02:37Z
Tim Pool LIES To His Audience To Protect Eliza Bleu - This PROVES It,aI0xEs1leAQ,2023-02-09T06:47:30Z
"Hasan Piker Accidentally EXPOSES Left-wing ""Bullying"" - He's SCARED!",-82Zqa2IS04,2023-02-08T23:47:20Z
Biden's State of the Union DISASTER - Trump vs DeSantis - Twitter Executives Keep Lying,W5jQGhKDHUs,2023-02-08T18:31:26Z
Tim Pool BLAMES Audience For Eliza Bleu During UNBELIEVABLE MELTDOWN on TimCast IRL,3hLRQcKlUFw,2023-02-07T06:20:44Z
TimCast IRL Chat ROASTS Him Over Eliza Bleu DISASTER - Worse Than Jack Murphy!,vJJxroRgBkc,2023-02-07T01:46:43Z
Logan Paul Gets ROASTED By The Internet,sM8jnL94G5w,2023-02-06T02:46:17Z
TimCast IRL Meltdown Continues - It Just Got Worse! Eliza Bleu DESTROYING an Empire,Ew7YfuBRLXU,2023-02-05T02:39:29Z
Tim Pool MELTDOWN - Goes FULL Jack Murphy To Protect Queen Eliza Bleu,1DdSlbmeVNU,2023-02-04T21:17:09Z
Super WOKE Hollywood Star Wants Critical Race Theory in ALL Schools,j__ws40QbSQ,2023-02-04T03:28:27Z
Tim Pool IGNORES Eliza Bleu/Elon Musk CENSORSHIP Story - Over 20 YouTube Channels Hit!,tQYNvgQFskM,2023-02-03T19:10:20Z
Star Wars Site BLOCKS Fans - MASSIVE Backlash After Adding PRONOUNS To Characters,COHVfxrxi8w,2023-02-03T06:36:52Z
Andrew Tate's Biggest Hater Gets EXPOSED LYING About EVERYTHING - Eliza Bleu Bombshell,0FhA0uCfe1k,2023-02-01T21:54:18Z
Tim Pool DELETES Tweets After MASSIVE Backlash - Threatens To Abandon Eliza Bleu Story Completely!,wfzUcbTITCg,2023-01-31T21:51:22Z
Eliza Bleu : Jack Murphy 2.0 - Tim Pool IGNORES Another Major Story,BHPC39SJNQU,2023-01-31T18:07:53Z
Soyboy Twitch Streamer CRIES on Camera After Getting Caught - Pathetic and Embarrassing,10XlfQeBy74,2023-01-31T14:24:28Z
Mr Beast Gets DESTROYED For Helping Blind People - Wokeness Hits INSANE Level,B-44DJqChio,2023-01-31T06:46:27Z
Elon Musk CENSORSHIP Scandal Goes FULL Jack Dorsey on Twitter,iQEbhPpO-pY,2023-01-29T02:11:38Z
Ted Cruz Calls For Hunter Biden RAID - McCarthy SLAMS Media & Dems - Trump Defends Mike Pence,UbIWmDeVahQ,2023-01-25T18:31:30Z
Steven Crowder on TimCast IRL Was INSANE,QLdNsLHXdtY,2023-01-24T04:07:19Z
Steven Crowder Set To Break Internet on TimCast IRL TONIGHT!,uQsUjO4EtGE,2023-01-23T22:39:53Z
Logan Paul DESTROYS His Career - Coffeezilla Owns This Man,5VciPnpbqM8,2023-01-08T04:01:25Z
Logan Paul DISASTER Continues - Coffeezilla Broke This Man,Q6ypjW82JWk,2023-01-05T02:04:24Z
Logan Paul Just DESTROYED Logan Paul,TjsT45Vz7eE,2023-01-04T08:48:48Z
