Title,Video ID,Published At
Doctor Who Christmas Special TANKS. Media Blames Fans (Again),USyX_cYoE_8,2023-12-29T16:30:05Z
Will Kathleen Kennedy Renew The Book of Boba Fett for a second season?,S3UfQYKFio4,2023-12-28T16:30:08Z
Doctor Who Christmas Special TV Ratings CRATER,nXonjBpqZds,2023-12-27T16:30:12Z
Doctor Who New Season is QUEER and CRINGE - Ncuti Gatwa is LAME,lgcPJ7flcEk,2023-12-20T16:30:08Z
How Much Money Disney Lost on the 2023 Box Office - A Definitive Analysis,4VgFwv82mgU,2023-12-19T16:30:01Z
Jason Momoa knows Aquaman 2 will BOMB at the Box Office,oXklFPNXztM,2023-12-18T20:58:49Z
The Media Turns on the 15th Doctor Who - Ncuti Gatwa,P_Dhuzt91zg,2023-12-15T22:34:23Z
The upcoming CRINGE Doctor Who: Ncuti Gatwa,WuxluGWkkVk,2023-12-14T16:30:05Z
Adam Driver admits Kathleen Kennedy had NO PLAN for Star Wars sequels,bMQ3Cz1Q0vs,2023-12-13T21:39:53Z
James Mangold Admits Indiana Jones 5 had Multiple Endings,nXBxLOB0hGo,2023-12-12T22:30:04Z
Doctor Who 60th Anniversary Toymaker episode was a CRINGE FEST,an3cuzSsoWI,2023-12-11T22:50:18Z
Is DESPERATE Disney Rebooting the MCU?,Ly_-esXMht0,2023-12-08T22:30:15Z
Kathleen Kennedy is DESPERATE for a win with RUSHED Star Wars Rey film,wO31wng3vSo,2023-12-07T22:30:09Z
Marvel and DC Comics are DYING while Manga is THRIVING; MCU & The Marvels symptom of bigger problem,cpuq7tHHuh4,2023-12-06T22:30:09Z
Disney Pulls the Plug on Brie Larson's The Marvels,ODawfeECodc,2023-12-05T22:30:05Z
Dr Who 60th Anniversary continues to be CRINGEY,xiGxmmvm0_U,2023-12-04T22:30:06Z
"Bob Iger ADMITS Disney hurt Star Wars, MCU, etc",EzbJ1dyLUC4,2023-12-01T22:00:05Z
How much $ has The M-She-U cost Disney after The Marvels BOMB?,J2sUKaE47-4,2023-11-30T16:30:02Z
Disney unable to make movies like The Marvels any longer??,KYi7-9Ez90w,2023-11-29T19:31:18Z
Dr Who 60th Anniversary is CRINGE,0MJnnB91pdw,2023-11-28T18:07:40Z
"Audiences have ABANDONED Disney as The Marvels, Wish FLOP",KkeoxBizt0Q,2023-11-27T22:30:04Z
Dave Filoni won't save Star Wars; he belongs to Kathleen Kennedy,3wOMB9MU0Gw,2023-11-22T16:00:32Z
Disney learned NOTHING from The Marvels FLOP / More gender swaps INCOMING,LJa4NSSySwk,2023-11-21T17:56:44Z
"The Marvels is a Box Office Calamity, Smashing MCU Records for Futility",kVGdNfAoG_E,2023-11-20T17:30:05Z
The Marvels Director Calls out Fans for Her FLOP,5mXpNFzZ4q4,2023-11-17T21:00:22Z
Disney is protecting The Marvels with censorship campaign,th8LHCN7BU8,2023-11-16T22:30:06Z
How much will The Marvels BOMB cost Disney at the Box Office?,bn5s0KDeFgQ,2023-11-15T22:30:03Z
The MCU is scrambling to repair itself after The Marvels BOMBS,vYEFXfn34Zw,2023-11-14T17:34:54Z
Brie Larson gives CRINGE interview; The Marvels promotion FAILS,J2Y9VsDzh78,2023-11-13T22:35:08Z
The Marvels early numbers are AWFUL,YM__FAd4Pzk,2023-11-10T22:30:04Z
"Seriously, The Marvels is going to BOMB big time",QlU-phnEIqM,2023-11-09T22:30:04Z
The Marvels is ROASTED by critics; it'll be a BOX OFFICE BOMB,-Z4kEdMck24,2023-11-08T22:30:00Z
Evidence that Kathleen Kennedy Star Wars is DYING,zs7mFpfTR8k,2023-11-07T23:30:19Z
The Marvels is about to FLOP hard,sBj1wlhNNdA,2023-11-06T23:30:15Z
Rumor: Ahsoka Fights Anakin on Mustafar in new show; Kathleen Kennedy doesn't understand Star Wars,bsijk3KZ8h0,2023-08-09T15:00:34Z
"Star Wars comic CONFIRMS Lando was RUINED by Kathleen Kennedy, Lucasfilm's political agenda",kqj_iZ3ld5I,2023-07-25T15:30:12Z
'Kathleen Kennedy FIRED from Lucasfilm / Star Wars' rumors grow as mainstream media joins in,Xt-jNbdjDlo,2023-07-24T15:30:07Z
Blue Beetle is set to BOMB worse than Indiana Jones 5 and The Flash,iBJQwJ3dmlQ,2023-07-21T15:30:11Z
"John Boyega ADMITS Star Wars fans were right about The Last Jedi, Kathleen Kennedy",cbLkja27XjQ,2023-07-20T15:30:09Z
Media Lies to Protect Indiana Jones 5 and Kathleen Kennedy,FQtviLdAZxU,2023-07-18T15:30:06Z
Will Disney's FAILURES save Star Wars & Indiana Jones from the likes of Kathleen Kennedy?,y24oWpRBbp4,2023-07-17T15:30:25Z
"Jon Favreau, Kathleen Kennedy, and the ongoing TURMOIL at Lucasfilm",KUF3ENWEPJA,2023-07-13T15:30:05Z
Kathleen Kennedy shills make Flimsy Excuses for Indiana Jones 5 as Mission Impossible 7 SOARS,gmvSCp9TTlg,2023-07-12T15:30:08Z
Indiana Jones 5 Box Office WORSE than predicted; Kathleen Kennedy's magnum opus of FAILURE,bjEcxHKQTXk,2023-07-11T15:30:16Z
Indiana Jones 5 Damage Control is PATHETIC; Kathleen Kennedy already FIRED?!,wn46DmKa-M0,2023-07-10T15:30:22Z
Indiana Jones 5 Ad is CRINGE; Kathleen Kennedy & Lucasfilm are DESPERATE and PATHETIC,QlMRyYxvwu8,2023-07-07T15:30:06Z
The Flimsy Excuse for Indiana Jones 5 and Kathleen Kennedy has been decided on,Pc9InW9Aw9g,2023-07-06T15:30:06Z
Indiana Jones 5 Box Office Embarrassment; Rumors of Kathleen Kennedy Firing HEAT UP,kreGqZGjtuw,2023-07-05T15:30:10Z
Indiana Jones 5 Bombed as bad as we thought; Kathleen Kennedy's failure is COMPLETE,2BdSQVx2wFc,2023-07-03T15:30:00Z
Indiana Jones 5: Kathleen Kennedy's greatest FAILURE,jR-Q27WkhQk,2023-06-30T15:30:11Z
The MCU Phase 5 STINKS; Secret Invasion is ANOTHER FLOP,WIdW1QsYQHE,2023-06-29T15:30:15Z
Phoebe Waller-Bridge suggests female Indiana Jones will happen; this is Kathleen Kennedy's plan,ZFUCkdErVBo,2023-06-28T15:30:08Z
Evidence that Kathleen Kennedy killed Star Wars - she has got to LEAVE LUCASFILM,fKCLkXLCrQY,2023-06-27T15:30:09Z
Star Wars Ahsoka show marketed as 'Strong Wahmen' series by Kathleen Kennedy cronies,W9QqBXjaSq0,2023-06-26T16:00:15Z
"Rey Star Wars movie plot synopsis has LEAKED, and it's BAD",aPxKnYfB_O0,2023-06-23T15:30:00Z
"Kathleen Kennedy: it's ""Possible"" Phoebe Waller-Bridge takes over Indiana Jones franchise",UYCgqUSJVHQ,2023-06-22T15:30:07Z
Secret Invasion becomes least popular MCU show ever while Samuel L. Jackson ATTACKS 'Sexist' fans,eNX1P2pdtxo,2023-06-21T15:30:15Z
The AWFUL Indiana Jones 5 LEAKS are CONFIRMED; Kathleen Kennedy has a CATASTROPHE on her hands,qdk8ytoH9-c,2023-06-20T15:30:13Z
James Mangold to RUIN Star Wars lore; Kathleen Kennedy gives him the origin of The Force movie,fUSSHXKK78U,2023-06-19T15:30:11Z
Disney Pixar's Elemental: Pre Mortem Analysis of a Looming Box Office FLOP,aVqFvXhNMSU,2023-06-16T15:30:00Z
Indiana Jones 5 helps Phoebe Waller-Bridge land her next big role,L_0OkeS3xL8,2023-06-15T15:30:03Z
"Disney Delays MCU, Star Wars Movies",sEYvEvkipVA,2023-06-14T15:30:12Z
The Acolyte creator says George Lucas is NOT the real creator of Star Wars?!,Rb581uHCrF4,2023-06-13T15:30:08Z
The Little Mermaid FLOPPED BAD - a Definitive Analysis,YbrVo6shjts,2023-06-12T15:30:08Z
Indiana Jones 5 Box Office Projection PLUMMETS,HorWqiSqdaA,2023-06-09T15:30:06Z
Star Wars The Acolyte Season 2 Canceled Already? ANOTHER Kathleen Kennedy FAILURE,vesDyS5uXaY,2023-06-08T15:30:22Z
RUMOR: Disney Finances so bad they might... sell Star Wars?!,yhc1qSWPB7Q,2023-06-07T15:30:12Z
Mark Hamill FINISHED with Star Wars? What will Kathleen Kennedy do without Jake Skywalker?,CPbKmyFqKX8,2023-06-06T15:30:03Z
Indiana Jones 5 will BOMB; Kathleen Kennedy has another failed franchise,1pp1voADMd8,2023-06-05T16:02:51Z
Star Wars Fans labeled TOXIC by Kathleen Kennedy's Lucasfilm AGAIN,k5_pi9icX9A,2023-06-02T18:03:22Z
"Indiana Jones 5 ""Buzz"" harnessed to grow Disney Plus",3VKkDdKjivM,2023-06-01T15:30:01Z
The Last Jedi and Kathleen Kennedy cost Disney investors BILLIONS?!,4OuFPUgsR5c,2023-05-31T15:30:01Z
KOTOR Remake Cancelled? Another Kathleen Kennedy Star Wars Project Crumbles,Y-BLU5KwPQY,2023-05-29T15:32:30Z
Indiana Jones 5 Plot Leak is CRINGE - Kathleen Kennedy RUINED another franchise if true,vwbCsw-1hg0,2023-05-26T15:30:12Z
Harrison Ford Interview is a WARNING not to see Indiana Jones 5,DbyXB2_WNEw,2023-05-25T15:30:03Z
"Kathleen Kennedy Gone For Reals this Time? (the rumor mill totally swears it's true, my dudes)",rvrYJzmB1vY,2023-05-24T15:53:29Z
Kathleen Kennedy's Indiana Jones is BAD Fan Fiction TRASH,J9DOjfQU42o,2023-05-23T15:04:50Z
Kathleen Kennedy makes upcoming Rey film sound WORSE; Disney Star Wars is UNMARKETABLE,bkaFDftTTVM,2023-05-22T15:22:06Z
Galactic Starcruiser CLOSING; Kathleen Kennedy's CRINGE Star Wars keeps FAILING,K08A6UMLn94,2023-05-19T15:19:18Z
"Indiana Jones 5 Clip ROASTED online; Kathleen Kennedy, Lucasfilm FAILED again",vauG_H6OWoM,2023-05-18T14:35:34Z
"Dave Filoni, Kathleen Kennedy want to trick Star Wars fans with Member Berries",aHO5QJcqZ7g,2023-05-17T14:55:48Z
Bob Chapek SUED over Disney Plus failings; who could've seen this coming?,-DRnp4phLk8,2023-05-16T14:48:37Z
Kathleen Kennedy just HUMILATED Rian Johnson; his Star Wars trilogy is DEAD,qEQJd4CWYvA,2023-05-15T15:05:58Z
"Star Wars The Acolyte will be Queer and Political, according to creator Leslye Headland",YUs_kHXgQaU,2023-05-12T14:51:04Z
Disney Plus is Bleeding Subscriptions; Star Wars & Marvel won't save it,TcTDpo3WZtY,2023-05-11T14:56:02Z
Kathleen Kennedy still blames Star Wars fatigue on poor movie reception,a2dbSltBANE,2023-05-10T15:01:09Z
Disney Keeps Losing Money on MCU Films; Guardians of the Galaxy 3 STRUGGLING,XYOMrzInKC0,2023-05-09T14:13:28Z
Disney ADMITS: MCU Phase 4 SUCKED,B7cLRTx7ey8,2023-02-23T15:00:09Z
RUMOR: Bob Iger + Kathleen Kennedy desperate enough to bring back Rey Palpatine?,FgZkQAn5OrA,2023-02-09T14:30:07Z
Disney Civil War: Bob Iger vs Nelson Peltz - Will this Save Star Wars from Kathleen Kennedy?,vP0jUgfQgYY,2023-02-01T17:45:01Z
"The Galactic Starcruiser is Financially Ruinous; Kathleen Kennedy, Bob Iger should be ASHAMED",Ydtsz7EvDQo,2023-01-26T15:00:31Z
Mandalorian season 3 apathy... has Kathleen Kennedy ended Star Wars? Or is there still hope?,VXQ_Uhg1ew8,2023-01-22T16:00:14Z
