Title,Video ID,Published At
Adam Driver Says He's DONE With Disney Star Wars,DF_xy4tq71k,2023-12-31T01:11:50Z
"Disney Has AWFUL Box Office Year After Losing Over A BILLION, Media Refuses To Say They're Failing!",_QECKEi3YGo,2023-12-29T17:41:02Z
"Adam Driver Says He's DONE With Disney Star Wars, Madame Web Looks Like More Marvel Sh*t | G+G Daily",o33HCiIDpqM,2023-12-29T17:27:11Z
Disney Star Wars The Acolyte Leaks Sound Like A Woke NIGHTMARE! | Lucasfilm Disaster!,BeM2-NPWjKM,2023-12-29T02:43:19Z
Rings Of Power DISASTER Gets WORSE In Season 2 | Sauron Casting MOCKED By Fans,1KZ7QGkdaw8,2023-12-28T18:10:06Z
"Star Wars The Acolyte DISASTER New Leaks, Disney Is The BIGGEST Woke LOSER Of 2023 | G+G Daily",2kFFIEOGGZc,2023-12-28T17:13:54Z
"The Marvels Director Wanted To Go FULL WOKE CRINGE, And Disney Let Her",5G5u8Rz13JM,2023-12-27T23:35:46Z
"Rings Of Power Season 2 Will Get WORSE, The Marvels Director Wanted To Go Full CRINGE | G+G Daily",NQjTaZywDtY,2023-12-27T17:26:18Z
Disney Shills Have A MELTDOWN Trying To Protect The Marvels After Aquaman 2 Box Office FLOP,7ZwpjfGENzE,2023-12-27T14:45:28Z
Tuesday Night's Main Event,ta66DFIJAWw,2023-12-27T05:04:41Z
Kevin Spacey SLAMS Netflix Over House of Cards In WILD Christmas Interview With Tucker Carlson,ac9H1dYVGgQ,2023-12-27T05:00:01Z
"Aquaman 2 Is A Box Office DISASTER, Disney Shills COPE Over The Marvels FAILURE | G+G Daily",LJSiy0wtlDw,2023-12-26T17:15:23Z
Merry Christmas! G+G Daily,eTR4TQPFX24,2023-12-25T16:56:09Z
Rocksteady Gets DESTROYED Over Suicide Squad Leaks And CREEPY Child Poison Ivy,uaxMyuEoP50,2023-12-25T14:02:57Z
Vin Diesel Gets SUED After TERRIBLE Allegations From 13 Years Ago | Another Hollywood Star Accused,Cddfbq_AQvc,2023-12-23T16:05:51Z
The Iron Claw is AMAZING,uG6iJXmH8dg,2023-12-22T23:42:31Z
"DCEU DIES With Aquaman 2, Vin Diesel Hit With MAJOR Allegation, Suicide Squad BACKLASH | G+G Daily",qpTxb6KS82M,2023-12-22T17:34:57Z
Marvel Set To DOUBLE DOWN On Woke M-She-U | Young Avengers Movie Will Be A NIGHTMARE,QMKBuBccQtw,2023-12-22T15:03:13Z
Warner Bros And Paramount Looking At HUGE MERGER After Woke Hollywood Failure,sgn_hXE1MDo,2023-12-22T03:37:02Z
Netflix Gets MASSIVE Backlash Over Cocomelon Lane | Boy In Dress Dances For 2 Gay Dads,8VNqofngZBE,2023-12-22T00:31:21Z
"Marvel Headed For Cringe DISASTER With Young Avengers, Netflix DESTROYED For Targeting Children",nKDHf94Hn_Q,2023-12-21T17:29:18Z
DC Gets SLAMMED For LYING About Amber Heard's Big Role | Aquaman 2 Faces Box Office DISASTER,v069aD8WfKA,2023-12-21T17:14:49Z
Marvel Set To DOUBLE DOWN On Failed M-SHE-U | X-Men Reboot All About WOMEN,vb-uBl8QHG8,2023-12-21T04:41:22Z
The American Society of Magical Negroes Gets DESTROYED,rg0wyRhiLaU,2023-12-20T22:26:15Z
"DC Ready For Aquaman 2 Box Office DISASTER, Lucasfilm Still HATES Luke Skywalker | G+G Daily",fkBki7Z-fYQ,2023-12-20T17:43:16Z
Insomniac Leaks | Henry Cavill's Warhammer 40k | & More TNME,ZC4VQr6DPC0,2023-12-20T04:22:36Z
Jonathan Majors - He Wuz Kang,DnWt8pos4qY,2023-12-19T22:53:12Z
Marvel FIRES Jonathan Majors After GUILTY Verdict - Disney Facing Major Backlash,sjQ62Gn4gng,2023-12-19T17:37:08Z
Elon Musk Plotting To Take Over Disney!?,SwtZG07sd2s,2023-12-19T17:15:27Z
"Elon Musk SLAMS Disney Again - PlayStation Making ""Journalists Mode"" For All Games",f-9bSosWFqs,2023-12-18T17:29:04Z
"Aquaman 2 Is A DISASTER | Amber Heard Has MAJOR Role, One Of The Worst DC Movies EVER",OMheDNDvmZc,2023-12-16T02:00:09Z
Disney Is A TOTAL DISASTER | Lost Over $1 BILLION At The Box Office In 2023,H0tDDVKQQVw,2023-12-15T21:48:59Z
"Disney PANICS After Losing $1 BILLION As Investors Go To WAR, Netflix Shows The Numbers | G+G Daily",e43o4RgLRnQ,2023-12-15T17:34:59Z
James Gunn Gets BLASTED For Saying THIS About Superhero Cameos While PRAISING The Flash,DDLtmnjCIPQ,2023-12-15T05:15:27Z
Adam Driver EXPOSES Lucasfilm And Disney Star Wars | Kylo Ren's Story Was COMPLETELY Different,olhTl3jj19U,2023-12-15T01:15:08Z
Captain America 4 Is A TOTAL DISASTER For Marvel | Brave New World Being COMPLETELY Reshot,iJl1AcCZdUo,2023-12-14T20:57:22Z
"Captain America 4 Is A DISASTER For Marvel, James Gunn CALLED OUT Over DC Comments | G+G Daily",We9jZ92oHfY,2023-12-14T18:37:55Z
Disney FAILURES Are Destroying Hasbro! | MASSIVE Layoffs After Marvel And Star Wars COLLAPSE,8ZaT06SNjng,2023-12-14T03:28:31Z
Investors PULL OUT Of Disney After Pushing Woke Activism And Trying To SILENCE Elon Musk,9H9oFiVvMTw,2023-12-13T21:47:15Z
"Investors PULL OUT Of Disney Over Woke Agenda, Disney Star Wars Failure DESTROYS Hasbro | G+G Daily",G-ol6PZTTnw,2023-12-13T17:15:50Z
Shazam Actor Zachary Levi CALLS OUT James Gunn After He Casts His Brother To Play MAJOR DC Villain,cfnqiRK-aR0,2023-12-13T14:26:19Z
The Finals HYPE | E3 is DEAD | Epic Games DESTROYS Google - TNME,Nf_9Ft0GNQY,2023-12-13T05:27:44Z
Netflix Gets SLAMMED For Anti-White Racism In New Obama Produced Movie,jg5Oe7DVgiQ,2023-12-12T21:30:03Z
Woke Hollywood Gets DESTROYED At The Box Office,4CkXHh-36K8,2023-12-12T18:47:39Z
"Zachary Levi CALLS OUT James Gunn, Netflix Gets BLASTED For Obama Movie | G+G Daily",FitxjViip-o,2023-12-12T17:11:10Z
How To Make Star Wars Great Again,yFZkDe83QF0,2023-12-12T14:00:41Z
"Woke Disney Gets SUED By 9,000 Women Who Say They Got Paid LESS THAN Men | Virtue Signal BACKFIRE",rfpjUVEPd7k,2023-12-12T01:00:30Z
Doctor Who Gets COMPLETELY DESTROYED | Fans BLAST Showrunner After EMBARRASSING Special,Cg6gEH4oeGI,2023-12-11T20:51:29Z
"Disney Gets SUED Again, Hollywood Gets DESTROYED At The Box Office, Death Of Doctor Who | G+G Daily",pCNvI_ojaZc,2023-12-11T17:18:04Z
Aquaman 2 - Another Box Office DISASTER,ATgCgxbyCBo,2023-12-09T16:01:52Z
Rachel Zegler Apology Tour BACKFIRES,RErxva4R5Z4,2023-12-08T20:30:11Z
"Rachel Zegler Starts Her APOLOGY TOUR For Disney, Aquaman 2 Looks Like A DISASTER| G+G Daily",vFTw_GCoKwg,2023-12-08T17:31:02Z
Ryan Reynolds Addresses Deadpool Leaks,D41SC0FnL5E,2023-12-08T15:36:20Z
Elon Musk CRUSHES Bob Iger and Disney,KyvFnpQz2cc,2023-12-07T18:50:53Z
"Ryan Reynolds RESPONDS To Deadpool 3 Leaks, Elon Musk GOES AFTER Bob Iger And Disney | G+G Daily",uxVLGiMfH5k,2023-12-07T17:15:02Z
GTA 6 Might Roast Disney,IGX69CB0dzk,2023-12-07T15:24:04Z
Angelina Jolie on Hollywood & MORE Bob Iger Trouble for Disney | G+G Daily,nWkHt2vC_NU,2023-12-06T17:31:35Z
GTA 6 DOMINATES The Internet | Tuesday Night's Main Event,TvdIZzqKv2A,2023-12-06T04:48:42Z
Disney Facing Major Scandal,PDK4o5CQbus,2023-12-05T23:12:18Z
GTA 6 Takes Over The Internet - Shatters YouTube Record,lAimBY1Ebtk,2023-12-05T20:21:02Z
"Grand Theft Auto VI Trailer LEAKS EARLY, Disney Is In BIG Trouble In Florida | G+G Daily",a_n0tIdscgw,2023-12-05T17:25:15Z
GTA 6 Trailer REACTION,8IwVkhhbyLE,2023-12-05T00:23:30Z
GTA 6 Trailer Will BREAK The Internet,IP1qXkm3O2Y,2023-12-04T23:25:19Z
The Marvels is Disney's BIGGEST Failure Ever!,Xyc5FjnrJCU,2023-12-04T19:54:18Z
"Disney Admits TOTAL FAILURE With The Marvels, Wish Drops Off BIG At Box Office | G+G Daily",QG73-29R710,2023-12-04T17:34:28Z
Greatest Video Game Soundtracks of All-Time,EJYd_S0AGuA,2023-12-04T17:32:58Z
Disney And Bob Iger Dealing With HUGE Backlash! | Cancel Disney Plus Trends After Elon Musk Response,ycNXupiSHZY,2023-12-02T00:31:52Z
"MASSIVE Backlash For Disney And Bob Iger, Woke Hollywood Is IMPLODING | G+G Daily",JmqeZhEGL-0,2023-12-01T17:11:17Z
Bob Iger Blames EVERYONE ELSE For The Marvels Box Office FAILURE,ynGT3RgfUdo,2023-12-01T03:30:26Z
"Elon Musk DESTROYS Disney | Tells Bob Iger ""Go F*ck Yourself""",UyW6xqUsaQI,2023-11-30T18:43:34Z
"Elon Musk SLAMS Disney And Bob Iger, Disney ADMITS Marvel Is FAILING | G+G Daily",xb0wQa_iRVI,2023-11-30T17:27:23Z
Taika Waititi Admits He USED Marvel For Clout,HAJ8KjmcP2o,2023-11-29T20:13:07Z
Bob Iger ADMITS Disney's Woke Agenda Has FAILED | G+G Daily,nCfY4tQbSJ4,2023-11-29T17:31:45Z
Lady Ballers REACTION - Daily Wire SLAMS Hollywood Wokeness,Ip3IR6WAxjc,2023-11-29T17:20:15Z
Game Awards Controversy - Retro Video Game Music - CM Punk RETURNS To WWE | TNME,gJLSydstxeE,2023-11-29T04:55:34Z
"Jimmy Fallon CANCELED For Misgendering. Calls Actor ""Bud""",kCnUJO2eIec,2023-11-28T20:02:53Z
"Woke Disney ADMITS To Driving Fans Away, Taika Waititi Won't Stop Pissing People Off | G+G Daily",P7MQKESueLQ,2023-11-28T17:36:38Z
Doctor Who DISASTER - This is PEAK Wokeness,-tQ3Z0jfvc8,2023-11-27T19:58:05Z
"Wish Is A Complete Box Office DISASTER For Disney, Gets DESTROYED By Competition | G+G Daily",Zqd0tdOPTIA,2023-11-27T17:05:28Z
"Disney In PANIC MODE Over Wish Box Office, The Marvels Writer Hired For Tomb Raider | G+G Daily",0PHoQZi0txQ,2023-11-24T17:11:08Z
Jamie Foxx CANCELED - Wish Box Office Disaster | G+G Daily - Happy Thanksgiving,OaQPGwLcjc0,2023-11-23T17:02:36Z
Disney Star Wars is DESPERATE w/ Dave Filoni Announcement - Insane Mario Kart 8 News | G+G Daily,EBd1FfeBZGg,2023-11-22T17:02:59Z
"Dave Filoni Will ""Save Star Wars"" | The Marvels is BAD - TNME",LnOeKNXgyss,2023-11-22T04:42:27Z
Marvel Making Silver Surfer A WOMAN?!? - Amber Heard MISSING From Aquaman Trailer | G+G Daily,zmniNJ1vEVY,2023-11-21T17:16:12Z
Mario Party Superstars | Geeks + Gamers,acZvSh1hykc,2023-11-21T05:57:11Z
Legend of Zelda Movie Set To FAIL If This Happens,j0UNRaDZeh4,2023-11-20T18:49:00Z
"The Marvels Is The Worst Box Office FAILURE In Marvel History, This Just Got WORSE | G+G Daily",4PyknZhQtzk,2023-11-20T17:14:14Z
"""Historic Failure"" - The Marvels ENDS The MCU with 78% Crash at Box Office",isCvyDWc9HM,2023-11-19T17:24:13Z
Marvels Box Office Gets WORSE - Hunger Games Facing Same Problems | G+G Daily,B-DHPqUGec0,2023-11-17T17:13:35Z
Woke Marvels Disaster Will Lose Hundreds of Millions For Disney,OUMDmRHDuAE,2023-11-17T04:05:58Z
Marvel Casts Pedro Pascal As Reed Richards?!? | Rachel Zegler WORST EVER Hunger Games Box Office,nJUDZ9bFOA0,2023-11-16T17:04:51Z
"FCC PASSES Biden's ""Digital Equity"" Internet Takeover",1zK1MJU-geg,2023-11-16T04:07:27Z
"Woke MELTDOWN Over The Marvels Box Office FAILURE, Disney Star Wars Is Pathetic | G+G Daily",K59dWjJA6wA,2023-11-15T17:21:57Z
The Marvels FAILS - Game of the Year - Internet Censorship | TNME,KG0t1tKfJyg,2023-11-15T04:16:29Z
The Marvels Box Office WORSE Than Reported | Woke MCU Has FAILED,_1LCrKgn-Zk,2023-11-14T21:59:46Z
"The Marvels Box Office FAILURE Triggers MCU Shills, Marvel Might Be DONE With Kang | G+G Daily",Z-dG9q9CsV4,2023-11-14T17:24:36Z
Party Animals INSANITY | Geeks + Gamers,Pv-B5U0HB_o,2023-11-14T06:45:34Z
"The Marvels Is A MASSIVE Box Office FLOP For Disney, Captain America 4 DISASTER | G+G Daily",QZatwIeBgcM,2023-11-13T17:25:12Z
People Should Be Fired For This,xNIkVCN5Qp8,2023-11-12T21:13:27Z
Disney PANICS After The Marvels Gets HORRIBLE News,G7KQyyRvxS8,2023-11-12T16:33:15Z
Hollywood TURNS on The Marvel Cinematic Universe,Ygkb4WCemVM,2023-11-11T23:38:42Z
The Marvels is a FLOP! #Disney,4otCiI1J7sY,2023-11-11T18:32:36Z
"""Worst MCU Film Ever"" - The Marvels is FLOPPING Big Time at Box Office",b69AmhtGw5g,2023-11-11T04:14:30Z
Fans DEMAND Refunds - Modern Warfare 3 is a DISASTER,6_jen32p698,2023-11-11T01:43:46Z
This Game is STUPID,wLkeTxN1FvA,2023-11-10T23:59:17Z
The Marvels Is BAD - G+G Daily,_DbxaDgMYd8,2023-11-10T16:29:08Z
"""Men Did This"" | The Marvels is a MASSIVE Flop",BdfLNjHXqLA,2023-11-10T01:42:58Z
Disney PANICS To Protect The Marvels - Hollywood Strike Ends | G+G Daily,PHnMXALMnnE,2023-11-09T17:06:55Z
The Marvels Is EVEN WORSE Than You Think  - Spoiler Review,WE-N14CH7fQ,2023-11-08T23:23:26Z
"The Marvels Sounds Like A Cringe DISASTER, Kevin Feige Ready To LEAVE Marvel?!? | G+G Daily",Tdr1LzNk8_U,2023-11-08T17:24:14Z
The Downfall Of Marvel,jm8ySS6IqyI,2023-11-08T15:45:01Z
The Marvels Disaster!,dUGHnUHAXxg,2023-11-08T15:09:25Z
The Marvels DISASTER - Alphacore Launch - Live Action Zelda Movie Announced | TNME,fY3C918Q730,2023-11-08T04:35:24Z
A Live-Action Zelda! #Nintendo,B0k8VOH9CjY,2023-11-07T23:10:36Z
Live Action Legend of Zelda Movie CONFIRMED By Miyamoto!,-poXv8ny3H8,2023-11-07T22:28:19Z
Black Girl Magic | MCU Hits All New CRINGE Level,aa3OU0_vtb4,2023-11-07T19:55:13Z
"Marvel Is DESPERATE To Save The Marvels, New Trailer Gets DESTROYED By Fans For Reveal | G+G Daily",XKPALUoENUs,2023-11-07T17:19:44Z
More Bad News For The Marvels Box Office Predictions,hlxKr-wUwDM,2023-11-06T20:24:13Z
"The Marvels Box Office Just Gets Worse, Insomniac SLAMMED For Destroying Spider-Man | G+G Daily",qGYwGuKutXo,2023-11-06T17:26:37Z
"Insomniac TRASHES Peter Parker - Makes Miles Morales ""Spider-Man""",sBiInpoqx_Y,2023-11-06T02:13:59Z
The Marvels Tracking To Be The BIGGEST MCU Flop Ever,UcT9-cS2XnU,2023-11-06T00:00:00Z
Modern Warfare 3 Gets EMBARASSED By Fortnite OG,NnvaOTSADiw,2023-11-05T20:54:14Z
MW3 SUCKS!!!! #CallOfDuty,cjex-zAJJIk,2023-11-04T06:33:37Z
Everybody HATES Modern Warfare 3,rTJh9UHWEPg,2023-11-04T03:43:03Z
Gina Carano SLAMS Disney,k4cxalATlf8,2023-11-03T16:37:29Z
"Loki Ratings Are A Total DISASTER For Marvel, Ahsoka FAILURE - Disney Star Wars Is DEAD | G+G Daily",fAEj8q1lRfo,2023-11-03T16:30:28Z
Gina Carano EXPOSES Disney For Using Bot Accounts To ATTACK Fans,I9wKChkCRYI,2023-11-03T05:08:56Z
Hollywood's Lie Exposed,yneyyRmrOiI,2023-11-03T03:00:41Z
Blade Getting CANCELED? MCU Goes FULL South Park Meme!,CnFlhfkvfyI,2023-11-02T19:23:46Z
"Marvel Studios Is IMPLODING After BOMBSHELL Report, The Marvels And Blade In CHAOS | G+G Daily",8m1JobMdJTQ,2023-11-02T16:17:08Z
MCU Burning To The Ground - Disney PANICS!,3hVMPnOkcBU,2023-11-02T05:43:50Z
Gina Carano SLAMS Rachel Zegler - Five Nights at Freddy's Keeps Dominating | G+G Daily,adC8ezus4vY,2023-11-01T16:22:00Z
Gina Carano CALLS OUT Rachel Zegler Over Hollywood Hypocrisy,4jaPjrRRXPA,2023-11-01T07:44:32Z
Five Nights At Freddy's EMBARRASSING Disney at Box Office,6gLB5SOqvT0,2023-11-01T04:08:18Z
Happy Halloween - Tuesday Night's Main Event,TlSzPjVlaaA,2023-11-01T02:48:07Z
The Marvels Entire Plot LEAKS - This Movie is DOOMED,4rIc6LXG6b4,2023-10-31T18:56:05Z
"The Marvels Plot Leak Sounds Like A DISASTER, Disney CEO Bob Iger In PANIC MODE | G+G Daily",uWd1iW9k-n4,2023-10-31T16:32:53Z
"Party Animals w/ Nerdrotic, Melonie Mac and More | Geeks + Gamers",RAEtzX5lVrA,2023-10-31T06:01:14Z
Ex-Marvel Executive TARGETS Disney For Takeover - Says Company is FAILING!,LnUHK__p2zY,2023-10-30T21:30:29Z
Gina Carano DESTROYS Male Feminist,c-Lrtn2yW78,2023-10-30T17:05:00Z
"Gina Carano DESTROYS Kathleen Kennedy And Lucasfilm, Five Nights At Freddy's DOMINATES | G+G Daily",Rz3cZqGSe8k,2023-10-30T16:16:35Z
Gina Carano DESTROYS Male Feminist Kathleen Kennedy Fan | Disney Star Wars DISASTER,ktojliJKVt4,2023-10-30T02:53:28Z
"Five Nights At Freddy's WRECKS Useless Movie ""Critics""",WUlNt7LO-mQ,2023-10-29T21:00:30Z
Spider-Man 2 | Woke Disaster or Game of the Year?,Qb1jSltzMWM,2023-10-29T00:06:07Z
Live-Action Snow White DELAYED! #Disney,3xKGvCo9b3k,2023-10-28T17:53:40Z
Gina Carano CRUSHES Disney #StarWars,wF0cD87ko6Y,2023-10-28T07:56:29Z
Gina Carano WRECKS Kathleen Kennedy After South Park Panderverse Episode,doby7GLLHnE,2023-10-28T06:25:29Z
South Park DESTROYS Woke Disney 🤣,vNmG9Jlij3A,2023-10-27T20:42:19Z
Disney RESPONDS To Daily Wire Snow White - Delays WOKE Rachel Zegler Film,CFYJK5AR1lc,2023-10-27T19:22:20Z
South Park DESTROYS Disney with Into The Panderverse,9fbjfv0AsB0,2023-10-27T16:52:03Z
South Park Special Destroys Disney and Kathleen Kennedy | The Marvels Post Credit Scene | G+G Daily,kq9EIJQpPlM,2023-10-27T16:09:18Z
Pixar Chief ADMITS Disney Failure | Five Nights at Freddy's Tracking For HUGE Opening Weekend,3XYsEWPq5yE,2023-10-26T16:15:24Z
Kylo Ren Returning To Save Disney Star Wars? | Loki Producer RESPONDS To Criticism,WyCTs47xcUI,2023-10-25T16:36:20Z
Game of The Year HYPE | The Marvels Set To BOMB | Spider-man 2 Breaks Playstation Sales Record,g4XfKEQEbwU,2023-10-25T04:05:41Z
Party Animals RAGE : The DUMBEST Video Game Ever Made,Hp7SH3JD_h4,2023-10-24T17:43:32Z
"Box Office Excuses For The Marvels Begin | James Bond Goes ""Current Day""",JbOov6ZD_b0,2023-10-24T16:15:09Z
Will Smith and Jada Pinkett Just DESTROYED Disney Star Wars,BIbVuGicXyM,2023-10-23T21:50:16Z
"Marvel And Star Wars BLAME DISNEY For Their FAILURES, Actors Union BLASTED Over Strike | G+G Daily",_U5UB8DFBfY,2023-10-23T16:27:23Z
Major Drama at TwitchCon,ED9vms_y6vA,2023-10-22T20:24:17Z
"Publisher RUSHED Rise of Kong - ""Worst Game of the Year""",2QLpsQu5qAc,2023-10-22T05:55:35Z
"YouTube ""Temporarily"" Suspends SSSniperwolf - Blames ""Both Sides"" For DOXXING Controversy",x4O2lmoV9pA,2023-10-20T19:03:46Z
"Will Smith's FINAL Embarrassment, Disney FLOUNDERS, Another Rachel Zegler FLOP | G+G Daily",abp_9H_NCpI,2023-10-20T16:17:40Z
SSSniperwolf Backlash Gets WORSE For Youtube,2UcDUFwNwKw,2023-10-19T22:41:20Z
JK Rowling Ready To Face Prison Over Freedom of Speech,icpcT5bY8Mc,2023-10-19T20:44:37Z
Brie Larson Wants OUT | Marvel Falling Apart!,Bq4_rUIpy_s,2023-10-19T19:06:34Z
"Brie Larson Is DONE With Marvel After The BACKLASH, Disney Star Wars FAILURE Gets Worse | G+G Daily",1vg6vGspy5g,2023-10-19T16:14:15Z
Titanfall 2 LIVE - Make Gaming Great Again,sSl6fSlIDAQ,2023-10-19T05:44:33Z
Super Mario Wonder Reviews Are INSANE,rlWOFyn29xQ,2023-10-19T04:31:49Z
"""Worse Than Gollum"" - Skull Island : Rise of Kong Gets DESTROYED By The Internet",zbQYQsmDC7o,2023-10-18T21:02:08Z
Disney Star Wars Keeps ATTACKING Fans - Skull Island : Rise of Kong Gets ROASTED By Internet,TJBv9QLs1xs,2023-10-18T16:30:02Z
Disney Has REAL Competition - Nintendo 64 4K - GOTY Hype | TNME,25qQOcm4MO4,2023-10-18T04:26:44Z
Disney Star Wars Will NEVER Be Saved,XX_n0s0plCI,2023-10-17T19:52:03Z
Daily Wire DESTROYS Disney's MEGA WOKE Snow White,2QNxi9UUqrI,2023-10-17T17:58:56Z
"Woke Disney Has DESTROYED Their Company, They Get TROLLED Over Rachel Zegler Snow White | G+G Daily",y4tnK2f-yyw,2023-10-17T16:10:28Z
Let The Chaos Begin - Party Animals | Geeks + Gamers,Kbp0HsOeXD4,2023-10-17T06:20:28Z
"Marvel Ready To REBOOT After Woke FAILURE, Jada Pinkett Smith DESTROYS Will Smith AGAIN | G+G Daily",jBoNTzfa-v8,2023-10-16T16:14:41Z
Disney PANICS - The Marvels Set To BOMB at Box Office!,eMtgUyHtAPw,2023-10-14T13:41:06Z
"The Marvels Tracking To Be MASSIVE Box Office FLOP, Woke Robyn Hood BACKLASH Gets Worse | G+G Daily",6EGR8b0gvgQ,2023-10-13T16:16:24Z
The Worst Show Ever Made | Robyn Hood : A Successful FAILURE,mDa38oHCoXI,2023-10-13T16:15:02Z
The Iron Claw Trailer Reaction,d-y2fZUmv04,2023-10-12T17:39:37Z
"Marvel FINALLY Admits They Are FAILING, Disney Star Wars Gets TERRIBLE Ahsoka News | G+G Daily",I6Y1muUYntw,2023-10-12T16:13:43Z
Titanfall 2 LIVE - Make Gaming Great Again,bRVHMsGen2o,2023-10-12T06:21:15Z
James Gunn Fires The Justice League - Universal Embarrasses Disney Again | G+G Daily,CEZDpc5s5s0,2023-10-11T16:17:08Z
Bungie Gets Owned Again | Unity CEO Retires | New PS5 Announced - TNME,YGSml6u8r_0,2023-10-11T03:40:56Z
Bungie's Legendary LATINX Backfire,iFF3EUJMcHw,2023-10-10T20:23:50Z
"Marvel Gets BAD NEWS For Loki Season 2, Robyn Hood The Worst Reviewed Show In HISTORY | G+G Daily",G7ADKAIhm1g,2023-10-10T16:17:49Z
Monday Night Mario Kart Wars | Geeks + Gamers,ADYmdykXjS8,2023-10-10T03:27:22Z
"Disney Gets BAD NEWS After Bob Iger's FAILURE, The Marvels Set For DISASTER | G+G Daily",YMQ2BhpAAaw,2023-10-09T16:10:19Z
"Ahsoka Ratings Are BAD NEWS For Disney Star Wars, Can Loki Help A FAILING MCU? | G+G Daily",ZpDHfVQzfPY,2023-10-06T16:20:51Z
"Disney In Full PANIC MODE After Woke FAILURE, Marvel Blade DISASTER Gets Worse | G+G Daily",Ocs-07BFtpw,2023-10-05T16:40:01Z
Titanfall 2 LIVE - Make Gaming Great Again,jAP7Lde2JFo,2023-10-05T06:48:43Z
Ahsoka Finally ENDS Causing Major Backlash - Robin Hood Director MELTDOWN | G+G Daily,ttGU-zwxdNE,2023-10-04T16:19:31Z
Bungie Gets DESTROYED Over Super Woke Tweet - Naughty Dog Forced To FIRE Employees | TNME,8KGOyLjH0EQ,2023-10-04T04:21:11Z
"Disney Star Wars Will GET WORSE, Woke Bungie Gets DESTROYED, Loki First Reactions | G+G Daily",YpDNwKPCkqE,2023-10-03T16:12:35Z
Monday Night Mario Kart Wars | Geeks + Gamers,D78ykthb8s0,2023-10-03T03:31:42Z
"Disney Star Wars Gets More BAD NEWS, Marvel FINALLY Works On X-Men After DESTROYING MCU | G+G Daily",nsaCA3kZ0-0,2023-10-02T16:15:36Z
"Ahsoka Has MASSIVE DROP In Ratings, KOTOR Remake Looks Like Another Star Wars FAILURE | G+G Daily",7gPnXMX6NzA,2023-09-29T16:18:09Z
Major Playstation Changes - Christopher Nolan in Talks To Take Over James Bond Franchise | G+G Daily,5S8Dp_PCJYo,2023-09-28T16:21:15Z
Titanfall 2 LIVE - Make Gaming Great Again,1olQAx_by3k,2023-09-28T04:12:28Z
"Woke Hollywood Writers Strike OFFICIALLY Over, Ahsoka Gets Slammed, MCU Cringe | G+G Daily",L0Ck1sUCg44,2023-09-27T16:39:33Z
"Sony HACKED Again | Rachel Zegler ""Fired"" From Snow White  - TNME",4iqVUNmftp8,2023-09-27T03:48:18Z
"Marvel Gets DESTROYED For Secret Invasion DISASTER, Hollywood Set To REBOOT The Office | G+G Daily",9LFCjr30RuI,2023-09-26T17:55:30Z
Monday Night Mario Kart Wars | Geeks + Gamers,jq0XGViFHNk,2023-09-26T04:16:24Z
"Woke Hollywood Strike Is ENDING, Snow White Budget OUT OF CONTROL For Disney | G+G Daily",8XHgNKM5XaM,2023-09-25T16:58:45Z
Saturday Night Gaming | Fortnite x Titanfall 2,2PQsUoQoBcc,2023-09-24T06:30:24Z
"Ahsoka Ratings Are BAD NEWS For Lucasfilm, Disney GIVES UP On Culture War After FAILURE? | G+G Daily",miqHXeIDxjc,2023-09-22T16:23:33Z
Rumble Stands Against Cancel Mob - Leslie Jones Still Crying Over Ghostbusters 2016 | G+G Daily,su98sYxB2BA,2023-09-21T16:49:45Z
Battlefront 2 LIVE - Make Gaming Great Again,XlEdXJ2tMHo,2023-09-21T03:19:17Z
"The Marvels Is Another Disney DISASTER, Grand Admiral Thrawn FINALLY Appears In Ahsoka | G+G Daily",bIH1XOM0Mvc,2023-09-20T16:08:56Z
Titanfall 2 is BACK!,_DxvZMmpAYg,2023-09-20T07:44:32Z
Major Xbox Plan LEAKS - Microsoft Wants To BUY Nintendo - Russell Brand CANCELED | TNME,PkicXCy72MA,2023-09-20T05:18:39Z
"DC Fans WALK OUT Of Aquaman 2 Screenings, Media Thinks She-Hulk Star Was NOT PAID Enough | G+G Daily",YszaS9f5wb8,2023-09-19T16:11:58Z
Monday Night Mario Kart Wars | Geeks + Gamers,5-_kSYxm7dk,2023-09-19T04:01:38Z
"Another HUGE Box Office FLOP For Disney, Russell Brand Hit With BIG Allegations By Media | G+G Daily",Og5EWqWOlT8,2023-09-18T16:13:13Z
Titanfall 2 is BACK!,Ua_zbadKLSg,2023-09-18T09:21:23Z
The Nun II Beats Haunting in Venice as MI7 Gets a Lifeline and Oppenheimer Crosses 900 Million,49oyDeNSXOw,2023-09-17T22:32:43Z
"Disney Is DESPERATE To Sell Off ABC After Woke FAILURE, Jonathan Majors Video Goes Viral | G+G Daily",t0iT8IfUUvM,2023-09-15T16:21:24Z
"Aquaman Director Calls Amber Heard A LIAR, Bill Maher SLAMMED For Breaking Strike, Nintendo Direct",Se0GQGK1U_k,2023-09-14T16:32:37Z
"Anakin Skywalker RETURNS In Ahsoka, Disney Plus DESPERATE For Subscribers After MASS Cancellation",QtTdRbnSd7Y,2023-09-14T03:01:30Z
Tuesday Night's Main Event,TS4m3XI1FVE,2023-09-13T05:21:07Z
"Woke Hollywood DESTROYS Themselves, DC KNOWS There's No Hope For Aquaman 2 | G+G Daily",_B7GiDJ-F94,2023-09-12T15:17:15Z
One Piece Netflix Review From An Anime Normie,BYSXn4rJlQg,2023-09-11T21:22:49Z
"Aquaman 2 Drops a Trailer, One Piece is Dominating, & Dan Vasc is Takeover | G+G Daily",mkiZep6CZzU,2023-09-11T16:22:25Z
Bollywood's Jawan Makes Splash as The Nun II Dominates,GtpzTs7Tr4U,2023-09-11T00:41:45Z
"Jimmy Fallon CANCELLED After Allegations From Staff, EVERYTHING Goes Wrong For Disney | G+G Daily",7DRar0OoN-k,2023-09-08T16:32:25Z
"Hollywood EXPOSED Paying For Rotten Tomatoes Reviews, Disney Has To Pay Over $9 BILLION | G+G Daily",g2EMnoX8qdk,2023-09-07T16:27:08Z
Battlefront 2 LIVE - Make Gaming Great Again,RliZplIxipM,2023-09-07T03:50:56Z
Starfield Pronoun RANT Explained,JEP3ySei0E4,2023-09-06T17:06:50Z
Starfield Release Day - Ahsoka Finally Gets Fans Talking | G+G Daily,bZvqHqOZ-fI,2023-09-06T17:03:33Z
Starfield Pronoun DRAMA | One Piece Live Action | Tuesday Night's Main Event,H_r7I8Z2mGs,2023-09-06T05:38:32Z
"James Gunn BLASTED For Old Social Media Posts, Ahsoka Is A RATINGS FAILURE For Star Wars | G+G Daily",zJFTSVmDKAY,2023-09-05T16:42:50Z
Monday Night Mario Kart Wars | Geeks + Gamers,BNXXDCACwLI,2023-09-05T03:42:29Z
Starfield DRAMA Hits INSANE Level,0AuwLVBlzQg,2023-09-04T22:18:09Z
"Starfield Controversy BLOWS UP Over Pronouns, Ahsoka Is A RATINGS FAILURE For Star Wars | G+G Daily",wL7zud1rU30,2023-09-04T16:43:28Z
Barbie BEATS Super Mario Bros. As Equalizer 3 Opens Strong,Ceb3jTQKApw,2023-09-04T00:50:21Z
"Disney Is DESPERATE For Money After Massive FAILURES, The Marvels CRINGE Trailer | G+G Daily",_kOYGmpL9yc,2023-09-01T16:28:51Z
Late Night Clowns DESTROYED By Internet - Everyone HATES Them | G+G Daily,BfYhNYdrAwQ,2023-08-31T16:55:59Z
Battlefront 2 LIVE - Make Gaming Great Again,V7sDV0OPvzM,2023-08-31T03:30:37Z
Disney PANICS Over Ahsoka Ratings - Oppenheimer Might Hit $1B Worldwide | G+G Daily,muWfUumCCT4,2023-08-30T16:15:29Z
Ahsoka FAILS - Gran Turismo CRUSHING at Box Office | Tuesday Night's Main Event,AoUvsU4DjlU,2023-08-30T03:06:24Z
"Ahsoka Ratings Are A DISASTER For Disney Star Wars, Disney CANCELS More Streaming Shows | G+G Daily",go0-rPJYs4c,2023-08-29T16:09:57Z
Monday Night Mario Kart Wars | Geeks + Gamers,TuUy6G8iRBI,2023-08-29T03:18:54Z
"Blue Beetle Set To Lose $100 MILLION For DC, Disney PANICS Over Rachel Zegler Backlash | G+G Daily",SJFxdSnN8cI,2023-08-28T16:17:17Z
Blue Bettle to Lose $100 Million as Gran Turismo Starts Strong,2Unw9Vi93yQ,2023-08-27T18:22:57Z
"Disney Gets DESPERATE After Stock CRASHES, Dune: Part 2 DELAYED Due To Hollywood Strike | G+G Daily",rJfgFdux8ZA,2023-08-25T16:52:00Z
Barbenheimer DESTROYS Disney - Blue Beetle Continues To FAIL | G+G Daily,FWDRlIYPklA,2023-08-24T16:52:20Z
Ahsoka SAVES Star Wars | Blue Beetle Only Failed Because of Weather | G+G Daily,GtbMlvnLpGM,2023-08-23T16:27:14Z
Post TNME Gaming Stream - 199,FUXF6jYrhMY,2023-08-23T06:11:33Z
"Ahsoka Will ""SAVE"" Star Wars | Nintendo Legend Retires | TNME",UsrkIEwIA3A,2023-08-23T03:43:27Z
Snake Eyes lacked SNAKE EYES in the #GIJoe universe #trendingshorts #shorts,ufauNHIGXkg,2023-08-23T00:48:10Z
#AHSOKA can’t save #StarWars #Disney has killed Star Wars #shorts #trendingshorts,mNYflIb8kPI,2023-08-22T17:52:14Z
