Title,Video ID,Published At
How Godzilla Minus One Just DESTROYED Hollywood,zL55r7nofk4,2023-12-17T19:04:14Z
Why The Marvels SUCKS - A Scene Comparison,p_cK9_SUfLM,2023-11-24T00:05:46Z
My Live Reaction/Rage For The Ahsoka Season 1 Finale,hwM1EaeswW8,2023-10-08T14:15:09Z
Why Sabine SUCKS - A Scene Comparison,ySLuxgGc9Oo,2023-09-19T19:25:38Z
Why Secret Invasion SUCKS - A Scene Comparison,9uZHBoeRDfc,2023-09-01T16:02:21Z
Why Darkseid SUCKS - A Scene Comparison,EVuvhZVbxes,2023-07-31T03:09:28Z
Why Alien Covenant SUCKS - A Scene Comparison,uON1ddPA8wE,2023-07-10T21:14:03Z
Why Ironheart SUCKS - A Scene Comparison,kZgKgGIgZs4,2023-06-11T23:51:10Z
A Critique Of Jurassic World Dominion - A Crime Against Humanity,WMBZLz0qmP0,2023-05-15T20:51:44Z
Why The Mandalorian SUCKS - A Scene Comparison,1BWj9DA1AbM,2023-04-07T23:29:47Z
A Review Of House Of The Dragon Episodes 6-10,7KidcAsQQUA,2023-04-02T03:58:29Z
Why The Rings Of Power SUCKS Part 3 - A Scene Comparison,pz4uZEblmf4,2023-02-01T21:40:45Z
