Title,Video ID,Published At
DC Fans Should Be Very Worried About James Gunn DCU,fFfezScZajQ,2023-12-31T17:00:35Z
Where Marvel & DC Went Wrong & Comic Recommendations,R2GKAeRP92M,2023-12-30T22:30:02Z
Finally Free To Admit Comics Are Screwed | Comics Aficionados,zSFlRM1Yxn8,2023-12-30T17:31:53Z
Top 10 Worst Comic Books 2023 Revealed!,OeR1qPeaZFs,2023-12-29T20:30:07Z
Top 10 Best Comic Books 2023 Revealed!!,NeruujLfGyE,2023-12-28T17:00:11Z
DC Comics Have Lost Their F**king Minds!,fbfcyfbDLmk,2023-12-27T22:30:04Z
Aquaman 2 Box Office Final Nail In The DCEU Coffin,YRixGSPE7QY,2023-12-27T17:00:21Z
"What A WBD, Paramount Merger Means For DC Comics",_5Snm8dOIw4,2023-12-26T22:30:07Z
"Tini Howard, Comics Poster Child Of Sub-Mediocrity",7E8jLgLtos0,2023-12-26T17:00:04Z
Christmas Geek Fix Special With Aaron Sparrow,qsi-NMxZQiA,2023-12-25T17:00:39Z
Feige’s Rumored X-Men Plans Won’t Save The MCU,uBwHzqiNNaI,2023-12-24T17:00:39Z
Best Christmas Comic of 2023 & More Recommendations,QocILMpFnc8,2023-12-23T22:30:01Z
Most Important Comic Nerd Debates Settled! | Comics Aficionados,F-wWVCGwELc,2023-12-23T17:46:07Z
Who's Excited For More Girl-Verine?,Db0jKtBoIZ8,2023-12-22T17:00:18Z
Marvel Studios Fire Jonathan Majors After Conviction,-uYM2qUco-E,2023-12-21T17:00:00Z
Only Took 6 Years For Shill Media To Admit We Are Right,WFCheIfQTS8,2023-12-20T17:00:32Z
DC Comics | Take Your Stories and Characters Seriously!,TWmx-BTFYLU,2023-12-19T17:00:19Z
Marvel Comics X-Men Reboot Hard To Believe,Pt7fkrwUfxg,2023-12-18T17:00:32Z
DC & Marvel Are Making The Direct Market Collapse,O9j63KzFx8o,2023-12-17T17:00:24Z
Best DC Event In Years & More Comic Book Recommendations,0zCkp21GCjM,2023-12-16T22:30:00Z
Superman Writer Goes Nuts Over Mark Millar | Comics Aficionados,2I6Y7M-_M7k,2023-12-16T17:31:55Z
Collateral Damage | Disney Destroys Hasbro,F132bx60zMc,2023-12-15T22:30:01Z
Why I'm Finally Done With Mark Waid Comics,YwBXA-vWARM,2023-12-15T17:00:11Z
Comic Media War Against Mark Millar Is Hilarious,Ggo9-9JO_Xg,2023-12-14T17:00:22Z
"Did A Black, Lesbian Vampire Really Replace Moon Knight?",GUbJ3bDW9vI,2023-12-13T22:30:01Z
Netflix In Trouble For Blackwashing Hannibal,qAy_XwSlQbc,2023-12-13T17:00:44Z
The Dumbest X-Men Fan In Comics History,m8ENCGwWQjk,2023-12-12T17:00:43Z
Marvel’s Krakoan X-Men Going Out With A Whimper,EHuUTz3ysns,2023-12-11T22:30:02Z
DC Comics Can't Survive Creators Like This,Od-yDrPYi7M,2023-12-11T17:00:17Z
Comic Creators Chase Away Last Fans Standing,VPc0kZ0Xig0,2023-12-10T18:00:13Z
Marvel Fails Harder & The Best New Comics This Week,PBvaHOARwyE,2023-12-09T22:30:04Z
Comic Creators Attack 30-Year LCS Owner | Comics Aficionados,si35kLSF9MY,2023-12-09T17:14:40Z
Speaking Truth Is The Greatest Offense In Comics,Z3LWEPKWsDg,2023-12-08T18:45:00Z
Feige’s Robert Downey Jr. Replacement Is Absolutely Insane,Tdm8-uRf8jQ,2023-12-07T17:00:23Z
The Marvels Dies The Worst MCU Death Ever,22bnQ1nOiME,2023-12-06T17:00:02Z
Mark Millar Takes Millarworld To Dark Horse Comics,VoVn8JwDNLY,2023-12-05T22:30:03Z
"Another DC Comics Legend Exits, Another Marvel Buffoon Stays",WTMvYS1FFxo,2023-12-05T17:00:31Z
OG Comic Retailer Proclaims LCS’s In Death Spiral,WRuCam7zGR0,2023-12-04T22:30:08Z
Marvel’s Legend Of The Butt Baby aka X-Men Blue: Origins,2UdfjVn6ITA,2023-12-04T17:00:02Z
Another Reason Nobody Trusts Marvel Comics,vKmhgrryqpk,2023-12-03T22:30:09Z
Comic Book Retailer Wants To See The Industry Burn,l5ffuvnCd_s,2023-12-03T17:00:39Z
Beast World vs Gang War & More Comic Recommendations,CyPmOEuEk1s,2023-12-02T22:30:02Z
"DC & Marvel Bad Retcon Week, Beast World v Gang War | Comics Aficionados",r94aCIzuo2Y,2023-12-02T17:34:30Z
We All Warned DC Comics This Would Happen,47IIttTzEDQ,2023-12-01T17:00:03Z
Kevin Feige & Disney Scrambling To Save Avengers Franchise,8yLtKqxfx7Q,2023-11-30T22:30:01Z
Disney Story of Failure Doesn't Add Up,Z9maUSKUiaY,2023-11-30T17:00:22Z
You Thought X-Men Couldn’t Get Worse…,UIKa_KfBqd8,2023-11-29T18:15:02Z
Aquaman 2 Bombing Bigger Than Flash Or The Marvels,2N6A0Zfc9iw,2023-11-28T17:00:03Z
Am I A Sucker For Buying Into Jason Aaron Batman Offworld?,leMwFdTgvFk,2023-11-27T18:00:31Z
The Marvels Cope Biggest In Movie History,u49Mys6xeEA,2023-11-26T19:02:46Z
Jason Aaron Aces Batman & More Comic Recommendations,I7ot38Y3EdI,2023-11-25T22:30:02Z
"Tom King Wonder Woman, Celebrating Comic Dying | Comics Aficionados",RzZr4oucgOI,2023-11-25T17:29:43Z
Tom King Went So Far Over The Line This Week,u1zthHwbF9E,2023-11-24T21:00:29Z
"James Gunn Hires Lex Luthor, Denies Major Superman Rumors",hHMN0ObDl_c,2023-11-24T17:00:30Z
The Best & Worst New Comics This Thanksgiving Week!,fsUp58ie-04,2023-11-23T22:30:06Z
Disney Star Wars Is Dead | Dave Filoni Changes Nothing,cKpk9Suo8Pw,2023-11-23T17:00:33Z
Who In The Hell Is Happy About Comics Dying?,YxEqmbjUPOY,2023-11-22T17:30:04Z
The Marvels | Worst Week 2 Drop In Comic Movie History,edeMKLyUnKA,2023-11-21T22:30:04Z
DC Comics Hacks Don’t Compare To Warren Ellis,NVVn1UU-_Jw,2023-11-21T17:26:41Z
Nothing Interesting Left For Batman Or Joker,wx3Myw9Z2cM,2023-11-20T18:05:47Z
MCU Fantastic Four Rumors | Feige Still Doesn’t Get It,SLhmM7LJfhU,2023-11-19T19:30:02Z
DC's Terrible Manga Attempt & Comic Recommendations,EsbiAi_NvfY,2023-11-18T22:30:01Z
Kevin Feige’s Marvel Week From Hell | Comics Aficionados,QpnOQRd8was,2023-11-18T17:29:40Z
"Loki Actor Leaves MCU, Huge Captain American Failure",SLlRFUFM2F0,2023-11-17T22:30:04Z
The Best Comic Book Event In Years,cfsKB1qnNcI,2023-11-17T17:00:34Z
Marvel Comics 2024 Looks A Lot Like It’s 2023…UNINSPIRED,JW_Y4YF8psU,2023-11-16T22:30:04Z
The Marvels Dies At The Worldwide Box Office,5C8-jD_UeHA,2023-11-16T17:00:04Z
DC Comics Trinity Of Mid Villains Take Over 2024,V07ILKDr1HQ,2023-11-14T18:30:05Z
How Chris Cantwell Made Thanos Not Cool,Q5imLhogc1E,2023-11-13T20:30:04Z
"X-Men Fans Are In For A World Of Disappointment, Says Breevort",oDDXbbfZfj0,2023-11-12T22:30:05Z
Moron Attacks Mark Millar Before Admitting He’s 100% Correct,jsyVp8Ac9dI,2023-11-12T18:33:58Z
What Was The Point Of Punisher Reboot & Comic Recommendations,SUJaAa8w64I,2023-11-11T22:30:02Z
"Direct Market Meltdown, Media Attack Millar | Comics Aficionados",oWhZqMlM0TA,2023-11-11T17:16:43Z
Every Fan Conspiracy Theory Is True,G7twoyWzQWM,2023-11-10T17:17:44Z
American Comics Shops Are On Deaths Doorstep,JRCJLNPSmFA,2023-11-09T17:00:23Z
The Marvels Review Fluffing Isn’t Working,N4I2GdH8dfw,2023-11-08T22:30:02Z
Batman Comics Are Heading Down Wrong Path,MhAiYwOE2S0,2023-11-08T17:00:17Z
There’s Only ONE Female Superhero Comic Story,lLl82NQNb3Q,2023-11-07T20:15:02Z
DC Comics Flawed Plan To Compete With Manga,my2vEUfRgqw,2023-11-05T22:30:06Z
Feige & Marvel Falling Apart In Real-Time,Mjvuf1g3w4E,2023-11-05T17:00:23Z
New Ultimate Universe Begins & More Comics Recommendations,gAOZPZCsWMw,2023-11-04T21:30:04Z
"Major MCU Drama This Week, Gotham War Finale | Comics Aficionados",Yh_67K0GEA0,2023-11-04T16:31:30Z
Is Gotham War The Worst Batman Story Ever?,CBmufxROjrE,2023-11-03T21:30:00Z
South Park Panderverse Buries Disney & Kathleen Kennedy,Dj8LKqEQ9hE,2023-11-03T16:00:12Z
"Marvel Revamp Daredevil, Rumored To Cancel Blade & More",4dkUW4EgdK8,2023-11-02T16:00:06Z
DC Comics Hit Rock Bottom - Batman Gotham War Finale,KCjjxXw68Ds,2023-11-01T17:26:01Z
The Enemy X-Men Couldn’t Defeat - Marvel’s Editors & Writers,kvJUVsVvBPQ,2023-10-31T21:30:06Z
The Marvel Comic Everyone Should Be Reading NOW!,rULMSyHmJBc,2023-10-31T16:00:09Z
Flash Reboot Dead After Only Two Issues,oBiAoqEd4Ns,2023-10-30T16:00:40Z
"Spider-Man & Mary Jane Are Finally Married, Sort Of",HOW1t1p3ct0,2023-10-29T21:30:01Z
Feige Desperate To Save MCU From The Marvels Humiliation,R8RxlDhS8zs,2023-10-29T18:00:09Z
Weirdest Great Comic of 2023 and More Comic Recommendations,3uLFYhRxwc4,2023-10-28T21:30:00Z
Alarming Shutdown of Comic Shops | Comics Aficionados,Hp638C2bm_k,2023-10-28T16:53:55Z
Bob Iger Incompetence Opens Disney To Another Battle,EEIm043y-qg,2023-10-27T16:00:10Z
LA’s 2 Oldest Comic Shops Are No More,zDhn3MywgQQ,2023-10-26T16:01:00Z
Tim Sheridan Exposes Himself And Alan Scott,kyyRYztd2Wk,2023-10-25T16:15:03Z
Disney Star Wars Did Thrawn Dirty,J6W6hK7DnEA,2023-10-24T16:00:17Z
Hawkgirl Is The Self-Insert Wankfest DC Leadership Deserve,9g_WTVAgdeI,2023-10-23T16:00:07Z
Marvel Secret Empire Still Sucks 5 Years Later,ifyeABncIJU,2023-10-22T21:30:04Z
Feige’s Awful MCU Avengers Reboot Plan,uHnQmIA69cQ,2023-10-22T16:00:43Z
Big Game vs World’s Finest & More Comics Recommendations,T9-IkAB7Q3o,2023-10-21T21:30:04Z
DC Comics Trash Fans As Homophobic Trolls | Comics Aficionados,rRLWbwzY59g,2023-10-21T16:38:48Z
DC Comics Writer Calling Fans Queerphobes and Trolls,vuRuBQeAknw,2023-10-20T16:00:55Z
Marvel & DC Are Led By Morons,3LbMgfbJ1rE,2023-10-19T21:30:00Z
X-Men News | Jordan White & His Legion Of Doofuses Are Done,-NIsjmrNSTc,2023-10-18T18:13:00Z
DC Update Classic Batman Death In The Family Comic,YGugVeG-Tpg,2023-10-17T21:30:03Z
Keep Catwoman & Female Writers Away From Batman | Gotham War,xGBXV0UD_Fo,2023-10-17T16:30:09Z
A Not Terrible Comic From Stephanie Phillips!,FZekJrVcFog,2023-10-16T21:30:02Z
Marvel Comics NYCC Provides A Glimmer Of Hope,zv1MIym2x0g,2023-10-16T16:00:57Z
YES Bad Comics From Marvel And DC Hurts Comic Shops,3IPaBe1earA,2023-10-15T21:30:00Z
"My “Friend” Forced Me To Watch Ahsoka, I Didn’t Deserve This",Q9HdeuoAnZo,2023-10-15T17:00:07Z
Breaking Down Which Comics Are HOT OR NOT This Week,2XTfa6r6AEk,2023-10-14T21:30:00Z
"DC Reject Trans Suberboy, Break Alan Scott | Comics Aficionados",cQI4lTVv61k,2023-10-14T17:11:41Z
MCU Epic Fails No Longer Tolerated,A7qTtN9QXCY,2023-10-13T21:30:00Z
DC Comics Very Strange Day At NY Comic Con,RwVW_5pZRJM,2023-10-13T16:00:18Z
Disney Clean House After Daredevil Born Again Fiasco,YTcmSEOgg_g,2023-10-12T21:30:03Z
Captain Marvel Stans Cope Over Imminent Flop,LdgL21o7sLs,2023-10-12T16:40:08Z
Marvel Don’t Want You Reading Amazing Spider-Man,jVyz0nRklAw,2023-10-11T21:30:06Z
Amber Heard's Final Screw You To Aquaman & Jason Mamoa,Jv99ryhpRDM,2023-10-11T16:00:16Z
Marvel Publish Anti-Semitic Images In Daredevil,d7Xr2X4v7r8,2023-10-10T21:30:07Z
DC's Destruction Of JSA & Alan Scott COMPLETE,bCB4ByCOSog,2023-10-10T16:00:08Z
Writers Strike Cost A Shocking Amount Of Jobs & Money,HmK3jjJ090U,2023-10-09T21:30:01Z
Fall Of X Fails To Make X-Men or Gerry Duggan Exciting,OWkQUuH0KBE,2023-10-09T16:00:19Z
Another Historic Comic Shop Struggling To Survive,3Xlxfoo2ZF4,2023-10-08T19:00:04Z
Drew Slurps Transformers #1 & More Comic Recommendations,Xor9fkamjjw,2023-10-07T21:30:02Z
"Marvel’s Insane Prices, Dan DiDio Attacks | Comics Aficionados",XgT3Q2IfvPs,2023-10-07T16:46:45Z
Comic Creators Attack Dan Didio For Talking To Comicsgate,iMB2cb-5qnM,2023-10-06T16:00:37Z
TMNT Fans 4 Year Comic Nightmare Is Almost Over,QceOWpNIssU,2023-10-05T21:30:03Z
The Most Exciting Comic Book Debut In Years,wXsRbKeEPgg,2023-10-05T16:00:44Z
Marvel Comics Demand Insane Prices For Zero Talent,RELDANlZtDg,2023-10-04T21:00:11Z
"Chip Zdarsky Breaks Batman, Family Around Gotham War",v98vlTj4HwU,2023-10-03T21:30:09Z
LCS Owner Inconsolable Over The State Of Comic Books,hFITmqERdWs,2023-10-03T16:00:30Z
Stop Letting Leah Williams Write Superhero Comics,eR7W-BhTewQ,2023-10-02T16:00:28Z
Fantastic Four Rumors: MCU Learned Nothing From Phase 4,2l1exlgOXiA,2023-10-01T21:30:00Z
"Gunn Confirms Returning DCU Heroes, Undercuts Aquaman 2",0N0WKy6watg,2023-10-01T16:35:52Z
Comic Of The Year Contender & More Recommendations,8VD8DjDnM0c,2023-09-30T21:30:00Z
"You Can Break Superheroes, Creators Woes | Comics Aficionados",8plDuzsiFW8,2023-09-30T16:50:46Z
How Many Comic Shops Need To Go Out Of Business?,T-ttdKZyIMk,2023-09-29T21:08:09Z
Writers Claim Flawless Victory Over Studios During Strike,jlS8BZV9dpw,2023-09-29T16:09:39Z
Marvel Cancel Scarlet Witch After Only 10 Issues,f1OKU98tXXE,2023-09-27T21:30:04Z
Comic Creators Shocked Industry They Broke Is Crashing,jaywRzCLrL4,2023-09-27T16:08:28Z
DISNEY DISASTER | Snow White Remake Worse By The Day,yLqB3oEoIgM,2023-09-26T21:30:05Z
NOBODY At Marvel Can Explain Why Carol Danvers Is Cool,RL4GGaDngkU,2023-09-26T16:53:30Z
Marvel Needs Dan Slott To SHUT UP!,Swwtyz0N9T4,2023-09-25T21:30:05Z
Predator Vs. Wolverine | My Kind Of Fan Service!,1sWLIz21UbU,2023-09-25T16:00:46Z
Comic Retailers Begging DC & Marvel To Talk To Them,WDTYQ-tu430,2023-09-24T21:30:02Z
Disney Won’t Exit The Culture War Under Bob Iger,MXMzttTxMj0,2023-09-24T16:15:00Z
Mark Millar Mic Drops DC & Marvel & More Recommendations,i1jCuu4V7-4,2023-09-23T21:30:04Z
"Creators Reject DC & Marvel, Marvel Punt 2023 | Comics Aficionados",aoNWNcrOnrg,2023-09-23T16:44:17Z
The Marvels Budget Is Astronomical | Huge Flop Incoming,NcGce-KGs9s,2023-09-22T21:30:04Z
IDW Comics Lost A Staggering Amount of Money,cN86fBS27P8,2023-09-22T16:00:26Z
Good Creators Reject Marvel and DC A-List Heroes,PEW7imdLiDQ,2023-09-21T16:00:52Z
Writers Brag About Queering Mainstream Comic Books,zc7YfxoTmTY,2023-09-20T21:30:14Z
Lets Talk About Tom King's Wonder Woman #1,TxqmDWew2tM,2023-09-20T16:00:25Z
Comics Whisper Network Returns For Bill Willingham,gU26Bgc5RvA,2023-09-19T21:30:04Z
Real Reason Fans Walked Out On Aquaman 2 Test Screenings,0PwTX4wQRkQ,2023-09-19T16:00:01Z
This Isn’t The Iceman Comic You’re Looking For,x_WNg56-d6I,2023-09-18T16:00:47Z
Comic Sales Charts Aren’t That Important Or Difficult,GnyQ32qTeeo,2023-09-17T21:30:01Z
Something About Aquaman 2 Smells Off,XwftCf98tXw,2023-09-17T16:00:31Z
Did Batman And Robin #1 Save Batman Day? & More Recommendations,Lk1zTo4xueo,2023-09-16T21:30:02Z
Kaare Andrews Live With The Comics Aficionados,sjg7AD-pOKQ,2023-09-16T16:56:29Z
Alan Moore Giving DC Comics Royalties To BLM,r9lxrtZg-OM,2023-09-16T00:29:26Z
Fables Creator Gives DC Comics A Huge FU,h8UVXUJW96Q,2023-09-15T14:00:38Z
Hollywood Strikers Furious Drew Barrymore Back Working,uxFdJI08wUs,2023-09-14T16:00:41Z
The Secret Behind Vault Comics 137k Unnatural Order Sales,bOehpJcFuiE,2023-09-13T21:30:05Z
Are Mainstream Comics Really Killing Creators?,hjMHkhH6SLU,2023-09-13T16:00:28Z
Hollywood Shutting Down Everything Due To Strikes,8JtU2WbkuUs,2023-09-12T20:30:00Z
There Is NO Modern Audience For Krakoan Era X-Men,ZBh_8PW7ndA,2023-09-11T21:30:04Z
This Is Why Dawn Of DC Has NO Chance,q4h6Ap_crxg,2023-09-11T16:00:39Z
Multiverses Are Breaking Comics & Movies,TcD2yzFq3Ms,2023-09-10T21:30:04Z
Strikes Start Taking Down Hollywood Elites,ONmZfJLT0PE,2023-09-10T16:00:17Z
Be carful of DC comics #batman #dccomics #comicbook #batmancomics #marvel #teambatman #comic,tClZUTCT_yw,2023-09-10T12:00:11Z
New Contender For Best Comic Series 2023 & More Recommendations,ZZB4clcQrg4,2023-09-09T21:30:02Z
Kevin Grevioux Live On The Comics Aficionados,LSxH5SGXhcE,2023-09-09T16:36:03Z
Knight Terrors Another DC Comics Disaster,XN1jwDXWOT4,2023-09-08T21:30:04Z
Tini Howard Hits Rock Bottom At Marvel,QjonJZcRLio,2023-09-08T16:00:17Z
Jonathan Hickman's G.O.D.S. In Trouble 🤔 #marvel #marvelcomics #comicbook #comic #comicbooks,nA-DNUlzEpE,2023-09-08T15:29:50Z
Hickman’s G.O.D.S. Series Backfires On Marvel Comics,DuQO3DzacQ4,2023-09-07T16:00:08Z
Sales Charts Can't Fix Comic Industry Meltdown,RZOkokbe4Ws,2023-09-06T21:30:02Z
Nobody Is Watching Ahsoka!,67WFys6Tbm0,2023-09-06T18:28:58Z
Punisher Haters Know Nothing About Frank Castle,opMZuE-PdNo,2023-09-06T16:00:42Z
Jorge Jiménez Can’t Save Batman From Gotham War,ArF-YyWUbrw,2023-09-05T21:30:04Z
"Disney In Chaos | Mass Delay MCU, She-Hulk 2 Return",6KMyhGIlYvU,2023-09-05T16:00:10Z
Ms. Marvel Takes Boring To The Next Level,ZhpMmL4yO-4,2023-09-04T16:34:25Z
Shills Throw Temper Tantrum Over Mark Millar Being Right,R9g7EeAQT38,2023-09-03T21:30:01Z
Disney Sued For Lying About Streaming…Again,In5u677FEgg,2023-09-03T16:00:16Z
Marvel's New Best Series & More Comic Recommendations,uD-OHfRtdm4,2023-09-02T21:30:03Z
"DC Debase Batman & Catwoman, Ahsoka Woes | Comics Aficionados",34B98DEzq-E,2023-09-02T16:58:55Z
Ahsoka The Biggest Rebuke of Disney Star Wars,C1TEi4DesWw,2023-08-31T16:06:18Z
Si Spurrier Compares Himself To Alan Freakin’ Moore,TRFsLPrS95Q,2023-08-30T21:30:03Z
Did Fans Abandon DC Comics Heroes?,ZG2qogf4w8w,2023-08-30T16:00:22Z
And Just Like That Chip Zdarsky’s Batman Run Died,ViKpTh6ZsMQ,2023-08-29T21:30:02Z
Ms. Marvel Beaks New Records In Latest Disaster,SM8BtsH-q_k,2023-08-29T16:00:19Z
The DC Comics Trinity That Never Was,YMVw03uf3Xw,2023-08-28T22:00:16Z
45 Issues Of Knight Terrors Leads To THIS!!!,TANEzoH2mf4,2023-08-28T16:00:30Z
Sad Reality For C-List Characters & Indie Comics,xJLcdxET200,2023-08-27T21:30:05Z
"CBR Is Dying A Hilarious, Slow, AI Driven Death",Rlm2AQ7IKUA,2023-08-27T16:00:30Z
Mark Millar Big Game Brings Pain & More Comic Recommendations,_Jl2r18etHI,2023-08-26T21:30:02Z
"Go Away Tom King, The Marvels FTW? Comics Aficionados",2mSblhBeJjE,2023-08-26T16:47:16Z
Please Don't Let These Rumors Be True,-JRL7973gpo,2023-08-25T21:30:00Z
Mark Millar Has A Plan To Save Comics & More,woP0AlfNWNw,2023-08-25T17:00:39Z
Now I’m Getting Really Annoyed,XifTdihGoIc,2023-08-24T21:30:05Z
James Gunn Cannot Reverse DC's Rapid Decline,qJDmdAWOfls,2023-08-24T16:00:40Z
Tom King And Wonder Woman A Match Made In Hell,c0YPady3zQU,2023-08-23T16:00:24Z
The Most Absurd Take On DC Comics In History,N3HR_z1zkXk,2023-08-22T16:00:27Z
2023 Box Office Flops Much Bigger Than Media Admit,NFx4URLjMFs,2023-08-21T21:30:03Z
DC Comics Kill Another Character With Huge Potential,Mx20VyMwx44,2023-08-21T16:15:02Z
Magic Order Finale Rules & More Comic Recommendations,1yfIr6-rEHw,2023-08-20T21:45:00Z
Mark Millar Talks Everything Geek On Comics Aficionados,Qz9o9pGWsIM,2023-08-20T18:38:03Z
Anyone Else Getting Bad Vibes From James Gunn?,KRO6P1Vcv10,2023-08-19T21:30:03Z
Is The Blue Beetle Movie Successful Or Not?,lPufUSWXwAk,2023-08-19T16:00:35Z
We Need To Talk About Marvel Comics (Disastrous 2023),3RMLEfOHjNc,2023-08-18T22:30:00Z
"Wolverine Sabretooth War Event Too Little, Too Late",7PFr-0hQW-s,2023-08-18T16:45:00Z
How Do They Keep Getting Work?,0qu-xD_lHAY,2023-08-17T21:30:00Z
What To Make of X-Men's Krakoan Age & Jordan White’s Future,ig03wkZHCLM,2023-08-17T16:00:29Z
Tom Taylor Makes Jon Kent Unworthy Superman,No38wOUBJ20,2023-08-16T16:40:02Z
Amazing Spider-Man Isn't Worth The Paper It’s Printed On,DOgn39MtO30,2023-08-14T16:30:02Z
"Spider-Man's ""Most Notorious Story” Getting A Sequel",XEtJw8X5YVM,2023-08-13T21:30:01Z
Why Saving X-Men Comics Is Harder Now Than Ever,psAD3DQ4kSs,2023-08-13T17:15:02Z
Westerns Are Back & More Comic Book Recommendations,I7kFLZXKa9Q,2023-08-12T21:30:01Z
"Spider-Man Hits Rock Bottom, IDW Mess | Comics Aficionados",xwzy6Ebtydk,2023-08-12T16:20:19Z
IDW Killing Comics Has The PERFECT Ending,9gj_K2V16z4,2023-08-11T17:30:02Z
Disney Selling Out To Apple Becoming Inevitable,vaZ-xEx_S68,2023-08-10T21:30:04Z
Bane Creator Slams Blue Beetle Director’s Socio-Political BS,NoZ63NfbbVM,2023-08-10T16:00:28Z
Is Tom Brevoort Leaving Marvel Comics?,pQZ5R--XRVg,2023-08-09T16:00:42Z
Spider-Man Manga Destroys Everything From Marvel Comics,4wfhcOviMfs,2023-08-07T16:45:00Z
Comic Shill Media Can't Even Complain RIGHT!,vfKWqhY8KHU,2023-08-06T21:30:09Z
Marvel Comics Cuck Tony Stark Iron Man HARDER,9tt549qMmNc,2023-08-06T16:00:13Z
Conan The Barbarian Done Perfect & More Comic Recommendations,esuU9Hme90Q,2023-08-05T21:30:06Z
"Comic Shops Get Desperate, MCU Reboot? | Comics Aficionados",9G00tuOsTjo,2023-08-05T16:39:13Z
Say It Ain’t So Lizzo!,xglbi-cHnJI,2023-08-04T21:30:04Z
Astonishing Iceman IS 2023 Superhero Comics,N41Kg8nTFQk,2023-08-04T16:15:00Z
TV Exec Believes Feige Already Planned His MCU Reboot,PUEM7BgW9hg,2023-08-03T16:46:00Z
Stop Letting Hack Writers Destroy Classic Characters,lOgh4T5-ZqY,2023-08-02T16:00:39Z
Comic Book Retailers Desperate Enough To Be Honest,kfBgUmF9bgw,2023-08-01T16:00:27Z
Marvel Break The First Rule Of Comic Books AGAIN!,OToWm8TDqc4,2023-07-31T21:30:01Z
Andrew Tate Comic Is Ludicrously Expensive! Looks Bad Too,r0THTsIH1BQ,2023-07-31T16:00:41Z
Hollywood Accidentally Find Their New Audience,7TsmlQpx_KY,2023-07-30T16:00:07Z
DC Ignore Their Best New Series & More Recommendations,tdwRGKAFlv4,2023-07-29T21:30:05Z
"Can Politics In Comics Go Back?, SDCC 2023 | Comics Aficionados",Rhi1qZA_BqI,2023-07-29T16:24:07Z
Comic Con Better Off Without Hollywood!!,-93Bb1YI9yA,2023-07-28T21:30:00Z
DC Comics Make You Regret Coming Back Every Single Time,G15KUK1Plss,2023-07-28T17:00:08Z
Can WBD Finally Fix Aquaman And The Lost Kingdom?,TDYjmebp6b0,2023-07-27T18:15:51Z
Did DC Comics Sales Just Triple In 2023?,F0qeZvllbUY,2023-07-26T16:00:20Z
"Holy S**t, They Actually Said IT!",_dO8BzgB_mg,2023-07-25T16:00:27Z
Marvel Spoilers | Hellfire Gala Is An Absolute Disaster!,KDzSriCkU_o,2023-07-24T21:30:03Z
The Worst Thing I've Done To Dok....YET!,QntvEdo37eA,2023-07-24T16:00:21Z
Things Can Get Worse For James Gunn & The DCU,5B2joRAuQg0,2023-07-23T21:30:00Z
Disney Destroying Next Avengers Team,bikZNZMiNJY,2023-07-23T16:00:26Z
THE Comic Book Event Of 2023 Is Here & More Recommendations,h-VM63DAwxU,2023-07-22T21:30:04Z
Just How Bad Is The Comic Industry Now? | Comics Aficionados,AGvHpUunZT8,2023-07-22T16:50:24Z
S**t Show At The Comic Book F**K Factory,RJ0FkbrTADA,2023-07-21T21:30:04Z
Am I Supposed To Feel Bad For These Other Morons?,ywzOVCe2qP0,2023-07-21T16:00:56Z
Comic Book Sales Are Way Worse Than You Imagine,aXeXtZ2GHxM,2023-07-20T21:30:00Z
Box Office Disaster: Disney Can't Save The Marvels,ekorbcHyB1o,2023-07-20T16:15:01Z
The Depressing State Of American Comics,WwvyQw2F0Ks,2023-07-19T21:00:28Z
Marvel Did Everything Wrong With Punisher,kCuRCJusOmg,2023-07-18T21:30:05Z
Ms. Marvel Is The Least Important Marvel Hero EVER!,YpvY9uMmlk0,2023-07-18T16:00:18Z
Hollywood Is Dying At Their Own Hands,vGj2HBbOPvI,2023-07-16T21:30:04Z
Barbie: How To Kill Your Franchise Before It Starts,a_S7pLP0G7k,2023-07-16T16:00:04Z
Mark Waid Almost Nails Teen Titans & The Best New Comics,iTa9RVY_Ka4,2023-07-15T21:30:03Z
"Comic Fans Toxic, Ms. Marvel Laughable | Comics Aficionados",YCPGdqzhnGw,2023-07-15T16:50:49Z
Can Tom Cruise Save Hollywood Again?,ZZ1yFlGTXN4,2023-07-14T21:38:57Z
Disney Signs Up For 2 More Years Of HELL!,MC4bOaIgAzg,2023-07-14T17:00:25Z
Superman Legacy Is Getting Weird Fast,1839VdEPBZo,2023-07-13T21:30:01Z
Mainstream Media Morons Are The Worst Hypocrites,A_DG2puSkAo,2023-07-13T16:00:05Z
"Comics Fans Aren’t Toxic, Comic Book Media Is!",P1xO7_L4az4,2023-07-12T17:30:02Z
DC Comics Fans Worst Nightmare Is Here!,DqYk5UNdwVU,2023-07-11T21:30:01Z
Indiana Jones Goes Down In Week 2 | Mangold Freaks Out,d5IEdWxziOc,2023-07-11T16:00:23Z
2023: A Cinematic Catastrophe - Disney's Darkest Year,kH0elIHYqVQ,2023-07-09T16:30:11Z
DC’s Knight Terrors Fiasco & The Best New Comics,XaQkxcqN8ns,2023-07-08T21:30:03Z
"Why Modern Comics Fail, Indiana Jones Flop | Comics Aficionados",gegXPxc15iU,2023-07-08T16:25:08Z
Spider-Man Finally Delivers Something Worth Hating,q3vi0JF7HlE,2023-07-07T20:00:14Z
Video Games Are Hollywood's Next Big Victim,zNgHOWfXEOk,2023-07-06T17:36:34Z
Why Disney Altering Daredevil From Netflix Is A Bad Idea,g1YmAVqz5Xk,2023-07-05T16:00:35Z
Is Marvel Making An Actual Good Blade Comic Book?,CCn25SgIy3k,2023-07-04T21:30:01Z
Our Comic Book Nightmare Is Finally Over!,I90lw61z2Uw,2023-07-03T21:30:04Z
Expectations Were Low But HOLY F**K!,oSUEKq-i-fk,2023-07-03T16:00:40Z
Disney Pledge To Crush George Lucas Star Wars,FZtPjFfoGcY,2023-07-02T21:45:00Z
The Spin Is On To Save Aquaman Sequel,6EjQugGVyi0,2023-07-02T16:00:04Z
"2 Box Office Catastrophes, Spider-Boy Hate | Comics Aficionados",zZY6rsVJs3U,2023-07-01T16:28:42Z
Why Events Are Killing Comic Books,AZiGVW_V-YE,2023-06-30T18:00:05Z
Indiana Jones Is About To Break The Wrong Record,BbD_lLIKd1M,2023-06-29T18:20:09Z
Flash News Somehow Gets More Embarrassing,gpObSFliPmw,2023-06-28T21:30:07Z
Comic Con Goes Down At The Worst Time!,9hV6UsCcgX4,2023-06-28T16:18:51Z
James Gunn Hires Henry Cavill-Lite As New Superman,VGiEnSvH76k,2023-06-27T20:55:44Z
Bad News For Spider-Man Across The Spider-Verse Fans,iKIgfONCUwY,2023-06-27T16:31:51Z
Teen Girl Tom King Is The BESTEST TOM KING!,4MVd74otMHg,2023-06-26T16:30:29Z
Kathleen Kennedy Wants Indiana Jones 5 To FAIL HARDER!,QF1W0GwLpvU,2023-06-25T21:30:02Z
2 Hot Marvel Comic Debuts & The Best New Comics,vL0SUZiK1RA,2023-06-25T16:00:38Z
Geek Talk With Special Guest Eric July Live | Comics Aficionados,9Fc6SE4eZIE,2023-06-24T16:15:40Z
The Acolyte Sounds Like The Worst Star Wars Anything Ever,NTQI2_tDZRI,2023-06-23T22:00:09Z
Marvel Skip SDCC | Scramble To Fix MCU,SrMr5VzuMZA,2023-06-23T16:30:05Z
James Gunn’s DCU Is Already Dead,WTfnKJmSfJ0,2023-06-22T21:30:04Z
Comic Publishers Passing Off AI Art As Original Work,137VCpP5s5s,2023-06-22T16:00:02Z
Not Even Marvel Know Why This Is Happening,r3LAzuLhfPs,2023-06-21T21:30:08Z
LCS Owner Lays The Smack Down On Marvel Comics,CgNQa4jSI4g,2023-06-21T16:00:14Z
This Is Why Modern Comics Fail Constantly,0xX1jy5BrPk,2023-06-20T16:00:02Z
Box Office Flop! Flash & Elemental Bomb HARD!,jQp6ixvPaSs,2023-06-19T16:41:08Z
James Gunn Hires New Batman Director For DCU,gv7QNc7-D08,2023-06-18T21:30:03Z
Best Comic Book News I’ve Heard In 2023!,WfdqLF9qMX8,2023-06-18T16:00:21Z
Kirkman’s Huge Surprise & The Best New Comics,R0rzuSZYlKA,2023-06-17T21:30:04Z
Comic Pro's Unbelievable Meltdown | Ultimate Universe Returns LIVE!,owipxf5XBEE,2023-06-17T16:43:31Z
Why Disney's Next Movie Might Be Its Biggest Flop Yet,W0Wc_K0hffI,2023-06-16T21:30:02Z
Eric July Is Living The Comic Dream & Clownin’ Haters,TQ82FAhS4OM,2023-06-16T16:00:50Z
Hickman Relaunching Marvel Ultimate Universe Feels Off,RDc0emEFB2k,2023-06-15T19:00:22Z
Am I Supposed To Feel Bad For These Morons?,8hJizXFmpeg,2023-06-14T17:15:00Z
DC Comics Latest Iron Man Knockoff Debuts,-E9S8xRU5dU,2023-06-13T21:30:00Z
DC Comics Blacklist Fan Run Comic Review Site,nJFEcpr-yCc,2023-06-13T16:00:37Z
Legendary Marvel Writer Breaks Down Frank Castle Punisher,Bt9E0IomdB8,2023-06-12T21:30:01Z
Marvel Comics Turned Cyclops Into A Giant P**sy,gPdtYybZsos,2023-06-12T16:00:25Z
