Title,Video ID,Published At
Why You Should Learn This Skill..,xuhL7KPzQa4,2023-12-30T10:41:57Z
How To Clear Your Mind,fc6P8nGDg0Q,2023-12-29T22:12:48Z
The Secrets of Success,DJGEgRht6b4,2023-12-27T18:51:14Z
Productivity Tools #3,-MIEKDdq0t0,2023-12-27T11:34:06Z
Productivity Tools #2,ikzfq8pkSZM,2023-12-27T03:17:02Z
Productivity Tools #1,OPjq4_Ynn6M,2023-12-27T01:58:43Z
ADHD IS Your Problem,mDM6DgJfk0k,2023-12-25T03:50:43Z
There Are NO Shortcuts,rKYU5YlAFi0,2023-12-24T00:57:25Z
This Book Helped Every Man,iAHHfPV_uxE,2023-12-23T17:02:13Z
This Is The SECRET To Attract Your Goals,mizkZG9N1wo,2023-12-22T19:48:19Z
The Secret to Have Productive Days,QVwmAlC6NrI,2023-12-20T23:26:45Z
Why Procrastination=Poverty,2r6sObh1UBE,2023-12-20T17:14:26Z
