Title,Video ID,Published At
Jordan Peterson DISMANTLES Feminist On Whether Men And Women Can Be Equal,o4XRXDOmpBs,2023-04-02T22:00:21Z
WOKE NPCs TRIGGERED Andrew Tate Is Free From Prison,pKYaPE64BP8,2023-04-02T21:00:21Z
Kirstan Hawkins DESTROYS Delusional Pro-Choice Student On BIOLOGY,1kwh03WojkE,2023-03-31T21:00:01Z
Charlie Kirk TAKES ON Delusional Pro-Transgender Hippy,k_MlPyIrI8g,2023-03-30T22:00:34Z
WOKE Students Answer If Men Can Get PREGNANT!,OVwnN0F64DI,2023-03-29T22:00:25Z
Victim OBSESSED LIberal Tries To Own Charlie Kirk And FAILS,HrVXe6hLAcE,2023-03-23T22:00:05Z
Matt Walsh DESTROYS Professor In What A Woman Is Debate,5GS15Ff0jgM,2023-03-21T21:00:03Z
Candace Owens EXPLODES On White Liberal College Professor,8pR3nZt_Yns,2023-03-20T22:00:04Z
TRIGGERED Leftist Student Has Meltdown By Charlie Kirks Logic And Facts,AAqVFkUDSL8,2023-03-19T21:00:03Z
Myron Tells COLD FACTS About Bitter 34 Year Old And This Happens..,9Xjvc_9-QAI,2023-03-18T22:00:05Z
@JustPearlyThings CALLS OUT Super Delusional Woman With These Cold FACTS,vuKXfFxEg04,2023-03-17T21:00:34Z
Charlie Kirk EXPOSES Hypocritical Students Socialist Ideals,Ol8dX2GkMvk,2023-03-15T22:00:07Z
White College NPC Gets DEPROGRAMMED In Less Than A MINUTE On White Privilege,jwTDK_vpZgs,2023-03-14T19:30:03Z
BLACK Woman Claims She's A FOX On Piers Morgan #piersmorgan #feminism #viral,LLR8VJUxZoU,2023-03-14T14:00:12Z
Piers Morgan Identifies As A Black Lesbian #piersmorgan #viral #feminism #whatisawoman,FFNcZYi0UXY,2023-03-13T12:00:10Z
WOKE Liberal STUNNED By Piers Morgan When He Asks Why He Can't Identity As A Black Lesbian,sj9Cp5niv8E,2023-03-12T19:00:32Z
Charlie Kirk DESTROYS Leftist Student With Biology,59nKQeVNsLQ,2023-03-10T19:00:02Z
Ben Shapiro DESTROYS Students Transgenderism And Pro-Abortion Arguments,p8zuZb_SITs,2023-03-06T19:00:30Z
The Survival Series Where Women Needed The Men,Xaow6SnMDiY,2023-03-06T14:15:26Z
Men Vs Women For Survival 😱😱,N_0AnSGVJB0,2023-03-05T15:42:20Z
Candace Owens WRECKS Race Baiting Feminist,tEl4UodNSmI,2023-03-03T18:00:32Z
South Park Gets INSANELY Honest With Transgender Episode,wG6CyabSzEc,2023-03-02T18:00:24Z
Pro-Abortion Student DESTROYED By Simple Logic,N8c6OoN3xdI,2023-03-01T18:00:08Z
PROMISCUOUS Feminist Gets HUMBLED Quick,J5x8IpeoinA,2023-02-27T18:00:08Z
Charlie Kirk DESTROYS Delusional Student With Facts And Logic,_rpzpNINVx0,2023-02-26T18:00:13Z
She's a Traditional Feminist #blackpill #feminist #bodycount,G80lQqa4ISU,2023-02-23T11:00:10Z
OnlyFans FEMINIST Gets Her Logic Flipped Back On Her,n3iQ55Hl2sg,2023-02-22T16:00:25Z
DELUSIONAL FEMINIST Gets Violent Because She Got Called This... @JustPearlyThings,79iDk44z4WE,2023-02-20T16:00:03Z
MODERN Woman Plays Victim And Gets OWNED,8kJf7EhA8MQ,2023-02-19T15:00:04Z
Delusional BIG Modern Woman Gets OWNED @JustPearlyThings,m0-1FaDlmvM,2023-01-16T14:00:26Z
KIDS Say The WAGE GAP Is Because Men Work Harder Than Women,lM9bL9i3HnY,2023-01-13T17:00:35Z
