Title,Video ID,Published At
DELUSIONAL Only Fans Model Gets ROASTED By Man,APksxR99B1s,2023-12-30T02:00:03Z
Woke Gender Activist SILENCED By Candace Owens When He Hears This,CwL02ZVw_KY,2023-12-26T03:00:06Z
Woke College Students WALK OFF When They Got Asked This Question!,SLPxure6rjE,2023-12-23T02:00:10Z
WAIT FOR IT... You Won't Believe What This Pro-Choice Activist Said About Women!,NgvlQAhg9oo,2023-12-21T02:00:08Z
Man SHUTS DOWN Delusional Woman,vBa5_E1CsE4,2023-12-19T02:00:16Z
What These College Students Say When Asked This Question Is Absolutely INSANE!,YI6KSSfeSBs,2023-12-17T02:00:17Z
Adam22 RAGE QUITS After BASED Man Says This!,r72VAGXDK7U,2023-12-16T03:00:32Z
Charlie Kirk DESTROYS Woke Pro-Trans College Student,HcUj6tRrd20,2023-12-15T01:00:07Z
TikTok's are Getting OUT OF HAND!,NmwXB7CFXUo,2023-12-14T02:00:08Z
THEY WEREN'T READY! Charlie Kirk DESTROYS White Liberal Students With FACTS!,Pei3AZhgUbg,2023-12-10T03:00:09Z
"""Plus Sized"" Woman Gets EXPOSED By Based Man",W6bjlTbwqlc,2023-12-08T02:00:17Z
BASED Mom Goes Off On School Board Because Of Children's Teacher Teaching This!,xYLm_ZUo2Ec,2023-12-07T03:00:28Z
TikTok Is Getting CRAZY!,KsYz7eUTKQk,2023-12-06T03:00:15Z
Matt Walsh Destroys COCKY Student When He Asks This Question,GCVLdP9BE7c,2023-12-04T02:00:05Z
YOU CAN'T MAKE THIS UP! WOKE PEOPLE GET STUMPED BY THIS SIMPLE QUESTION!,2qyQufwYNU0,2023-12-03T01:00:01Z
Charlie Kirk DESTROYS Entire Army Of Woke Students!,Sk7OKqgeWSA,2023-12-02T02:00:16Z
BASED Dad Gets Kicked Out Of School Board Meeting After He Reads Kids Book That Says This!,L0Qy3P0ZkGE,2023-12-01T02:00:07Z
WOAH! You Won't Believe What These Privileged Students Said When They Were Asked This Question,cdlKCOVVPKk,2023-11-30T02:00:12Z
"WAIT FOR IT... College Students Get Asked Whether Men Can Menstruate, And This Happened!",txDtr8N3RdY,2023-11-28T02:00:31Z
Man EXPOSES Delusional Woman After She Says This...,bzV7vsyriaQ,2023-11-28T00:00:17Z
"Charlie Kirk Completely DESTROYS White BLM Supporting Woke Student, SHE WASN'T READY!",FGgHj8LFdj0,2023-11-27T02:00:06Z
The Most CONTROVERSIAL Video Ever On The Internet,DZHLuzSADUA,2023-11-27T01:00:03Z
11-Year-Old Leaves School Board SILENCED As He Reads From GRAPHIC Book Found In School Library,Oez1RKOEgcQ,2023-11-26T01:00:10Z
Woke College Students CALLED OUT For “Blaming” White People,hjaXn6eqhEo,2023-11-24T02:00:17Z
WAIT FOR IT... WHAT THIS COLLEGE STUDENT DOES NEXT WILL LEAVE YOU SHOCKED!,9d8uR_gTyks,2023-11-22T01:00:06Z
WOKE College Students Gender Nonsense Gets EXPOSED!,--oGFea5WSI,2023-11-21T19:00:00Z
MUST WATCH! You Won't Believe What These Woke College Students Said About Racism!,999FluoW6OE,2023-11-21T02:00:03Z
Ben Shapiro SHUTS DOWN Woke Smug College Student And This Happened!,i2ZeRlS7V0s,2023-11-19T02:00:19Z
WAIT FOR IT... Woke College Students Say This About Men!,MbWe3AmmWK0,2023-11-17T01:00:10Z
Gender Activist Tries To Outsmart Charlie Kirk And INSTANTLY REGRETS IT!,0SXTqO9XcTg,2023-11-16T02:00:00Z
Feminist Gets Asked To Define One Of Her Buzzwords And This Happens!,-hKXXB5FBmY,2023-11-16T01:00:00Z
MUST WATCH! Woke College Students Get STUMPED By This Question!,5Yz5MhHKIlw,2023-11-15T02:00:02Z
Men Give DELUSIONAL Only Fans Girl A Reality Check,tp_PmHmRcRw,2023-11-15T01:00:32Z
BASED Dad Confronts School Board On Trans Ideology In Kids Books And Leaves Them SPEECHLESS!,opAB1JKxgZY,2023-11-15T00:00:32Z
Woke Trans Activist Gets Stopped By The Cops And This Happened!,qymrlpFUslA,2023-11-14T02:00:31Z
Lana Rhoades Gets EXPOSED By Men,rCTBWWnqBZc,2023-11-14T01:00:33Z
WAIT FOR IT... You Won't Believe What They Said About WHITE PEOPLE!,PAVsnBJSiz8,2023-11-13T02:00:09Z
Matt Walsh Gets Brutally Honest And EXPOSES Woke Students Trans Ideology,Nd7VaOwXr20,2023-11-12T02:00:14Z
SHE GOT REJECTED BY CHARLIE KIRK AFTER SAYING THIS!,WY5-V5rpUE8,2023-11-11T02:00:12Z
YOU CAN'T MAKE THIS UP! You Won't Believe What This WOKE BLM Activist Just Said!,nut1j19YQSg,2023-11-11T01:00:30Z
"OBESE ""Woman"" Gets Rejected In A Room Full of Men",-XrQGEkhvD8,2023-11-10T01:00:00Z
YOU WON'T BELIEVE WHAT THESE WOKE PARENTS ARE DOING TO KIDS!,Bra6JEtAPQM,2023-11-09T02:00:05Z
THIS IS WHAT HAPPENS WHEN YOU BECOME A WOKE COLLEGE STUDENT!,trnY4BRNNl4,2023-11-09T01:00:32Z
Ben Shapiro DESTROYS This Woke College Student With Ease!,jNWaAqZS9zQ,2023-11-08T02:00:17Z
MUST WATCH! You Won't Believe What This Woman Said About Babies!,ZC570kexgAo,2023-11-07T02:00:14Z
HE LEFT CRYING! Charlie Kirk Leaves Woke Student SPEECHLESS For Saying This!,VbdiBmqtooQ,2023-11-06T02:00:19Z
YOU CAN'T MAKE THIS UP! WOKE STUDENTS GET STUMPED BY THIS ONE QUESTION!,1N617cmAzl8,2023-11-05T02:00:01Z
CLOWN WORLD! GEN Z's Hot Takes On Modern Day Problems,CxVSI3yQ60o,2023-11-04T02:00:04Z
The Saddest Video Ever On YouTube...,iedeMcCs_I0,2023-11-03T16:00:38Z
HE GOT KICKED OUT! Charlie Kirk SHUTS DOWN Woke Student For Claiming This!,O4i_b1b5r4c,2023-11-03T01:00:10Z
BASED Immigrant Student Completely Destroys WOKE College Students,H5TSYOBKv48,2023-11-02T02:00:05Z
"""Independent"" Feminist Gets STUMPED When Asked This Simple Question",nSFxFt_v0VU,2023-11-02T00:00:30Z
SHE WALKED OFF! Woke College Student Gets TRIGGERED And This Happened!,x1WFQUbVsE4,2023-11-01T02:00:22Z
Charlie Kirk EMBARRASES Woke College Student On Racism!,paG_rqQUPz4,2023-10-31T02:00:19Z
YOU WON'T BELIEVE WHAT THESE WOKE COLLEGE STUDENTS SAID ABOUT WHITE PRIVILEGE!,8Elym7mV8-o,2023-10-31T01:00:06Z
THIS WAS HARD TO WATCH! Woke Feminists Lose It And This Happened!,0C6oNidaA28,2023-10-29T02:00:00Z
Matt Walsh Shuts Down Woke Trans Student With EASE!,FXMUCjiqtXs,2023-10-29T00:00:06Z
GET READY FOR IT... WOKE Protestors Can't Answer This Simple Question,BpFK0Mg-yyE,2023-10-28T01:00:04Z
HE DEFINITLEY DIDN'T SEE THIS COMING FROM CHARLIE KIRK!,L2hLNUrYjXU,2023-10-27T01:00:09Z
YOU CAN'T MAKE THIS UP! Woke College Students Attack White Man And This Happens!,3g_gPjc0dQ8,2023-10-26T01:00:02Z
BASED Virgin Girl DESTROYS OF Model In Heated Debate!,l-ro0OfmZ7o,2023-10-26T00:00:15Z
DELUSIONAL Woman Gets Completely EXPOSED!,tB-zubYYo0E,2023-10-25T02:00:30Z
WOKE Liberal Gets TRIGGERED When She Hears This!,UDchpuvNumQ,2023-10-24T02:00:09Z
DETRANSITIONER EXPOSES TRANS MADNESS IN EPIC SPEECH!,ITwkm1QKI6k,2023-10-24T00:00:09Z
Charlie Kirk SHUTS DOWN Smug Woke Feminist And This Happened...,aIVD1TMX6tQ,2023-10-23T01:00:00Z
WAIT FOR IT... COLLEGE STUDENTS SIGN PETITION TO END WOMEN'S SUFFRAGE!,TVpG-5KTOzs,2023-10-21T01:00:12Z
"WOKE COLLEGE STUDENTS GET ASKED HOW MANY GENDERS THERE ARE, AND THIS HAPPENS...",paraiV7oJfQ,2023-10-21T00:00:22Z
PIERS MORGAN EXPOSES TRANS ATHLETE AND LEAVES EVERYONE SPEECHLESS!,CrEA7x6x5Vw,2023-10-20T01:00:04Z
Candace Owens SILENCES Rude Woke College Student When She Hears This!,gXHhTbL10ec,2023-10-18T00:00:17Z
Mom DESTROYS Gender Ideology With Common Sense And Leaves School Board SPEECHLESS!,_U52sN-6gJg,2023-10-15T23:00:22Z
Only Fans Girl FAILS To Make BASED Man Simp,ww9VyiGv2LM,2023-10-15T21:00:31Z
BASED Dad Strips And GOES OFF On Gender Madness To School Board,fYtbagV_opo,2023-10-15T00:00:22Z
WATCH THIS... WOKE Parents Think Children Should Be Able To Transition Without Parent's Consent!?,XazHnLVV1ro,2023-10-14T23:00:20Z
Dylan Mulvaney Wins Woman of The Year And Claims To Be A Victim!,aKvNMCQvSKg,2023-10-13T22:00:01Z
CHARLIE KIRK DESTROYS WOKE TRANS IDEOLOGY IN EPIC DEBATE!,tGbLNGW_9uk,2023-10-13T00:00:31Z
MEN ATTEND WOMEN'S CONFERENCE BY IDENTIFYING AS NON BINARY!,xF2Dkl4n0GE,2023-10-10T23:00:33Z
PIERS MORGAN EVISCERATES HSBC ADVERT AND WOKE FEMINIST,nNwN2b6qDkY,2023-10-09T23:00:30Z
30K LIVE CELEBRATION Q&A/REACTION - Woke Activist Goes NUTS Over Child Sterilization!,6CE08hG4D_0,2023-10-07T09:21:11Z
PREGNANT CANDACE OWENS DESTROYS WOKE COLLEGE STUDENTS WITH EASE!,EygPd4siJxM,2023-10-07T00:00:05Z
SHARE THIS WITH EVERYONE YOU KNOW! THEY ARE COMING FOR YOUR KIDS!,D1QkC-JAjeY,2023-10-06T01:00:05Z
WAIT FOR IT... WOKE LIB'S WAN'T YOU TO PAY FOR REPARATIONS!,yLlMa3xnP2A,2023-10-05T23:00:36Z
BASED DAD EXPOSES SCHOOL BOARD AND LEAVES EVERYONE SPEECHLESS!,1mzfgOPYbmw,2023-10-05T00:00:02Z
SHE GOT STUMPED WHEN CHARLIE KIRK ASKED HER THIS!,gfnJsHP1DsA,2023-10-04T23:00:28Z
THIS IS SAD! WOKE COLLEGE STUDENTS CAN'T ASNWER THIS SIMPLE QUESTION!,G6tJPPiahB4,2023-10-04T01:00:06Z
THIS CAN'T BE REAL! THIS IS WHAT HAPPENS WHEN SOCIETY GOES WOKE!,aKaxJYlWtbg,2023-10-03T23:00:00Z
Piers Morgan SLAMS Megan Rapinoe & Woke Feminist Over Trans Athlete Debate,Mknlh_DuAGk,2023-10-02T23:00:15Z
"THEY DIDN'T SEE THIS COMING! IF YOU CAN CHANGE YOUR GENDER, YOU CAN CHANGE YOUR RACE RIGHT?",7nguq4T4ZyE,2023-10-01T23:00:02Z
WAIT FOR IT... PROFESSOR ATTACKS STREET PREACHER AND THIS HAPPENS!,CYaMk09UOPI,2023-09-30T01:00:05Z
Looting BLM Activists Celebrations Ends In DISASTER - GETS ARRESTED!?,9mVyPQnIoBA,2023-09-29T00:00:08Z
WOMEN DON'T NEED MEN ANYMORE!?,Nht0g8-dmq0,2023-09-28T01:00:14Z
THEY WON'T LIKE THIS! JOE ROGAN TORCHES TRANS MADNESS WITH ONE QUESTION,YWmG5I74k60,2023-09-27T02:00:10Z
TRANS ACTIVIST GETS A DOSE OF REALITY!,wiFKyTIl3QM,2023-09-27T01:00:30Z
Jordan Peterson SILENCES 2 Feminists With Ease!,zApkMwjfJvI,2023-09-26T01:00:32Z
Is It Gay To Date A Trans Woman??,5WHoAtyyQb0,2023-09-24T23:00:02Z
Self-Righteous Climate Change Activist Gets Completely DESTROYED!,u9EV5ydNmLw,2023-09-23T01:00:24Z
How To Get Cancelled In 3 Words...,utim4Gn7rEg,2023-09-23T00:00:34Z
WAIT FOR IT... Women Call Guys In Their Friendzone And Ask For Money,TxSke3Qz7pk,2023-09-21T23:00:16Z
ENTITLED Feminist Completely FAILS When Asked This!,a7PV_km2TUc,2023-09-21T00:00:00Z
MATT WALSH EXPOSES GENDER MADNESS AND LEAVES EVERYONE SPEECHLESS!,g_tVnIjULZQ,2023-09-20T01:00:30Z
"BASED Man Asks Trans Children's Activist One Question, Then It All Goes Bad",VcnDusetOHY,2023-09-19T02:00:17Z
"White Man P*nches BLM Activist Just For Asking For Reparations? ""THIS IS MY ROSA PARKS MOMENT!""",HuD7yBdWB7w,2023-09-19T00:00:10Z
"DELUSIONAL Students Answer ""What Is A Woman?""",w2Ob-GSY6mQ,2023-09-18T01:00:32Z
Meat Eating Farmer DESTROYS Vegan Only Fans Girl With Ease,3j7bZigVxV4,2023-09-17T23:00:02Z
How To End Your Career In 6 Minutes...,0N0WHsRN1Hs,2023-09-17T02:00:00Z
Candace Owens Completely DESTROYS LGBTQ Agenda,dMv4plQM0yI,2023-09-16T02:00:11Z
Self-Entitled Feminist Gets EXPOSED By Men,7AXm0nQCmUU,2023-09-16T00:00:03Z
"Piers Morgan WRECKS Vegan Activist, Leaving Her Speechless!",-s9F12s_YGY,2023-09-15T02:00:00Z
Jordan Peterson WRECKS Climate Change Activist On Live TV - The Audience Loves It,Mmfiw_pSuKk,2023-09-15T01:00:06Z
Fat Acceptance Cringe - THE WEST IS DOOMED!,tg3ou7ngRyw,2023-09-14T00:00:33Z
Candace Owens Completely HUMILIATES OnlyFans Girls And This Happens!,PCmugSTdJ5U,2023-09-12T02:00:18Z
Douglas Murray Absolutely TORCHES Just Stop Oil Activist,1dcGk9PX4wA,2023-09-11T23:00:01Z
BLM Race Hustler Gets COMPLETELY WRECKED In Heated Debate On Piers Morgan,07-aHOJHlJM,2023-09-11T02:00:00Z
WAIT FOR IT.... Black Feminist GOES OFF On Chinese People For This!,8Hl4jm0jEts,2023-09-10T02:00:03Z
Candace Owens COMPLETELY DESTROYS Whatever Podcast Panel On Marriage,5jvf1tKfTeE,2023-09-10T01:00:03Z
IT CAN'T GET ANY MORE CRAZIER THAN THIS!,HB2qfHMjRhM,2023-09-08T02:00:10Z
WHAT IS GOING ON HERE!?,hpTlzaHD8SM,2023-09-08T01:00:28Z
Ben Shapiro COMPLETELY DEMOLISHES Woke Student With Ease!,2hUhKjcfPKk,2023-09-07T01:00:02Z
YouTuber GOES MAYHEM When Video Game Uses Preferred PRONOUNS and PUSHES LGBTQIA IDEOLOGY!,XeR4LTYigeo,2023-09-06T23:00:11Z
"Dinesh D'Souza Absolutely DESTROYS Woke Professor, Leaving Him Speechless!",8dbghY56r9Y,2023-09-06T02:00:02Z
These WOKE Liberal Students Were Not Expecting THIS!,1lCw_Tst4c4,2023-09-06T00:00:00Z
"Strong & Independent Feminist Brags About Not Needing Men, INSTANTLY REGRETS IT!",2PW9JKfhJrk,2023-09-05T23:00:01Z
Michael Knowles SHUTS DOWN White Liberal With Ease!,wHvLeAs8N_w,2023-09-05T01:00:31Z
Is It Okay To Be White? SHOCKING ANSWERS!,AG1zsTf2C2k,2023-09-05T00:00:05Z
"BASED Mom DROPS Mic At School Board, Wearing A Dress Doesn’t Make You A Woman",H6tstuDg1Xg,2023-09-04T02:00:04Z
This Sign Had These WOKE Women TRIGGERED!,6vcCcRfRDiY,2023-09-03T00:00:02Z
WAIT FOR IT.. Woke College Students Play The RACE Card And This Happens!,MGkJTM0nNzY,2023-09-02T01:00:08Z
Can You Be Racist To White People??,VGZeA9HzPZs,2023-09-01T23:00:16Z
"Woke Disney’s Snow White Rachel Zegler Backlash Gets WORSE, PEOPLE WANT HER GONE!",4RDXpNIP_g0,2023-09-01T01:00:02Z
Michael Knowles Completely DESTROYS Second Professor In One Day,JK6_MVSXUWI,2023-08-31T01:00:13Z
WOKE Students Hate Trump SOTU Quotes… Until Hearing They’re From 2020 Dem Candidates,iaOdjoS0FpY,2023-08-30T01:00:13Z
Logan Paul Just Got Absolutely WRECKED By Dillon Danis,urEoUCZXpM8,2023-08-29T22:00:35Z
BASED Dr Miriam Grossman Destroys Gender Ideology in 5 Minutes,T7ZswPOyZOc,2023-08-29T01:00:08Z
Douglas Murray WRECKS Smug LGBTQ Panellist's Live!,3p1RDGpmcX0,2023-08-29T00:00:01Z
Michael Knowles UNLOADS On the Left Over Their Racism And Bigotry,ZAdCtHdRkiE,2023-08-28T00:00:15Z
Ben Shapiro BREAKS Woke College Student With FACTS NOT FEELINGS,KnVdYFGMM3A,2023-08-27T02:00:11Z
Charlie Kirk Absolutely DESTROYS Smug BLM Activist Leaving Him Speechless!,ndCF5OURqjA,2023-08-27T00:00:30Z
College Students CONDEMN BLM After They Learn Where Their Money Is REALLY Going,8NIUsMUA_Ng,2023-08-26T01:00:05Z
"Khabib Nurmagomedov DISMANTLES Woke Mob And Sets Record Straight on LGBTQ: ""Only Men and Women""",G1K57i3_ZBg,2023-08-25T02:00:07Z
Gen-Z Can't Answer the Most Basic Questions - OUR EDUCATION SYSTEM IS IN FINISHED!,c5y1RN-J9ks,2023-08-25T01:00:23Z
Dinesh D'Souza SHOCKS and SILENCES Woke Liberal With Facts & Logic,PnwPh091qIU,2023-08-24T02:00:16Z
Larry Elder DESTROYS BLM Narrative On The Breakfast Club,3x7OVWFAb6w,2023-08-24T01:00:01Z
Charlie Kirk Completely DISMANTLES Pro-Trans Activist With Ease!,2LtCVkMrEa4,2023-08-23T03:00:01Z
This Is Exactly Why You DON'T Challenge Dinesh D'Souza!,1VrEARQrPbE,2023-08-22T02:00:00Z
Ben Shapiro SHUTS DOWN Disrespectful Snowflake Who Says This About His Wife!,rubS2xYdwd0,2023-08-22T00:00:30Z
Woke Students Are SO PROUD Of Kamala Harris For... Well... They Don't Know,j2s7mM5MiUk,2023-08-21T01:00:18Z
Frank Turek WRECKS College Student Over Gender & Biology,Ud4itNWheak,2023-08-20T23:00:21Z
Larry Elder Completely SHUTS DOWN The Breakfast Club!,uZFN4-ad7wE,2023-08-20T01:00:34Z
Based Mom Completely GOES OFF On School Board,bIXHSJ80B3Q,2023-08-19T20:00:09Z
BLM Activist Gets STUMPED On Piers Morgan Over Colonial Reparations,GJmr1yGLGWc,2023-08-19T01:00:07Z
Michael Knowles Completely UNLOADS on 2 Cocky Liberals Who Have A Full Blown MELTDOWN!,W_IVYmiiSCw,2023-08-18T01:00:21Z
THIS IS CRAZY! Send This To Your WOKE Friends!,pJQJ_p13orc,2023-08-17T23:00:20Z
"Sen. John Kennedy Asks Woke Feminist BLUNT Question, Then It All Goes BAD!",t6gGzzorwVU,2023-08-17T00:00:22Z
College Students Think America Oppresses Women...Then They Hear About Afghanistan,FgH04V_iYM4,2023-08-16T02:00:03Z
Ben Shapiro Completely DEMOLISHES Little Socialist Student With FACTS NOT FEELINGS!,Ur_JReZAwWg,2023-08-16T00:00:19Z
Student Tries And FAILS To Stump Dinesh D'Souza During Q&A,S9EL2zFCgZs,2023-08-14T23:00:15Z
Jesse Lee Peterson Completely SILENCES Woke Mob on Dr. Phil,cFrJGA453gI,2023-08-14T02:00:21Z
"Woke BLM Student Tries WHINING At Ben Shapiro, He Is NOT Having It, Responds With FIRE!",XQBovM167kU,2023-08-13T02:00:10Z
Has Fat Acceptance Gone Too Far!?,n_OooYvT3tw,2023-08-12T22:00:30Z
Woke Students Support Socialism... Until It's Applied To Their GPA,Fwsy9105hXk,2023-08-12T01:00:11Z
"Michael Knowles BREAKS Trans Ideology, Leaves Students SPEECHLESS!",SAaahlYsLXs,2023-08-11T21:00:12Z
College Students Asked D'Souza To Prove The Democrats' Terrible History,ZijaSslQ6ng,2023-08-11T02:00:17Z
Douglas Murray Absolutely FLAMED Feminist Journalist Live!,cJB5GRgNcr4,2023-08-10T02:00:14Z
Ben Shapiro Drops A MASSIVE Truth Bomb On Colin Kaepernick And Liberal Student!,buFf9eTmZFU,2023-08-10T00:00:11Z
Dinesh D'Souza SHATTERS Woke Student's Ideas And Guts Core White Supremacist Argument,ojAJEd635Eo,2023-08-09T03:00:28Z
Woke BLM Activist Clashes with Piers Morgan Over Colonial Reparations,hqQ0NFBOs4Q,2023-08-09T02:00:24Z
College Students Support Diversity Quotas...Until It Comes to Football,KwXo1pcT4XY,2023-08-08T03:00:08Z
Douglas Murray Completely DISMANTLES BLM Race Hustler's Narrative,SYaiw7AqC8k,2023-08-07T03:00:19Z
Liberal Student Has Meltdown After Getting STUMPED By Charlie Kirk,SFs2J4HEaxQ,2023-08-06T03:00:12Z
Ben Shapiro COMPLETELY Exposes the HUGE PROBLEM Caused by Feminism,Ef5LIHu6rpc,2023-08-05T04:00:12Z
Piers Morgan GOES OFF On Obese TikToker And ATTACKS Woke CULTURE!,v7djR-mT1G0,2023-08-04T01:00:22Z
DELUSIONAL Trans EMT Gets Absolutely DESTROYED By Matt Walsh And Walks Out!,i9BTbWGFxDA,2023-08-04T00:00:12Z
Woke College Student Thinks He Has Ben Shapiro Cornered. THINK AGAIN!,vTLhy8LKyNA,2023-08-03T03:00:32Z
Candace Owens Goes SCORCHED EARTH On Absurd Fox News Guest In HEATED DEBATE!,A0W5HLcxfcM,2023-08-02T02:00:06Z
SHE WASN’T EXPECTING THIS FROM BEN SHAPIRO!,tVOwAATUCzA,2023-08-01T22:00:22Z
Kristan Hawkins CRUSHES Woke Pro-Choice Students Logic,k_NR20xDcME,2023-08-01T03:00:28Z
Ben Shapiro ABSOLUTELY DESTROYS Smug Leftist In HEATED Battle!,iEQ4wkBjYVs,2023-08-01T02:00:25Z
Piers Morgan SILENCES JustPearlyThings Over A Song As She TRIGGERS WOKE Lawyer!,IS23U8zQ0E0,2023-08-01T01:00:07Z
She Tried To DEBATE Brian But FAILED MISERABLEY!,siG5wSkAsNs,2023-07-31T02:00:30Z
ØnlyFans Model Likes To Cheat On Her Boyfriend?! (UNHINGED),cow2O9MEIgk,2023-07-30T03:00:17Z
Woke College Students Love Medicare For All... Until Hearing What's Actually In It,zipQls9TI_o,2023-07-30T02:00:24Z
"BLACK PEOPLE DON'T WANNA HEAR THIS, KEVIN GATES KEPT IT REAL!",wOHDb4KlsPc,2023-07-29T03:00:34Z
Woke Students Say ‘My Body My Choice’... Until it Comes to Vaccine Mandates,SlO_mtxT_uo,2023-07-29T02:00:08Z
Ice Cube CALLS OUT Woke Hollywood in Tucker Carlson BASED Interview!,e4J5llQIxqU,2023-07-29T01:00:14Z
Charlie Kirk SCORCHES BLM Supporting Athlete,mroeKFZ3e9I,2023-07-28T03:00:30Z
Woke Black College Students Become UNHINGED From Pro-Lifers Sign And This Happens!,gVBZS3B7ldo,2023-07-27T03:00:18Z
Officer Tatum EMBARRASSES Race Baiting White Liberal College Student,XudyxLjJtI8,2023-07-26T02:00:13Z
Would You Date A Transgender Person? THIS IS CRAZY!,aIMp4HJPJXY,2023-07-26T01:00:00Z
Adam22 Offers His Wife To ANDREW TATE And IMMEDIATELY Regrets It!,pxV41-Kr4Eg,2023-07-25T23:00:20Z
JustPearlyThings SCORCHES Radical Feminist On The Wage Gap With Piers Morgan,RZI6EhHH6BI,2023-07-24T23:00:24Z
Woke College Feminist Thinks Britney Spears Is A WNBA Player #feminism #wagegap  #woke #wnba,Lk5C531niJI,2023-07-22T13:00:44Z
Candace Owens DESTROYS Woke Feminist Who Can't Keep Up,-gWZM9hqQX8,2023-07-19T02:00:00Z
WOKE College Students Get STUMPED By Their Unrealistic Dating Standards,VtLNq8WfWS0,2023-07-18T22:00:25Z
Piers Morgan Gets Into HEATED Debate With James Barr On Pride Flags,pt1S3oJ_30c,2023-07-17T02:00:30Z
**I'M ANGRY! Candace Owens Tells BLACK PEOPLE That WHITE PEOPLE Didn't Invent Slavery They Ended It,2pU1tbs332Q,2023-07-17T01:00:01Z
Adam22 Allows His Wife To Get Clapped By BBC!,M0dqeAn0vCo,2023-07-16T01:00:11Z
Feminists Can't Name A WNBA Team - THIS IS WILD!,O8VjUWoPJW0,2023-07-15T01:00:12Z
No Mercy! WOKE Student STUNNED By Michael Knowles After Making Crazy Claim,TFOQs0gDpto,2023-07-14T01:00:09Z
Can Only White People Be Racist?,5vxnzl2lq00,2023-07-13T00:00:03Z
WOKE College Students Say Refusing To Date A Trans Gender Means You Are Uneducated And A Bigot,DI5UGh2C25w,2023-07-10T03:00:05Z
WOKE BLM Human Rights Activist Gets A BRUTAL Reality Check From BASED Republican,C9R16jYzWK0,2023-07-09T03:00:04Z
The Victim Olympics Has Begun: Unmasking the Culture of Playing Victims,-xNEVBB2BOQ,2023-07-06T03:00:00Z
Piers Morgan Vs Elle Brooke In HEATED OnlyFans Debate,C6PQMenyC04,2023-06-13T03:00:04Z
Ben Shapiro DESTROYS Black Lives Matter Panel In HEATED Debate!,UuGvb5A9nXQ,2023-06-12T03:00:11Z
UNHINGED Leftist Gets DRAGGED OFF After Trying To Rush Charlie Kirk,xeHZzE0mzkk,2023-06-11T03:00:22Z
Privileged BLM Supporter Tells White Students To GET OUT!,hkJPWmMqxcc,2023-06-10T03:00:20Z
Asking New Yorkers Do White Lives Matter? GETS RACIST!,LAhRnfsPTLw,2023-06-08T03:00:14Z
WATCH WHAT HAPPENS NEXT! Woke Student Tries To Call Dinesh D'Souza RACIST,1SG5akiM1tM,2023-06-06T02:00:00Z
BLM Activist Calls Piers Morgan RACIST For Calling OUT Her Hypocrisy During Heated DEBATE!,if6eeMHiKcE,2023-06-05T03:00:20Z
Asking New York City What Is A Woman? This Is CRAZY!,GqhPctntj9U,2023-06-05T02:00:04Z
BLM Supporter Uses The RACE CARD And Gets Declined REAL QUICK! (He Caught Her In 4K),hwcbdAeB3L0,2023-06-04T01:00:25Z
"Michael Knowles OBLITERATES Leftist Student Who Can't Score A Point On Him, Even With Help!",h3zzU8xViac,2023-06-01T02:00:21Z
Candace Owens SCORCHES Unhinged Black Liberal,ZiuogijMYu4,2023-05-30T03:00:23Z
Piers Morgan DESTROYS VIRAL Tiktok Star Mizzy Who Screams Racism After Being ARRESTED!,28rAPKQ3KKI,2023-05-29T03:00:03Z
Zuby Sets WOKE Black Woman Straight On Transgenderism In Sports,bv5b7v5w81Y,2023-05-27T03:00:30Z
Woke RACE BAITER Gets Completely WRECKED By Based Black KING,vhZjkbsDdag,2023-05-26T03:00:23Z
Dinesh D'Souza DESTROYS Woke Leftist Student With Facts & Logic,2-XhMTJjvsA,2023-05-23T03:00:01Z
"TikTokers RACE CARD FAILS After She Filmed Herself Confronting ""Racist"" Uber Driver (It Backfires!)",QfxOF2dQAc8,2023-05-22T03:00:17Z
DELUSIONAL Infinite Gender Believing WOKIES In DC Pride (Gets Degenerate),Mfns0-JLKAA,2023-05-22T02:00:11Z
Ben Shapiro DESTROYS Disrespectful Woke College Student In HEATED Debate! (Owned Badly),rgChEG4B6Ag,2023-05-21T03:00:22Z
Myron Absolutely DESTROYS Boss Feminists With FACTS And This Happens!,-_ZhegucrfM,2023-05-20T03:00:00Z
Elon Musk DESTROYS BBC Reporter With This Simple Question. #elonmusk #viral #viralvideo #bbc,ndxJIXAcVj8,2023-05-18T21:44:36Z
Gorlock The Destroyer Claims To Have A ROSTER of CELEBRITIES Sliding In His/Her Dms,JdC5yJEKiCk,2023-05-18T03:00:06Z
Dinesh D'Souza COMPLETELY DESTROYS Woke College Student On WHITE Privilege,mZgnyzdzFg0,2023-05-17T03:00:20Z
Ben Shapiro UTTERLY EXPOSES Black Congresswoman Trying To Call Him PRIVILEGED,43Z9SqGNMF4,2023-05-15T02:00:01Z
Candace Owens ABSOLUTELY SCORCHES Male Feminist!,RGYWgDXALeA,2023-05-10T02:00:14Z
RACE Obsessed Students Get EXPOSED When They CAN'T COMPARE Transgenderism And Transracialism,lWjGp1-3fLk,2023-05-09T02:00:21Z
VIRAL: Crazy Woman Says MEN Can Get PREGNANT - Gets LAUGHED At By Committee!,QxjCrXjGaDQ,2023-05-08T03:00:08Z
Things Get HEATED When John Kennedy Asks Dem Witnesses If They Support Abortion Up To Birth,QminKh4YRag,2023-05-08T02:00:15Z
BASED Mom Absolutely DESTROYS CRT Narrative At School Board,8EfEAgXQahc,2023-05-07T02:00:06Z
Candace Owens Absolutely TORCHES Black Student On Why White Privilege Doesn't Exist,vSc2VzDNMjA,2023-05-03T01:00:31Z
Candace Owens TORCHES Democratic Rep Who Accuses Her Of THIS! #candaceowens #viral #fyp,6jDYtmyFQ7M,2023-05-02T17:48:20Z
WOKE Racebaiter Tries To Outsmart Charlie Kirk And FAILS Miserably!,v_6SGqKkGrI,2023-05-02T02:00:18Z
DELUSIONAL ØnlyFans Girl Gets Upset That She Is S*xualised & Gets CALLED OUT!,P5sVg78Ns0k,2023-05-02T00:00:20Z
Woke Feminist Asks BLACK Man If He Identifies As Black! #woke #viral #feminism #allenwest,qr-y6sBbsMo,2023-04-30T19:51:18Z
DELUSIONAL Woman Gets BITTER When Myron Debunks Her BS And Says It!,0bzQ28tKKys,2023-04-29T01:00:02Z
Piers Morgan Has FIERY Debate With Male FEMINIST On Transgender Women In Sports,ynUsqsw8lQw,2023-04-28T02:00:17Z
DELUSIONAL Trans College Student Demands Charlie Kirk Pay For Their Gender Surgery,3ON7knqkVtg,2023-04-28T00:00:03Z
DELUSIONAL Modern Woman Couldn't Answer This Question In HEATED Debated Against Pearl,7ay3L0cGWRA,2023-04-27T22:00:03Z
BASED Panel Roasts Smelly ONLYFANS Model On @whatever Podcast,bAJno1-Ul-c,2023-04-27T01:00:17Z
Candace Owens TORCHES Democratic Rep Who FAILS To Smear Her With This Fiery Response!,zEPQNC-mQwY,2023-04-25T01:00:24Z
Elon Musk DESTROYS Liberal BBC Reporter For Lying About Twitter Promoting Hate Speech,MUNmZHN3wmM,2023-04-24T02:00:06Z
Michael Knowles DESTROYS Delusional Student Who Claimed Transgenderism Is Indigenous,LXc69ovn6ig,2023-04-23T23:00:14Z
Allen West Leaves Woke Feminist SPEECHLESS After Legendary Double Smackdown,LpycNdCLe5M,2023-04-23T02:00:06Z
POST-WALL Cougar Gets KICKED Out Of @JustPearlyThings Podcast And This Happened!,zqSq4vMt_FM,2023-04-23T00:00:29Z
WOKE College Feminists TRIGGERED Tate Is Free With TOP G Clone!,47g3EtzFg3g,2023-04-20T23:30:01Z
Drag Queen On Piers Morgan. #piersmorgan #dragqueen #viral,Ey4Xv5l0MbQ,2023-04-20T14:23:43Z
Charlie Kirk Ties SMUG Feminist Academic In Knots,RW3ZrRGXhrI,2023-04-19T22:00:12Z
Piers Morgan DEBATES If Drag Queens Should Perfom S*xual Acts in Front Of Kids,_olVRU3IhqY,2023-04-18T22:00:25Z
Preacher Gets Told To Shut Up And Go Back To Africa. #viral #viralvideo #preacher,q1ISYHV_vp4,2023-04-18T02:00:13Z
Pro-Choice Student Tries To SCHOOL Michael Knowles On Abortion And It Completely FAILS,uarv5w8vE54,2023-04-18T00:00:30Z
FANATICAL Liberal Professor Has MELTDOWN When Asked If Men Can Get Pregnant,MgXZcJNwr5A,2023-04-16T22:00:18Z
BLACK News Reporter TORCHES Woke Guest Defending Nike Sponsoring Dylan Mulvaney In HEATED Debate!,YZspoi7_TlE,2023-04-15T22:00:11Z
WOKE Leftist Student Debates Matt Walsh On Transing Kids,FGi5rlxqO2E,2023-04-14T23:00:09Z
Myron Kicks Out SALTY 35 Year Old In HEATED Exchange!,HFnx_ekYHkY,2023-04-14T22:00:06Z
Pro-Abortion Student DESTROYS Herself During DEBATE With Michael Knowles,ubNAttUitqg,2023-04-12T22:00:32Z
BASED Mom Dresses Up As A CAT At School Board Meeting To Get Point Across,HnsH_3UwPGk,2023-04-11T22:00:18Z
Matt Walsh DEBATES Trans On What Is A Woman,HEtH5PO4wAk,2023-04-07T23:00:05Z
Child Drag Show Supporter VIOLENTLY Assaults And SPITS On Parent,Ds34PLQcmBc,2023-04-04T22:00:11Z
FANATICAL Feminist ASSAULTS Man At LGBTQ Rally And This Happened!,dhf5R0A1Rtc,2023-04-03T22:00:29Z
